all_awardings,allow_live_comments,author,author_flair_css_class,author_flair_richtext,author_flair_text,author_flair_type,author_fullname,author_patreon_flair,author_premium,awarders,can_mod_post,contest_mode,created_utc,domain,full_link,gildings,id,is_crosspostable,is_meta,is_original_content,is_reddit_media_domain,is_robot_indexable,is_self,is_video,link_flair_background_color,link_flair_richtext,link_flair_text_color,link_flair_type,locked,media_only,no_follow,num_comments,num_crossposts,over_18,parent_whitelist_status,permalink,pinned,pwls,removed_by_category,retrieved_on,score,selftext,send_replies,spoiler,stickied,subreddit,subreddit_id,subreddit_subscribers,subreddit_type,thumbnail,title,total_awards_received,treatment_tags,upvote_ratio,url,whitelist_status,wls,link_flair_css_class,link_flair_template_id,link_flair_text,post_hint,preview,author_flair_background_color,author_flair_template_id,author_flair_text_color
[],False,shoctologist,,[],,text,t2_f3phq,False,False,[],False,False,1618666540,self.keto,https://www.reddit.com/r/keto/comments/msqv1a/mct_oil/,{},msqv1a,True,False,False,False,True,True,False,,[],dark,text,False,False,True,6,0,False,all_ads,/r/keto/comments/msqv1a/mct_oil/,False,6,,1618666551,1,"Bottom line up front: how much value do you place in MCT oil?  And how can I ensure that I'm getting a quality MCT oil if I buy one online?

About me: I'm still relatively new to keto; I began the day after Thanksgiving last year and have been going great (with one 3-day period two weeks ago where I allowed myself to have carbs before returning to form).  I have lost 30 lbs since Thanksgiving 2020 (due in part to both keto and IF, not really exercising much yet); however, before my brief carb overload, I realized I was plateauing and not really losing much anymore.

So I started to finally keep track of my nutrient counts (I mostly just avoided eating anything with carbs, testing to ensure I never fell out of ketosis) and I realized that there are days when I have trouble getting my fat intake where it should be.  Don't get me wrong, for the most part, I have been nearly spot-on with my macros (60/30/10) without actually focusing on hitting those numbers for months, which I was surprised by, but there are days where it gets out of whack.  (Usually those are the days where I have chicken breast for dinner, as the protein/fat ratio throws things off a bit).

I decided to finally look into MCT oil, but as with everything, I don't trust any company's claims of being great.  I've seen far too much bullsh\*t... I usually go to Labdoor to check for their rating on supplements, but they don't seem to have MCT ratings.

So I wanted to come to you to ask about your preferred MCT oil; just the basic, no frills, MCT oil that you use.  Because I know if I search online for something, I'll get 1,000 different product suggestions (with at least 50,000 usages of the term ""keto"" and 20,000 ""weight loss"" on the labels) and not have any clue which is worthwhile.",True,False,False,keto,t5_2rske,2366848,public,self,MCT Oil?,0,[],1.0,https://www.reddit.com/r/keto/comments/msqv1a/mct_oil/,all_ads,6,,,,,,,,
[],False,losing4me,,[],,text,t2_b1sqlnjs,False,False,[],False,False,1618659690,self.keto,https://www.reddit.com/r/keto/comments/msp6x1/question_for_those_that_are_fat_adapted/,{},msp6x1,True,False,False,False,True,True,False,,[],dark,text,False,False,True,7,0,False,all_ads,/r/keto/comments/msp6x1/question_for_those_that_are_fat_adapted/,False,6,,1618659701,1,"I am curious,  for those people that are fat adapted , when you do have an instance when you go over a bit on carbs and your body switches gears and burns carbs and then switches back do you gain a little weight in the short time? Do you get a little water retention?
It would be great to hear what it is like when your body can switch from being a fat burner to a carb burner and back to a fat burner.",True,False,False,keto,t5_2rske,2366733,public,self,Question for those that are FAT ADAPTED,0,[],1.0,https://www.reddit.com/r/keto/comments/msp6x1/question_for_those_that_are_fat_adapted/,all_ads,6,,,,,,,,
[],False,mshhh,,[],,text,t2_a5s5f,False,False,[],False,False,1618658144,self.keto,https://www.reddit.com/r/keto/comments/msovgy/2021_progress/,{},msovgy,True,False,False,False,True,True,False,,[],dark,text,False,False,True,109,0,True,all_ads,/r/keto/comments/msovgy/2021_progress/,False,6,,1618658154,1,"[Progress](https://imgur.com/a/iArzuLX)

From January 5th to today I’ve lost 34.2 lbs. / 15.5 kg (5'5"", 235.2 lbs. to 201.1 lbs.). The picture shows January 9th vs. April 10th. 

In the summer of 2019 I’d gotten down to 174 lbs. from 230 lbs., then my life situation changed, then Covid happened (excuses excuses, but I succumbed to them). By January of this year I’d regained everything plus 5 lbs., and was back at a point where the weight was getting physically uncomfortable. About half of the initial weight loss was from keto, and I wanted to get back into it because not has it been the easiest and most comfortable way to stay in a calorie deficit, I generally feel amazing on it.

Especially this past fall I struggled with getting half heartedly into it again and again, only to go off it way too easy. This resulted in slower (but still...) weight gain and feeling kinda hopeless. During a particularly indulgent December, and my feet hurting a lot after work days (fairly active job), I started to prepare mentally for a different January. Seeing photos from New Years Eve was the cherry on top and I was looking forward to taking back control. 

It’s now been over 3 months back on keto, and I generally feel better than I did all of 2020. I know motivation is unreliable, but it’s still here in full force and I take advantage of it the best I can. I didn’t start out with any exercise goals beside collecting a bunch of steps on my Fitbit. Only very recently did I start c25k as I felt a genuine wish to sweat more. 

I try to stay at 20g carbs or under, allowing up to 25g if need be. The past 1.5 months I’ve incorporated IF and some 36 hr fasts and found that I absolutely love it, so that will definitely be a part of my journey going forward. This was not necessary for me to be successful with keto or weight loss at all, I was most interested in all the other benefits. Still, I didn’t expect it to suit my lifestyle as well as it has. I know I would never have bothered with this if I wasn’t already eating keto. 

Sorry for this little wall of text, I just wanted to contextualize and explain what I've been doing. I guess I felt like sharing because I just feel so *hopeful* these days, and keto plays a huge role in this.",True,False,False,keto,t5_2rske,2366708,public,nsfw,2021 progress,0,[],1.0,https://www.reddit.com/r/keto/comments/msovgy/2021_progress/,promo_adult_nsfw,3,,,,self,"{'enabled': False, 'images': [{'id': '_pv7UFt34sJbxzvJMJkJZagcp_7UMHp2vDbJTTQYIxU', 'resolutions': [{'height': 108, 'url': 'https://external-preview.redd.it/DidT-JVH0gyu4MOMsb0i7eP69g0v99hC0gsh6XS8x2U.jpg?width=108&amp;crop=smart&amp;auto=webp&amp;s=34c4d26ff20aac194fa25079b5515b81d778cc9d', 'width': 108}, {'height': 216, 'url': 'https://external-preview.redd.it/DidT-JVH0gyu4MOMsb0i7eP69g0v99hC0gsh6XS8x2U.jpg?width=216&amp;crop=smart&amp;auto=webp&amp;s=bb9b3945475059990d40a0345b79a45d5bf75e8d', 'width': 216}, {'height': 320, 'url': 'https://external-preview.redd.it/DidT-JVH0gyu4MOMsb0i7eP69g0v99hC0gsh6XS8x2U.jpg?width=320&amp;crop=smart&amp;auto=webp&amp;s=81504f220424a302bc0d72762e351be6e5160a8e', 'width': 320}, {'height': 640, 'url': 'https://external-preview.redd.it/DidT-JVH0gyu4MOMsb0i7eP69g0v99hC0gsh6XS8x2U.jpg?width=640&amp;crop=smart&amp;auto=webp&amp;s=e52c6708d2d13c3175e5ca688c7f6654a248ef80', 'width': 640}, {'height': 960, 'url': 'https://external-preview.redd.it/DidT-JVH0gyu4MOMsb0i7eP69g0v99hC0gsh6XS8x2U.jpg?width=960&amp;crop=smart&amp;auto=webp&amp;s=77a13591bfdba1867ebc5982004b412862f28cc5', 'width': 960}, {'height': 1080, 'url': 'https://external-preview.redd.it/DidT-JVH0gyu4MOMsb0i7eP69g0v99hC0gsh6XS8x2U.jpg?width=1080&amp;crop=smart&amp;auto=webp&amp;s=5e84036045e8ee3178a468d7c28e481e2b8ae53d', 'width': 1080}], 'source': {'height': 1080, 'url': 'https://external-preview.redd.it/DidT-JVH0gyu4MOMsb0i7eP69g0v99hC0gsh6XS8x2U.jpg?auto=webp&amp;s=f09104108a53cb255852daaa05eb18503bd068ab', 'width': 1080}, 'variants': {'nsfw': {'resolutions': [{'height': 108, 'url': 'https://external-preview.redd.it/DidT-JVH0gyu4MOMsb0i7eP69g0v99hC0gsh6XS8x2U.jpg?width=108&amp;crop=smart&amp;blur=10&amp;format=pjpg&amp;auto=webp&amp;s=8fc9a7d0f3fc2ad83eed1f104468c037cd9bffa5', 'width': 108}, {'height': 216, 'url': 'https://external-preview.redd.it/DidT-JVH0gyu4MOMsb0i7eP69g0v99hC0gsh6XS8x2U.jpg?width=216&amp;crop=smart&amp;blur=21&amp;format=pjpg&amp;auto=webp&amp;s=c0c09c51cb64b906c6e770dac837f54eed5a05a3', 'width': 216}, {'height': 320, 'url': 'https://external-preview.redd.it/DidT-JVH0gyu4MOMsb0i7eP69g0v99hC0gsh6XS8x2U.jpg?width=320&amp;crop=smart&amp;blur=32&amp;format=pjpg&amp;auto=webp&amp;s=1affdda9548ca1a71bcbd0977545dbc1bc3ed3e7', 'width': 320}, {'height': 640, 'url': 'https://external-preview.redd.it/DidT-JVH0gyu4MOMsb0i7eP69g0v99hC0gsh6XS8x2U.jpg?width=640&amp;crop=smart&amp;blur=40&amp;format=pjpg&amp;auto=webp&amp;s=31c96827d02a09a1e8b28b3f1fb4e42d063f15ec', 'width': 640}, {'height': 960, 'url': 'https://external-preview.redd.it/DidT-JVH0gyu4MOMsb0i7eP69g0v99hC0gsh6XS8x2U.jpg?width=960&amp;crop=smart&amp;blur=40&amp;format=pjpg&amp;auto=webp&amp;s=4582a1ec14e4e10dea157cb46a6362454589da75', 'width': 960}, {'height': 1080, 'url': 'https://external-preview.redd.it/DidT-JVH0gyu4MOMsb0i7eP69g0v99hC0gsh6XS8x2U.jpg?width=1080&amp;crop=smart&amp;blur=40&amp;format=pjpg&amp;auto=webp&amp;s=0b9984f70b6539e0c1a16f00c0de172effbb548e', 'width': 1080}], 'source': {'height': 1080, 'url': 'https://external-preview.redd.it/DidT-JVH0gyu4MOMsb0i7eP69g0v99hC0gsh6XS8x2U.jpg?blur=40&amp;format=pjpg&amp;auto=webp&amp;s=26307c2563a29c413cf06f4eaebf39f2170ccb2c', 'width': 1080}}, 'obfuscated': {'resolutions': [{'height': 108, 'url': 'https://external-preview.redd.it/DidT-JVH0gyu4MOMsb0i7eP69g0v99hC0gsh6XS8x2U.jpg?width=108&amp;crop=smart&amp;blur=10&amp;format=pjpg&amp;auto=webp&amp;s=8fc9a7d0f3fc2ad83eed1f104468c037cd9bffa5', 'width': 108}, {'height': 216, 'url': 'https://external-preview.redd.it/DidT-JVH0gyu4MOMsb0i7eP69g0v99hC0gsh6XS8x2U.jpg?width=216&amp;crop=smart&amp;blur=21&amp;format=pjpg&amp;auto=webp&amp;s=c0c09c51cb64b906c6e770dac837f54eed5a05a3', 'width': 216}, {'height': 320, 'url': 'https://external-preview.redd.it/DidT-JVH0gyu4MOMsb0i7eP69g0v99hC0gsh6XS8x2U.jpg?width=320&amp;crop=smart&amp;blur=32&amp;format=pjpg&amp;auto=webp&amp;s=1affdda9548ca1a71bcbd0977545dbc1bc3ed3e7', 'width': 320}, {'height': 640, 'url': 'https://external-preview.redd.it/DidT-JVH0gyu4MOMsb0i7eP69g0v99hC0gsh6XS8x2U.jpg?width=640&amp;crop=smart&amp;blur=40&amp;format=pjpg&amp;auto=webp&amp;s=31c96827d02a09a1e8b28b3f1fb4e42d063f15ec', 'width': 640}, {'height': 960, 'url': 'https://external-preview.redd.it/DidT-JVH0gyu4MOMsb0i7eP69g0v99hC0gsh6XS8x2U.jpg?width=960&amp;crop=smart&amp;blur=40&amp;format=pjpg&amp;auto=webp&amp;s=4582a1ec14e4e10dea157cb46a6362454589da75', 'width': 960}, {'height': 1080, 'url': 'https://external-preview.redd.it/DidT-JVH0gyu4MOMsb0i7eP69g0v99hC0gsh6XS8x2U.jpg?width=1080&amp;crop=smart&amp;blur=40&amp;format=pjpg&amp;auto=webp&amp;s=0b9984f70b6539e0c1a16f00c0de172effbb548e', 'width': 1080}], 'source': {'height': 1080, 'url': 'https://external-preview.redd.it/DidT-JVH0gyu4MOMsb0i7eP69g0v99hC0gsh6XS8x2U.jpg?blur=40&amp;format=pjpg&amp;auto=webp&amp;s=26307c2563a29c413cf06f4eaebf39f2170ccb2c', 'width': 1080}}}}]}",,,
[],False,Salty-Panda8150,,[],,text,t2_1oq6cg8u,False,False,[],False,False,1618654034,self.keto,https://www.reddit.com/r/keto/comments/mso3dg/confusedfrustrated_by_lack_of_progress/,{},mso3dg,True,False,False,False,True,True,False,,[],dark,text,False,False,True,11,0,False,all_ads,/r/keto/comments/mso3dg/confusedfrustrated_by_lack_of_progress/,False,6,,1618654044,1,"Hey folks, first time posting on Reddit in general so be gentle please lol

so, I've been doing keto very successfully for about 2 months now, and I'm quite proud to announce that I'm down almost 40 pounds so far! started at a little over 400 (i know, I've been a big boi) to about 365. height is 5'11 if that matters. My issue is this, my weight loss has definitely stalled despite hitting the gym regularly 3-5 times a week doing at least 20 minutes of cardio (heart rate is about 150 the entire time after a brief warm up) and strength training broken up by muscle groups each gym day. last time I did a weigh in I was 365 and this was about a week ago. The last few days I got curious and checked again and each day tends to fluctuate from around 361 to 373! I'm really not sure what I'm doing wrong here.

&amp;#x200B;

Been doing high protein Keto OMAD since the beginning and that is also when I started working out. macros are protein 140 carbs 20 fat 180 but the only one I consistently hit is protein, I treat everything else as a limit. Calories are below 1800 which is a pretty drastic deficit for a man of my size, but I generally feel fine and have enough energy to make it through the day to day and hit the gym still.",True,False,False,keto,t5_2rske,2366658,public,self,confused/frustrated by lack of progress!!!,0,[],1.0,https://www.reddit.com/r/keto/comments/mso3dg/confusedfrustrated_by_lack_of_progress/,all_ads,6,,,,,,,,
[],False,AutoModerator,,[],,text,t2_6l4z3,False,True,[],False,False,1618653615,self.keto,https://www.reddit.com/r/keto/comments/mso0h9/20210417_rketo_beginners_community_support_thread/,{},mso0h9,True,False,False,False,True,True,False,,[],dark,text,False,False,True,30,0,False,all_ads,/r/keto/comments/mso0h9/20210417_rketo_beginners_community_support_thread/,False,6,,1618653629,1,"Hello /r/keto Community!

Please use this support thread to talk freely and support each other. \*\*We've switched up the format to last 2 days so that there's more time for interaction on questions and answers.\*\*

All visitors, new and old, are kindly reminded to observe the sidebar rules, check the FAQ, and use the Search Bar before creating new posts.

*If you're new to* /r/keto *and need some info, start with* [*Keto in a Nutshell*](https://www.reddit.com/r/keto/wiki/keto_in_a_nutshell) *and* [*the FAQ*](https://www.reddit.com/r/keto/wiki/faq)*. Or, if you have a question that doesn't seem to be covered, head on over to the Community Support thread (pinned to the top of the subreddit) and ask the community!*",True,False,True,keto,t5_2rske,2366658,public,self,[2021-04-17] - /r/keto Beginners &amp; Community Support Thread,0,[],1.0,https://www.reddit.com/r/keto/comments/mso0h9/20210417_rketo_beginners_community_support_thread/,all_ads,6,,,,,,,,
[],False,Jtbmoon,,[],,text,t2_9l0tfdt4,False,False,[],False,False,1618652855,self.keto,https://www.reddit.com/r/keto/comments/msnvhq/help/,{},msnvhq,True,False,False,False,True,True,False,,"[{'e': 'text', 't': 'Help'}]",dark,richtext,False,False,False,41,0,False,all_ads,/r/keto/comments/msnvhq/help/,False,6,,1618652866,1,I've been doing Keto for about 3 months and have only lost about 15 pounds! I thought I would have lost a lot more weight by now. Idk what I'm doing wrong. I stay under 20g of carbs a day EVERYDAY! I started at 210 in January and I'm now at 195. I'm losing hope y'all. I know some weight loss is better than none but I'm still so far from my goal weight of 135. I figured I'd be at least halfway there by now. I'm really bummed. Any advise please!,True,False,False,keto,t5_2rske,2366650,public,self,Help!,0,[],1.0,https://www.reddit.com/r/keto/comments/msnvhq/help/,all_ads,6,SOS,715fe9ae-abe7-11e8-8938-0ef2dfd48a7e,Help,,,,,
[],False,avp216,,[],,text,t2_do25h,False,False,[],False,False,1618652375,self.keto,https://www.reddit.com/r/keto/comments/msns9e/help_and_tips_with_continues_weight_loss_on_keto/,{},msns9e,True,False,False,False,True,True,False,,"[{'e': 'text', 't': 'Help'}]",dark,richtext,False,False,True,8,0,False,all_ads,/r/keto/comments/msns9e/help_and_tips_with_continues_weight_loss_on_keto/,False,6,,1618652386,1,"Hello everyone! 

At the end of Last year, i decided to start Keto again and lose weight.  It has been going well thus far, but i believe progress is relatively slow, and i think i might be doing something wrong somewhere.  So, i am here looking for advice into what i can do to improve the situation! :D

&amp;#x200B;

My start point and end point are as follows:

Sepetember 2020: 124.5 Kg at 43.1 BMI

As of Today, April 17 2021: 99.4 Kg at 34.4 BMI

&amp;#x200B;

So, about 8 months to lose 25.1 Kg.  

&amp;#x200B;

While i am happy i lost weight at all, i think this might be too slow.  I am aware my body could just be a slower model lol, but i am hoping some of you fine individuals could help me improve this \^\_\^

I am going for the following macros ideally:

5% Carbs

25% Protein

70% Fat

1500 Calories

&amp;#x200B;

Usually, i stay just under the macros, but sometimes i exceed a bit depending on meal.  But i have did my best to adhere to this as best as possible.  My main issue is staying under the CALORIE limit to reach my fat goal.

&amp;#x200B;

Anyways, i have rambled on long enough!  Any insight into how i could improve would be amazing!

Thank you in advice, and i hope you all have a pleasant day :D",True,False,False,keto,t5_2rske,2366645,public,self,Help and tips with continues weight loss on Keto!,0,[],1.0,https://www.reddit.com/r/keto/comments/msns9e/help_and_tips_with_continues_weight_loss_on_keto/,all_ads,6,SOS,715fe9ae-abe7-11e8-8938-0ef2dfd48a7e,Help,,,,,
[],False,Think-Caterpillar760,,[],,text,t2_7349tdx5,False,False,[],False,False,1618652209,self.keto,https://www.reddit.com/r/keto/comments/msnr7i/keto_longterm_vs_shortterm_benefits/,{},msnr7i,True,False,False,False,True,True,False,,[],dark,text,False,False,True,2,0,False,all_ads,/r/keto/comments/msnr7i/keto_longterm_vs_shortterm_benefits/,False,6,,1618652219,1,"I'm currently about 2 months into my Keto journey and it has really been a positive experience for me. 

I've heard your body keeps becoming more and more fat-adapted with time. And wonder what Keto looks like overtimes and how it changes your body/metabolism in the long run.  Just trying to figure out what more I could be expecting in terms of health, energy levels, mental clarity, etc.",True,False,False,keto,t5_2rske,2366641,public,self,Keto long-term vs short-term benefits?,0,[],1.0,https://www.reddit.com/r/keto/comments/msnr7i/keto_longterm_vs_shortterm_benefits/,all_ads,6,,,,,,,,
[],False,-HyperConnectivity-,,[],,text,t2_axv34fla,False,False,[],False,False,1618651465,self.keto,https://www.reddit.com/r/keto/comments/msnmby/how_to_unify_protein_restriction_with_weight/,{},msnmby,True,False,False,False,True,True,False,,[],dark,text,False,False,True,9,0,False,all_ads,/r/keto/comments/msnmby/how_to_unify_protein_restriction_with_weight/,False,6,,1618651475,1,"Hello all.  


I often see the recommendations to limit protein intake to a maximum of 25-35 g per meal, as this is what the body is able to utilize for muscle synthesis and that excess protein may be unproductive to ketosis, as it will convert to glucose.   


And yet, as someone attempting to gain muscle mass by bodyweight training, while eating two meals a day within an 8 hour window. Eating only 25-35 g of protein per meal seems sort of silly, if no detrimental to progress.   


Do you know how high protein or adequate protein for muscle building can be unified with ketogenic eating for maximum benefit in both areas?",True,False,False,keto,t5_2rske,2366630,public,self,How to unify protein restriction with weight training?,0,[],1.0,https://www.reddit.com/r/keto/comments/msnmby/how_to_unify_protein_restriction_with_weight/,all_ads,6,,,,,,,,
[],False,alonsiuseysenbarth,,[],,text,t2_ad5bsv66,False,False,[],False,False,1618647829,self.keto,https://www.reddit.com/r/keto/comments/msmy66/transitioning_out_of_keto/,{},msmy66,True,False,False,False,True,True,False,,[],dark,text,False,False,False,3,0,False,all_ads,/r/keto/comments/msmy66/transitioning_out_of_keto/,False,6,,1618647839,1,"Hey everyone, I don't know if this fits in here too, but I have decided to slowly end my keto journey/ low carb high fat nutrition. I did it for 60 days, lost around 20lbs and felt quite well. But I had very often diarrhea, an upset stomach, eventhough I was aware of having good fats, a diverse diet and getting my greens, minerals and vitamins in. I learned through this elemination, that i cannot digest tomatoes well and lots more about my body.
I have decided to slowly transition out of the lchf way of eating into more of a 40/30/30 c/f/p macro split, for several reasons.

Do you have any points I should be aware of?
I will stay at clear goals like keeping processed sugar out, only drinking water and not drinking my calories. But I am a bit afraid of messing up with reintroducing carbs into my diet again.
BR, and sorry for the grammar, english is not my native language.
:)",True,False,False,keto,t5_2rske,2366580,public,self,Transitioning out of keto,0,[],1.0,https://www.reddit.com/r/keto/comments/msmy66/transitioning_out_of_keto/,all_ads,6,,,,,,,,
[],False,killboby,,[],,text,t2_60itzdcz,False,False,[],False,False,1618643957,self.keto,https://www.reddit.com/r/keto/comments/msm8cr/25_lbs_down_4_weeks_in/,{},msm8cr,True,False,False,False,True,True,False,,[],dark,text,False,False,True,39,0,False,all_ads,/r/keto/comments/msm8cr/25_lbs_down_4_weeks_in/,False,6,,1618643968,1,"2020 was bad for me. I’ve always been big. I have dabbled with Keto in 2017 and did ok for a couple months, but I always found a way to justify “cheating” and I quickly got bored and gained whatever I had lost. I was 277lbs. I started an office job the same year and as of March 22nd of this year I was 353lbs. It hurts to even type that number. I had had enough. I gained 50lbs in 2020 alone. Working from home may as well have been called eat all fucking day at home. 
March 22nd I jumped head first Into Keto. 20g of carbs or less. I am down 24.6lbs. I have way more energy, clothes are fitting better. Im not nearly as Hungry as before. I would eat big meals morning, noon and evening. Not to mention snacks at night. Now I am IF 16/8’ish and generally have two small meals a day. My goal is 100lbs. For anyone who’s starting like I am, carbs are addicting but seeing the pounds melt off is just as addictive to me. Here’s to 75 more pounds!!",True,False,False,keto,t5_2rske,2366530,public,self,25 LBS down 4 weeks in!!!,0,[],1.0,https://www.reddit.com/r/keto/comments/msm8cr/25_lbs_down_4_weeks_in/,all_ads,6,,,,,,,,
[],False,FettiMcSchwanz,,[],,text,t2_1dreocxr,False,False,[],False,False,1618643111,self.keto,https://www.reddit.com/r/keto/comments/msm27w/keto_is_the_best_working_diet_for_me/,{},msm27w,True,False,False,False,True,True,False,,"[{'e': 'text', 't': 'Success Story'}]",dark,richtext,False,False,True,3,0,False,all_ads,/r/keto/comments/msm27w/keto_is_the_best_working_diet_for_me/,False,6,,1618643121,1,"Hi, im a male that recently turned 30 and end of January I passed 100 Kilo. Back then I ate a shitload of carbs and did little to no sport thanks to corona. Thats when I found out about keto. I started my keto voyage and only made single cheat days every 3 weeks. Since then I lost !!! 8,5 Kilo !!! in just over 2.5 months. I feel a lot more confident and people tell me how my face looks slimer and my stomach shrinked. 

English is not my first language so sorry for the bad grammar and choice of words. KETO ROCKS!",True,False,False,keto,t5_2rske,2366522,public,self,Keto is the best working diet for me,0,[],1.0,https://www.reddit.com/r/keto/comments/msm27w/keto_is_the_best_working_diet_for_me/,all_ads,6,success,a8bb6b80-abe7-11e8-8696-0ed9e0d77ef8,Success Story,,,,,
