all_awardings,allow_live_comments,author,author_flair_css_class,author_flair_richtext,author_flair_text,author_flair_type,author_fullname,author_patreon_flair,author_premium,awarders,can_mod_post,contest_mode,created_utc,domain,full_link,gildings,id,is_crosspostable,is_meta,is_original_content,is_reddit_media_domain,is_robot_indexable,is_self,is_video,link_flair_background_color,link_flair_richtext,link_flair_text_color,link_flair_type,locked,media_only,no_follow,num_comments,num_crossposts,over_18,parent_whitelist_status,permalink,pinned,post_hint,preview,pwls,removed_by_category,retrieved_on,score,selftext,send_replies,spoiler,stickied,subreddit,subreddit_id,subreddit_subscribers,subreddit_type,thumbnail,title,total_awards_received,treatment_tags,upvote_ratio,url,whitelist_status,wls,link_flair_css_class,link_flair_template_id,link_flair_text,author_cakeday,author_flair_background_color,author_flair_template_id,author_flair_text_color,crosspost_parent,crosspost_parent_list,url_overridden_by_dest
[],False,Andykaufman9,,[],,text,t2_10xywt,False,False,[],False,False,1618467775,self.keto,https://www.reddit.com/r/keto/comments/mr8zs3/blood_glucose_levels/,{},mr8zs3,True,False,False,False,True,True,False,,[],dark,text,False,False,True,6,0,False,all_ads,/r/keto/comments/mr8zs3/blood_glucose_levels/,False,,,6,,1618467786,1,"Hey guys,

Im doing 2.5 months Keto right now and I love it.
I lost around 12 kilo’s right now and i am almost at my goal weight of 95 kilo (im 192 cm length).
I lost a lot of fatt and have more and more energy, no more brain fog.

Yesterday i did some glucose testing which hovers during the day between 89-93. This is all included with eating.

Now my fasting glucose after waking up was 101, which made me worried.
I read a lot about physiological insulin resistance, and i have a feeling this could be it.

Does anyone have an explanation for this? Otherwise i will do a checkup at the doctors.

Thanks guys!",True,False,False,keto,t5_2rske,2364003,public,self,Blood Glucose Levels,0,[],1.0,https://www.reddit.com/r/keto/comments/mr8zs3/blood_glucose_levels/,all_ads,6,,,,,,,,,,
[],False,MC_Samson,,[],,text,t2_kuu3h,False,True,[],False,False,1618467654,self.keto,https://www.reddit.com/r/keto/comments/mr8yvk/what_are_the_possible_reasons_for_weight_loss/,{},mr8yvk,True,False,False,False,True,True,False,,[],dark,text,False,False,True,14,0,False,all_ads,/r/keto/comments/mr8yvk/what_are_the_possible_reasons_for_weight_loss/,False,,,6,,1618467664,1,"Hi guys,

So I’ve been tracking my calories and amount of carbs and apart from 2 days where I purposefully went over (in terms of carbs), this past month I’ve consistently stayed at around 1200 or less calories a day, at least on average. And 30g of carbs a day or less (this is what I’ve done when I did it before and had no issues).

In the past 1 week though I haven’t seen any change in weight at all, in fact if anything a slight increase. It’s a little disheartening as keto is obviously a lot of effort. Usually I would see a loss of weight almost daily, but I haven’t dropped anything since 8 days ago.

I know it’s only a single week but idk. I’m planning to workout soon which will hopefully help.",True,False,False,keto,t5_2rske,2364002,public,self,What are the possible reasons for weight loss stalls?,0,[],1.0,https://www.reddit.com/r/keto/comments/mr8yvk/what_are_the_possible_reasons_for_weight_loss/,all_ads,6,,,,,,,,,,
[],False,EpilepticSquidly,,[],,text,t2_14p48a,False,False,[],False,False,1618460336,self.keto,https://www.reddit.com/r/keto/comments/mr7efe/any_changes_in_your_nonalcoholic_fatty_liver/,{},mr7efe,True,False,False,False,True,True,False,,[],dark,text,False,False,False,12,0,False,all_ads,/r/keto/comments/mr7efe/any_changes_in_your_nonalcoholic_fatty_liver/,False,,,6,,1618460348,1,"I've been keto for about a year. Dropped 50lbs, kept it off. I eat a lot of healthy fat and saturated animal fats. Before I lost weight I had early stages of fatty liver disease.  I've seen bipolar studies on how keto affects liver health in long term.  I was looking to hear some anecdotal reports from my fellow keto peeps. I'm getting blood work done this month.",True,False,False,keto,t5_2rske,2363942,public,self,Any changes in your Non-Alcoholic Fatty Liver Disease?,0,[],1.0,https://www.reddit.com/r/keto/comments/mr7efe/any_changes_in_your_nonalcoholic_fatty_liver/,all_ads,6,,,,,,,,,,
[],False,Lorib64,,[],,text,t2_bhxhv,False,False,[],False,False,1618458150,self.keto,https://www.reddit.com/r/keto/comments/mr6vd3/has_anyone_had_positive_changes_in_mental_health/,{},mr6vd3,True,False,False,False,True,True,False,,"[{'e': 'text', 't': 'Medical'}]",dark,richtext,False,False,True,31,0,False,all_ads,/r/keto/comments/mr6vd3/has_anyone_had_positive_changes_in_mental_health/,False,,,6,,1618458160,1,"I have a friend who convinced me to try keto.  I have been eating a keto diet for about 3 months.  He says it greatly helped his depression.  I have a type of schizophrenia with mood swings and am wondering if it could help me.

I also have type 2 diabetes and am on a medically supervised keto plan.  It is slightly different than what is in the FAQs but similar.  My glucose numbers have improved but not enough for any med changes yet.

My provider agreed to talk with my psychiatrist to inform him on how keto can affect mental health.  

I am curious if anyone else has had improvement in mood or other mental health symptoms with dietary changes.  I am not looking for medical advice, just wondering what to expect.
My mood has been good and I have had psychotic symptoms under control for years.  I also have been on the same medication regimen for years.",True,False,False,keto,t5_2rske,2363922,public,self,Has anyone had positive changes in mental health with keto?,0,[],1.0,https://www.reddit.com/r/keto/comments/mr6vd3/has_anyone_had_positive_changes_in_mental_health/,all_ads,6,med,b54fe080-e60a-11e8-b192-0e3e23ec553c,Medical,,,,,,,
[],False,TuPapiEstaAqui,,[],,text,t2_aonswbwo,False,False,[],False,False,1618456065,self.keto,https://www.reddit.com/r/keto/comments/mr6bzp/body_odor_changed/,{},mr6bzp,True,False,False,False,True,True,False,,"[{'e': 'text', 't': 'Medical'}]",dark,richtext,False,False,True,23,0,False,all_ads,/r/keto/comments/mr6bzp/body_odor_changed/,False,,,6,,1618456076,1,Hi all. 38m here. I’m on day 8. My under arm body odor has changed. It smells sweeter. And is much stronger/more pungent. Maybe sweeter isn’t the right word because it still smells stinky. I searched a bit and didn’t see anything about a sweet smell. It’s a polar opposite to how I used to smell. Has anyone experienced this?,True,False,False,keto,t5_2rske,2363894,public,self,Body odor changed.,0,[],1.0,https://www.reddit.com/r/keto/comments/mr6bzp/body_odor_changed/,all_ads,6,med,b54fe080-e60a-11e8-b192-0e3e23ec553c,Medical,,,,,,,
[],False,gambitx007,,[],,text,t2_x5s3o,False,False,[],False,False,1618453073,self.keto,https://www.reddit.com/r/keto/comments/mr5jhw/its_my_cake_day_so_ill_post_my_success759_lbs_lost/,{},mr5jhw,True,False,False,False,True,True,False,,[],dark,text,False,False,False,20,0,False,all_ads,/r/keto/comments/mr5jhw/its_my_cake_day_so_ill_post_my_success759_lbs_lost/,False,,,6,,1618453085,1,"I was 419 lbs last year. Worst shape of my life. My son was born right after lockdown last year and everything hurt. Bending down to bathe him. Walking him up and down stairs to change him etc. Everything sucked and hurt. I needed change. 

I started doing keto casually since November 2020. I didn't weigh myself at first so I had to check my weight against my doctor visit in January of last year. Checking last week I've lost 75.9 lbs without working out yet. A few weeks after I started taking it serious I noticed I have a lot more energy. I had my first soda this weekend. Coke zero and sprite zero. But I have gone hard with sparkle water and thats now my go to if I get a craving. 

I've been stuck at this weight for the past few weeks. I stopped using the carb manager to track my meals. Ever since they did that update a few months ago I don't care for it anymore. My goal is to lose another 75 by August. Gotta start actually working out. I got a bike seat for the baby. He will love it. Also received a bike trailer for his first birthday in case the seat doesn't work out. 

Still to scared to post before and after pictures. Maybe after 100 lbs. But my life has changed. Thank you to everyone here who has done a great job answering questions that are easy to find.",True,False,False,keto,t5_2rske,2363874,public,self,It's my cake day so I'll post my success.(75.9 lbs lost),0,[],1.0,https://www.reddit.com/r/keto/comments/mr5jhw/its_my_cake_day_so_ill_post_my_success759_lbs_lost/,all_ads,6,,,,True,,,,,,
[],False,Determined_Cupcake,,[],,text,t2_9t47qavp,False,False,[],False,False,1618452711,self.keto,https://www.reddit.com/r/keto/comments/mr5g1b/working_to_lose_weight_not_sure_if_keto_is_for_me/,{},mr5g1b,True,False,False,False,True,True,False,,"[{'e': 'text', 't': 'Help'}]",dark,richtext,False,False,True,14,0,False,all_ads,/r/keto/comments/mr5g1b/working_to_lose_weight_not_sure_if_keto_is_for_me/,False,,,6,,1618452722,1,"So, I started cutting carbs about three weeks ago. I noticed a remarkable change in energy and clarity of mind. Then I thought, "" It couldn't be too hard to go keto from here..."" So I downloaded Sensa and tried to stick to the suggested goals. It's been 13 days since then, and every time I get close to the suggested goal of carbs (25g)
I get this weird whole body feeling of acidity, confusion, and like I just want to claw off my own face. Then I totally overeat and feel guilty, but it solves the feeling. 75g is too many, but around 50g seems just right ( Carbs) I'm eating 120g of fat a day (24hrs) and 50-80g protein. And on this I feel great. But according to the rules, I won't be in ketosis this way. So, am I burning carbs, or fat? Or do I need to stop this charade and be a carbie again? I'm fairly active, walking most of the day around my house doing chores, and walking with weights. Do I need to increase my carb intake because of physical activity?",True,False,False,keto,t5_2rske,2363869,public,self,"Working to lose weight, not sure if Keto is for me?",0,[],1.0,https://www.reddit.com/r/keto/comments/mr5g1b/working_to_lose_weight_not_sure_if_keto_is_for_me/,all_ads,6,SOS,715fe9ae-abe7-11e8-8938-0ef2dfd48a7e,Help,,,,,,,
[],False,that_techno_girl,,[],,text,t2_h29pcge,False,False,[],False,False,1618450072,self.keto,https://www.reddit.com/r/keto/comments/mr4q47/scotch_eggs/,{},mr4q47,True,False,False,False,True,True,False,,"[{'e': 'text', 't': 'Food and Recipes'}]",dark,richtext,False,False,True,11,0,False,all_ads,/r/keto/comments/mr4q47/scotch_eggs/,False,,,6,,1618450082,1,"So I just saw a fb post of a friend eating scotch eggs and I thought to myself ""oh are those keto?"" So after looking up a recipe looks like they get breaded/coated with crushed corn flakes. Am I off the wall thinking you could prob sub crushed pork rinds and be good to go? I'm still new to this but trying to work out shipping lists/mean plans/things the kids will eat.",True,False,False,keto,t5_2rske,2363838,public,self,Scotch eggs?,0,[],1.0,https://www.reddit.com/r/keto/comments/mr4q47/scotch_eggs/,all_ads,6,food,537f8c0c-e60a-11e8-95c1-0e9c77d8d010,Food and Recipes,,,,,,,
[],False,NotBadGatsby,,[],,text,t2_7mxnfa8e,False,False,[],False,False,1618449315,self.keto,https://www.reddit.com/r/keto/comments/mr4it9/using_exercise_to_increase_daily_carb_limit/,{},mr4it9,True,False,False,False,True,True,False,,[],dark,text,False,False,True,11,0,False,all_ads,/r/keto/comments/mr4it9/using_exercise_to_increase_daily_carb_limit/,False,,,6,,1618449326,1,"Do you alter the amount of carbs you eat in a day depending on the amount of exercise you do?

I have my FitBit set up to My Fitness Pal and have set my daily macros at 20g carbs, 107g protein and 145g fat. As you probably know, my daily carb intake is automatically adjusted in MFP when my FitBit syncs and adds steps to my exercise count.

I’m wondering if most of you limit your carb intake to 20g (or whatever your daily limit is) no matter what activity you do, or if you follow MFP’s adjustments and eat more carbs as you burn them off with exercise before reaching your daily goal.",True,False,False,keto,t5_2rske,2363823,public,self,Using exercise to increase daily carb limit,0,[],1.0,https://www.reddit.com/r/keto/comments/mr4it9/using_exercise_to_increase_daily_carb_limit/,all_ads,6,,,,,,,,,,
[],False,huntersalt24,,[],,text,t2_7w5kjiey,False,False,[],False,False,1618445401,self.keto,https://www.reddit.com/r/keto/comments/mr3gn4/how_to_quit_keto/,{},mr3gn4,True,False,False,False,True,True,False,,[],dark,text,False,False,True,3,0,False,all_ads,/r/keto/comments/mr3gn4/how_to_quit_keto/,False,,,6,,1618445413,1,"Hey everyone! Keto has worked great for me I've gone from 240lbs to 210. I am now working out regularly and feel like it's about time for me to quit keto, problem is I am scared of gaining all that covid quarantine weight back. Any suggestions?",True,False,False,keto,t5_2rske,2363788,public,self,How to quit keto,0,[],1.0,https://www.reddit.com/r/keto/comments/mr3gn4/how_to_quit_keto/,all_ads,6,,,,,,,,,,
[],False,socal-chicana,black,"[{'e': 'text', 't': '53F |5\'5"" | SW 284 | CW 134 | GW 130| SD 8/10/19'}]","53F |5'5"" | SW 284 | CW 134 | GW 130| SD 8/10/19",richtext,t2_4xi1t1dh,False,True,[],False,False,1618441782,self.keto,https://www.reddit.com/r/keto/comments/mr2f7p/my_sister_is_a_star/,{},mr2f7p,True,False,False,False,True,True,False,,"[{'e': 'text', 't': 'Success Story'}]",dark,richtext,False,False,True,58,0,False,all_ads,/r/keto/comments/mr2f7p/my_sister_is_a_star/,False,,,6,,1618441792,1,"When I saw my sister in October she was shocked by my weight loss and asked me about it. I was very gentle in explaining what I eat and how keto works for me. I was careful because my sister has been put on diets and judged for her weight since she was 8. I didn’t want her to feel pressured. We talked about it a few times when she went back home, but only when she brought it up. When she didn’t talk about it I didn’t bring it up because I didn’t want her to feel guilty. She wasn’t weighing herself because she has such bad associations with being weighed. 

Fast forward to now — she sends me a picture and she she’s lost 64 freaking pounds and it honestly looks like she lost 100. She said she nearly died of shock when she stepped on the scale. She has about 120 to go and feels great.

I’m happier for her than I am for myself about my own losses. I didn’t have to deal with being obese until I was an adult. Childhood was hellish for her. 🥲 Even including my husband (who I adore) she’s my favorite person in the world. ❤️",True,False,False,keto,t5_2rske,2363751,public,self,My sister is a star!,0,[],1.0,https://www.reddit.com/r/keto/comments/mr2f7p/my_sister_is_a_star/,all_ads,6,success,a8bb6b80-abe7-11e8-8696-0ed9e0d77ef8,Success Story,,#edeff1,bf715102-aa2c-11e9-835a-0e92680f1d3e,dark,,,
[],False,_neon_salamander_,black,"[{'e': 'text', 't': '34F / SW: 175 / GW: 130 / CW: 130'}]",34F / SW: 175 / GW: 130 / CW: 130,richtext,t2_a8rc63ze,False,False,[],False,False,1618441669,self.keto,https://www.reddit.com/r/keto/comments/mr2dw4/i_met_my_stretch_gw_today/,{},mr2dw4,True,False,False,False,True,True,False,,[],dark,text,False,False,True,4,0,False,all_ads,/r/keto/comments/mr2dw4/i_met_my_stretch_gw_today/,False,,,6,,1618441680,1,"and I just might keep going! I'd fallen off the tracking wagon but was still eating very low carb. I was so thrilled to see that number on the scale today!

Never been fit in my life...until now. 
Never felt confident wearing shorts...until now.
Never lost weight in a healthy and sustainable way...until now. 
Never going back.",True,False,False,keto,t5_2rske,2363750,public,self,I met my stretch GW today...,0,[],1.0,https://www.reddit.com/r/keto/comments/mr2dw4/i_met_my_stretch_gw_today/,all_ads,6,,,,,#edeff1,bf715102-aa2c-11e9-835a-0e92680f1d3e,dark,,,
[],False,helloamigo,,[],,text,t2_6ibom,False,False,[],False,False,1618439919,self.keto,https://www.reddit.com/r/keto/comments/mr1u6t/costco_mesquite_wings/,{},mr1u6t,True,False,False,False,True,True,False,,[],dark,text,False,False,True,10,0,False,all_ads,/r/keto/comments/mr1u6t/costco_mesquite_wings/,False,,,6,,1618439930,1,"My girlfriend and I swung by Costco today and picked up a big pack of these. They're already cooked so all you have to do is warm them up whenever you get a hankering but upon further examination, they have starch and some sugar (why Costco, why!?) I've been looking online for the past hour for nutrition info since Cronometer doesn't have them in their database but have had no success. I actually found them on MFP but I've learned to take that info with a grain of salt. Does anyone have any accurate nutrition info for these? Even if it means I can only eat a few at a time, they're great for those lazy days when I don't feel like cooking.",True,False,False,keto,t5_2rske,2363742,public,self,Costco Mesquite Wings,0,[],1.0,https://www.reddit.com/r/keto/comments/mr1u6t/costco_mesquite_wings/,all_ads,6,,,,,,,,,,
[],False,Dagonz01,,[],,text,t2_2j3fjuvr,False,False,[],False,False,1618439840,self.keto,https://www.reddit.com/r/keto/comments/mr1ta4/what_do_you_aim_for/,{},mr1ta4,True,False,False,False,True,True,False,,[],dark,text,False,False,True,16,0,False,all_ads,/r/keto/comments/mr1ta4/what_do_you_aim_for/,False,,,6,,1618439851,1,"I’m getting back into keto; I was successful Pre covid. I’m doing it a lot more clean and controlled this time around. I’m currently meal prepping, looking for input on how many carbs everyone aims to be below daily.",True,False,False,keto,t5_2rske,2363742,public,self,What do you aim for?,0,[],1.0,https://www.reddit.com/r/keto/comments/mr1ta4/what_do_you_aim_for/,all_ads,6,,,,,,,,,,
[],False,Traditional_Sock_135,black,"[{'e': 'text', 't': '28M, SW: 245, CW: 195, GW: 175'}]","28M, SW: 245, CW: 195, GW: 175",richtext,t2_agqwnmed,False,False,[],False,False,1618439663,self.keto,https://www.reddit.com/r/keto/comments/mr1r9o/can_you_always_trust_nutrition_labels/,{},mr1r9o,True,False,False,False,True,True,False,,"[{'e': 'text', 't': 'Food and Recipes'}]",dark,richtext,False,False,True,8,0,False,all_ads,/r/keto/comments/mr1r9o/can_you_always_trust_nutrition_labels/,False,,,6,,1618439674,1,"I recently found a type of BBQ-flavored ""protein chip"" that tastes *extremely* similar to Baked BBQ Lays but claims to have 19g protein, 4g net carbs, and 5g fat.  If it's true it's a game-changer, but the taste is so similar to Lays I feel like it can't be true.  Not gonna say the brand because I don't wanna come off as trying to advertise the product.  It's not a brand that I'd heard of before which is part of why I'm not sure whether I trust it.  

Does anyone actually verify the macros listed in nutrition labels? I read that there's a 20% allowable margin of error in calorie labeling but I can't get any answers about whether companies can manipulate the macros.",True,False,False,keto,t5_2rske,2363739,public,self,Can you always trust nutrition labels?,0,[],1.0,https://www.reddit.com/r/keto/comments/mr1r9o/can_you_always_trust_nutrition_labels/,all_ads,6,food,537f8c0c-e60a-11e8-95c1-0e9c77d8d010,Food and Recipes,,#edeff1,bf715102-aa2c-11e9-835a-0e92680f1d3e,dark,,,
[],False,beebsylon,black,"[{'e': 'text', 't': 'F 40 SW 192 CW 189 GW 160'}]",F 40 SW 192 CW 189 GW 160,richtext,t2_l61xeb9,False,False,[],False,False,1618438675,self.keto,https://www.reddit.com/r/keto/comments/mr1fxx/dammit_ordered_a_sfheavy_cream_keto_frappuccino/,{},mr1fxx,True,False,False,False,True,True,False,,"[{'e': 'text', 't': 'Help'}]",dark,richtext,False,False,False,1,0,False,all_ads,/r/keto/comments/mr1fxx/dammit_ordered_a_sfheavy_cream_keto_frappuccino/,False,,,6,,1618438686,1,"Ordered a SF cinnamon dolce, no milk, just heavy cream. It tasted too good, so I looked it up when I got home. F#ck. The frap “base” is coffee syrup, corn syrup, and tons of sugar. Argh.

How long, on average, does it take to get back into ketosis after a slip like this?",True,False,False,keto,t5_2rske,2363731,public,self,Dammit. Ordered a SF/heavy cream keto Frappuccino and had no idea....,0,[],1.0,https://www.reddit.com/r/keto/comments/mr1fxx/dammit_ordered_a_sfheavy_cream_keto_frappuccino/,all_ads,6,SOS,715fe9ae-abe7-11e8-8938-0ef2dfd48a7e,Help,,#edeff1,bf715102-aa2c-11e9-835a-0e92680f1d3e,dark,,,
[],False,KyleJ3105,,[],,text,t2_5fwohoni,False,False,[],False,False,1618437723,self.keto,https://www.reddit.com/r/keto/comments/mr14sh/does_carb_manager_weight_meat_raw_or_cooked/,{},mr14sh,True,False,False,False,True,True,False,,"[{'e': 'text', 't': 'Help'}]",dark,richtext,False,False,False,13,0,False,all_ads,/r/keto/comments/mr14sh/does_carb_manager_weight_meat_raw_or_cooked/,False,,,6,,1618437734,1,"
For anyone using carb manager to track food. When I put 100g of chicken breast into carb manager it tells me it’s almost 200 calories.... I thought 100g of chicken breast was around 110-115 calories which makes me think it’s measuring cooked (I do raw weighing) note I’m inputing skinless chicken breast on carb manager",True,False,False,keto,t5_2rske,2363724,public,self,Does carb manager weight meat raw or cooked?,0,[],1.0,https://www.reddit.com/r/keto/comments/mr14sh/does_carb_manager_weight_meat_raw_or_cooked/,all_ads,6,SOS,715fe9ae-abe7-11e8-8938-0ef2dfd48a7e,Help,,,,,,,
[],False,GlutenFreeBlumpkin,,[],,text,t2_9xwzw9p2,False,False,[],False,False,1618437128,self.keto,https://www.reddit.com/r/keto/comments/mr0xyb/just_crossed_the_border_from_the_obese_to/,{},mr0xyb,True,False,False,False,True,True,False,,"[{'e': 'text', 't': 'Success Story'}]",dark,richtext,False,False,True,24,0,False,all_ads,/r/keto/comments/mr0xyb/just_crossed_the_border_from_the_obese_to/,False,,,6,,1618437140,1,"I’m a 6’1” male with a starting weight of 243 (quarantine combined with weight from antidepressants) and today I reached 223 lbs! 

That makes my BMI 29.4, just under obese (yeah, I know BMI is not the most accurate measure for health, however, I was never some beefed up weight lifter, however my pants have gotten looser). 

I’ve done keto before with not much success (I was very sloppy with it). 

So I decided to give it 100%, almost completely cut out drinking (had one glass of wine between the beginning of March and now), did some intermittent fasting, along with some days running or long hikes. 

Living alone, I took advantage my COVID isolation as an opportunity to have a greater control over every single thing that I eat. 

Plus when I’m feeling like getting takeout, there’s a BBQ place near my apartment (I live in Texas) where I can grab some brisket (topped with only salt and pepper) and some string beans.",True,False,False,keto,t5_2rske,2363716,public,self,Just crossed the border from the obese to overweight territory!,0,[],1.0,https://www.reddit.com/r/keto/comments/mr0xyb/just_crossed_the_border_from_the_obese_to/,all_ads,6,success,a8bb6b80-abe7-11e8-8696-0ed9e0d77ef8,Success Story,,,,,,,
[],False,Crescentia-Fortuna,,[],,text,t2_4lvpkmrf,False,False,[],False,False,1618432322,self.keto,https://www.reddit.com/r/keto/comments/mqzcx5/how_to_actually_balance_meals_where_to_get_the_fat/,{},mqzcx5,True,False,False,False,True,True,False,,"[{'e': 'text', 't': 'Help'}]",dark,richtext,False,False,True,20,0,False,all_ads,/r/keto/comments/mqzcx5/how_to_actually_balance_meals_where_to_get_the_fat/,False,,,6,,1618432334,1,"Hello!
I would like to give keto a try, and I've read a bunch of general things now, as well as reading through the food list with accepteble foods for keto.

So 5% carbs, 35% protein, 60% fat it is... but looking at the list of food, where do I get the fat from and how much in actual weight do I need of it?

Eating meat, skipping carbs by swapping them out with green veggies is what comes to mind for me, but I feel like I would end up eating too much protein and don't actually get the fat that I need like this.

And with the lists alone, I just can't quite grasp how much I need to eat of what to achieve this 5/35/60 ratio.

So I wanted to ask if someone could give me an example of a meal that I could theoretically eat every day that would give me all the important nutreints and keeps the ratio.
Of course I don't intent to actually only eat this one meal forever, but I think it would help me understand how to structure my meals. (As in, how many grams of meat +  gramms of veggies + gramms of whatever the fat comes from) 

I usually eat 2 meals a day (brunch and dinner)
so a suggestion for brunch + dinner would be nice.

Thanks in advance!",True,False,False,keto,t5_2rske,2363653,public,self,How to actually balance meals / where to get the fat?,0,[],1.0,https://www.reddit.com/r/keto/comments/mqzcx5/how_to_actually_balance_meals_where_to_get_the_fat/,all_ads,6,SOS,715fe9ae-abe7-11e8-8938-0ef2dfd48a7e,Help,,,,,,,
