all_awardings,allow_live_comments,author,author_flair_css_class,author_flair_richtext,author_flair_text,author_flair_type,author_fullname,author_patreon_flair,author_premium,awarders,can_mod_post,contest_mode,created_utc,domain,full_link,gildings,id,is_crosspostable,is_meta,is_original_content,is_reddit_media_domain,is_robot_indexable,is_self,is_video,link_flair_background_color,link_flair_richtext,link_flair_text_color,link_flair_type,locked,media_only,no_follow,num_comments,num_crossposts,over_18,parent_whitelist_status,permalink,pinned,pwls,removed_by_category,retrieved_on,score,selftext,send_replies,spoiler,stickied,subreddit,subreddit_id,subreddit_subscribers,subreddit_type,thumbnail,title,total_awards_received,treatment_tags,upvote_ratio,url,whitelist_status,wls,link_flair_css_class,link_flair_template_id,link_flair_text,post_hint,preview,author_flair_background_color,author_flair_template_id,author_flair_text_color
[],False,anarchoCB,black,"[{'e': 'text', 't': '31/M/6\'0"" |SW: 218| CW 158 DONE!'}]","31/M/6'0"" |SW: 218| CW 158 DONE!",richtext,t2_l356m,False,False,[],False,False,1618690319,self.keto,https://www.reddit.com/r/keto/comments/msy4kc/has_anyone_tried_these_brands_of_monk_fruit/,{},msy4kc,True,False,False,False,True,True,False,,"[{'e': 'text', 't': 'Food and Recipes'}]",dark,richtext,False,False,True,7,0,False,all_ads,/r/keto/comments/msy4kc/has_anyone_tried_these_brands_of_monk_fruit/,False,6,,1618690330,1,"We've been eating a lot of Lakanto monk fruit from COSTCO, but they've been sold out for months. I found these two cheaper brands on Amazon, and I'm wondering if anyone has tried them (Milliard and Microingredients)?


https://www.amazon.com/Milliard-Monk-Fruit-Sweetener-Replacement/dp/B088FZ67WN/ref=sr_1_10?dchild=1&amp;keywords=monk+fruit&amp;qid=1618689725&amp;sr=8-10

https://www.amazon.com/Organic-Sweetener-Erythritol-Smoothie-Friendly/dp/B07X4BL4GC/ref=sr_1_13?dchild=1&amp;keywords=monk+fruit&amp;qid=1618689725&amp;sr=8-13


Thank you!!!",True,False,False,keto,t5_2rske,2367208,public,self,Has anyone tried these brands of Monk Fruit?,0,[],1.0,https://www.reddit.com/r/keto/comments/msy4kc/has_anyone_tried_these_brands_of_monk_fruit/,all_ads,6,food,537f8c0c-e60a-11e8-95c1-0e9c77d8d010,Food and Recipes,,,#edeff1,986aabd0-6394-11e1-b751-12313b08a511,dark
[],False,albertwittgenstein,,[],,text,t2_acygcvt,False,False,[],False,False,1618690033,self.keto,https://www.reddit.com/r/keto/comments/msy1d4/my_keto_journey/,{},msy1d4,True,False,False,False,True,True,False,,[],dark,text,False,False,False,0,0,False,all_ads,/r/keto/comments/msy1d4/my_keto_journey/,False,6,,1618690044,1,i have started keto/omad today. my current weight 117 kg. my highest was 155 kg. i was doing if 16/8 before. i am open to suggestion to switch keto. i have been jumping rope for 7 months. my question is when i start to exercise in keto?,True,False,False,keto,t5_2rske,2367205,public,self,my keto journey,0,[],1.0,https://www.reddit.com/r/keto/comments/msy1d4/my_keto_journey/,all_ads,6,,,,,,,,
[],False,aziz_chinwi,,[],,text,t2_8pvcew3k,False,False,[],False,False,1618689532,self.keto,https://www.reddit.com/r/keto/comments/msxvkj/green_tea/,{},msxvkj,True,False,False,False,True,True,False,,[],dark,text,False,False,True,0,0,False,all_ads,/r/keto/comments/msxvkj/green_tea/,False,6,,1618689544,1,"[Green Tea](https://sites.google.com/view/best-teas-to-lose-weight-/accueil) 

Green tea is one of the most well-known types of tea, and is linked with many health benefits.

It’s also one of the most effective teas for weight loss. There is substantial evidence linking green tea to decreases in both weight and body fat.

In one 2008 study, 60 obese people followed a standardized diet for 12 weeks while regularly drinking either green tea or a placebo.

Over the course of the study, those who drank green tea lost 7.3 pounds (3.3 kg) more weight than the placebo group 

Another study found that people who consumed green tea extract for 12 weeks experienced significant decreases in body weight, body fat and waist circumference, compared to a control group",True,False,False,keto,t5_2rske,2367204,public,self,Green Tea,0,[],1.0,https://www.reddit.com/r/keto/comments/msxvkj/green_tea/,all_ads,6,,,,self,"{'enabled': False, 'images': [{'id': 'tbgdMzmW3aHOho6GD6OAkWU4oBtvD4FX36KcuB4hQHw', 'resolutions': [{'height': 65, 'url': 'https://external-preview.redd.it/vUoGbm2ysxyq-rc1NwLtyVlSBuT-niFiW0YX5N6-sV4.jpg?width=108&amp;crop=smart&amp;auto=webp&amp;s=fa79d9e0717777e6ab94bc6d6c7b07b5c63a0f58', 'width': 108}, {'height': 131, 'url': 'https://external-preview.redd.it/vUoGbm2ysxyq-rc1NwLtyVlSBuT-niFiW0YX5N6-sV4.jpg?width=216&amp;crop=smart&amp;auto=webp&amp;s=39ec6a70272d2107c947e8a8cc2c92722efcaeed', 'width': 216}, {'height': 195, 'url': 'https://external-preview.redd.it/vUoGbm2ysxyq-rc1NwLtyVlSBuT-niFiW0YX5N6-sV4.jpg?width=320&amp;crop=smart&amp;auto=webp&amp;s=c264e0496e7f90e31ba92fc56137bff5d82c247b', 'width': 320}], 'source': {'height': 300, 'url': 'https://external-preview.redd.it/vUoGbm2ysxyq-rc1NwLtyVlSBuT-niFiW0YX5N6-sV4.jpg?auto=webp&amp;s=3ba6bdf2af524d14e69943cc045602993fc87ade', 'width': 492}, 'variants': {}}]}",,,
[],False,er3733,,"[{'e': 'text', 't': '42/m/178cm SW:(1 July 17: 99kg) CW: 93kg GW: 70kg'}]",42/m/178cm SW:(1 July 17: 99kg) CW: 93kg GW: 70kg,richtext,t2_8xnux,False,False,[],False,False,1618687745,self.keto,https://www.reddit.com/r/keto/comments/msxbf6/is_it_a_plateau_if_it_just_isnt_working/,{},msxbf6,True,False,False,False,True,True,False,,[],dark,text,False,False,True,9,0,False,all_ads,/r/keto/comments/msxbf6/is_it_a_plateau_if_it_just_isnt_working/,False,6,,1618687756,1,"So i lost roughly 50 pounds on keto a few years ago. So i kinda know how it works....
My gf and i decided to try it again about a month ago. Weve been on it for a month. We are tracking carbs and have maintained low carbs based on our weight/height. Our keto sticks (fwiw) show we are excreting ketones. 

I lost five pounds the first week and got stuck, she's lost two and is thinking about giving up. her goal is only ten pounds.

SW 196 CW 191 GW 160",True,False,False,keto,t5_2rske,2367173,public,self,Is it a plateau if it just isn't working?,0,[],1.0,https://www.reddit.com/r/keto/comments/msxbf6/is_it_a_plateau_if_it_just_isnt_working/,all_ads,6,,,,,,,,dark
[],False,cookiekid6,,[],,text,t2_2u962dy8,False,False,[],False,False,1618686176,self.keto,https://www.reddit.com/r/keto/comments/mswt17/happy_hour_deals/,{},mswt17,True,False,False,False,True,True,False,,"[{'e': 'text', 't': 'Other'}]",dark,richtext,False,False,False,8,0,False,all_ads,/r/keto/comments/mswt17/happy_hour_deals/,False,6,,1618686187,1,When I was coming back from a trip we stopped by this place that had wing happy hour from 3-6. Since fat and proteins are more expensive than regular diets I was hoping we could discuss good keto restaurant happy hour deals like that one and how to find these deals in our local Restaurants.,True,False,False,keto,t5_2rske,2367150,public,self,Happy hour deals…,0,[],1.0,https://www.reddit.com/r/keto/comments/mswt17/happy_hour_deals/,all_ads,6,other,9f422c2a-e610-11e8-80ec-0e36d2568fbe,Other,,,,,
[],False,somethinglikethat20,,[],,text,t2_81b8uq8l,False,False,[],False,False,1618684456,self.keto,https://www.reddit.com/r/keto/comments/msw9a7/getting_back_on_the_horse/,{},msw9a7,True,False,False,False,True,True,False,,[],dark,text,False,False,True,8,0,False,all_ads,/r/keto/comments/msw9a7/getting_back_on_the_horse/,False,6,,1618684467,1,"Last year I lost about 30lbs give or take doing keto, well at the end of January I went through some personal struggles and then moved in February. I used the stress from all this as an excuse to indulge and basically fell completely off of keto for two months and have fallen into my old fast food diet routine. This week I weighed myself and found out in I gained almost all of the weight I spent 6 months loosing back. I'm not letting this discourage me though and I am back with avengeance. I'm starting off easy with atkins and keto frozen meals and will gradually going to impliment meal prep back into my schedule. Sorry food addiction but your to toxic for me, bye.",True,False,False,keto,t5_2rske,2367121,public,self,Getting back on the horse,0,[],1.0,https://www.reddit.com/r/keto/comments/msw9a7/getting_back_on_the_horse/,all_ads,6,,,,,,,,
[],False,NomarsFool,,[],,text,t2_c1yvpv8,False,False,[],False,False,1618683170,self.keto,https://www.reddit.com/r/keto/comments/msvuq9/black_soybeans_change_in_nutrition_label/,{},msvuq9,True,False,False,False,True,True,False,,"[{'e': 'text', 't': 'Food and Recipes'}]",dark,richtext,False,False,True,15,0,False,all_ads,/r/keto/comments/msvuq9/black_soybeans_change_in_nutrition_label/,False,6,,1618683186,1,"Black Soybeans (canned) from Eden foods used to have the following nutrition information (per 130 g)

120 calories  
7g fat  
11g protein  
8g carbohydrates  
7g fiber  
1g net carbs

Which was pretty attractive. Unfortunately, they recently changed their label quite dramatically so it is now:

130 calories  
4.5g fat  
11g protein  
**11**g carbohydrates  
**6**g fiber  
**5**g net carbs

That's a pretty dramatic change.",True,False,False,keto,t5_2rske,2367107,public,self,Black Soybeans - Change in nutrition label,0,[],1.0,https://www.reddit.com/r/keto/comments/msvuq9/black_soybeans_change_in_nutrition_label/,all_ads,6,food,537f8c0c-e60a-11e8-95c1-0e9c77d8d010,Food and Recipes,,,,,
[],False,No-Personality9312,,[],,text,t2_4c4s4ych,False,False,[],False,False,1618682407,self.keto,https://www.reddit.com/r/keto/comments/msvlpm/bloated_stomach_why_god_why/,{},msvlpm,True,False,False,False,True,True,False,,"[{'e': 'text', 't': 'Tips and Tricks'}]",dark,richtext,False,False,True,16,0,False,all_ads,/r/keto/comments/msvlpm/bloated_stomach_why_god_why/,False,6,,1618682418,1,"So, I started keto. It hasn't even been a whole week yet, and somehow my belly is the biggest it's ever been. However according to my scale I have supposedly lost a little weight?  
I was wondering if anyone else has gone through something similar? Please tell me what happend after you got a bloated stomach on keto!!!",True,False,False,keto,t5_2rske,2367097,public,self,"BLOATED STOMACH, WHY GOD WHY.",0,[],1.0,https://www.reddit.com/r/keto/comments/msvlpm/bloated_stomach_why_god_why/,all_ads,6,TNT ,2c0c329e-abe8-11e8-a749-0ea6409e913c,Tips and Tricks,,,,,
[],False,brisquet,,[],,text,t2_tpaj0,False,False,[],False,False,1618679184,self.keto,https://www.reddit.com/r/keto/comments/msulma/the_journey_is_full_of_ups_and_downs/,{},msulma,True,False,False,False,True,True,False,,"[{'e': 'text', 't': 'Success Story'}]",dark,richtext,False,False,True,3,0,False,all_ads,/r/keto/comments/msulma/the_journey_is_full_of_ups_and_downs/,False,6,,1618679194,1,"I just want to tell anyone trying keto to keep going!  It may seem like you are stuck at a certain weight or nothing is happening, but give it time.  I have been on keto for over 2 years and didn’t really track my weight in the beginning. 

I bought a Wyze scale to track my progress and it has been amazing for tracking!  I have had it for a year now and it’s been great. There were a few months it felt like I wasn’t losing any more weight and I was destined to hover above 190 lbs. but I finally broke through that barrier!  After seeing the scale go up and down, up and down I now see 187 and now consistently under 190. 

I highly suggest getting this scale as it tracks many different metrics and is only $20 plus shipping!  Remember to weigh yourself at the same time each day. I weigh right before I get in the shower in the morning.  

[Scale graphs](https://imgur.com/gallery/cH96iv8)",True,False,False,keto,t5_2rske,2367054,public,self,The journey is full of ups and downs,0,[],1.0,https://www.reddit.com/r/keto/comments/msulma/the_journey_is_full_of_ups_and_downs/,all_ads,6,success,a8bb6b80-abe7-11e8-8696-0ed9e0d77ef8,Success Story,self,"{'enabled': False, 'images': [{'id': '8_xpfpTK2c2bNgwgoUCQs8UGkGk1lpLXzePI6uqFPqo', 'resolutions': [{'height': 185, 'url': 'https://external-preview.redd.it/25dzrv_6stlcUoG-aVmiNd52EnzKVjawjw-Zl2TFWLc.jpg?width=108&amp;crop=smart&amp;auto=webp&amp;s=08d8241ca727203c553642775e6f6ac5576dc132', 'width': 108}, {'height': 370, 'url': 'https://external-preview.redd.it/25dzrv_6stlcUoG-aVmiNd52EnzKVjawjw-Zl2TFWLc.jpg?width=216&amp;crop=smart&amp;auto=webp&amp;s=dc8ba177b797eb32981adc7b062e7a78a6e88c67', 'width': 216}, {'height': 549, 'url': 'https://external-preview.redd.it/25dzrv_6stlcUoG-aVmiNd52EnzKVjawjw-Zl2TFWLc.jpg?width=320&amp;crop=smart&amp;auto=webp&amp;s=448f0f8c02f965060f10955601707837d54ccd1c', 'width': 320}, {'height': 1098, 'url': 'https://external-preview.redd.it/25dzrv_6stlcUoG-aVmiNd52EnzKVjawjw-Zl2TFWLc.jpg?width=640&amp;crop=smart&amp;auto=webp&amp;s=d1276264d3b1d3050316786dcefec91deff54e3e', 'width': 640}], 'source': {'height': 1287, 'url': 'https://external-preview.redd.it/25dzrv_6stlcUoG-aVmiNd52EnzKVjawjw-Zl2TFWLc.jpg?auto=webp&amp;s=702ef9e09dc52c677df09942eb3fb77ecbed39d6', 'width': 750}, 'variants': {}}]}",,,
[],False,Think-Caterpillar760,,[],,text,t2_7349tdx5,False,False,[],False,False,1618678469,self.keto,https://www.reddit.com/r/keto/comments/msudes/thought_about_offalorgan_meats/,{},msudes,True,False,False,False,True,True,False,,[],dark,text,False,False,True,7,0,False,all_ads,/r/keto/comments/msudes/thought_about_offalorgan_meats/,False,6,,1618678479,1,"I've never really eaten any organ meats but they seem to be one of the most nutrient-dense foods out there.

At the same time, they seem to have much higher levels of HDL cholesterol(at least 5x higher compared to lean meat).  There are also some supposed risks of organ meats have toxins in them.

My family has a history of heart disease and I'm trying to decide whether I should start eating Offal such as Brain, Liver, heart, etc.  

Most of the research I've done about HDL seems to be inconclusive. I'm trying to figure out if I should start eating offal, after all the nutritional benefits seem insane.

  
Has anyone here had a positive experience with offal? And wonder how noticeable the health benefits were for you.",True,False,False,keto,t5_2rske,2367043,public,self,Thought about Offal(Organ Meats),0,[],1.0,https://www.reddit.com/r/keto/comments/msudes/thought_about_offalorgan_meats/,all_ads,6,,,,,,,,
[],False,mmckinley,black,"[{'e': 'text', 't': 'F64 5\'9""SW 178 CW 158 GW 159'}]","F64 5'9""SW 178 CW 158 GW 159",richtext,t2_12spu5,False,False,[],False,False,1618678152,self.keto,https://www.reddit.com/r/keto/comments/msu9uu/maintenance/,{},msu9uu,True,False,False,False,True,True,False,,[],dark,text,False,False,True,7,0,False,all_ads,/r/keto/comments/msu9uu/maintenance/,False,6,,1618678163,1,"I have been eating Keto for 11 months.  It has been SLOW going, but have kept my carbs under 20g a day.  I have reached my goal weight (yeah!) and now want to increase carbs a bit to maintain.  Will this change the way I feel?  I've heard the term ""fat adapted"" a lot on here....will I still have that?  I'm assuming I will go out of Ketosis, but losing weight was a benefit....just wondering how I can maintain my weight while still reaping the benefits without the continued weight loss.",True,False,False,keto,t5_2rske,2367033,public,self,Maintenance,0,[],1.0,https://www.reddit.com/r/keto/comments/msu9uu/maintenance/,all_ads,6,,,,,,#edeff1,bf715102-aa2c-11e9-835a-0e92680f1d3e,dark
[],False,KetoWorks000,,[],,text,t2_8ulqv4hr,False,False,[],False,False,1618678061,self.keto,https://www.reddit.com/r/keto/comments/msu8up/keto_doesnt_work_for_me_anymore/,{},msu8up,True,False,False,False,True,True,False,,"[{'e': 'text', 't': 'Help'}]",dark,richtext,False,False,True,25,0,False,all_ads,/r/keto/comments/msu8up/keto_doesnt_work_for_me_anymore/,False,6,,1618678072,1,"Hey everyone, 

In 10 days it will mark my 6 month anniversary of me starting keto. Since then I’ve learned a lot and tried a lot. When I started keto in the first few weeks like everyone I dropped a decent amount of weight (14 pounds) and was very happy. Then after doing keto for around 2 months and rarely exercising I dropped almost 30 pounds total. 

But in the last 4 months I have barley lost any weight (5 pounds total). I haven’t changed anything that I was doing in the beginning. If anything I’ve made my diet better but I’m still not losing weight. I checked if I had ketones in my body today and the thing came back as negative. Even though I haven’t done anything that would be a reason why my body isn’t in ketosis. 

My diet nowadays consists of foods like almonds, cheese, mixed berries, bulletproof coffee, stevia, half and half, eggs, vegetables, chicken and beef. 

I’ve done my macros, I count calories, I count carbs, I don’t eat any sugar but I still don’t lose weight anymore and I don’t know what to do. 

If anyone has any suggestions on what I can do to lose weight please let me know. 

Thanks and have a good day.",True,False,False,keto,t5_2rske,2367031,public,self,Keto doesn’t work for me anymore.,0,[],1.0,https://www.reddit.com/r/keto/comments/msu8up/keto_doesnt_work_for_me_anymore/,all_ads,6,SOS,715fe9ae-abe7-11e8-8938-0ef2dfd48a7e,Help,,,,,
[],False,Dolmetscher007,black,"[{'e': 'text', 't': '43M / 6\'4"" - [SW:378&gt;GW:260&gt;CW:370] - SD: 3/2021'}]","43M / 6'4"" - [SW:378>GW:260>CW:370] - SD: 3/2021",richtext,t2_q56wm,False,False,[],False,False,1618672052,self.keto,https://www.reddit.com/r/keto/comments/msseww/should_i_track_alcoholic_spirits_along_with_all/,{},msseww,True,False,False,False,True,True,False,,[],dark,text,False,False,True,5,0,False,all_ads,/r/keto/comments/msseww/should_i_track_alcoholic_spirits_along_with_all/,False,6,,1618672063,1,"I am one of those impatient 40-somethings who lost a ton of weight on a low-carb diet 20 years ago, and is not struggling to see significant loss on Keto. I've been weighing my food and tracking everything I put in my mouth. When I track everything I eat and drink, I am well within and often 20% under my caloric and carbohydrate goals for my macros. However, if I drink any alcohol (spirits only: Vodka, Gin, etc.), that stuff is so calorically dense, if I tracked those calories as well... I'd shoot past my caloric goal for the day after a couple of sips. 

Now, I've heard from multiple resources that ethanol is so taxing on the system to dismantle and digest that it actually requires more calories to process than it contains. I rarely drink alcohol. Maybe once a week at the most, and when I do, it it always Gin and Diet Tonic, or I sip on Scotch and soda. So, I'm not talking about the calories in beer or sugary cocktails. I am only talking about the huge number of calories in spirits. Do you guys count them in with your macros for the day?",True,False,False,keto,t5_2rske,2366931,public,self,Should I track alcoholic spirits along with all my macros?,0,[],1.0,https://www.reddit.com/r/keto/comments/msseww/should_i_track_alcoholic_spirits_along_with_all/,all_ads,6,,,,,,#edeff1,bf715102-aa2c-11e9-835a-0e92680f1d3e,dark
[],False,andra-vio08,,[],,text,t2_4yinz1sk,False,False,[],False,False,1618671890,self.keto,https://www.reddit.com/r/keto/comments/mssd73/sucralose_yay_or_nay/,{},mssd73,True,False,False,False,True,True,False,,"[{'e': 'text', 't': 'Help'}]",dark,richtext,False,False,True,18,0,False,all_ads,/r/keto/comments/mssd73/sucralose_yay_or_nay/,False,6,,1618671901,1,"Hi, guys. First day on Keto. Earlier I had a conversation with a friend and we started talking about the sweetener in my ketoade. I'm using a sucralose Bulk Powder carb &amp; sugar free sweetener, strawberry flavoured - the Liquiflav drops. 

This person started being very aggressive towards me because I said I'm using sucralose. What's wrong with it?! 

I know that the powder ones have maltodextrine and dextrose as fillers, but not this one - this one is liquid, 0 carbs, 0 sugars, no nasties. Does it still raise insulin, or what's wrong with it? Thanks!",True,False,False,keto,t5_2rske,2366928,public,self,Sucralose - yay or nay?,0,[],1.0,https://www.reddit.com/r/keto/comments/mssd73/sucralose_yay_or_nay/,all_ads,6,SOS,715fe9ae-abe7-11e8-8938-0ef2dfd48a7e,Help,,,,,
[],False,ChocBrew,,[],,text,t2_3bziwtqw,False,False,[],False,False,1618671216,self.keto,https://www.reddit.com/r/keto/comments/mss64j/solve_the_electrolyte_riddle/,{},mss64j,True,False,False,False,True,True,False,,[],dark,text,False,False,False,4,0,False,all_ads,/r/keto/comments/mss64j/solve_the_electrolyte_riddle/,False,6,,1618671227,1,"Ever since going keto/low carb I feel my electrolytes were messed up, but I still can't figure out how to properly correct them. Since you guys are electrolyte experts by default maybe you could figure this out. What would you say based on these symptoms and reactions to each supplements? I've tried to supplement and add foods in many different ways and nothing seems effective so far.

Overall symptoms: Brain fog, effort to breathe (only on rare occasions I ""forget"" I'm breathing, low energy overall, threshold crampy legs.

Sodium: Makes me feel just with a little more energy and less lightheaded for a short amount of time. Taking more won't help much. Serum is always around the mid-lower healthy range.

Potassium: Instantly kills any anxiety and makes my breathing smooth, lowers cramps. The effects are very short lived and reverse into worsening symptoms in a pretty short time. Taking too much irritates stomach, increases brain fog and makes me  dizzy and weak. Serum is always around the upper healthy range.

Magnesium: This is a real riddle. Magnesium takes a while to buildup in the body so it would make a lot of sense to assume I'm depleted, after all I haven't been supplementing throughout the lowest carb periods. But I can't tolerate it at all. As little as 260mg-400mg a day will increase sleepiness(will make me sleepy the next day even if I take it at night), cramps (yeah, literally a short while after taking my muscle will threaten to cramp at the next contraction), diarrhea, and brain fog. Tried most forms (glycinate, malate, threonate), threonate is the only one that won't give me diarrhea, but same side effects. Serum is on the lower healthy range which could indicate subclinical hypomagnesemia but I can't tolerate it. Go figure....

Calcium: probably have been on a pretty low intake for a long time based on what I eat. Had a vit D deficiency a while ago, but was corrected through supplements and reached normal levels. Whenever I had a bunch of dairy or calcium rich foods I did not feel anything in particular. Serum is around the upper healthy range.",True,False,False,keto,t5_2rske,2366918,public,self,Solve the electrolyte riddle,0,[],1.0,https://www.reddit.com/r/keto/comments/mss64j/solve_the_electrolyte_riddle/,all_ads,6,,,,,,,,
[],False,DGMishka,,[],,text,t2_zz6b1,False,False,[],False,False,1618668803,self.keto,https://www.reddit.com/r/keto/comments/msrhds/goal_achieved/,{},msrhds,True,False,False,False,True,True,False,,"[{'e': 'text', 't': 'Success Story'}]",dark,richtext,False,False,True,16,0,False,all_ads,/r/keto/comments/msrhds/goal_achieved/,False,6,,1618668814,1,"I'm a long time lurker to the sub, and been watching people left and right hit there goals. My journey wasn't as great as most, I started off at 217 pounds and at 5'7"" that would put me in the overweight category.

I started keto as anew year's resolution for myself and as a bet to my fiancee that I could lose the weight (she loves me either way but wants me to be healthy). I took on the path of strict keto and with the help of the advice of many people in this sub I finally made it toy goal weight.

I AM 180 POUNDS NOW!

I haven't been this weight since I was a sophomore in college, I am 27 now. I never thought I'd shed the weight, I did keto once before like 3 years ago but quit because I was approaching the whole diet incorrectly. 

Now, for me, this isn't a diet this is a lifestyle and I plan to keep on it for as long as I live. In reality, keto isn't so hard and I am so glad I took the plunge.

Thank you all on this sub, and thank you keto!",True,False,False,keto,t5_2rske,2366880,public,self,Goal Achieved!,0,[],1.0,https://www.reddit.com/r/keto/comments/msrhds/goal_achieved/,all_ads,6,success,a8bb6b80-abe7-11e8-8696-0ed9e0d77ef8,Success Story,,,,,
