[],False,laulish,,[],,text,t2_2fjigdc0,False,False,[],False,False,1618415363,self.keto,https://www.reddit.com/r/keto/comments/mqtdvp/vitaminsveggies/,{},mqtdvp,True,False,False,False,True,True,False,,[],dark,text,False,False,True,10,0,False,all_ads,/r/keto/comments/mqtdvp/vitaminsveggies/,False,,,6,,1618415374,1,"Hi!

My boyfriend has been doing keto and loves it... but does NOT eat veggies anymore (he hates them lol). Obviously its not ideal health wise, but can anyone recommend vitamins to help with the lack of vitamins found in veggies?",True,False,False,keto,t5_2rske,2363465,public,self,Vitamins/veggies,0,[],1.0,https://www.reddit.com/r/keto/comments/mqtdvp/vitaminsveggies/,all_ads,6,,,,,,,,,,
[],False,cabininwoods62,,[],,text,t2_2mk7xtu7,False,False,[],False,False,1618414560,self.keto,https://www.reddit.com/r/keto/comments/mqt457/please_recommend_basics/,{},mqt457,True,False,False,False,True,True,False,,[],dark,text,False,False,True,11,0,False,all_ads,/r/keto/comments/mqt457/please_recommend_basics/,False,,,6,,1618414571,1,"New-by to counting macronutrients and glucose/ketone monitoring.  Would someone please recommend their website for logging food; carb, fat, protein?  And a recommendation for which meter system?  Thanks",True,False,False,keto,t5_2rske,2363453,public,self,Please Recommend Basics,0,[],1.0,https://www.reddit.com/r/keto/comments/mqt457/please_recommend_basics/,all_ads,6,,,,,,,,,,
[],False,ChapterOne_Loomings,,[],,text,t2_e3rfj,False,False,[],False,False,1618414391,self.keto,https://www.reddit.com/r/keto/comments/mqt22l/psoriasis/,{},mqt22l,True,False,False,False,True,True,False,,[],dark,text,False,False,True,13,0,False,all_ads,/r/keto/comments/mqt22l/psoriasis/,False,,,6,,1618414401,1,"I've been off my psoriasis medication for several months due to changing insurance.  My case is pretty mild, but I definitely flare and it's noticeable.  Started keto and my red spots and flakes are significantly lessened.  Also joint inflammation is a lot better.  Unforeseen benefit!",False,False,False,keto,t5_2rske,2363449,public,self,Psoriasis?,0,[],1.0,https://www.reddit.com/r/keto/comments/mqt22l/psoriasis/,all_ads,6,,,,,,,,,,
[],False,Glittering-Stock-394,,[],,text,t2_afa1ucnu,False,False,[],False,False,1618412832,self.keto,https://www.reddit.com/r/keto/comments/mqsil7/concerned_about_hair_and_skin_during_rapid_weight/,{},mqsil7,True,False,False,False,True,True,False,,[],dark,text,False,False,True,9,0,False,all_ads,/r/keto/comments/mqsil7/concerned_about_hair_and_skin_during_rapid_weight/,False,,,6,,1618412843,1,"I am 27F, SW: 209.45, Target: 143. My question to people who have lost significant amount of weight (like 20+ lbs) through keto within months, what was the condition (if any) on your skin and hair? 

I have just started recently, keto and IF together. Less then two weeks, already lost 9.5 pounds, which is so far the best result from any diet I've tried. While I'm absolutely delighted and motivated to stick to the diet strictly, I'm getting a bit worried about the wellbeing of my skin and hair. Thankfully both are naturally great and I want to at least try nurturing them in a way that the rapid weight loss won't harm them significantly. I'm particularly getting worried because I've seen people losing about half of the hair due to rapid weight loss with keto. Everything is looking okay for me so far, but is there anything I can do as prevention to maintain the proper health for my hair and skin?

I'm consuming healthy protein and fat as part of my keto diet, with sufficient amount of vegetables as suggested. Have been taking a HSN supplement once a day for past three months as well. Is there anything else for me to do?",True,False,False,keto,t5_2rske,2363425,public,self,Concerned about hair and skin during rapid weight loss,0,[],1.0,https://www.reddit.com/r/keto/comments/mqsil7/concerned_about_hair_and_skin_during_rapid_weight/,all_ads,6,,,,,,,,,,
[],False,maf528,black,"[{'e': 'text', 't': '36/M/6\'2"" | SW 218| CW 192| GW 185'}]","36/M/6'2"" | SW 218| CW 192| GW 185",richtext,t2_2s8jfpus,False,False,[],False,False,1618404637,self.keto,https://www.reddit.com/r/keto/comments/mqpvy9/looking_for_some_opinions_on_keto_snacking/,{},mqpvy9,True,False,False,False,True,True,False,,[],dark,text,False,False,True,20,0,False,all_ads,/r/keto/comments/mqpvy9/looking_for_some_opinions_on_keto_snacking/,False,,,6,,1618404649,1,"Hi All, been stalking this group since I started my keto journey about 2.5 months ago.  I'll start off by saying it's gone way better than I ever expected and I'm very happy with my results so far.  The first month I was eating really clean, but then I discovered all the keto snacks available.  Now every day I find myself wanting something sweet, so I'm having at least 1 of (if not more) quest bar, quest peanut butter cups, diet soda, sugar free jello.  The thing is I can't decide how to feel about this.  On one hand, part of the reason I gained weight in recent years was my sweet tooth, so I feel like it's a very bad habit to be getting back into.  But on the other hand, the whole reason I started keto was to lose weight.  So if I stay within my macros and continue to see progress, what's the harm if it helps me stay sane?  Just wanted to see how others felt about this.  Thanks!",True,False,False,keto,t5_2rske,2363324,public,self,Looking for some opinions on keto snacking,0,[],1.0,https://www.reddit.com/r/keto/comments/mqpvy9/looking_for_some_opinions_on_keto_snacking/,all_ads,6,,,,,#edeff1,bf715102-aa2c-11e9-835a-0e92680f1d3e,dark,,,
[],False,Vast-Star655,,[],,text,t2_8w9xntxh,False,False,[],False,False,1618402380,self.keto,https://www.reddit.com/r/keto/comments/mqp988/lookingforadvice/,{},mqp988,True,False,False,False,True,True,False,,[],dark,text,False,False,True,12,0,False,all_ads,/r/keto/comments/mqp988/lookingforadvice/,False,,,6,,1618402392,1,Any recommendations for someone who can barely cook? I’m looking for something (app or service) that tells me what ingredients to buy from the store and helps me prep and cook. I see these services everywhere but don’t want to dive into one head first without knowing if it’s a good one. Any recommendations would be greatly appreciated! Thanks!,True,False,False,keto,t5_2rske,2363302,public,self,Lookingforadvice,0,[],1.0,https://www.reddit.com/r/keto/comments/mqp988/lookingforadvice/,all_ads,6,,,,,,,,,,
[],False,1122boogiewoogieave,,[],,text,t2_ct1w4,False,False,[],False,False,1618397958,self.keto,https://www.reddit.com/r/keto/comments/mqo5mz/is_multivitamin_necessary/,{},mqo5mz,True,False,False,False,True,True,False,,[],dark,text,False,False,False,10,0,False,all_ads,/r/keto/comments/mqo5mz/is_multivitamin_necessary/,False,,,6,,1618397968,1,"I'll start off by saying that Ive been doing Keto since August with pretty great results - started at 242lb, currently at 195lb (6'1”). Lately I've been wondering if I am going to be having any health issues in the near future having not been eating foods rich in vitamins I would have gotten on a conventional diet.  I put half-salt on everything I cook in order to prevent cramping but I'm wondering if there's anything nutrition wise I'm missing out on not taking the daily multivitamin. Do any of you long term ketoers avoid the multi?",True,False,False,keto,t5_2rske,2363259,public,self,Is multivitamin necessary?,0,[],1.0,https://www.reddit.com/r/keto/comments/mqo5mz/is_multivitamin_necessary/,all_ads,6,,,,,,,,,,
[],False,freespo,,[],,text,t2_a24a0l4c,False,False,[],False,False,1618395650,self.keto,https://www.reddit.com/r/keto/comments/mqnnfe/im_changing_my_life_with_keto_without_changing_my/,{},mqnnfe,True,False,False,False,True,True,False,,[],dark,text,False,False,True,5,0,False,all_ads,/r/keto/comments/mqnnfe/im_changing_my_life_with_keto_without_changing_my/,False,,,6,,1618395660,1,"I’m 53M, 6’1.  In the last 30 years I’ve been always overweight.

I went trough a lot of different trials in order to go down with my weight. In 2013 I tried Dukan and I’ve got good results with -40lbs loss. That nutrition was very difficult to maintain, moreover I had also few health negative consequences. After I interrupted it, I bounced back to 260lbs. Then I tried a low-cal balanced diet I had a relatively lower weight loss and It was again very difficult to follow this kind of nutrition.

My dream has been to go back under 220lbs (100kg). I was really upset that even though in the past I got the target, I‘d not been able to stay there. I was quite desperate, and I couldn’t control my weight at all, and I reached again and again 260lbs.

One year ago, while I was struggling with my last low-fat/low-cal diet with actual poor results and lot of hardship, I was told about keto and the incredible result you can achieve with it.

I started with keto, and I have to admit, initially it was very difficult. Big difficulties for me was to give up on my beloved pasta and pizza and that’s a real sacrifice considering I’m Italian.

I was almost to give up, when luckily one year ago a friend of mine introduced an Italian brand specialized in low card foods to. They offer pasta, bread, cakes all with very low carb content (around 5gr CHO/100gr). There are also preparations to make pasta, bread, pizza and cakes home. Everything tastes delicious. You wouldn’t be even able to recognize differences with high carb food.

This way I’m now able to eat all my beloved dishes keeping my carbohydrate lower than 25gr a day.

Eating in such a way eventually I hit my target few months ago and I’m going further down. My current weight is 210lbs (95Kg)

I haven’t felt my self so good and energetic since my twenties. I will stay on keto forever. That’s only joy and fun and no sacrifice at all.",True,False,False,keto,t5_2rske,2363239,public,self,"I’m changing my life with keto, without changing my habits!",0,[],1.0,https://www.reddit.com/r/keto/comments/mqnnfe/im_changing_my_life_with_keto_without_changing_my/,all_ads,6,,,,,,,,,,
[],False,AutoModerator,,[],,text,t2_6l4z3,False,True,[],False,False,1618394413,self.keto,https://www.reddit.com/r/keto/comments/mqndpx/20210414_workout_wednesday_whats_your_fitness/,{},mqndpx,True,False,False,False,True,True,False,,[],dark,text,False,False,True,11,0,False,all_ads,/r/keto/comments/mqndpx/20210414_workout_wednesday_whats_your_fitness/,False,,,6,,1618394426,1,"Hey /r/keto!

Running? Lifting? Yoga? Swimming? Rowing? How are you getting your heart rate up these days?

Share your fitness regimen OR ask the community any questions you have about working out!

*If you're new to* /r/keto *and need some info, start with* [*Keto in a Nutshell*](https://www.reddit.com/r/keto/wiki/keto_in_a_nutshell) *and* [*the FAQ*](https://www.reddit.com/r/keto/wiki/faq)*. Or, if you have a question that doesn't seem to be covered, head on over to the Community Support thread (pinned to the top of the subreddit) and ask the community!*",True,False,True,keto,t5_2rske,2363223,public,self,[2021-04-14] - [Workout Wednesday] – What’s your fitness look like?,0,[],1.0,https://www.reddit.com/r/keto/comments/mqndpx/20210414_workout_wednesday_whats_your_fitness/,all_ads,6,,,,,,,,,,
[],False,S_Lukiuz,,[],,text,t2_3qwkh1h4,False,False,[],False,False,1618379565,self.keto,https://www.reddit.com/r/keto/comments/mqkb81/what_is_this/,{},mqkb81,True,False,False,False,True,True,False,,"[{'e': 'text', 't': 'Help'}]",dark,richtext,False,False,True,8,0,False,all_ads,/r/keto/comments/mqkb81/what_is_this/,False,,,6,,1618379576,1,"Hello, I have been doing keto for almost a month now (and before that I was gluten free and almost keto-like low calorie diet for couple of months) and I am happy with the results and especially feeling really good now that I am out of that keto flu funk! But for a few days I’ve had these herpes-like rashes around the corners of my lips. Has anyone experienced something like this? And how can I get rid of it because they are making me feel really bad.",True,False,False,keto,t5_2rske,2363120,public,self,What is this?,0,[],1.0,https://www.reddit.com/r/keto/comments/mqkb81/what_is_this/,all_ads,6,SOS,715fe9ae-abe7-11e8-8938-0ef2dfd48a7e,Help,,,,,,,
[],False,SGrim01,black,"[{'e': 'text', 't': '50M, SW:256, CW:215, GW:175'}]","50M, SW:256, CW:215, GW:175",richtext,t2_6zgdmmju,False,False,[],False,False,1618378057,self.keto,https://www.reddit.com/r/keto/comments/mqjza6/doctor_success/,{},mqjza6,True,False,False,False,True,True,False,,[],dark,text,False,False,True,98,0,False,all_ads,/r/keto/comments/mqjza6/doctor_success/,False,,,6,,1618378068,1,"Went to my new doctor today.  Was all prepared to give him an education on why keto isn't going to kill me and why my labs look great and I should stop taking my statin.

Soon as he walked in and saw my weight loss he asked if I was doing keto.  I was ready for a smackdown.  But when I confirmed it, he smiled and said ""Awesome job!"".  Then he went on for 20 minutes about how healthy keto is and how he's been bouncing between actual keto and just very low carb for over a year and hasn't felt better.  Then he asked me if I'd be ok with him discontinuing my statin and doing another lipid panel in 6 months to confirm I'm fine without them... before I had a chance to bring it up.

So yeah... couldn't have gone better despite me being anxious about having to argue with him about keto.  It's nice to see that doctors are starting to get up to speed on this stuff finally.",True,False,False,keto,t5_2rske,2363099,public,self,Doctor Success,0,[],1.0,https://www.reddit.com/r/keto/comments/mqjza6/doctor_success/,all_ads,6,,,,,#edeff1,bf715102-aa2c-11e9-835a-0e92680f1d3e,dark,,,
[],False,owlegion,,[],,text,t2_7j3bpgoo,False,False,[],False,False,1618377025,self.keto,https://www.reddit.com/r/keto/comments/mqjqlp/after_2_weeks_on_clean_keto_processed_fast_food/,{},mqjqlp,True,False,False,False,True,True,False,,[],dark,text,False,False,True,2,0,False,all_ads,/r/keto/comments/mqjqlp/after_2_weeks_on_clean_keto_processed_fast_food/,False,,,6,,1618377035,1,"I'm writing this post because I thought this might encourage some people to continue on their keto journey. 

Backstory: I used to be 203lbs(5'9 male) back in August, now at 164lbs after tonights cheat meal maybe at 169lbs.  

I do back to back water fasting, and keto on eating days. I eat virtually no sugar on keto not even artificial sugar. It seems like my weight loss had stalled at 164 lbs, so I thought take a break from keto, and eat whatever I wanted to get my leptin levels up. I still ate keto, I just couldn't order anything off of uber eats for some reason. I just craved broccoli, and spinach with a hamburger patty with cheese. So I had that for lunch, and the same meal for dinner. With an organic cookie, half of a brownie, and some chocolate pretzels. 

So an hour ago, I said to myself I need more carbs, so I finally went with something on uber eats. I went with Wendy's. I got some nuggets, fries, and a burger.  BIG MISTAKE. The food tasted so badddddddddddddd, like ewwwwww. My organic burger tasted way better than the wendy's burger. After all these years, I finally know why people say to avoid processed foods.Cause I feel like shit now. I felt like the meal I had was not wholesome at all. Their was no feeling of pleasure while eating the food. 

So don't give up, you may have carb cravings or junk food cravings, and honestly it's not worth it. Stay on keto, and your gut microbiome will crave healthier food.",True,False,False,keto,t5_2rske,2363083,public,self,"After 2 weeks on clean keto, processed fast food made me feel disgusted and unsatisfied",0,[],1.0,https://www.reddit.com/r/keto/comments/mqjqlp/after_2_weeks_on_clean_keto_processed_fast_food/,all_ads,6,,,,,,,,,,
[],False,JennyPigg,,[],,text,t2_21r2kkvz,False,False,[],False,False,1618376537,self.keto,https://www.reddit.com/r/keto/comments/mqjmax/too_little_fat/,{},mqjmax,True,False,False,False,True,True,False,,"[{'e': 'text', 't': 'Help'}]",dark,richtext,False,False,True,30,0,False,all_ads,/r/keto/comments/mqjmax/too_little_fat/,False,,,6,,1618376548,1,"I’ve been doing keto for 11 months and have lost 90 lbs. I have stalled with 12 lbs to go. I don’t really monitor my ketone levels that much anymore because I’ve been consistently losing, but the past two months I’ve stalled and I’ve also noticed that when I do take my ketone levels, they are off. Could I be getting too little fat? Over time on keto, I’ve found that I’m not all that hungry and I don’t eat much. Here’s my menu (and it’s boring and the same but I look at it as feeding and nothing else):

— 4 cups of coffee throughout day with 1/2 TBSP of heavy cream per cup of coffee
— 2-3 eggs, 1/4 cup ground sausage, 1/4 cup cheese all cooked in avocado oil (1 TBSP)
— keto brand sea salt ice cream bar with 1 tsp of peanut butter
— 2 rounds of babybel cheese
— 1 TBSP of MCT oil
— Water, lots

I eat the same thing every day and that’s it. I’m just not hungry. Is my stall because I’ve only got 10 lbs to go or am I not getting enough fat?",True,False,False,keto,t5_2rske,2363079,public,self,Too Little Fat?!?,0,[],1.0,https://www.reddit.com/r/keto/comments/mqjmax/too_little_fat/,all_ads,6,SOS,715fe9ae-abe7-11e8-8938-0ef2dfd48a7e,Help,,,,,,,
[],False,armbreak,,[],,text,t2_5gz2514a,False,False,[],False,False,1618374224,self.keto,https://www.reddit.com/r/keto/comments/mqj3ng/calf_cramps/,{},mqj3ng,True,False,False,False,True,True,False,,"[{'e': 'text', 't': 'Help'}]",dark,richtext,False,False,True,12,0,False,all_ads,/r/keto/comments/mqj3ng/calf_cramps/,False,,,6,,1618374234,1,"Hey yall! I've been doing keto for a little over a month now, and I've lost 20 pounds! I'm so happy! But recently, within the last week my calves keep almost/actually cramping on me, and it hurts like hell.

After a bit of research I found out this is caused by keto. What does everyone recommend? I hate hate hate calf cramps and wanna do my very best to avoid them at all costs, because I'm on keto for the long run here.

I seen some people say pickle juice helps, can I get some vouchers for that if so?

Thanks in advance. :)",True,False,False,keto,t5_2rske,2363048,public,self,Calf cramps!,0,[],1.0,https://www.reddit.com/r/keto/comments/mqj3ng/calf_cramps/,all_ads,6,SOS,715fe9ae-abe7-11e8-8938-0ef2dfd48a7e,Help,,,,,,,
[],False,et187,,[],,text,t2_ap33vqmm,False,False,[],False,False,1618372147,self.keto,https://www.reddit.com/r/keto/comments/mqilrc/the_problem_with_keto/,{},mqilrc,True,False,False,False,True,True,False,,[],dark,text,False,False,False,4,0,False,all_ads,/r/keto/comments/mqilrc/the_problem_with_keto/,False,self,"{'enabled': False, 'images': [{'id': 'Jg0uAIinDsXPxbvsCBhb7p7jKrI2iZyqgLKoTNPZLYg', 'resolutions': [{'height': 138, 'url': 'https://external-preview.redd.it/BvOyK_mGlt4t0RLRd1nloTeJzfGMDFiHECQOtUEUp2Y.jpg?width=108&amp;crop=smart&amp;auto=webp&amp;s=dd465d5da87b6014911ad202c8672411ac03947a', 'width': 108}, {'height': 276, 'url': 'https://external-preview.redd.it/BvOyK_mGlt4t0RLRd1nloTeJzfGMDFiHECQOtUEUp2Y.jpg?width=216&amp;crop=smart&amp;auto=webp&amp;s=5730ecebbf265bb31020f60f0ff9e716e00a8ec2', 'width': 216}, {'height': 409, 'url': 'https://external-preview.redd.it/BvOyK_mGlt4t0RLRd1nloTeJzfGMDFiHECQOtUEUp2Y.jpg?width=320&amp;crop=smart&amp;auto=webp&amp;s=f0cab6ff8bfa7483c29a4187948cbb44bd1ea1f6', 'width': 320}, {'height': 818, 'url': 'https://external-preview.redd.it/BvOyK_mGlt4t0RLRd1nloTeJzfGMDFiHECQOtUEUp2Y.jpg?width=640&amp;crop=smart&amp;auto=webp&amp;s=3a34ea1310e6bbee6ff7eda11a10126faf5136b8', 'width': 640}], 'source': {'height': 1126, 'url': 'https://external-preview.redd.it/BvOyK_mGlt4t0RLRd1nloTeJzfGMDFiHECQOtUEUp2Y.jpg?auto=webp&amp;s=3402b18ccdc127a40dc6dec8383c0681cf5ab3f7', 'width': 880}, 'variants': {}}]}",6,,1618372240,0,"So a few weeks back a friend and I were discussing Keto and how it works for so many people.  We like everyone else decided to try it.  The 1st week went well, I lost 7lb and my friend lost 8lb (not that we are competing or anything).  So far so good, right? Well into my 3rd week I lost 2lb and my friend gained 5lb.  In the meantime both my brother and my mom got on the kick and the same thing happened to them.  They lost a good amount of weight the 1st 2 weeks and then it slowed down drastically.  After talking with my brother, his friend (in the nutrition field) mentioned a different approach that basically outlined the do's and don't with this kind of diet and set him up with a ""eating"" plan.  Did it work? Yes. Do I have a friend that is willing to set up a personal ""eating"" plan for me? The answer is no.  Do I want to pay someone tons of money to tell me how to eat? Also no. But I did some research and there is tons of it on the internet.  I've been reading the forums, articles, posts, you name it.  Everything I came across had conflicting info.  So the same friend that got me started on this Keto life style found the Keto Resource and the 28 day Keto online.  He swears by it, and he didn't have to pay someone tons of money.  So what did I do? I paid the $37 (it was on sale) and I signed up for the ""challenge"", I figured why not.  Its cheap and if it works, even better. So far I changed my eating habits and I feel less bloated and not as hungry.  Here is the link if anyone is interested, I figured I'd share and maybe it will help some more people out.  [https://tiny.one/KetoRes](https://tiny.one/KetoRes)",True,False,False,keto,t5_2rske,2363025,public,self,The Problem with Keto,0,[],0.5,https://www.reddit.com/r/keto/comments/mqilrc/the_problem_with_keto/,all_ads,6,,,,,,,,,,
[],False,MrComedy325,,[],,text,t2_o0r1b,False,False,[],False,False,1618003623,self.keto,https://www.reddit.com/r/keto/comments/mnr3fn/constantly_hungry_am_i_doing_keto_right/,{},mnr3fn,True,False,False,False,True,True,False,,[],dark,text,False,False,True,0,0,False,all_ads,/r/keto/comments/mnr3fn/constantly_hungry_am_i_doing_keto_right/,False,,,6,,1618003635,1,"I started keto last week and I am hungry. As a short male (5'5) hoping to lose some weight, here have been my daily macros:

1427 calories |120g fat | 71g protein | 20g carbs.

I've been really hungry. What am I doing wrong?",True,False,False,keto,t5_2rske,2359443,public,self,"Constantly hungry, am I doing keto right?",0,[],1.0,https://www.reddit.com/r/keto/comments/mnr3fn/constantly_hungry_am_i_doing_keto_right/,all_ads,6,,,,,,,,,,
