all_awardings,allow_live_comments,author,author_flair_css_class,author_flair_richtext,author_flair_text,author_flair_type,author_fullname,author_patreon_flair,author_premium,awarders,can_mod_post,contest_mode,created_utc,domain,full_link,gildings,id,is_crosspostable,is_meta,is_original_content,is_reddit_media_domain,is_robot_indexable,is_self,is_video,link_flair_background_color,link_flair_richtext,link_flair_text_color,link_flair_type,locked,media_only,no_follow,num_comments,num_crossposts,over_18,parent_whitelist_status,permalink,pinned,pwls,removed_by_category,retrieved_on,score,selftext,send_replies,spoiler,stickied,subreddit,subreddit_id,subreddit_subscribers,subreddit_type,thumbnail,title,total_awards_received,treatment_tags,upvote_ratio,url,whitelist_status,wls,link_flair_css_class,link_flair_template_id,link_flair_text,post_hint,preview,author_flair_background_color,author_flair_template_id,author_flair_text_color
[],False,gorgonflabish75,,[],,text,t2_135f47,False,False,[],False,False,1618718266,self.keto,https://www.reddit.com/r/keto/comments/mt5nmj/lost_110_pounds_in_less_than_a_year/,{},mt5nmj,True,False,False,False,True,True,False,,"[{'e': 'text', 't': 'Success Story'}]",dark,richtext,False,False,True,1,0,False,all_ads,/r/keto/comments/mt5nmj/lost_110_pounds_in_less_than_a_year/,False,6,,1618718277,1,"[Progress](https://imgur.com/gallery/5yoEiCr)

Last year around March I've lost a job at the same time Covid shut down everything in my area, I spent a month in my bed browsing memes on the internet until I met someone who successfully lost around 100 pounds with keto. I was tired of being in my bed, in a situation I couldn't control and knew Covid would be the perfect opportunity to train hard, eat better and fix myself.
I've suffered from huge back pain for years and lost a lot of money on chiropractors when the only issue was my weight and lack of exercise. (I couldn't tie my shoes it was too painful to bend over but now I can rest the palm of my hands on the floor in that position !)

Time has come.

I hopped into the keto bandwagon and did intermittent fasting everyday. My diet was mostly made of fish, charcuterie, cheese, almond milk isolate shakes and lots of low carb veggies.
My appetite decreased over time like pure magic.
I cut down in half every portions of the amount of food i've used to eat and limited myself to three meals a day, sometimes two, no snacking. I also took potassium and magnesium supplements just in case.

To introduce myself to consistant exercise, I promised myself to do 30 mins a day of cardiovascular training, nothing else. Eliptical was my training of choice, then later I discovered a passion for jogging. I recently ran  a half marathon in 2 hours, I couldn't believe it. I still pinch myself to know if i'm dreaming or not.

I did that, only that from April 2020 to January 2021.
10 Months, went from 250lbs to 140lbs.
No excess, only 30 mins a day of jogging and a stable keto diet (with a cheat meal on Fridays for me.)

I must say I'm proud, happy and I can't believe it.
If I had to do it again I would certainly retake the challenge without hesitating.
Sadly, I saw a lot of people around me gaining a lot of weight during the quarantine and I truly hope my story will spark a little light of motivation in them.",True,False,False,keto,t5_2rske,2367608,public,self,Lost 110 pounds in less than a year !,0,[],1.0,https://www.reddit.com/r/keto/comments/mt5nmj/lost_110_pounds_in_less_than_a_year/,all_ads,6,success,a8bb6b80-abe7-11e8-8696-0ed9e0d77ef8,Success Story,self,"{'enabled': False, 'images': [{'id': 'cz5pbuY1vJFl9xGIcy2qEmgTPDY--3QDZJ1b-GWkrTs', 'resolutions': [{'height': 108, 'url': 'https://external-preview.redd.it/UCTr7lqOhRfUWRWNwvCHjt_j5NeCcpSHBTQOxSlavrU.jpg?width=108&amp;crop=smart&amp;auto=webp&amp;s=78fec3529db901a0cd5fbdd2a7e56733dba4865e', 'width': 108}, {'height': 216, 'url': 'https://external-preview.redd.it/UCTr7lqOhRfUWRWNwvCHjt_j5NeCcpSHBTQOxSlavrU.jpg?width=216&amp;crop=smart&amp;auto=webp&amp;s=001b13e9600ce825d0a28473c709e0e362c66a33', 'width': 216}, {'height': 320, 'url': 'https://external-preview.redd.it/UCTr7lqOhRfUWRWNwvCHjt_j5NeCcpSHBTQOxSlavrU.jpg?width=320&amp;crop=smart&amp;auto=webp&amp;s=63e8dafc413e4bb2f1068783d8928063ffe51e63', 'width': 320}, {'height': 640, 'url': 'https://external-preview.redd.it/UCTr7lqOhRfUWRWNwvCHjt_j5NeCcpSHBTQOxSlavrU.jpg?width=640&amp;crop=smart&amp;auto=webp&amp;s=1f4cd48df4d27d456bb4f03b1653da827312e9d0', 'width': 640}, {'height': 960, 'url': 'https://external-preview.redd.it/UCTr7lqOhRfUWRWNwvCHjt_j5NeCcpSHBTQOxSlavrU.jpg?width=960&amp;crop=smart&amp;auto=webp&amp;s=fce8cdba6d79bd83820dd7ecd245a8796f4e740b', 'width': 960}, {'height': 1080, 'url': 'https://external-preview.redd.it/UCTr7lqOhRfUWRWNwvCHjt_j5NeCcpSHBTQOxSlavrU.jpg?width=1080&amp;crop=smart&amp;auto=webp&amp;s=995dcee916a0b2571cae1fd865acb9e231c51a63', 'width': 1080}], 'source': {'height': 2048, 'url': 'https://external-preview.redd.it/UCTr7lqOhRfUWRWNwvCHjt_j5NeCcpSHBTQOxSlavrU.jpg?auto=webp&amp;s=298bdedb1a823f265f0760ef7c6c10b12d0afc24', 'width': 2048}, 'variants': {}}]}",,,
[],False,articlesarestupid,,[],,text,t2_3ffhwcgq,False,False,[],False,False,1618717975,self.keto,https://www.reddit.com/r/keto/comments/mt5l8k/what_was_your_longest_plateau_fight/,{},mt5l8k,True,False,False,False,True,True,False,,[],dark,text,False,False,False,1,0,False,all_ads,/r/keto/comments/mt5l8k/what_was_your_longest_plateau_fight/,False,6,,1618717988,1,"Title says it. I don't have any tools to measure stuff, and I have lost 20-22lb so far from 280 lb (26M, 5'5''). I am fighting with my second weight stall since mid-March, and I don't know how long it will last lol. I need to start working out...",True,False,False,keto,t5_2rske,2367604,public,self,What was your longest plateau fight?,0,[],1.0,https://www.reddit.com/r/keto/comments/mt5l8k/what_was_your_longest_plateau_fight/,all_ads,6,,,,,,,,
[],False,makesumnoize,,[],,text,t2_855h6,False,False,[],False,False,1618717093,self.keto,https://www.reddit.com/r/keto/comments/mt5dlp/any_recommendations_for_a_good_multivitamin_for/,{},mt5dlp,True,False,False,False,True,True,False,,"[{'e': 'text', 't': 'Help'}]",dark,richtext,False,False,True,0,0,False,all_ads,/r/keto/comments/mt5dlp/any_recommendations_for_a_good_multivitamin_for/,False,6,,1618717104,1,"Hi all, 

Been on Keto for about 2 months now (going great, amazing results) and wanted to supplement my diet with a multivitamin to make sure I remain healthy going forward. Have been experiencing some GI issues for a few weeks.

Does anyone have a recommendation for a good multivitamin for men (late twenties) that won't break my daily carb count (25gs or less/day)? Thank you in advance. First time posting here so if any additional info is needed am happy to provide!",True,False,False,keto,t5_2rske,2367589,public,self,Any recommendations for a good multivitamin for men?,0,[],1.0,https://www.reddit.com/r/keto/comments/mt5dlp/any_recommendations_for_a_good_multivitamin_for/,all_ads,6,SOS,715fe9ae-abe7-11e8-8938-0ef2dfd48a7e,Help,,,,,
[],False,aware_nightmare_85,,[],,text,t2_b7yh5g4g,False,False,[],False,False,1618716553,self.keto,https://www.reddit.com/r/keto/comments/mt58yg/keto_gerd_is_it_possible/,{},mt58yg,True,False,False,False,True,True,False,,[],dark,text,False,False,True,2,0,False,all_ads,/r/keto/comments/mt58yg/keto_gerd_is_it_possible/,False,6,,1618716563,1,"In 2017 I lost 100 pounds with strict keto and felt great. Managed to keep it off with on-and-off lazy keto until falling off the keto wagon completely at the end of 2019. In the middle of 2020 I tried keto again but started experiencing GERD symptoms that were first misdiagnosed as sinus and asthma issues. In December a veteran ENT immediately recognized it as ""silent reflux"" aka GERD and told me to do an elimination diet: cut out all fatty and acidic foods, coffee, and carbonated drinks. The elimination diet helped until I came down with a terrible norovirus (stomach flu) over St. Patrick's Day this year; everything afterwards made my stomach hurt and nauseous as hell. Saw another random doctor - due to my PCP being overbooked - said my post-stomach flu issues was due to GERD and prescribed me to continue a bland diet and take 40mg PPI pills every morning. He also lectured me about my weight -- with neither advice nor a referral to a nutritionist -- which pissed me off.

While the meds have helped, my weight continues to creep up because a GERD-friendly diet is kryptonite to people with PCOS and insulin resistance. I love keto. I miss it. And I desperately need to get back to losing weight because it is wreaking havoc on my knees and ankles. This week I've been 75% immobile - only getting up to let my dog outside - because my knees are so swollen and stiff with obesity-related osteoarthritis. I am also tired all the time because my body can't handle the glucose from eating a bland diet, not to mention my hormones are out of whack. 

So in a nutshell: I feel like I am stuck between a rock and hard place having to choose between saving my esophagus or saving myself from type 2 diabetes. I know keto will help **my whole body** feel better but I don't want to disobey doctor's orders by starting keto again. What I want to know is if there are some people here who manage to do keto with GERD that can be managed with PPI drugs?

Tldr; is there anyone here that does keto with GERD that successfully manages it with PPI drugs?",True,False,False,keto,t5_2rske,2367576,public,self,Keto + GERD. Is it possible?,0,[],1.0,https://www.reddit.com/r/keto/comments/mt58yg/keto_gerd_is_it_possible/,all_ads,6,,,,,,,,
[],False,universitybabe10131,black,"[{'e': 'text', 't': 'Type your AWESOME flair here '}]",Type your AWESOME flair here ,richtext,t2_787jlv4j,False,False,[],False,False,1618715864,self.keto,https://www.reddit.com/r/keto/comments/mt52jk/i_did_it/,{},mt52jk,True,False,False,False,True,True,False,,[],dark,text,False,False,True,0,0,False,all_ads,/r/keto/comments/mt52jk/i_did_it/,False,6,,1618715875,1,"

Hit my goal weight today! 130lbs. 5”2 female. 22 years old. Starting weight 150 last year. Just continuing to lose body fat, stay healthy, and stay hydrated. 
Next goal is to gain strong ab muscles and master a hand stand! 

There was at least a month I was stuck at 133-136lb. I know the numbers don’t really matter but it feels good.",True,False,False,keto,t5_2rske,2367569,public,self,I did it!!,0,[],1.0,https://www.reddit.com/r/keto/comments/mt52jk/i_did_it/,all_ads,6,,,,,,#edeff1,bf715102-aa2c-11e9-835a-0e92680f1d3e,dark
[],False,Doo77m,,[],,text,t2_3eie5xox,False,False,[],False,False,1618714430,self.keto,https://www.reddit.com/r/keto/comments/mt4qec/opinion_on_keto_ebook/,{},mt4qec,True,False,False,False,True,True,False,,"[{'e': 'text', 't': 'Help'}]",dark,richtext,False,False,True,0,0,False,all_ads,/r/keto/comments/mt4qec/opinion_on_keto_ebook/,False,6,,1618714443,1,"I found this keto e-book on this link 
https://issuu.com/roockytips/docs/easy_keto__1_
To download the full version of the ebook you have to go through a link on the ebook but eventually you can get it..
Anyway since there are many of those books
out there is this free book any good or should I
get something else ?
I Am new to keto and I would like to learn about it",True,False,False,keto,t5_2rske,2367549,public,self,Opinion on Keto e-book,0,[],1.0,https://www.reddit.com/r/keto/comments/mt4qec/opinion_on_keto_ebook/,all_ads,6,SOS,715fe9ae-abe7-11e8-8938-0ef2dfd48a7e,Help,self,"{'enabled': False, 'images': [{'id': 'ma5AArgjKwCHGsMHEEoxPXtQZ7RbcTNad0JxALL1sNI', 'resolutions': [{'height': 139, 'url': 'https://external-preview.redd.it/ofGu3QQHwe5XMq9NR3AuffBb7dVNH7bnOeMBxqvwFw8.jpg?width=108&amp;crop=smart&amp;auto=webp&amp;s=d9cb7d93565d76fc06a105a09785a91101ecaf0a', 'width': 108}], 'source': {'height': 150, 'url': 'https://external-preview.redd.it/ofGu3QQHwe5XMq9NR3AuffBb7dVNH7bnOeMBxqvwFw8.jpg?auto=webp&amp;s=54d5a2dfa06b32c4754976eae8867cf3f0d21837', 'width': 116}, 'variants': {}}]}",,,
[],False,OrionTheRedPanda,,[],,text,t2_17a17c,False,False,[],False,False,1618708286,self.keto,https://www.reddit.com/r/keto/comments/mt37x5/is_it_fine_to_mix_keto_with_intermittent_fasting/,{},mt37x5,True,False,False,False,True,True,False,,"[{'e': 'text', 't': 'Help'}]",dark,richtext,False,False,True,5,0,False,all_ads,/r/keto/comments/mt37x5/is_it_fine_to_mix_keto_with_intermittent_fasting/,False,6,,1618708297,1,"I started doing keto this week and I was curious if it's safe to mix it in with intermittent fasting (specifically the 16 hours no food, 8 hours good to go.)

I work all day as a delivery driver and rarely have any time to grab a bite to eat so I figured I would just do both at the same time to see some faster results. Is it safe to mix these two or should I just drop the fasting?",True,False,False,keto,t5_2rske,2367457,public,self,Is it fine to mix Keto with intermittent fasting?,0,[],1.0,https://www.reddit.com/r/keto/comments/mt37x5/is_it_fine_to_mix_keto_with_intermittent_fasting/,all_ads,6,SOS,715fe9ae-abe7-11e8-8938-0ef2dfd48a7e,Help,,,,,
[],False,E1116,,[],,text,t2_85zsoycd,False,False,[],False,False,1618707573,self.keto,https://www.reddit.com/r/keto/comments/mt31bx/chest_pressure_tightness_when_taking_deep_breath/,{},mt31bx,True,False,False,False,True,True,False,,"[{'e': 'text', 't': 'Medical'}]",dark,richtext,False,False,True,3,0,False,all_ads,/r/keto/comments/mt31bx/chest_pressure_tightness_when_taking_deep_breath/,False,6,,1618707584,1,"Just to start off - I have a doctors appointment Thursday and will address this with my doctor . 
I seen my doctor last month and everything was fine so I dont think im having a heart attack or in need of immediate medical attention however ,

I am having chest tightness and when i take a deep breath feeling a bit of pressure in my sternum. 

I am drinking two Tbsp, of apple cider vinegar daily
&amp; a little over a month into the keto diet. 

Im seeing a lot of benefits of keto but is wondering if this is a keto thing and what I can do to get rid of it ? I have never had any issues with this in my life and was always relatively healthy . As I said , a few weeks ago doctor checked me and all was fine. I have been having trouble with keto at first but feel like as of recently I really got the hang of it and am doing great! If there is anything I can do to prevent this I would be open to it . 

Also - i am drinking a gallon of water a day.",True,False,False,keto,t5_2rske,2367446,public,self,Chest pressure/ tightness when taking deep breath,0,[],1.0,https://www.reddit.com/r/keto/comments/mt31bx/chest_pressure_tightness_when_taking_deep_breath/,all_ads,6,med,b54fe080-e60a-11e8-b192-0e3e23ec553c,Medical,,,,,
[],False,freddyt55555,,[],,text,t2_26jdzrp,False,False,[],False,False,1618706514,self.keto,https://www.reddit.com/r/keto/comments/mt2rpx/new_keto_products_at_costco_some_may_be_old_but/,{},mt2rpx,True,False,False,False,True,True,False,,"[{'e': 'text', 't': 'Food and Recipes'}]",dark,richtext,False,False,False,7,0,False,all_ads,/r/keto/comments/mt2rpx/new_keto_products_at_costco_some_may_be_old_but/,False,6,,1618706527,1," [New Costco keto products - Imgur](https://imgur.com/a/MKfZRef) 

Some of these products might not actually be new, but it was the first time I've seen a most of them them. I noticed the Keto Made Simple bars at least 3 months ago, but it was definitely the first time I noticed the cups.

I didn't take a picture of the nutrition label on the ice cream bars and the keto crackers. I originally started taking pictures of the products just as a reminder to look-up the products later. It wasn't until later that I figured I'd take a picture of the nutrition label too to share with others.

Apart from these items, the store I went to had the usual Artisan Bakers Keto Bread and the Innofoods Coconut Keto Clusters. I'm glad those are still selling well enough for Costco to continue carrying.",True,False,False,keto,t5_2rske,2367433,public,self,New keto products at Costco (some may be old but seasonal),0,[],1.0,https://www.reddit.com/r/keto/comments/mt2rpx/new_keto_products_at_costco_some_may_be_old_but/,all_ads,6,food,537f8c0c-e60a-11e8-95c1-0e9c77d8d010,Food and Recipes,self,"{'enabled': False, 'images': [{'id': 'y9nYlSBTd3Bt3G8UySFpZ_Z7WpGOfelFUH1vdbG8Crc', 'resolutions': [{'height': 144, 'url': 'https://external-preview.redd.it/bV7BrDGwZgGnsxIBo1N-k0IUMW9j_rUuMj13zy0VFvY.jpg?width=108&amp;crop=smart&amp;auto=webp&amp;s=8c5592fc0cd60204d823bcaa894624aef9929330', 'width': 108}, {'height': 288, 'url': 'https://external-preview.redd.it/bV7BrDGwZgGnsxIBo1N-k0IUMW9j_rUuMj13zy0VFvY.jpg?width=216&amp;crop=smart&amp;auto=webp&amp;s=7dc74561f8155084e82cc77be399e089f1c28b36', 'width': 216}, {'height': 426, 'url': 'https://external-preview.redd.it/bV7BrDGwZgGnsxIBo1N-k0IUMW9j_rUuMj13zy0VFvY.jpg?width=320&amp;crop=smart&amp;auto=webp&amp;s=dbbfc5bc3a015afae2388ca5c123fc422fc8f20b', 'width': 320}, {'height': 853, 'url': 'https://external-preview.redd.it/bV7BrDGwZgGnsxIBo1N-k0IUMW9j_rUuMj13zy0VFvY.jpg?width=640&amp;crop=smart&amp;auto=webp&amp;s=f6aea6d73b94b33eeb5fc50ea6679a2772dd22a2', 'width': 640}, {'height': 1280, 'url': 'https://external-preview.redd.it/bV7BrDGwZgGnsxIBo1N-k0IUMW9j_rUuMj13zy0VFvY.jpg?width=960&amp;crop=smart&amp;auto=webp&amp;s=9774b72245c48a60fc8b8637136920c673db0632', 'width': 960}, {'height': 1440, 'url': 'https://external-preview.redd.it/bV7BrDGwZgGnsxIBo1N-k0IUMW9j_rUuMj13zy0VFvY.jpg?width=1080&amp;crop=smart&amp;auto=webp&amp;s=450ef297c43f3feb9a35928705ff698a666483d7', 'width': 1080}], 'source': {'height': 4032, 'url': 'https://external-preview.redd.it/bV7BrDGwZgGnsxIBo1N-k0IUMW9j_rUuMj13zy0VFvY.jpg?auto=webp&amp;s=f1a0e06d90add290456fc0bcdebae2d89116cc42', 'width': 3024}, 'variants': {}}]}",,,
[],False,kungfu-barbie,,[],,text,t2_312urs30,False,False,[],False,False,1618704786,self.keto,https://www.reddit.com/r/keto/comments/mt2bmw/continuous_glucose_monitor/,{},mt2bmw,True,False,False,False,True,True,False,,[],dark,text,False,False,True,9,0,False,all_ads,/r/keto/comments/mt2bmw/continuous_glucose_monitor/,False,6,,1618704797,1,"Anyone use one of these? I have impaired fasting glucose and I signed up for this system/program called January. They will send a request to my doc for a prescription. They use Freestyle Libre for their program. Just curious if anyone is familiar with this program or has used it. I’m a nurse practitioner and have done keto before. Need to start agin, but I am REALLY interested in finding out how different food affect my blood sugar.",True,False,False,keto,t5_2rske,2367406,public,self,Continuous glucose monitor,0,[],1.0,https://www.reddit.com/r/keto/comments/mt2bmw/continuous_glucose_monitor/,all_ads,6,,,,,,,,
[],False,weathergod100,,[],,text,t2_afo5jdvo,False,False,[],False,False,1618703164,self.keto,https://www.reddit.com/r/keto/comments/mt1vs9/how_many_grams_of_carbs_does_it_take_you_guys_to/,{},mt1vs9,True,False,False,False,True,True,False,,[],dark,text,False,False,True,5,0,False,all_ads,/r/keto/comments/mt1vs9/how_many_grams_of_carbs_does_it_take_you_guys_to/,False,6,,1618703175,1,I mostly stick to eating no sugar but sometimes I will cheat (once a month maybe) and have an ice cream. And I’ll check my ketones a few hours after and the next day and I’m still producing them. You would think something like an ice cream would kick you out of ketosis. Can anyone explain this thanks!,True,False,False,keto,t5_2rske,2367390,public,self,How many grams of carbs does it take you guys to get kicked out of ketosis?,0,[],1.0,https://www.reddit.com/r/keto/comments/mt1vs9/how_many_grams_of_carbs_does_it_take_you_guys_to/,all_ads,6,,,,,,,,
[],False,LadyArty19,,[],,text,t2_5d2xtid2,False,False,[],False,False,1618701442,self.keto,https://www.reddit.com/r/keto/comments/mt1eq3/monk_fruit_recommendations/,{},mt1eq3,True,False,False,False,True,True,False,,"[{'e': 'text', 't': 'Help'}]",dark,richtext,False,False,True,5,0,False,all_ads,/r/keto/comments/mt1eq3/monk_fruit_recommendations/,False,6,,1618701453,1,"Swerve just isn’t cutting it for me, and monk fruit is probably the only natural sweetener I haven’t tried yet. It isn’t in stores anywhere near me and there are so many brands and “blends” online I don’t know which one to pick! Would love to hear suggestions.",True,False,False,keto,t5_2rske,2367365,public,self,Monk fruit recommendations?,0,[],1.0,https://www.reddit.com/r/keto/comments/mt1eq3/monk_fruit_recommendations/,all_ads,6,SOS,715fe9ae-abe7-11e8-8938-0ef2dfd48a7e,Help,,,,,
[],False,LittleBoiFound,,[],,text,t2_4jr23vn2,False,True,[],False,False,1618700611,self.keto,https://www.reddit.com/r/keto/comments/mt15zf/been_the_same_weight_for_a_year_what_am_i_doing/,{},mt15zf,True,False,False,False,True,True,False,,"[{'e': 'text', 't': 'Help'}]",dark,richtext,False,False,True,9,0,False,all_ads,/r/keto/comments/mt15zf/been_the_same_weight_for_a_year_what_am_i_doing/,False,6,,1618700622,1,"Why in God’s name am I not losing weight? Four years ago I was 317. I am now 237. I lost the weight thanks to Keto. It’s the only thing that has ever worked. I’ve been between 236 - 241 for a year. My BMI is still in the 40’s so I certainly have more to lose. I monitor my ketones using finger prick blood testing. Typically I’m between 0.9 and 1.9. Most often right around 1.4. This seems average for me even when I was actively losing a lot of weight. On occasion it goes past 2.0 but not real often. 

I’ve tried so many little tweaks and nothing has made a difference. Most recently I slashed my protein in hopes that my liver was doing me wrong and converting protein to glucose. I do intermittent fasting, anywhere from 24 to 36 hours. Carbs are always 20 or under. I thought maybe my keto cheesecake wasn’t helping so I cut that out. I don’t need any keto sweets. I have pecans if I’m wanting a treat. On average my daily fat intake is about 80 grams. 

I walk 5-7 days a week, depending on the weather. 

What am I missing?",True,False,False,keto,t5_2rske,2367359,public,self,Been the same weight for a year - what am I doing wrong?,0,[],1.0,https://www.reddit.com/r/keto/comments/mt15zf/been_the_same_weight_for_a_year_what_am_i_doing/,all_ads,6,SOS,715fe9ae-abe7-11e8-8938-0ef2dfd48a7e,Help,,,,,
[],False,Bitwix,,[],,text,t2_7lkb7u2x,False,False,[],False,False,1618700182,self.keto,https://www.reddit.com/r/keto/comments/mt11ij/what_is_your_strategy_for_bolusing_for_net_carbs/,{},mt11ij,True,False,False,False,True,True,False,,"[{'e': 'text', 't': 'Medical'}]",dark,richtext,False,False,True,6,0,False,all_ads,/r/keto/comments/mt11ij/what_is_your_strategy_for_bolusing_for_net_carbs/,False,6,,1618700194,1,"Last week, my endo recommended I try SlimFast Fat Bomb peanut butter cups.  They have 7 carbs and 2 net carbs.  I don't recall if she told me how she boluses for them (or if she did).  I have seen people say that they only bolus for the net carbs in things and are fine.  I bolused for all 7 carbs (I was a bit nervous about bolusing for so little) and that worked out.  I'm just curious as to what other people's strategies are?  Things with diabetes change so quickly that tomorrow I could bolus for the same thing in the same way and have it be a complete distaster, so I want a few methods lined up in case my method stops working.",True,False,False,keto,t5_2rske,2367350,public,self,What is your strategy for bolusing for net carbs? (T1D),0,[],1.0,https://www.reddit.com/r/keto/comments/mt11ij/what_is_your_strategy_for_bolusing_for_net_carbs/,all_ads,6,med,b54fe080-e60a-11e8-b192-0e3e23ec553c,Medical,,,,,
[],False,kkushh07,,[],,text,t2_1quunqom,False,False,[],False,False,1618698125,self.keto,https://www.reddit.com/r/keto/comments/mt0gx6/second_time_around_and_i_have_diarrhea/,{},mt0gx6,True,False,False,False,True,True,False,,[],dark,text,False,False,False,3,0,False,all_ads,/r/keto/comments/mt0gx6/second_time_around_and_i_have_diarrhea/,False,6,,1618698136,1,I did keto for about a month and a half january through March 2021. Lost 20 pounds. Never had diarrhea. I had solid stools once every two days. Got back on keto last Wednesday and I'm having diarrhea. I know it's a common symptom but why would my body react differently the second time around? Has anyone had this happen?,True,False,False,keto,t5_2rske,2367321,public,self,Second time around and I have diarrhea,0,[],1.0,https://www.reddit.com/r/keto/comments/mt0gx6/second_time_around_and_i_have_diarrhea/,all_ads,6,,,,,,,,
[],False,anon2734,,[],,text,t2_15mgwb,False,False,[],False,False,1618691446,self.keto,https://www.reddit.com/r/keto/comments/msyh7t/anyone_feel_depressed_after_breaking_keto/,{},msyh7t,True,False,False,False,True,True,False,,"[{'e': 'text', 't': 'Help'}]",dark,richtext,False,False,True,10,0,False,all_ads,/r/keto/comments/msyh7t/anyone_feel_depressed_after_breaking_keto/,False,6,,1618691456,1,"So was on keto this week, I broke it last night after fasting about 20ish hrs. Also had a few drinks. Didn't sleep very well, felt very out of it today. I had eggs, chicken, and guac for brunch. Starting to feel more back to normal now but was way down and spaced out earlier.",True,False,False,keto,t5_2rske,2367224,public,self,Anyone feel depressed after breaking keto?,0,[],1.0,https://www.reddit.com/r/keto/comments/msyh7t/anyone_feel_depressed_after_breaking_keto/,all_ads,6,SOS,715fe9ae-abe7-11e8-8938-0ef2dfd48a7e,Help,,,,,
