all_awardings,allow_live_comments,author,author_flair_css_class,author_flair_richtext,author_flair_text,author_flair_type,author_fullname,author_patreon_flair,author_premium,awarders,can_mod_post,contest_mode,created_utc,domain,full_link,gildings,id,is_crosspostable,is_meta,is_original_content,is_reddit_media_domain,is_robot_indexable,is_self,is_video,link_flair_background_color,link_flair_richtext,link_flair_text_color,link_flair_type,locked,media_only,no_follow,num_comments,num_crossposts,over_18,parent_whitelist_status,permalink,pinned,pwls,removed_by_category,retrieved_on,score,selftext,send_replies,spoiler,stickied,subreddit,subreddit_id,subreddit_subscribers,subreddit_type,thumbnail,title,total_awards_received,treatment_tags,upvote_ratio,url,whitelist_status,wls,link_flair_css_class,link_flair_template_id,link_flair_text,post_hint,preview,author_flair_background_color,author_flair_template_id,author_flair_text_color
[],False,stormthegates8,,[],,text,t2_9up83abz,False,False,[],False,False,1618637560,self.keto,https://www.reddit.com/r/keto/comments/mskw73/why_round_3_is_different/,{},mskw73,True,False,False,False,True,True,False,,"[{'e': 'text', 't': 'Success Story'}]",dark,richtext,False,False,True,9,0,False,all_ads,/r/keto/comments/mskw73/why_round_3_is_different/,False,6,,1618637572,1,"I’ll start this off with my first two weight loss journeys to give you an idea of where I have been and where I am at now. I hope it gives someone out there the motivation they need to find the lifestyle that works best for them, keto or not.

My first weight loss journey in 2013 was based on calorie restriction and cardio. I paid no mind to macros since I didn’t know what a macro was... I just focused on eating healthy foods and made sure I had a big calorie deficit while hitting the gym for 45 minutes a day. I lost 30 pounds in 3 months. I was stuck at 166 pounds for about a week before I became so discouraged, I gave up. I hit a plateau and didn’t know how to break it. Instead of being patient and trying to work through it, I went back to my old bad habits.

My second weight loss journey was in 2018. I had hit 209 pounds on the scale... my heaviest ever, outside of being 230 pounds when i was 9 months pregnant with my son. NOPE! I started a low fat diet. That, working 2 fairly active full-time jobs, AND going to the gym, helped me shed 47 pounds in 4 months. My progress went downhill when I switched to 3rd shift at one of my jobs. I was stuck at 162 pounds and didn’t have the patience to break through the plateau. I didn’t give up on myself immediately this time, but I lost it over time and ended up gaining all but 5 pounds back within the next few years.

Here we are. Round 3. Sitting at 204 pounds and struggling to stay awake past 6:30pm every day, I knew changes had to be made. I joined and followed social media groups for the top trending lifestyle: Keto. I read through so many progress posts and most people have done so well with it. I decided to look into this way of life a little more and read about carb restriction. The ONE thing I haven’t yet targeted! I then stumbled upon an article about carb sensitivity and the warning signs. I will be damned. I relate to every single sign. That day I discovered that I really need to limit my carbs and I decided that Keto is probably best for me, personally. 

I started this journey 2 and a half months ago in February and I’m already down almost 40 pounds. This time, with minimal exercise and working only one job. With this new diet, paired with intermittent fasting, there is no doubt in my mind that I will finally make it through the 160’s and maybe even reach my ultimate goal of 145 pounds. A goal that I have repeatedly failed to achieve for 7 years now. With the knowledge and experience I have this time around, I WILL succeed. Only 20 more pounds to go. The last 20. The hardest 20.",True,False,False,keto,t5_2rske,2366443,public,self,Why Round 3 is Different,0,[],1.0,https://www.reddit.com/r/keto/comments/mskw73/why_round_3_is_different/,all_ads,6,success,a8bb6b80-abe7-11e8-8696-0ed9e0d77ef8,Success Story,,,,,
