[],False,forestgreene1,,[],,text,t2_1p8i8whw,False,False,[],False,False,1618431434,self.keto,https://www.reddit.com/r/keto/comments/mqz21i/grams_vs_percentage/,{},mqz21i,True,False,False,False,True,True,False,,"[{'e': 'text', 't': 'Help'}]",dark,richtext,False,False,True,6,0,False,all_ads,/r/keto/comments/mqz21i/grams_vs_percentage/,False,,,6,,1618431446,1,"Hi all. I am a total beginner and I can't find this info anywhere lol. It's day 3 of low carb for me and I'm facing some confusion. I set MFP at 15% net carbs, which put me at 69g net carbs for the day since my caloric goal is 1850. Unfortunately, with the foods I had on hand, I was so focused on keeping below 69g of carbohydrates that I didn't meet my caloric goal. I only ate ~800-900 calories each for the last 2 days. Thus, my percentage of carbohydrates was more like 20-30%. My question therein lies: is it the number of grams or the percentage that matters more on a low carb/keto diet?",True,False,False,keto,t5_2rske,2363646,public,self,Grams vs Percentage?,0,[],1.0,https://www.reddit.com/r/keto/comments/mqz21i/grams_vs_percentage/,all_ads,6,SOS,715fe9ae-abe7-11e8-8938-0ef2dfd48a7e,Help,,,,,,,
[],False,ketonaples,,[],,text,t2_5c2lgfez,False,False,[],False,False,1618430961,self.keto,https://www.reddit.com/r/keto/comments/mqyw92/body_hives_16_days_after_first_pfizer_shot/,{},mqyw92,True,False,False,False,True,True,False,,[],dark,text,False,False,True,11,0,False,all_ads,/r/keto/comments/mqyw92/body_hives_16_days_after_first_pfizer_shot/,False,,,6,,1618430974,1,"After being on Keto for 14 months, I'm about 5 lbs from my goal weight and BMI of 22.  I had my first covid shot 16 days ago.  Yesterday I began to develop hives all over my body...hot burning red itchy hives even on my palms and soles of feet.  I'm not predisposed to allergies, ate nothing out of the ordinary, and since starting Keto I have not had a single malady or illness of any kind.  I used to get cold sores about every 2 months...not a single one since starting Keto.  My blood work is perfect.  Saw a doctor today and am now on a course of steroids.  Is there anyone out there who has experienced anything similar more than 2 weeks post injection.  The doctor doubts it's the vaccine causing the problem, but I'm not so sure.  Just curious if I'm not alone.  FYI, I'm a 61 yo female.  TX",True,False,False,keto,t5_2rske,2363640,public,self,Body hives 16 days after first Pfizer shot,0,[],1.0,https://www.reddit.com/r/keto/comments/mqyw92/body_hives_16_days_after_first_pfizer_shot/,all_ads,6,,,,,,,,,,
[],False,NikkiT64,,[],,text,t2_6hnjgdon,False,False,[],False,False,1618430670,self.keto,https://www.reddit.com/r/keto/comments/mqysh7/thirst_question/,{},mqysh7,True,False,False,False,True,True,False,,"[{'e': 'text', 't': 'Tips and Tricks'}]",dark,richtext,False,False,True,12,0,False,all_ads,/r/keto/comments/mqysh7/thirst_question/,False,,,6,,1618430681,1,"Hey keto fam. 
Long story short I’ve been living the keto life on and off for about 4 years. Lost a good amount of weight and have bouts of non-keto eating. - food addiction issues. Anyhow my question is I always feel extreme thirst while doing keto. Like to the point where no matter how much water I’m drinking I never feel satisfied. Anyone have any tips or experienced this before? Any advice would be much appreciated. TIA!",True,False,False,keto,t5_2rske,2363637,public,self,Thirst question,0,[],1.0,https://www.reddit.com/r/keto/comments/mqysh7/thirst_question/,all_ads,6,TNT ,2c0c329e-abe8-11e8-a749-0ea6409e913c,Tips and Tricks,,,,,,,
[],False,lilacdust_,,[],,text,t2_7hhkciuq,False,False,[],False,False,1618430140,self.keto,https://www.reddit.com/r/keto/comments/mqylll/has_anyone_noticed_an_improvement_in_ocdanxiety/,{},mqylll,True,False,False,False,True,True,False,,[],dark,text,False,False,True,7,0,False,all_ads,/r/keto/comments/mqylll/has_anyone_noticed_an_improvement_in_ocdanxiety/,False,,,6,,1618430151,1,"I have horrible anxiety and OCD symptoms but don't want to take medication. I'm wondering if anyone has noticed improvements?

If so, what was the resolution or improvement of your symptoms like? How many carbs do you eat in a day? how long did it take you to notice improvements? What does your diet look like?",True,False,False,keto,t5_2rske,2363631,public,self,Has anyone noticed an improvement in OCD/anxiety symptoms?,0,[],1.0,https://www.reddit.com/r/keto/comments/mqylll/has_anyone_noticed_an_improvement_in_ocdanxiety/,all_ads,6,,,,,,,,,,
[],False,whataborgor,,[],,text,t2_4f90s6f2,False,False,[],False,False,1618426540,self.keto,https://www.reddit.com/r/keto/comments/mqxbmp/keto_euphoria/,{},mqxbmp,True,False,False,False,True,True,False,,"[{'e': 'text', 't': 'Help'}]",dark,richtext,False,False,True,25,0,False,all_ads,/r/keto/comments/mqxbmp/keto_euphoria/,False,,,6,,1618426550,1,"I’ve noticed that when I’m in ketosis I experience a sort of euphoric feeling, I’m able to wake up earlier and have energy through out the day. My brain doesn’t feel all foggy and I can remember things easier. I’ve also noticed I’m more relaxed and easier to talk to. I have never experienced feeling like this outside of being in ketosis which sucks because I hate how restrictive keto is! I would love to feel like this when I’m not on keto as I feel keto is not sustainable for me in the long run. How can I continue to feel like this while not on keto? Is it primarily due to clean eating?",True,False,False,keto,t5_2rske,2363590,public,self,Keto euphoria,0,[],1.0,https://www.reddit.com/r/keto/comments/mqxbmp/keto_euphoria/,all_ads,6,SOS,715fe9ae-abe7-11e8-8938-0ef2dfd48a7e,Help,,,,,,,
[],False,UnlikelyU,,[],,text,t2_47c10r1e,False,False,[],False,False,1618425489,self.keto,https://www.reddit.com/r/keto/comments/mqwycv/late_night_dinnersseltzer/,{},mqwycv,True,False,False,False,True,True,False,,[],dark,text,False,False,True,13,0,False,all_ads,/r/keto/comments/mqwycv/late_night_dinnersseltzer/,False,,,6,,1618425500,1,"Hi everyone! Thanks in advance for advice. I’ve been doing keto for about 6 weeks. I’ve lost 6 pounds and am feeling really good! I previously didn’t Keto back in 2017 and lost about 50 pounds and it seemed like that time it melted off. I’m grateful to have lost this time around but progress seems ....slow. The only thing I feel like I’m doing differently is drinking  more hard seltzer’s, and eating after work (I’m a nurse and eat around 8:00-8:30p)

I always stay under 20-25 net carbs per day allotting for seltzer’s. I  normally eat a big lunch 700-1000 calories around 2pm and am not really hungry when I get home but it definitely feels like I should eat “dinner”. 

Does anyone have suggestions?

Thanks!",True,False,False,keto,t5_2rske,2363585,public,self,Late night dinners/seltzer,0,[],1.0,https://www.reddit.com/r/keto/comments/mqwycv/late_night_dinnersseltzer/,all_ads,6,,,,,,,,,,
[],False,TimberVolk,black,"[{'e': 'text', 't': '24M Newbie | SW 193 | CW 185 | GW 140'}]",24M Newbie | SW 193 | CW 185 | GW 140,richtext,t2_mxegm,False,False,[],False,False,1618423727,self.keto,https://www.reddit.com/r/keto/comments/mqwc87/pics_6_weeks_in_10_lbs_down_and_my_partner/,{},mqwc87,True,False,False,False,True,True,False,,[],dark,text,False,False,True,14,0,False,all_ads,/r/keto/comments/mqwc87/pics_6_weeks_in_10_lbs_down_and_my_partner/,False,self,"{'enabled': False, 'images': [{'id': 'PHHRh5sxyQT4viKa64undatk49gwGr6khGOROCMQgWY', 'resolutions': [{'height': 108, 'url': 'https://external-preview.redd.it/X8OI2DloEjazLWqjKAZFwb0CIXD4ek2ldry6ai2zVAU.jpg?width=108&amp;crop=smart&amp;auto=webp&amp;s=dd8d4aa62ce0dcaee992e46c661ff799ebbf0433', 'width': 108}, {'height': 216, 'url': 'https://external-preview.redd.it/X8OI2DloEjazLWqjKAZFwb0CIXD4ek2ldry6ai2zVAU.jpg?width=216&amp;crop=smart&amp;auto=webp&amp;s=96a3d8f915ae268d24364ccedb8c31e1d5cb7ede', 'width': 216}, {'height': 320, 'url': 'https://external-preview.redd.it/X8OI2DloEjazLWqjKAZFwb0CIXD4ek2ldry6ai2zVAU.jpg?width=320&amp;crop=smart&amp;auto=webp&amp;s=5783196fb36cf1a3e0c8d2bd4135629041cd4c84', 'width': 320}, {'height': 640, 'url': 'https://external-preview.redd.it/X8OI2DloEjazLWqjKAZFwb0CIXD4ek2ldry6ai2zVAU.jpg?width=640&amp;crop=smart&amp;auto=webp&amp;s=79628171bbfdaf677689f567ad907127d35ea425', 'width': 640}, {'height': 960, 'url': 'https://external-preview.redd.it/X8OI2DloEjazLWqjKAZFwb0CIXD4ek2ldry6ai2zVAU.jpg?width=960&amp;crop=smart&amp;auto=webp&amp;s=5017fa5609d99760db6c2c3a4f37cfc2d03525b2', 'width': 960}, {'height': 1080, 'url': 'https://external-preview.redd.it/X8OI2DloEjazLWqjKAZFwb0CIXD4ek2ldry6ai2zVAU.jpg?width=1080&amp;crop=smart&amp;auto=webp&amp;s=39c312a1175a34af06336c97681204cdf75bed37', 'width': 1080}], 'source': {'height': 1080, 'url': 'https://external-preview.redd.it/X8OI2DloEjazLWqjKAZFwb0CIXD4ek2ldry6ai2zVAU.jpg?auto=webp&amp;s=4d07affa8b2f9bdd91774e7724e6bc8607fe484f', 'width': 1080}, 'variants': {}}]}",6,,1618423737,1,"Y'all, keto has helped me lose what I've been struggling to get down for well over 6 months. I'm a huge sweet tooth and snacker, so combined with my small frame and general disposition to sedentary hobbies, it was way easier to pack it on than it was to lose it through strictly CICO. Keto had helped me finally crack that sweet tooth and appreciate a wider variety of foods and flavors.

But this weekend, I feel like I really turned a new leaf! My partner was looking at me in the mirror after we hopped out of the shower, and noted that I was definitely looking slimmer; looking at my [progress side by side](http://imgur.com/a/gcFuQnZ), I'm inclined to believe him!

To be honest, it may even be more than 10 lbs; I switched scales a few weeks ago due to my first scale needing calibrated every single time for accuracy, which jumped me from 185 to 187 when I made the switch. But to keep myself humble, I'm just going off straight numbers and saying I'm 10 lbs down.

Also what is everyone's favorite cheese-free keto recipe? My partner is casein and whey intolerant, so anything besides butter really hurts his GI tract.",True,False,False,keto,t5_2rske,2363566,public,self,"[Pics] 6 Weeks in, 10 lbs down, and my partner noticed I've slimmed down! 24M 5'4 193 lbs &gt; 183 lbs",0,[],1.0,https://www.reddit.com/r/keto/comments/mqwc87/pics_6_weeks_in_10_lbs_down_and_my_partner/,all_ads,6,,,,,#edeff1,bf715102-aa2c-11e9-835a-0e92680f1d3e,dark,,,
[],False,aimeelilyflower,,[],,text,t2_8w5up3lc,False,False,[],False,False,1618422842,self.keto,https://www.reddit.com/r/keto/comments/mqw10u/keto_uk/,{},mqw10u,True,False,False,False,True,True,False,,[],dark,text,False,False,True,19,0,False,all_ads,/r/keto/comments/mqw10u/keto_uk/,False,,,6,,1618422852,1,"I love Keto but the options here are so limited - no Costco shopping/no swankly keto cafes/ no keto bread! 

If I want some keto related snacks, I have to order from the US and it’s extortionate. The UK are always late to the party 😂",True,False,False,keto,t5_2rske,2363557,public,self,Keto Uk?!,0,[],1.0,https://www.reddit.com/r/keto/comments/mqw10u/keto_uk/,all_ads,6,,,,,,,,,,
[],False,Valentine21469,,[],,text,t2_wahdm,False,False,[],False,False,1618422828,self.keto,https://www.reddit.com/r/keto/comments/mqw0vm/need_some_shortcutshackstricks/,{},mqw0vm,True,False,False,False,True,True,False,,[],dark,text,False,False,True,16,0,False,all_ads,/r/keto/comments/mqw0vm/need_some_shortcutshackstricks/,False,,,6,,1618422840,1,"I’m new to keto and as a busy working Mom could really use a few shortcut-style hacks and tricks to help me, since realistically I won’t have a few hours each week to roast a big batch of whatever to have on hand for quick meals and snacking. Could people share a few items that are always on their grocery lists for quick meals assembly and snacks to help shorten my learning curve?",True,False,False,keto,t5_2rske,2363557,public,self,Need some shortcuts/hacks/tricks,0,[],1.0,https://www.reddit.com/r/keto/comments/mqw0vm/need_some_shortcutshackstricks/,all_ads,6,,,,,,,,,,
[],False,Mistress_Cinder,,[],,text,t2_l20opvw,False,False,[],False,False,1618421909,self.keto,https://www.reddit.com/r/keto/comments/mqvpc8/has_anybody_tried_bioptimizers_apex_supplement/,{},mqvpc8,True,False,False,False,True,True,False,,[],dark,text,False,False,False,31,0,False,all_ads,/r/keto/comments/mqvpc8/has_anybody_tried_bioptimizers_apex_supplement/,False,self,"{'enabled': False, 'images': [{'id': 'O1Jc_Uodyr7NiC27KJBHnFAPRGB1iJla2IwPub_bXYU', 'resolutions': [{'height': 108, 'url': 'https://external-preview.redd.it/iIf-s4Yqx7nu1WUEv-JDlcMXvj-o5364Ba3mQxkqrFA.jpg?width=108&amp;crop=smart&amp;auto=webp&amp;s=1efca4e9da7c76f8980874f9ca9cb1369654593d', 'width': 108}, {'height': 216, 'url': 'https://external-preview.redd.it/iIf-s4Yqx7nu1WUEv-JDlcMXvj-o5364Ba3mQxkqrFA.jpg?width=216&amp;crop=smart&amp;auto=webp&amp;s=aea8ff37340e8756a474c2da39ea0fb56e0db1ed', 'width': 216}, {'height': 320, 'url': 'https://external-preview.redd.it/iIf-s4Yqx7nu1WUEv-JDlcMXvj-o5364Ba3mQxkqrFA.jpg?width=320&amp;crop=smart&amp;auto=webp&amp;s=16ff76af06531d208aa15dac608285ccbebc8bb4', 'width': 320}, {'height': 640, 'url': 'https://external-preview.redd.it/iIf-s4Yqx7nu1WUEv-JDlcMXvj-o5364Ba3mQxkqrFA.jpg?width=640&amp;crop=smart&amp;auto=webp&amp;s=db67bdddb6e019e41161554e55ed85cb5f853a3a', 'width': 640}, {'height': 960, 'url': 'https://external-preview.redd.it/iIf-s4Yqx7nu1WUEv-JDlcMXvj-o5364Ba3mQxkqrFA.jpg?width=960&amp;crop=smart&amp;auto=webp&amp;s=555664ef42b32948a038b4ca5e8d0d7776153a8d', 'width': 960}], 'source': {'height': 1024, 'url': 'https://external-preview.redd.it/iIf-s4Yqx7nu1WUEv-JDlcMXvj-o5364Ba3mQxkqrFA.jpg?auto=webp&amp;s=b218a3bcd856c0be18cffb0031698273559cd1a7', 'width': 1024}, 'variants': {}}]}",6,,1618421919,1,"I am super strict clean Keto right now. I have a super physically active job where I am on my feet 9hrs a day. My energy is better the more clean I eat and eating super low carbs. I feel better having some selective carbs, so I am more Ketovore than Carnivore. Has anybody tried this supplement for more energy?? I am hanging in there but I still find I spend one of my days off doing nothing to recover. I would like to have more energy on my day off or at the end of the week. https://shop.bioptimizers.com/products/kapex",True,False,False,keto,t5_2rske,2363541,public,self,Has anybody tried Bioptimizers Apex Supplement??,0,[],1.0,https://www.reddit.com/r/keto/comments/mqvpc8/has_anybody_tried_bioptimizers_apex_supplement/,all_ads,6,,,,,,,,,,
[],False,Brahms12,,[],,text,t2_la0jfch,False,False,[],False,False,1618419626,self.keto,https://www.reddit.com/r/keto/comments/mquw7i/annual_physical_yesterday_my_cholesterol_is_269/,{},mquw7i,True,False,False,False,True,True,False,,[],dark,text,False,False,True,13,0,False,all_ads,/r/keto/comments/mquw7i/annual_physical_yesterday_my_cholesterol_is_269/,False,,,6,,1618419643,1,"Anyone have success with Keto while lowering saturated fats?   I have been eating meat everyday along with berries and almonds, yogurt, spinach salads.

Weird thing is my cholesterol was slightly higher last May 274.

Any suggestions before I get talked to about medication?",True,False,False,keto,t5_2rske,2363515,public,self,Annual physical yesterday. My cholesterol is 269! Yikes.,0,[],1.0,https://www.reddit.com/r/keto/comments/mquw7i/annual_physical_yesterday_my_cholesterol_is_269/,all_ads,6,,,,,,,,,,
[],False,rangetrout12,,[],,text,t2_2iiry2tn,False,False,[],False,False,1618418122,self.keto,https://www.reddit.com/r/keto/comments/mqudia/can_eating_a_few_chips_throw_you_out_of_ketosis/,{},mqudia,True,False,False,False,True,True,False,,"[{'e': 'text', 't': 'Help'}]",dark,richtext,False,False,True,7,0,False,all_ads,/r/keto/comments/mqudia/can_eating_a_few_chips_throw_you_out_of_ketosis/,False,,,6,,1618418133,1,"So i’ve been on Keto for about 7 weeks now and today when i got home from work i saw a bag of my favorite chips, I couldn’t help myself because im a dumb puece of shit so i took a few, i’d say about 10g maybe? It was only a few but now i’m worried that it might throw me out of Ketosis? 

They were 44/100g carbs so I shouldn’t have eaten more than 5 carbs but I’m still nervous, do they have any chemicals in them that might ruin the keto diet?",True,False,False,keto,t5_2rske,2363501,public,self,Can eating a few chips throw you out of Ketosis?,0,[],1.0,https://www.reddit.com/r/keto/comments/mqudia/can_eating_a_few_chips_throw_you_out_of_ketosis/,all_ads,6,SOS,715fe9ae-abe7-11e8-8938-0ef2dfd48a7e,Help,,,,,,,
[],False,klutzosaurus-rex,,[],,text,t2_4tjac,False,False,[],False,False,1618418081,self.keto,https://www.reddit.com/r/keto/comments/mqucyd/progress_report_for_accountability/,{},mqucyd,True,False,False,False,True,True,False,,"[{'e': 'text', 't': 'Other'}]",dark,richtext,False,False,False,2,0,False,all_ads,/r/keto/comments/mqucyd/progress_report_for_accountability/,False,,,6,,1618418092,1,"SW: 198lbs GW: 130lbs CW: 184lbs

Hello fellow reddit ketoers! Just putting my story out there more for accountability but I will take support too, lol! My goal weight is just a lower number and not what I am holding myself too. I may get there, below there, or be above. For me it is all about how I feel and look to myself, and not the scale number. I found this sub over 4 years ago when I first tried keto. I was 130lbs then, and was just trying to get rid of stubborn extra tummy flab. I got down to 122 and still had it, but that's a whole 'nother post. I did not phase carbs back in, and just started eating like I did prior to keto. Add in stress from a really shitty job, anxiety and depression and you get to me at 170lbs. Then I finally got a new non stressful job and COVID lockdowns happened. We ate out the whole time and maybe cooked 3-4 times. Once we were allowed back at work I was just ordering door dash because I am lazy and it was convenient. That's how we got to me at 198lbs. My boyfriend also gained a lot of weight too, and we both were just done. We decided we would do keto, and we have been on it for about 3 or 4 weeks. To me it is the easiest diet I've ever been on and I can do it without feeling like I am depriving myself. I love that I don't get cravings or hangry anymore and that I have to actually remind myself it's probably time to eat. My only ""complaint"" is that I miss fruit. I am a huge fruit fan. My boyfriend on the other hand is a bread/pasta/rice fanatic so he hates this. He also hates all veggies except potatoes and carrots. But he is sticking with it until he gets where he wants. To him this food is just calories to fuel the body. 

I haven't started exercising yet, but I need too. Mainly for my mental health but I remember my gym routines from 4 years ago and I was just starting to feel strong and see muscles developing, so I want to get back to that feeling. I have chondromalacia (cartilage is coming off the back of my kneecaps) in both knees and a birth defect in my back (spina bifida occulta) that prevent me from doing high impact things, like running. I LOVE running. Of course I love the thing I can't do. UGH. So I suck it up in the gym (like my boyfriend does with food) for other cardio like a bike or elliptical. Anyone else limited in working out? What kind of workouts do you do? I think we will start by just going walking everyday, and I will add things in from there. I hate ""starting over"" in regards to working out because I hate feeling crappy (I am a baby for pain) for the first few weeks. No pain no gain.  


Without exercise being involved I've lost 14lbs and I'm stoked about it. My real problem is patience!!!! i just want to be back at my smaller size and feeling super confident. A pic of me from the previous keto time came up in my timehop today and OMG please gimme dat back!!! I know I will get there, but I need to stay focused on the now.  I hope everyone is doing well, and staying well on their journey!",True,False,False,keto,t5_2rske,2363500,public,self,Progress Report - For Accountability,0,[],1.0,https://www.reddit.com/r/keto/comments/mqucyd/progress_report_for_accountability/,all_ads,6,other,9f422c2a-e610-11e8-80ec-0e36d2568fbe,Other,,,,,,,
[],False,alpal41,,[],,text,t2_12zg6s,False,False,[],False,False,1618417801,self.keto,https://www.reddit.com/r/keto/comments/mqu9gm/i_feel_weird_anxious/,{},mqu9gm,True,False,False,False,True,True,False,,[],dark,text,False,False,True,6,0,False,all_ads,/r/keto/comments/mqu9gm/i_feel_weird_anxious/,False,,,6,,1618417812,1,"For reference: I am 24F/5'7""/178lbs/GW:140 ------- I am trying to consume 1200-1650 calories a day (the amount each day depends on my activity level)... I hit 1650 days 1 &amp; 2 because I am half way through the insanity workout program, I just added strength training, and I walk a couple of miles most days. I was actually 174 when I started, but gained weight during insanity. I was half-assing my diet, i would do great 3-4 days and then I'd cheat for the rest of the week. I decided keto was a good idea because there's really no room for ""messing up"", which would keep me on top of my diet. The thought of being kicked out of ketosis is enough healthy pressure for me to not give into cravings! I am eating steaks, salmon, chicken, broccoli, yogurt, some cheeses, protein shakes, some bacon, eggs, and that's pretty much it.

This is my first week of keto, I am on day 3. Days 1 &amp; 2 were pretty good, I tried to consume LOTS of fats (only to realize that you don't need actually need that much, it's all about cutting carbs) and I kept my carbs below 22g. I am also being conscious of not going too much on protein! I bought a scale to accurately measure my food so I KNOW what kind of calories and macros I'm getting, which has actually been nice! I was WAY off from my previous guessing.

I've made sure to keep up with my electrolytes, I started taking magnesium and potassium tablets yesterday, and I know I'm getting enough sodium. BUT this morning I felt the symptoms of a hangover. Usually when I drink alcohol, I take magnesium and potassium tablets, eat food, and drink plenty of water before I fall asleep- and usually I feel fine. BUT THIS MORNING I FELT HUNGOVER, even though I've been keeping up with water intake and electrolytes!

ALSO, I've been feeling very anxious, and my awareness has changed. I feel like my world is just off. Like something happened that made my life super different. Then I started to doubt the entire diet. I was like ""is this healthy?"" ""am I putting myself in danger?"" ""I am challenging my body too hard?"". Idk I kept thinking about this as artificial scarcity, I guess there's a lot of fear based stuff in the media about this diet that's making me doubt this whole thing. Has ANYONE gone through this? Is this a good idea?? I need some reassurance and motivation! I don't want to hurt myself. I am trying to lose fat, but mostly I am trying to be as healthy and energized as humanely possible!",True,False,False,keto,t5_2rske,2363495,public,self,I feel WEIRD &amp; ANXIOUS!,0,[],1.0,https://www.reddit.com/r/keto/comments/mqu9gm/i_feel_weird_anxious/,all_ads,6,,,,,,,,,,
[],False,Lodge_Guy,,[],,text,t2_v0hqyop,False,False,[],False,False,1618416768,self.keto,https://www.reddit.com/r/keto/comments/mqtvw1/pre_diabetic/,{},mqtvw1,True,False,False,False,True,True,False,,[],dark,text,False,False,True,2,0,False,all_ads,/r/keto/comments/mqtvw1/pre_diabetic/,False,,,6,,1618416779,1,My girlfriend was diagnosed as Pre diabetic this morning. A life changing journey lies ahead for us. I’m looking at it in a positive light. Any tips and tricks to getting on this diet and staying on it would be much appreciated. Thanks.,True,False,False,keto,t5_2rske,2363485,public,self,Pre diabetic,0,[],1.0,https://www.reddit.com/r/keto/comments/mqtvw1/pre_diabetic/,all_ads,6,,,,,,,,,,
[],False,Sp0ken4,,[],,text,t2_ft8ce,False,True,[],False,False,1618416716,self.keto,https://www.reddit.com/r/keto/comments/mqtv8m/arguing_dirty_vs_clean_keto_is_stupid/,{},mqtv8m,True,False,False,False,True,True,False,,[],dark,text,False,False,False,362,0,False,all_ads,/r/keto/comments/mqtv8m/arguing_dirty_vs_clean_keto_is_stupid/,False,,,6,,1618416728,1,"I've been doing Keto for 4 years. I primarily do it for it's anti-inflammatory and low acid properties, along with all the other goodness. One of the coolest things I've seen throughout those four years is local stores packing new low-carb and keto friendly options. It's makes a sustainable keto lifestyle a lot more cost effective and realistic. 

For example, there are literally six different keto breads I can purchase from a number of stores in my neighborhood. There's pasta, keto bakeries, fucking cereal, waffles and all types of new shit. 

And yet there's so much animosity from people staunchly approaching keto with a *eat clean* mindset. As if a function of keto isn't to clean your innards. And sure it's fine, do as you please. What's not fine is dismissing others who have managed to integrate Keto into their life their way.  

There are so many new folks that get railed by asshats that have convinced themselves anything processed is anti keto. And I believe these folks hurt the keto community. 

Personally I think clean/dirty keto is bullshit. Some people have trouble with moderation so they choose a label to help them maintain their goals. But in the end,  nutritional ketosis is nutritional ketosis, how you maintain that doesn't matter as long as it works and is healthy for you.",True,False,False,keto,t5_2rske,2363484,public,self,Arguing Dirty vs Clean Keto is Stupid,0,[],1.0,https://www.reddit.com/r/keto/comments/mqtv8m/arguing_dirty_vs_clean_keto_is_stupid/,all_ads,6,,,,,,,,,,
