[],False,TylerJL19,,[],,text,t2_g4hfw07,False,False,[],False,False,1618494493,self.vegan,https://www.reddit.com/r/vegan/comments/mrf1ew/the_usda_are_the_biggest_bunch_of_liars_on_this/,{},mrf1ew,True,,False,False,False,True,True,False,,Disturbing,[],dc972d74-f01f-11e2-8b35-12313b0cdc23,Disturbing,dark,text,False,False,False,31,0,False,all_ads,/r/vegan/comments/mrf1ew/the_usda_are_the_biggest_bunch_of_liars_on_this/,False,6,,1618494503,1,"On the USDA’s official website, it states that you should be drinking 2 and a half cups of dairy milk every single day, even though it has been shown time and time again that there are serious health risks associated with drinking milk of a different species. Not only this, but they have an area where you can input your age, weight, and gender and they will tell you how much you need of each food group (fruits, vegetables, whole grains, protein sources, and dairy). I tried inputting my own information and it said I needed 2 and a half cups of milk. I then tried to put in the info for a 95 year old man who weighs 999 pounds, and it said I needed to be on a diet 1200 calories less than when I put in my actual information to achieve a healthy weight. In those 1200 calories lost, THEY WERE ALL LESS FRUITS, VEGETABLES, WHOLE GRAINS, AND PROTEIN SOURCES AND THE SAME AMOUNT OF MILK. 

No matter what data you put in with the excepted of kids under 9 years old, you will find they recommend the same amount of milk, whether you’re young or old, obese or skinny, male or female, it doesn’t matter, yet what does change is the amount of fruits and vegetables you should eat the more you weigh (which on the website they say is LESS). So obviously being paid off by the Dairy Industry, and they don’t even try to hide it. Never trust the USDA with any of their recommendations, because more than likely they’re getting paid to tell you something that is simply not true.",True,False,False,vegan,t5_2qhpm,589888,public,self,The USDA are the biggest bunch of liars on this Earth.,0,[],1.0,https://www.reddit.com/r/vegan/comments/mrf1ew/the_usda_are_the_biggest_bunch_of_liars_on_this/,,all_ads,6,,,,,,,,,,,,,,
[],False,jodiekhughes,,[],,text,t2_21z2u2vz,False,False,[],False,False,1618493691,self.vegan,https://www.reddit.com/r/vegan/comments/mresc3/psychology_and_animal_testing/,{},mresc3,True,,False,False,False,True,True,False,,Discussion,[],0d26d52c-2ef1-11e5-8c17-0ec131dbf691,Discussion,dark,text,False,False,True,4,0,False,all_ads,/r/vegan/comments/mresc3/psychology_and_animal_testing/,False,6,,1618493702,1,"Hi everyone!

I'm currently doing a Psychology MSc, and I was really shocked to learn about the extent to which animals are tested on in psychology studies today. I guess I always assumed it was something that was done in the past but has since been moved away from. I obviously have no intention of ever being involved in any animal testing,  I was wondering what people's thoughts were though? It seems to still be considered to be 'for the greater good' in the psychology field generally, but to me that just doesn't win out compared to the exploitation and cruelty that goes on",True,False,False,vegan,t5_2qhpm,589888,public,self,Psychology and animal testing,0,[],1.0,https://www.reddit.com/r/vegan/comments/mresc3/psychology_and_animal_testing/,,all_ads,6,,,,,,,,,,,,,,
[],False,EllenKC98,,[],,text,t2_3nmwc6ol,False,False,[],False,False,1618492754,self.vegan,https://www.reddit.com/r/vegan/comments/mrehoi/irish_vegans_need_some_help_tempeh/,{},mrehoi,True,,False,False,False,True,True,False,,,[],,,dark,text,False,False,True,2,0,False,all_ads,/r/vegan/comments/mrehoi/irish_vegans_need_some_help_tempeh/,False,6,,1618492765,1,"I have been living in NL for the past few years, and there, tempeh is as common and as cheap as tofu in the supermarkets, they have it everywhere. Back in Dublin, lidl or aldi dont seem to have it, and I can only find it as specialist stores and minimum 3 euro for a small amount. Plus they have it someones floating in brine in jars which is a bit strange to me and overall contributes to brain vibes. Has anyone found somewhere good/cheaper to find it here? Perhaps in Asian supermarkets in the city...thanks!",True,False,False,vegan,t5_2qhpm,589884,public,self,IRISH VEGANS need some help - Tempeh?,0,[],1.0,https://www.reddit.com/r/vegan/comments/mrehoi/irish_vegans_need_some_help_tempeh/,,all_ads,6,,,,,,,,,,,,,,
[],False,teaandbiscuits11,,[],,text,t2_53c18miz,False,False,[],False,False,1618489887,self.vegan,https://www.reddit.com/r/vegan/comments/mrdo4f/i_accidentaly_bought_a_non_vegan_coffee_to_go/,{},mrdo4f,True,,False,False,False,True,True,False,,Advice,[],3ae8cb6e-685e-11e9-90e6-0eb95b81be6a,Advice,dark,text,False,False,True,20,0,False,all_ads,/r/vegan/comments/mrdo4f/i_accidentaly_bought_a_non_vegan_coffee_to_go/,False,6,,1618489898,1,"Ok, I screwed up big time. 

I bought a coconutmilk coffee at a small business in my town and I was there once before and at that time I asked if it is vegan or if there is any actual dairy milk in it. That was a month ago. I was told it is not and that it is vegan. So today I bought there again and this time I did not ask. However, I saw that she put real milk in it. At that point it was already too late and it is not like I can reject it since I did not ask today. Therefore it wouldn't be okay to complain in my opinion. I obviously feel more than horrible about it and I have learned a lesson. I was too careless. I am vegan for 4 years so it is really awful. I should know better.

Now I have it and don't know what to do. I live alone so I have noone to give it to. I don't want to drink it but I also don't want to throw it away. But these are my only two options. What would you do in my situation?",True,False,False,vegan,t5_2qhpm,589870,public,self,I accidentaly bought a non vegan coffee to go. What to do?,0,[],1.0,https://www.reddit.com/r/vegan/comments/mrdo4f/i_accidentaly_bought_a_non_vegan_coffee_to_go/,,all_ads,6,,,,,,,,,,,,,,
[],False,teamsameteam,,[],,text,t2_8pm72rt5,False,True,[],False,False,1618483928,self.vegan,https://www.reddit.com/r/vegan/comments/mrc60l/seeking_a_vegan_mortgage_agent_licensed_in_north/,{},mrc60l,True,,False,False,False,True,True,False,,Question,[],3fa453f8-685e-11e9-862d-0ee93d557dce,Question,dark,text,False,False,True,10,0,False,all_ads,/r/vegan/comments/mrc60l/seeking_a_vegan_mortgage_agent_licensed_in_north/,False,6,,1618483939,1,"We are moving to North Carolina and purchasing a home. As a vegan I feel its critical that we support other vegans in their line of work. Not only should we support each other but we are also attempting to prevent profits from  being used for animal products. Anyone? Anyone? 

Thank you so much for all your time :)",True,False,False,vegan,t5_2qhpm,589856,public,self,Seeking a VEGAN mortgage agent licensed in North Carolina,0,[],1.0,https://www.reddit.com/r/vegan/comments/mrc60l/seeking_a_vegan_mortgage_agent_licensed_in_north/,,all_ads,6,,,,,,,,,,,,,,
[],False,Different_Pen3200,,[],,text,t2_6z6avqor,False,False,[],False,False,1618480313,self.vegan,https://www.reddit.com/r/vegan/comments/mrbinh/has_anyone_felt_bullied_by_someone_for_becoming/,{},mrbinh,True,,False,False,False,True,True,False,,,[],,,dark,text,False,False,True,30,0,False,all_ads,/r/vegan/comments/mrbinh/has_anyone_felt_bullied_by_someone_for_becoming/,False,6,,1618480324,1,"So I have this friend which I actually feel like I shouldn't speak anymore. They made out for me to fussy for asking for a restaurant that had more than vegan option but I really didn't care about the restaurant. Just nice to have an option and she made out to be fussy. Then she started suggesting a steak restaurant in group chat which was not cool either as there's a Muslim girl there too so she couldn't eat there either. She claimed she didn't want to eat Japanese, burgers or Italian food but I am apparently fussy. I said you are being childish then she claimed that my diet is fussy. When I am vegan for ethics. At the dinner she basically made me feel like actual shit about being vegan like I am actually hurting her. She tried say I am ruining her dinner plans and how she doesnt know what to cook now and how it's all my fault. Then complained about going to a vegan wedding for 10 minutes. Honestly the most selfish person. I just wanted to rant and see others have dealt with people like this. At least my family eats vegan for dinner with me so that's nice",True,False,False,vegan,t5_2qhpm,589841,public,self,Has anyone felt bullied by someone for becoming vegan,0,[],0.99,https://www.reddit.com/r/vegan/comments/mrbinh/has_anyone_felt_bullied_by_someone_for_becoming/,,all_ads,6,,,,,,,,,,,,,,
[],False,OkButterscotch5689,,[],,text,t2_bgpv0i15,False,False,[],False,False,1618476290,self.vegan,https://www.reddit.com/r/vegan/comments/mraokd/is_it_ok_to_eat_no_saturated_fat_whatsoever/,{},mraokd,True,,False,False,False,True,True,False,,,[],,,dark,text,False,False,True,19,0,False,all_ads,/r/vegan/comments/mraokd/is_it_ok_to_eat_no_saturated_fat_whatsoever/,False,6,,1618476302,1,"Sorry but I am banging my head against the wall trying to google this, no matter which way you search it all you get is ""try to eat less, no more than 10% of your calories, etc."" and I've tried to post this in 5 different subreddits and it wasnt allowed in any of them, now I'm on a temporary lockout from posting and not even sure if it will post to here. This question is literally trying to kill me lol. Anyways, Is saturated fat an essential nutrient/is there a minimum amount you should consume to be healthy? I've been tracking my diet, and while I'm getting plenty of healthy fat I'm only getting about 5 or 6 grams of saturated fat a day. Is that good or bad? Is it best to eat 0 or are there benefits to eating some? Please help!!",True,False,False,vegan,t5_2qhpm,589826,public,self,Is it ok to eat no saturated fat whatsoever?,0,[],1.0,https://www.reddit.com/r/vegan/comments/mraokd/is_it_ok_to_eat_no_saturated_fat_whatsoever/,,all_ads,6,,,,,,,,,,,,,,
[],False,andreimateiro,,[],,text,t2_3ytern88,False,False,[],False,False,1618473744,self.vegan,https://www.reddit.com/r/vegan/comments/mra5y1/free_premium_vegan_recipes_and_meal_plans/,{},mra5y1,True,,False,False,False,True,True,False,,Food,[],d9f9ddf0-f024-11e2-8ebb-12313b0c8c59,Food,dark,text,False,False,True,3,0,False,all_ads,/r/vegan/comments/mra5y1/free_premium_vegan_recipes_and_meal_plans/,False,6,,1618473754,1,"Hello there, beautiful people!

If you are looking for healthy, delicious and easy plant based recipes and meal plans with detailed nutritional information, I'd like to offer you **3 months of free premium access** to [Plantiful - Mindful Eating](https://apps.apple.com/app/apple-store/id1544718935?pt=120521473&amp;ct=reddit&amp;mt=8). There's no catch and no auto renewing subscription.

**Plantiful** is an iOS app growing a collection of vegan recipes and meal plans to help people to eat better, for their health, for the love of our Plant and animal friends. All recipes and meal plans have detailed nutrition information for you to take informed decisions when it comes to targeting your nutritional needs or achieving your fitness goals.

Currently we offer an iOS app with recipes and meal plans and we target to expand by adding tips, guides and health recommendations.

Just DM me with your email (the email you sign in with) and we will activate the premium subscription for you.

Grab [Plantiful - Mindful Eating](https://apps.apple.com/app/apple-store/id1544718935?pt=120521473&amp;ct=reddit&amp;mt=8) here.

Thank you for your trust!",True,False,False,vegan,t5_2qhpm,589815,public,self,Free Premium Vegan Recipes and Meal Plans,0,[],1.0,https://www.reddit.com/r/vegan/comments/mra5y1/free_premium_vegan_recipes_and_meal_plans/,,all_ads,6,,,,,self,"{'enabled': False, 'images': [{'id': 'GO-u5Nea8j39LK7_GShERFY4oC6T9faY1lije0NoPAY', 'resolutions': [{'height': 56, 'url': 'https://external-preview.redd.it/iXM8r0dvatPj1JzKrOSefoySP4XrxyK2QRxiyj5bNGY.jpg?width=108&amp;crop=smart&amp;auto=webp&amp;s=fd20b81f07d751943a8170f2a33b38bdc66a4741', 'width': 108}, {'height': 113, 'url': 'https://external-preview.redd.it/iXM8r0dvatPj1JzKrOSefoySP4XrxyK2QRxiyj5bNGY.jpg?width=216&amp;crop=smart&amp;auto=webp&amp;s=b9a423be767b1fe4cd23d7f2b0dc251332f2ae01', 'width': 216}, {'height': 168, 'url': 'https://external-preview.redd.it/iXM8r0dvatPj1JzKrOSefoySP4XrxyK2QRxiyj5bNGY.jpg?width=320&amp;crop=smart&amp;auto=webp&amp;s=714cc61f6c8b7b59304daff0f7b22503a7951b2f', 'width': 320}, {'height': 336, 'url': 'https://external-preview.redd.it/iXM8r0dvatPj1JzKrOSefoySP4XrxyK2QRxiyj5bNGY.jpg?width=640&amp;crop=smart&amp;auto=webp&amp;s=6b94c5334c6c38feb947bdef137ef32391db3d27', 'width': 640}, {'height': 504, 'url': 'https://external-preview.redd.it/iXM8r0dvatPj1JzKrOSefoySP4XrxyK2QRxiyj5bNGY.jpg?width=960&amp;crop=smart&amp;auto=webp&amp;s=1347416c008180cfa2f574ae3fd27dcb88cb4a31', 'width': 960}, {'height': 567, 'url': 'https://external-preview.redd.it/iXM8r0dvatPj1JzKrOSefoySP4XrxyK2QRxiyj5bNGY.jpg?width=1080&amp;crop=smart&amp;auto=webp&amp;s=60df11151d6633bb94241d70f6b080f26184e902', 'width': 1080}], 'source': {'height': 630, 'url': 'https://external-preview.redd.it/iXM8r0dvatPj1JzKrOSefoySP4XrxyK2QRxiyj5bNGY.jpg?auto=webp&amp;s=605004286885654d049dee2cf62f5ab6eaccab48', 'width': 1200}, 'variants': {}}]}",,,,,,,,
[],False,agarPlate25,,[],,text,t2_2lhz6gy3,False,False,[],False,False,1618469820,self.vegan,https://www.reddit.com/r/vegan/comments/mr9e88/giving_up_on_my_dream/,{},mr9e88,True,,False,False,False,True,True,False,,,[],,,dark,text,False,False,True,14,0,False,all_ads,/r/vegan/comments/mr9e88/giving_up_on_my_dream/,False,6,,1618469831,1,"I'm currently studying for a masters of engineering in biotechnology. I have a dog I love and I went vegan about a year and a half ago. Since then It's like my mind has opened and I can sympathize with animal on a much more intense and emotional level. Before, it was like my mind protected itself by turning it of. (got my dog a year ago).

About the dream: I started my studies wanting to research the brain and mental illness. I wanted to find what happens in the brain during therapy vs. medication. But as I'm in my fourth year, I'm realizing this won't be possible without animal experiments, and I don't think I can do it. I have found that I have an interest in bacteria (the good and the bad kind!) and I have gotten an internship this summer with a research group studying the plauge bacteria, and I danced with joy! Yet this morning I'm drinking my tea, eating my hemp seed toast, and feeling a loss for what could have been. I have  my own experience with mental illness and my best friend of 15 years have battled it her while life, and I was really wanting to make a difference in the field. I can't help but feeling a little weak, but the thought of spending my career experimenting on mice makes me want to vomit, flies were bad enough.

I don't know if anyone will read this, but it felt somewhat therapeutic to type it out. I hope you are all being safe and taking care of your physical and mental well being in these crazy times.",True,False,False,vegan,t5_2qhpm,589799,public,self,Giving up on my dream,0,[],1.0,https://www.reddit.com/r/vegan/comments/mr9e88/giving_up_on_my_dream/,,all_ads,6,,,,,,,,,,,,,,
