[],False,Big_Size9510,,[],,text,t2_78nf14pe,False,False,[],False,False,1617550608,self.vegan,https://www.reddit.com/r/vegan/comments/mjyipg/my_older_cousin_finally_went_vegan_and_decided_to/,{},mjyipg,True,False,False,False,True,True,False,,[],dark,text,False,False,False,11,0,False,all_ads,/r/vegan/comments/mjyipg/my_older_cousin_finally_went_vegan_and_decided_to/,False,,,6,1617551054,3,"Ever since I became vegan 5 years ago my cousin was skeptical about the idea. I had stayed strong in my values and knew I would not be going back. After a few years he couldn’t believe I was still a vegan. After we hung out a few times he wondered how I was staying so strong, he actually tried some of my vegan foods I made and really liked it. He had been eating meat for his entire 40 years of being alive, he didn’t think it would be possible. 

Eventually he became curious himself. I turned 21 years old 3 months ago and that’s when he contacted me, explaining how he wish he was a vegan, he actually cared about the animals, and realized he can be completely healthy and even more healthy as a side effect of being vegan. That’s when I decided we should live together. We have been helping each other create a vegan life together ever since he moved into my apartment, we really haven’t looked back since. He learned how to cook and prepare vegan meals, and even started making me food. After he cut out dairy a lot of his back pain cleared up and his energy improved. We are so close now like brothers.",True,False,False,vegan,t5_2qhpm,585727,public,self,,,My older cousin finally went vegan and decided to live with me as a roommate,0,[],1.0,https://www.reddit.com/r/vegan/comments/mjyipg/my_older_cousin_finally_went_vegan_and_decided_to/,,all_ads,6,,,,,,,,,,,,,,,,,
[],False,kappakingtut2,,[],,text,t2_3vzkhw6z,False,False,[],False,False,1617549445,self.vegan,https://www.reddit.com/r/vegan/comments/mjy5k3/can_i_get_some_opinions_on_protein_sources_some/,{},mjy5k3,True,False,False,False,True,True,False,,[],dark,text,False,False,False,27,0,False,all_ads,/r/vegan/comments/mjy5k3/can_i_get_some_opinions_on_protein_sources_some/,False,,,6,1617549793,1,"I'm living with IBS and I still haven't figured out exactly which foods trigger my problems. I want to try the elimination diet again. But that would mean eliminating a lot of the stuff people use for protein.

No sieten because because of the gluten
No soy. So no tofu, or edamame
No nuts. So no almonds. 
No chickpeas. No beans of any kind. Lentils have always been particularly troublesome for me. 

So what's left?

I guess I can still eat sunflower seeds and quinoa? Maybe brown rice? But I think starchy foods like rice can cause bloating which is a problem for me.

And I'm asking specifically about protein because I think protein helps me? Yesterday I had Lenny and Larry's complete protein cookie. Two scoops of the protein powder Huel. A whole bunch of multigrain chips, chips made with flaxseed, quinoa, sesame seed. And I think it helped. I'm not sure if it was because of a protein-rich day. Or if it was just because of the excessive amount of absorbent flaxseed in the chips and Huel.",True,False,False,vegan,t5_2qhpm,585716,public,self,,,Can I get some opinions on protein sources? Some of the most common sources are problematic for me because of a medical thing,0,[],1.0,https://www.reddit.com/r/vegan/comments/mjy5k3/can_i_get_some_opinions_on_protein_sources_some/,,all_ads,6,,,,,,,,Question,3fa453f8-685e-11e9-862d-0ee93d557dce,Question,,,,,,,
[],False,vegancandle,,[],,text,t2_2zh6fxwg,False,False,[],False,False,1617548810,self.vegan,https://www.reddit.com/r/vegan/comments/mjxye8/what_does_everyone_think_about_kip_andersen/,{},mjxye8,True,False,False,False,True,True,False,,[],dark,text,False,False,True,6,0,False,all_ads,/r/vegan/comments/mjxye8/what_does_everyone_think_about_kip_andersen/,False,,,6,1617548996,1,"I always hear criticism from people, vegans too, about stats on Cowspiracy, not sure about What the Health being untrue so was wondering what people think about the films and his work.",True,False,False,vegan,t5_2qhpm,585714,public,self,,,"What does everyone think about Kip Andersen? (Producer of the films Cowspiracy, What the Health and Seaspiracy)",0,[],1.0,https://www.reddit.com/r/vegan/comments/mjxye8/what_does_everyone_think_about_kip_andersen/,,all_ads,6,,,,,,,,,,,,,,,,,
[],False,vegancandle,,[],,text,t2_2zh6fxwg,False,False,[],False,False,1617538857,self.vegan,https://www.reddit.com/r/vegan/comments/mjv81t/which_subreddits_have_you_been_banned_from/,{},mjv81t,True,False,False,False,True,True,False,,[],dark,text,False,False,True,20,0,False,all_ads,/r/vegan/comments/mjv81t/which_subreddits_have_you_been_banned_from/,False,,,6,1617538868,1,"Just got banned for 7 days from r/socialism for being 'liberal'. What a joke! Just because I had the audacity to state that we shouldn't be caging and killing animals while there are so many alternatives available to us. 

Funny thing is they have an image of Angela Davis on their sub who is vegan too. 

Wondering what subs others have been banned from.",True,False,False,vegan,t5_2qhpm,585670,public,self,,,Which subreddits have you been banned from?,0,[],1.0,https://www.reddit.com/r/vegan/comments/mjv81t/which_subreddits_have_you_been_banned_from/,,all_ads,6,,,,,,,,,,,,,,,,,
[],False,cosmosogurl,,[],,text,t2_2rr6en9g,False,False,[],False,False,1617536222,self.vegan,https://www.reddit.com/r/vegan/comments/mjulu6/will_becoming_vegan_truly_make_a_difference_in/,{},mjulu6,True,False,False,False,True,True,False,,[],dark,text,False,False,True,28,0,False,all_ads,/r/vegan/comments/mjulu6/will_becoming_vegan_truly_make_a_difference_in/,False,,,6,1617536232,1,"I'm a young adult always having wanted to become a vegan, finally almost having financial independence to do so.
However, Everyday I feel so depressed about the state of the world and that every waking moment there is an animal out there suffering. 
I don't want to live in a world like this, and I feel so guilty having the chance to enjoy life while billions of animals everyday don't get even the slightest of chance. :(
These companies are so rich and fast food chains are everywhere, I just feel so hopeless and that me even becoming vegan for my own health won't stop the daily pain so many animals will still feel. 
Is there any hope in sight? Will all this animal cruelty end someday?!
Thank you. ;-;",True,False,False,vegan,t5_2qhpm,585658,public,self,,,Will Becoming Vegan Truly Make A Difference In The World?,0,[],1.0,https://www.reddit.com/r/vegan/comments/mjulu6/will_becoming_vegan_truly_make_a_difference_in/,,all_ads,6,,,,,,,,Question,3fa453f8-685e-11e9-862d-0ee93d557dce,Question,,,,,,,
[],False,jammiesandtea,,[],,text,t2_9s9l6q1l,False,False,[],False,False,1617533504,self.vegan,https://www.reddit.com/r/vegan/comments/mju0vt/vegan_pasta_sauce/,{},mju0vt,True,False,False,False,True,True,False,,[],dark,text,False,False,True,10,0,False,all_ads,/r/vegan/comments/mju0vt/vegan_pasta_sauce/,False,,,6,1617533515,1,"I’m curious if anyone has an easy vegan pasta sauce recipe they could share with me. Besides marinara, I’ve tried a premade vegan Alfredo sauce from Publix that wasn’t too great. I do like nutritional yeast so I could def try something using that. I just don’t have any experience making my own. I’ve seen a couple sauces using cashews but haven’t tried them. Mainly because of that high fat content. I’m trying to eat low fat. Any ideas/recipes are welcome and appreciated!",True,False,False,vegan,t5_2qhpm,585650,public,self,,,Vegan pasta sauce,0,[],1.0,https://www.reddit.com/r/vegan/comments/mju0vt/vegan_pasta_sauce/,,all_ads,6,,,,,,,,,,,,,,,,,
[],False,Linie99,,[],,text,t2_cfnq6yz,False,False,[],False,False,1617530267,self.vegan,https://www.reddit.com/r/vegan/comments/mjtcuv/how_to_deal_with_omni_roommates/,{},mjtcuv,True,False,False,False,True,True,False,,[],dark,text,False,False,True,27,0,False,all_ads,/r/vegan/comments/mjtcuv/how_to_deal_with_omni_roommates/,False,,,6,1617530278,1,"Long time lurker, first time poster. I've been vegan for two months now (vegetarian before that) and I'm encountering some problems with my omni roommates. For context: I am a university student living in a shared house with some other students. Despite our differences, we all get along well and we usually eat dinner together (we take turns cooking each day). Moving out is not an option on the short term (perhaps in a year or so, but definitely not sooner than that).

The main problem is that my roommates do not want to adjust their cooking to my dietary preferences; whereas vegetarian was not really a problem to them (I'd just get a meat substitute alongside my veggies), cooking vegan meals is something they find 'too complicated' because it requires more adjustments. I also do not feel comfortable asking them to take my relatively new dietary preferences into account, because they already mock me whenever they see me drinking non-dairy milk (""oAtS hAvE fEeLiNgS tOo"") and they constantly try to debate me, while obviously not taking my arguments seriously (which is a whole other problem on its own, really). As a consequence, I am still regularly consuming meals which do contain milk, cheese and other dairy products, something which I find increasingly uncomfortable...

Have any of you had similar experiences with omni roommates in the past? How did you cope with this? I'm really grateful for any advice I can get!",True,False,False,vegan,t5_2qhpm,585644,public,self,,,How to deal with omni roommates?,0,[],1.0,https://www.reddit.com/r/vegan/comments/mjtcuv/how_to_deal_with_omni_roommates/,,all_ads,6,,,,,,,,Advice,3ae8cb6e-685e-11e9-90e6-0eb95b81be6a,Advice,,,,,,,
[],False,pixiem0th,,[],vegan,text,t2_5oorwejc,False,False,[],False,False,1617529996,self.vegan,https://www.reddit.com/r/vegan/comments/mjtawt/how_to_deal_with_being_surrounded_by_animal/,{},mjtawt,True,False,False,False,True,True,False,,[],dark,text,False,False,True,8,0,False,all_ads,/r/vegan/comments/mjtawt/how_to_deal_with_being_surrounded_by_animal/,False,,,6,1617530007,1,"I'm about to have dinner with my boyfriend's parents and I'm not sure if I can stomach my own meal if I'm going to be sitting at the same table where dead animals are being served. It's not like I can decline though, as they wouldn't understand and would just conclude that I am either rude or being unnecessarily difficult. One of the dishes they ordered is even grotesquely named 'goat on the bone'. Ugh.

How do you guys deal with this?",True,False,False,vegan,t5_2qhpm,585642,public,self,,,How to deal with being surrounded by animal cruelty?,0,[],1.0,https://www.reddit.com/r/vegan/comments/mjtawt/how_to_deal_with_being_surrounded_by_animal/,,all_ads,6,,,,,,70cd74e0-f01f-11e2-be4e-12313d05241f,dark,,,,,,,,,,
[],False,Nomadic_warrior23,,[],,text,t2_b5lxnjlo,False,False,[],False,False,1617528526,self.vegan,https://www.reddit.com/r/vegan/comments/mjt0aq/making_your_pet_a_vegan_is_fucked_up/,{},mjt0aq,True,False,False,False,True,True,False,,[],dark,text,False,False,False,2,0,False,all_ads,/r/vegan/comments/mjt0aq/making_your_pet_a_vegan_is_fucked_up/,False,self,"{'enabled': False, 'images': [{'id': 'v3lzHcXoBBRtqpciS0asyHpALh6w6TfBh_nd2Z0qOgg', 'resolutions': [{'height': 144, 'url': 'https://external-preview.redd.it/M-cQO2ml3H3XygjNa88aLTGqg5f_6QorWJIZVQ7DoQY.jpg?width=108&amp;crop=smart&amp;auto=webp&amp;s=d9f046733a6ff6a6e28ca30df47e606ab838607d', 'width': 108}, {'height': 288, 'url': 'https://external-preview.redd.it/M-cQO2ml3H3XygjNa88aLTGqg5f_6QorWJIZVQ7DoQY.jpg?width=216&amp;crop=smart&amp;auto=webp&amp;s=d13e685fd82dd86527c30e93127b948ae1f5d7fb', 'width': 216}, {'height': 426, 'url': 'https://external-preview.redd.it/M-cQO2ml3H3XygjNa88aLTGqg5f_6QorWJIZVQ7DoQY.jpg?width=320&amp;crop=smart&amp;auto=webp&amp;s=6d43673eecfd944bcd544330d1f8027d8973264b', 'width': 320}, {'height': 853, 'url': 'https://external-preview.redd.it/M-cQO2ml3H3XygjNa88aLTGqg5f_6QorWJIZVQ7DoQY.jpg?width=640&amp;crop=smart&amp;auto=webp&amp;s=12d583d0bf2a7414b1aa3b7ea2c87180b8e499e0', 'width': 640}], 'source': {'height': 960, 'url': 'https://external-preview.redd.it/M-cQO2ml3H3XygjNa88aLTGqg5f_6QorWJIZVQ7DoQY.jpg?auto=webp&amp;s=d636cbe81e5f601a8222e570fc7323e6dda4faea', 'width': 720}, 'variants': {}}]}",6,1617528537,1,"Don’t make your pet a vegan, unless it’s a herbivore like a rabbit or a horse. Dogs and cats have fangs and eating meat for them is very healthy. Making them vegan is extremely unhealthy as well. 

https://www.whyanimalsdothething.com/why-a-vegan-diet-will-kill-your-cat-and-sicken-your-dog

This is like the equivalent of feeding a cow meat. Cows are natural herbivores.",True,False,False,vegan,t5_2qhpm,585629,public,self,,,Making your pet a Vegan is fucked up.,0,[],1.0,https://www.reddit.com/r/vegan/comments/mjt0aq/making_your_pet_a_vegan_is_fucked_up/,,all_ads,6,,,,,,,,News,1720c1be-2ef1-11e5-96b3-0e5ca32a3025,News,,,,,,,
[],False,biohacker1337,,[],,text,t2_5giwy6oz,False,False,[],False,False,1617521948,self.vegan,https://www.reddit.com/r/vegan/comments/mjrohq/vegan_cheese_hack_to_make_vegan_cheese_taste_real/,{},mjrohq,True,False,False,False,True,True,False,,[],dark,text,False,False,True,2,0,False,all_ads,/r/vegan/comments/mjrohq/vegan_cheese_hack_to_make_vegan_cheese_taste_real/,False,self,"{'enabled': False, 'images': [{'id': '9uTomqftXoQZlVZaALugeSsAWAfTTSHuRQr9e6epnX0', 'resolutions': [{'height': 81, 'url': 'https://external-preview.redd.it/FpqTREqR3h_jwN8njJrrSdX44E06ML08bKwjHgrZFEA.jpg?width=108&amp;crop=smart&amp;auto=webp&amp;s=50dbfb3ea189471b17a9a7fd3584e91eee3dc9dd', 'width': 108}, {'height': 162, 'url': 'https://external-preview.redd.it/FpqTREqR3h_jwN8njJrrSdX44E06ML08bKwjHgrZFEA.jpg?width=216&amp;crop=smart&amp;auto=webp&amp;s=da31c48a9df4a3d51c2eebe14f1e2c9b0ffc089a', 'width': 216}, {'height': 240, 'url': 'https://external-preview.redd.it/FpqTREqR3h_jwN8njJrrSdX44E06ML08bKwjHgrZFEA.jpg?width=320&amp;crop=smart&amp;auto=webp&amp;s=c9c01ba0d5f0a87196ca2fb3032bd82a793b7c94', 'width': 320}], 'source': {'height': 360, 'url': 'https://external-preview.redd.it/FpqTREqR3h_jwN8njJrrSdX44E06ML08bKwjHgrZFEA.jpg?auto=webp&amp;s=d1d8019478b77491a9e51f37f4ba2f7adab5e00b', 'width': 480}, 'variants': {}}]}",6,1617521958,1,"https://youtu.be/HtH6is3UWPI

Just take the best vegan cheese you can find Vio Life Mozarella blocks and Parmesan Powder works. Other good brands are Daiya and Green Vie.

Basics.

1. Grate it yourself
2. Add the Parmesan
3. Add small amounts of almond milk.
4. Heat on low and turn to sauce at desired level
5. Use as you want to

The way this works is melting vegan cheese evaporates the water and makes it taste bad so hydrating it helps prevent it worsening and improves texture flavour and use.

Best for melted added on top pasta pizza after cooked etc but even in sandwiches it’s better like this makes it taste real af",True,False,False,vegan,t5_2qhpm,585605,public,self,,,Vegan cheese hack to make vegan cheese taste real,0,[],1.0,https://www.reddit.com/r/vegan/comments/mjrohq/vegan_cheese_hack_to_make_vegan_cheese_taste_real/,,all_ads,6,,,,,,,,Educational,700e5036-b9b6-11e8-bfb2-0ef7b7f43048,Educational,,,,,,,
[],False,KrissieKris,,[],,text,t2_43m5l4o9,False,False,[],False,False,1617521890,self.vegan,https://www.reddit.com/r/vegan/comments/mjro2p/vegan_with_ibd/,{},mjro2p,True,False,False,False,True,True,False,,[],dark,text,False,False,True,1,0,False,all_ads,/r/vegan/comments/mjro2p/vegan_with_ibd/,False,,,6,1617521900,1,"Hi there,    
Is there any (successful) vegan who has an IBD (Crohn’s, UC)? I would love to get into the veganism lifestyle, however with Crohn’s I cannot really eat beans or legumes in general in large quantities. Sometimes I treat myself once per month or so but because of the illness, it does not do me any good. I am a bit worried that I would miss on nutrients, vitamins etc.    
Thank you in advance!",True,False,False,vegan,t5_2qhpm,585605,public,self,,,Vegan with IBD?,0,[],1.0,https://www.reddit.com/r/vegan/comments/mjro2p/vegan_with_ibd/,,all_ads,6,,,,,,,,,,,,,,,,,
[],False,royalok5,,[],,text,t2_449rug1n,False,False,[],False,False,1617519715,self.vegan,https://www.reddit.com/r/vegan/comments/mjr784/school_audio_recording_on_veganism/,{},mjr784,True,False,False,False,True,True,False,,[],dark,text,False,False,True,2,0,False,all_ads,/r/vegan/comments/mjr784/school_audio_recording_on_veganism/,False,,,6,1617519725,1,"I have a school project that is due tomorrow. I do not know anyone who is vegan and I have to a audio recording interview on veganism. If anyone can send me an audio recording on answering the question below? 

What made you want to be vegan?
What kinds of food do vegans eat and is it only vegetables and plants? 
What do you like about being vegan?
Has there been any health benefits in being vegan that helped you? 
What is some advice and reasons why people should go vegan and how it can help everybody? 

This will be a private assignment that is available to my professor and myself. 

Please message me the audio. Thank you for the help.",True,False,False,vegan,t5_2qhpm,585606,public,self,,,School Audio Recording on Veganism,0,[],1.0,https://www.reddit.com/r/vegan/comments/mjr784/school_audio_recording_on_veganism/,,all_ads,6,,,,,,,,,,,,,,,,,
