all_awardings,allow_live_comments,author,author_flair_css_class,author_flair_richtext,author_flair_text,author_flair_type,author_fullname,author_patreon_flair,author_premium,awarders,can_mod_post,contest_mode,created_utc,domain,full_link,gildings,id,is_crosspostable,is_meta,is_original_content,is_reddit_media_domain,is_robot_indexable,is_self,is_video,link_flair_background_color,link_flair_richtext,link_flair_text_color,link_flair_type,locked,media_only,no_follow,num_comments,num_crossposts,over_18,parent_whitelist_status,permalink,pinned,post_hint,preview,pwls,retrieved_on,score,selftext,send_replies,spoiler,stickied,subreddit,subreddit_id,subreddit_subscribers,subreddit_type,thumbnail,thumbnail_height,thumbnail_width,title,total_awards_received,treatment_tags,upvote_ratio,url,url_overridden_by_dest,whitelist_status,wls,media,media_embed,removed_by_category,secure_media,secure_media_embed,author_flair_template_id,author_flair_text_color,link_flair_css_class,link_flair_template_id,link_flair_text,crosspost_parent,crosspost_parent_list,gallery_data,is_gallery,media_metadata,author_flair_background_color,edited
[],False,Lenkstudent,,[],,text,t2_58vtyvu0,False,False,[],False,False,1617561545,self.vegan,https://www.reddit.com/r/vegan/comments/mk21k2/is_20ish_years_the_turning_point/,{},mk21k2,True,False,False,False,True,True,False,,[],dark,text,False,False,True,2,0,False,all_ads,/r/vegan/comments/mk21k2/is_20ish_years_the_turning_point/,False,,,6,1617564312,2,"As with most everyone else, my biggest regret about going vegan is not doing it sooner. I'm approaching my two year anniversary soon and it's at least a start to help with my conscience about my diet prior to making the switch.

Two years ago today I still ate dairy. I was still complicit in the torture and exploitation of poor dairy cows. Some if not many of those cows are probably still alive today and continue to suffer, so I still feel complicit in what is happening to them because while I no longer fund what is happening to them *now*, I was responsible for the demand that ultimately lead to them being bred into existence in the first place.

Only after 5-6 years after going vegan will no dairy cow suffer due to my past choices. Because they've been murdered. But I feel it's actually somewhere around 20 years, or the life expectancy of a cow, when the debt can even begin to be repaid. I paid for a life born into slavery and I paid for a premature death. And two years of Veganism doesn't even begin to make me a good person.",True,False,False,vegan,t5_2qhpm,585772,public,self,,,Is 20ish years the turning point?,0,[],1.0,https://www.reddit.com/r/vegan/comments/mk21k2/is_20ish_years_the_turning_point/,,all_ads,6,,,,,,,,Discussion,0d26d52c-2ef1-11e5-8c17-0ec131dbf691,Discussion,,,,,,,
[],False,samvandervelden1002,,[],,text,t2_9ahoccuz,False,False,[],False,False,1617561228,self.vegan,https://www.reddit.com/r/vegan/comments/mk1xud/is_it_really_true_that_84_of_vegans_quit/,{},mk1xud,True,False,False,False,True,True,False,,[],dark,text,False,False,False,11,0,False,all_ads,/r/vegan/comments/mk1xud/is_it_really_true_that_84_of_vegans_quit/,False,,,6,1617563907,2,I keep hearing this number but I'm really skeptical about this to me it would seem way more obvious for that number to be reverse.,True,False,False,vegan,t5_2qhpm,585770,public,self,,,Is it really true that 84% of vegans quit?,0,[],1.0,https://www.reddit.com/r/vegan/comments/mk1xud/is_it_really_true_that_84_of_vegans_quit/,,all_ads,6,,,,,,,,Question,3fa453f8-685e-11e9-862d-0ee93d557dce,Question,,,,,,,
[],False,Phil_82,,[],,text,t2_4loej53,False,False,[],False,False,1617560820,self.vegan,https://www.reddit.com/r/vegan/comments/mk1t2q/so_anyone_watched_seaspiracy_yet_me_and_the_wife/,{},mk1t2q,True,False,False,False,True,True,False,,[],dark,text,False,False,True,9,0,False,all_ads,/r/vegan/comments/mk1t2q/so_anyone_watched_seaspiracy_yet_me_and_the_wife/,False,,,6,1617563343,2,"First off, if you haven't seen it, go watch it. 

Basically, if you haven't seen it, all of us as one planet, if we continue to fish the oceans the way we do, are pretty much done for. It seems like the worldwide powers that be are determined to destroy the planet by letting actual pirates do whatever the hell they want at sea.

It seems like trawling is even more destructive than deforestation and the fact that the people who are supposed to be overseeing it and protecting the oceans are all offshoots of the companies doing the damage.

It is horrific. And sometimes, the thought of what we are doing to our home by mistreating it the way we are doing, we totally deserve to go extinct. The human race could have been do much better than what it had become. It makes me very sad.",True,False,False,vegan,t5_2qhpm,585770,public,self,,,"So, anyone watched seaspiracy yet? Me and the wife did and we were both quite shocked by the findings, but sadly, not that surprised...",0,[],1.0,https://www.reddit.com/r/vegan/comments/mk1t2q/so_anyone_watched_seaspiracy_yet_me_and_the_wife/,,all_ads,6,,,,,,,,Discussion,0d26d52c-2ef1-11e5-8c17-0ec131dbf691,Discussion,,,,,,,
[],False,Senior-Number6083,,[],,text,t2_aj476v8o,False,False,[],False,False,1617559623,self.vegan,https://www.reddit.com/r/vegan/comments/mk1fax/any_tips_in_beating_my_dairy_and_meat_addiction/,{},mk1fax,True,False,False,False,True,True,False,,[],dark,text,False,False,True,8,0,False,all_ads,/r/vegan/comments/mk1fax/any_tips_in_beating_my_dairy_and_meat_addiction/,False,,,6,1617561912,1,"And to food and convenience in general. My cravings are really strong and hard to ignore especially in a lonely time like this. I’m going to start making money again (I live with my dad still) so I can buy my own food, but I can’t seem to control myself at the grocery store when there’s meat/cheese/yogurt options. I like the taste too much and it’s comforting when I’m sad. Vegan food is unsatisfactory and takes a while to prepare, at least in my experience and lack of culinary skills. Meat and dairy are so easy to prepare and so flavorful. Sorry if that sounded sickening. I apologize if I’m victimizing myself, the real victims are the animals.",True,False,False,vegan,t5_2qhpm,585763,public,self,,,Any tips in beating my dairy and meat addiction?,0,[],1.0,https://www.reddit.com/r/vegan/comments/mk1fax/any_tips_in_beating_my_dairy_and_meat_addiction/,,all_ads,6,,,,,,,,Advice,3ae8cb6e-685e-11e9-90e6-0eb95b81be6a,Advice,,,,,,,
[],False,Squishkin,,[],,text,t2_5c9oadby,False,False,[],False,False,1617559524,self.vegan,https://www.reddit.com/r/vegan/comments/mk1e4n/how_to_feel_okay_about_raising_cats/,{},mk1e4n,True,False,False,False,True,True,False,,[],dark,text,False,False,True,10,0,False,all_ads,/r/vegan/comments/mk1e4n/how_to_feel_okay_about_raising_cats/,False,,,6,1617561792,1,"Lately I have been troubled by cracking open four cans of fancy feast per day for each of my two cats.

Mostly we use the chicken variety so considering one chicken is harvested for about 1000 calories and the 72 calorie can is around 50% calories of chicken then each can is about 1/28th of a chicken (rough math)  So every 7 days each of my cats kills a chicken which was raised in awful conditions, their everyday being sufferring in a teeny cage.   I feed my cats this so they survive but why should their lives be more important than the immense torment these 52 chickens experience per year?  I love my cats but I can't help but feel like having human companions that are carnivorous perpetuate the very atrocities we need to come together to stomp out. 

I feel demotivated to help at animal shelters like I used to because my mind sees helping one cat resulting in torturing hundreds of chickens.",True,False,False,vegan,t5_2qhpm,585762,public,self,,,How to feel okay about raising cats,0,[],1.0,https://www.reddit.com/r/vegan/comments/mk1e4n/how_to_feel_okay_about_raising_cats/,,all_ads,6,,,,,,,,Discussion,0d26d52c-2ef1-11e5-8c17-0ec131dbf691,Discussion,,,,,,,
[],False,rjlupin5499,,[],vegan 8+ years,text,t2_fhzh7,False,False,[],False,False,1617557422,self.vegan,https://www.reddit.com/r/vegan/comments/mk0q1o/my_8_year_post_dedicated_to_the_vegans_who_came/,{},mk0q1o,True,False,False,False,True,True,False,,[],dark,text,False,False,False,1,0,False,all_ads,/r/vegan/comments/mk0q1o/my_8_year_post_dedicated_to_the_vegans_who_came/,False,,,6,1617559102,4,"&gt; Do not unjustly eat fish the water has given up,  
 And do not desire as food the flesh of slaughtered animals,  
 Or the white milk of mothers who intended its pure draught  
 for their young, not noble ladies.  
 And do not grieve the unsuspecting birds by taking eggs;  
 for injustice is the worst of crimes.  
 And spare the honey which the bees get industriously  
 from the flowers of fragrant plants;  
 For they did not store it that it might belong to others,  
 Nor did they gather it for bounty and gifts.  
 I washed my hands of all this; and wish that I  
 Perceived my way before my hair went gray!  
&gt;  
&gt;— **Abu al-'Ala' al-Ma'arri**  
*(973 - 1057 C.E.)*

Man, it's been a journey.  I gave up meat (and always had to specify that it included poultry and fish) in 2007.  I went vegan in April of 2013, and haven't looked back.  This month marks eight years of veganism.  In the last eight years, veganism has come a long way.  I went from having a couple of insta-foods that I could buy at the local chain grocer to having an exponentially growing number of items that I seem to be able to have.  The irony, of course, is that I eat a lot healthier these days and don't buy most of the new products that are on the market on any sort of regular basis.  I do my best to try a fair few of them, though, just to see what they're like.

Just setting an example for people has gotten people thinking, and my partner completely made the transition to veganism last summer.  This movement seems to only be beginning.

**I dedicate this post to all of the vegans who were doing it before I was, paving the way to make it a hell of a lot easier for me and everyone else these days.**

Thank you!",True,False,False,vegan,t5_2qhpm,585762,public,self,,,My 8 Year Post: Dedicated to the vegans who came before us.,0,[],1.0,https://www.reddit.com/r/vegan/comments/mk0q1o/my_8_year_post_dedicated_to_the_vegans_who_came/,,all_ads,6,,,,,,349bd530-7bcd-11e9-9a04-0ee954ab499e,dark,Uplifting,d6a5fb70-f024-11e2-8dba-12313b0ae2ae,Uplifting,,,,,,,
[],False,Waste-Comedian4998,,[],,text,t2_9wx2z68u,False,False,[],False,False,1617557330,self.vegan,https://www.reddit.com/r/vegan/comments/mk0ow0/need_to_vent_about_inlaw_teasing_me/,{},mk0ow0,True,False,False,False,True,True,False,,[],dark,text,False,False,False,6,0,False,all_ads,/r/vegan/comments/mk0ow0/need_to_vent_about_inlaw_teasing_me/,False,self,"{'enabled': False, 'images': [{'id': 'Ojm4mRX2N9zvYIG82uCK6SaQAamk4a3ypudY5VVynms', 'resolutions': [{'height': 56, 'url': 'https://external-preview.redd.it/uIOVUmd23WUctWswNZgT8ZTyWdb9X3ghIks19k-XRFM.jpg?width=108&amp;crop=smart&amp;auto=webp&amp;s=fbc461f277ca25906d0b9f7d630d4eafbe595ace', 'width': 108}, {'height': 112, 'url': 'https://external-preview.redd.it/uIOVUmd23WUctWswNZgT8ZTyWdb9X3ghIks19k-XRFM.jpg?width=216&amp;crop=smart&amp;auto=webp&amp;s=26126232baa2f9d52d8ba69b92c72884a036edf5', 'width': 216}, {'height': 167, 'url': 'https://external-preview.redd.it/uIOVUmd23WUctWswNZgT8ZTyWdb9X3ghIks19k-XRFM.jpg?width=320&amp;crop=smart&amp;auto=webp&amp;s=e049120732b5dfefbfa0e2c80b6cd79ba763f0de', 'width': 320}, {'height': 334, 'url': 'https://external-preview.redd.it/uIOVUmd23WUctWswNZgT8ZTyWdb9X3ghIks19k-XRFM.jpg?width=640&amp;crop=smart&amp;auto=webp&amp;s=d205a1968958e51ab8497526da2defefd69b7da4', 'width': 640}, {'height': 501, 'url': 'https://external-preview.redd.it/uIOVUmd23WUctWswNZgT8ZTyWdb9X3ghIks19k-XRFM.jpg?width=960&amp;crop=smart&amp;auto=webp&amp;s=331c8238b787cdce236cd84827471b3e157dabb3', 'width': 960}], 'source': {'height': 549, 'url': 'https://external-preview.redd.it/uIOVUmd23WUctWswNZgT8ZTyWdb9X3ghIks19k-XRFM.jpg?auto=webp&amp;s=5bf940784d10e9415dd4276591674a36f22fbfa1', 'width': 1050}, 'variants': {}}]}",6,1617559028,2,"The other day in the family group chat with my in-laws, my SIL - in the context of another conversation - slipped in a dig at me for being vegan. When I politely called her out on it and laid down a boundary saying that it's not okay to make me the butt of jokes about my lifestyle, she gave a totally transparent BS apology saying that she ""respected"" my choices and that it was just a ""lighthearted tease"".

Let me be clear that I do not talk about my veganism unless someone else brings it up, and I have never suggested to her that I disapprove of her choice to eat meat. Literally have never, ever gone there with her. 5 years I've known her, 1 1/2 of them as a vegan.

I followed up with her privately saying that I appreciated the apology, but that there was no valid reason to tease me for not eating animals. That respect and teasing aren't compatible in my view. That as a lifelong vegetarian I've been the butt of thousands of similar jokes and that they were the source of some childhood trauma and abusive behavior by people I thought were my friends. That her words really hurt me and were confusing in the context of an otherwise positive and supportive relationship. I sent her [this article](https://www.nytimes.com/2019/08/28/opinion/vegan-food.html). I told her that I hoped she could empathize and hoped that this additional context could strengthen our relationship. 

As a progressive gay feminist of color, I thought she'd be able to empathize. All I got back?

&gt; i hear you

I'm honestly gobsmacked. I didn't exactly expect ""love and light"", but that curt, empty, icy 3-word reply was not on my possibility list. The fact that it came from a grown-ass woman in her late 30s. The difference between how she handled the convo in private vs in front of her family. The total disregard of me basically pouring my heart out to her. It hurts. It confirms my previous suspicions about her being vapid and self-centered at her core.

But I know that her reaction isn't about me, and I know that this interaction is really a blessing because she showed me her true colors, both who she is and how she really sees me (and by extension my husband, her brother). I don't regret it, but I'm not happy.",True,False,False,vegan,t5_2qhpm,585760,public,self,,,Need to vent about in-law teasing me,0,[],1.0,https://www.reddit.com/r/vegan/comments/mk0ow0/need_to_vent_about_inlaw_teasing_me/,,all_ads,6,,,,,,,,,,,,,,,,,
[],False,SmartDude89,,[],,text,t2_8cronoae,False,False,[],False,False,1617554892,self.vegan,https://www.reddit.com/r/vegan/comments/mjzw97/forget_about_some_fancy_vegan_easter_meal_all_i/,{},mjzw97,True,False,False,False,True,True,False,,[],dark,text,False,False,False,1,0,False,all_ads,/r/vegan/comments/mjzw97/forget_about_some_fancy_vegan_easter_meal_all_i/,False,,,6,1617556100,4,"&amp;#x200B;

https://preview.redd.it/rvhkcxujr6r61.jpg?width=1668&amp;format=pjpg&amp;auto=webp&amp;s=869b39f59d5c54c615f36c59e38338f758ed951f",True,False,False,vegan,t5_2qhpm,585748,public,https://b.thumbs.redditmedia.com/LElNweiUYWkBF5ajIBnd18zOatEbEceow2BHTZzlisU.jpg,140.0,140.0,Forget about some fancy vegan Easter meal. All I need is the good old fashioned one!,0,[],1.0,https://www.reddit.com/r/vegan/comments/mjzw97/forget_about_some_fancy_vegan_easter_meal_all_i/,,all_ads,6,,,,,,,,,,,,,,,"{'rvhkcxujr6r61': {'e': 'Image', 'id': 'rvhkcxujr6r61', 'm': 'image/jpg', 'p': [{'u': 'https://preview.redd.it/rvhkcxujr6r61.jpg?width=108&amp;crop=smart&amp;auto=webp&amp;s=1949168475446dbc3cbee94168d86d48075a9f43', 'x': 108, 'y': 192}, {'u': 'https://preview.redd.it/rvhkcxujr6r61.jpg?width=216&amp;crop=smart&amp;auto=webp&amp;s=478c3322063d0ed980e4c39f2aac07fce65bc75e', 'x': 216, 'y': 384}, {'u': 'https://preview.redd.it/rvhkcxujr6r61.jpg?width=320&amp;crop=smart&amp;auto=webp&amp;s=5a7566a72c6f0b9fd10a7aa2429a5c754c6b6273', 'x': 320, 'y': 569}, {'u': 'https://preview.redd.it/rvhkcxujr6r61.jpg?width=640&amp;crop=smart&amp;auto=webp&amp;s=e7b03be6425e0d88b18953b283d2ebf338050371', 'x': 640, 'y': 1138}, {'u': 'https://preview.redd.it/rvhkcxujr6r61.jpg?width=960&amp;crop=smart&amp;auto=webp&amp;s=b3753e04d54f046a239e300f8a46761986e247a2', 'x': 960, 'y': 1708}, {'u': 'https://preview.redd.it/rvhkcxujr6r61.jpg?width=1080&amp;crop=smart&amp;auto=webp&amp;s=4a9c363c219b34ad11d8113c4351ef4588f8610f', 'x': 1080, 'y': 1921}], 's': {'u': 'https://preview.redd.it/rvhkcxujr6r61.jpg?width=1668&amp;format=pjpg&amp;auto=webp&amp;s=869b39f59d5c54c615f36c59e38338f758ed951f', 'x': 1668, 'y': 2968}, 'status': 'valid'}}",,
[],False,ytodysm,,[],,text,t2_1tcue89x,False,False,[],False,False,1617554401,self.vegan,https://www.reddit.com/r/vegan/comments/mjzqik/vegan_antidandruff_shampoo/,{},mjzqik,True,False,False,False,True,True,False,,[],dark,text,False,False,True,5,0,False,all_ads,/r/vegan/comments/mjzqik/vegan_antidandruff_shampoo/,False,,,6,1617555345,1,"I’ll search the sub, too, but figured we could generate some fresh answers.",True,False,False,vegan,t5_2qhpm,585751,public,self,,,Vegan Antidandruff Shampoo?,0,[],0.99,https://www.reddit.com/r/vegan/comments/mjzqik/vegan_antidandruff_shampoo/,,all_ads,6,,,,,,,,Question,3fa453f8-685e-11e9-862d-0ee93d557dce,Question,,,,,,,
[],False,Cain777c,,[],,text,t2_3hdblbnv,False,False,[],False,False,1617553785,self.vegan,https://www.reddit.com/r/vegan/comments/mjzjh3/im_hardcore_questioning_the_basics_of_veganism/,{},mjzjh3,True,False,False,False,True,True,False,,[],dark,text,False,False,True,25,0,False,all_ads,/r/vegan/comments/mjzjh3/im_hardcore_questioning_the_basics_of_veganism/,False,,,6,1617554606,0,"We recently started keeping pet chickens who were given away for free. They've been laying eggs and I've been wondering what I will do if one falls sick or passes of natural causes. I'm curious as to what this community feels about that, before I make assumptions. It clearly disobey the vegan standards but its the biologically correct thing to do - the eggs would rot and make the birds sick eventually as they are not broody. I feel like it's instantly and completely undermined my support for veganism but again I don't want to make assumptions. What do you think?
Thanks!",True,False,False,vegan,t5_2qhpm,585747,public,self,,,I'm hard-core questioning the basics of veganism after raising chickens,0,[],0.5,https://www.reddit.com/r/vegan/comments/mjzjh3/im_hardcore_questioning_the_basics_of_veganism/,,all_ads,6,,,,,,,,,,,,,,,,,
[],False,L-JvG,,[],veganarchist,text,t2_2hssg27n,False,False,[],False,False,1617553766,self.vegan,https://www.reddit.com/r/vegan/comments/mjzj95/why_are_you_vegan/,{},mjzj95,True,False,False,False,True,True,False,,[],dark,text,False,False,True,12,0,False,all_ads,/r/vegan/comments/mjzj95/why_are_you_vegan/,False,,,6,1617554592,0,"There are so many valid answers. Only for health reasons is a bit lacking. Yeah I’m sure that cheese sandwich is soooo much healthier for you now that it’s all plant saturated fats, but hay if it keeps you vegan keep flying you’re freak flag.

Obviously there is the superiority of those who do it for moral reasons and respect to them. Definitely more swayed by it lately personally but it didn’t convince me initially so I wouldn’t call myself an ethical vegan. 

So many great reasons, so much data and philosophy. There is however one group I looks down on abs honestly I dislike more and more the longer I’m vegan. “Icky” vegans. 

Oh you think meat is icky? 

It all started when you tried to cook a stake and the tissue at the bottom of the packet was dripping in blood? Hahaha yeah so funny how you only ate stake at restaurants because of that before giving it up all together.

Really liked drum sticks until you bit a blood vessel and you can’t look at chicken nuggets the same way? 

Did you know that sausage are sometimes made using pig intestines? Ewwwwww so gross that when an animal is eaten all of it at least gets fucking used rather than thrown away to rot for its suffering. Hahahah yeah right gross. 

You used to eat cheese all the time, yum how could you live without it right, none of that stinky stuff though hahaha gross mould am I right? Then one day you left you’re really expensive cheddar at the back of the fridge and part of it froze and the other part went all fuzzy after you got back from holiday. Hahah yeah it’s a lot of money to loose, can’t look at any cheese the same way anymore though right? Mould hahaha gross yeah. 

You just don’t like dairy and think it’s gross now that you know puss gets in it? That a stupid reason, it was just as puss filled when you last had it. 

You just think that killing an animal is icky, no problem with the death of its desire to live, it’s poor living conditions, is being a product, no no no just that killing is icky. 



You’re not a vegan your just upset knowing how you’re food gets made.",True,False,False,vegan,t5_2qhpm,585747,public,self,,,Why are you vegan?,0,[],0.33,https://www.reddit.com/r/vegan/comments/mjzj95/why_are_you_vegan/,,all_ads,6,,,,,,a267b3ba-3ff9-11e3-a1fd-12313d21c4ee,dark,Rant,93c0fe64-689e-11e5-b5be-0e7eccdaeabd,Rant,,,,,,,
[],False,RaccGodChomby,,[],,text,t2_5efjbz74,False,False,[],False,False,1617552517,self.vegan,https://www.reddit.com/r/vegan/comments/mjz4mo/rip_fruffalo_wings_field_roast/,{},mjz4mo,True,False,False,False,True,True,False,,[],dark,text,False,False,False,1,0,False,all_ads,/r/vegan/comments/mjz4mo/rip_fruffalo_wings_field_roast/,False,,,6,1617553436,2,"Just ordered a package of FRUFFALO wings as part of our groceries and when it arrived I was deeply saddened to notice the packaging and naming had changed. I love almost everything Field Roast does and while the new packaging is certainly sexier there's just something that was so endearing about *Fruffalo* that makes my heart sad in knowing it's now gone. Fruffalo Wings are dead. Long live Fruffalo Wings!

(Edited for captions)

[::Not as sexy but what a personality and hella cute!::](https://preview.redd.it/gl0jwu2xj6r61.png?width=679&amp;format=png&amp;auto=webp&amp;s=35e7eb8535835c7ff37bc8ebba0a71d3ac86943a)

[::sexy delicious booing::](https://preview.redd.it/mx475pkuj6r61.png?width=1100&amp;format=png&amp;auto=webp&amp;s=68105dc00994b152f54b1af354a49cdd1c7217d8)",True,False,False,vegan,t5_2qhpm,585741,public,https://a.thumbs.redditmedia.com/vj-TGuU9QqJguIzxjvy-X7inLni6BN62Phf4nJ8-c70.jpg,140.0,140.0,RIP Fruffalo Wings (Field Roast),0,[],1.0,https://www.reddit.com/r/vegan/comments/mjz4mo/rip_fruffalo_wings_field_roast/,,all_ads,6,,,,,,,,,,,,,,,"{'gl0jwu2xj6r61': {'e': 'Image', 'id': 'gl0jwu2xj6r61', 'm': 'image/png', 'p': [{'u': 'https://preview.redd.it/gl0jwu2xj6r61.png?width=108&amp;crop=smart&amp;auto=webp&amp;s=679415780f3c263d47da1bb02c48b80035503f43', 'x': 108, 'y': 127}, {'u': 'https://preview.redd.it/gl0jwu2xj6r61.png?width=216&amp;crop=smart&amp;auto=webp&amp;s=d6bdfe253344740fb8cafeba7edbfe65638512ce', 'x': 216, 'y': 254}, {'u': 'https://preview.redd.it/gl0jwu2xj6r61.png?width=320&amp;crop=smart&amp;auto=webp&amp;s=c4addab8ce7ef819df1123073b477c51fa57deb2', 'x': 320, 'y': 377}, {'u': 'https://preview.redd.it/gl0jwu2xj6r61.png?width=640&amp;crop=smart&amp;auto=webp&amp;s=a5dcf88a8e203bf71184c3cf354736e6f6979b48', 'x': 640, 'y': 754}], 's': {'u': 'https://preview.redd.it/gl0jwu2xj6r61.png?width=679&amp;format=png&amp;auto=webp&amp;s=35e7eb8535835c7ff37bc8ebba0a71d3ac86943a', 'x': 679, 'y': 801}, 'status': 'valid'}, 'mx475pkuj6r61': {'e': 'Image', 'id': 'mx475pkuj6r61', 'm': 'image/png', 'p': [{'u': 'https://preview.redd.it/mx475pkuj6r61.png?width=108&amp;crop=smart&amp;auto=webp&amp;s=9d73b8d95a2d0abb0da65e534c4fcb6456fa8a91', 'x': 108, 'y': 108}, {'u': 'https://preview.redd.it/mx475pkuj6r61.png?width=216&amp;crop=smart&amp;auto=webp&amp;s=2165dc3b0a5155129dd61f870f04a42a7e61176b', 'x': 216, 'y': 216}, {'u': 'https://preview.redd.it/mx475pkuj6r61.png?width=320&amp;crop=smart&amp;auto=webp&amp;s=d24f837055eea8e68dcf01f981183aa429e882d8', 'x': 320, 'y': 320}, {'u': 'https://preview.redd.it/mx475pkuj6r61.png?width=640&amp;crop=smart&amp;auto=webp&amp;s=22c1ca6b98077e5b133495495787e069c35ace49', 'x': 640, 'y': 640}, {'u': 'https://preview.redd.it/mx475pkuj6r61.png?width=960&amp;crop=smart&amp;auto=webp&amp;s=82c3a78c398aaec3c9121cc45410a4ae9613911f', 'x': 960, 'y': 960}, {'u': 'https://preview.redd.it/mx475pkuj6r61.png?width=1080&amp;crop=smart&amp;auto=webp&amp;s=7c6d2d6433bb7b2b5fbb275102044079c70f00ec', 'x': 1080, 'y': 1080}], 's': {'u': 'https://preview.redd.it/mx475pkuj6r61.png?width=1100&amp;format=png&amp;auto=webp&amp;s=68105dc00994b152f54b1af354a49cdd1c7217d8', 'x': 1100, 'y': 1100}, 'status': 'valid'}}",,
