[],False,sp091,,[],,text,t2_10lvd8,False,False,[],False,False,1617896947,self.vegan,https://www.reddit.com/r/vegan/comments/mmuoo7/vegan_cooking_comic_looking_for_input/,{},mmuoo7,True,False,False,False,True,True,False,,[],dark,text,False,False,True,0,0,False,all_ads,/r/vegan/comments/mmuoo7/vegan_cooking_comic_looking_for_input/,False,6,1617896959,1,"Hello! I'm starting a comic about vegan cooking and am trying to find a good name for it. 

What's your vote?

If you have other ideas or favorite vegan puns, let me know in the comments!

&amp;#x200B;

[View Poll](https://www.reddit.com/poll/mmuoo7)",True,False,False,vegan,t5_2qhpm,587536,public,self,Vegan Cooking Comic looking for input!,0,[],1.0,https://www.reddit.com/r/vegan/comments/mmuoo7/vegan_cooking_comic_looking_for_input/,all_ads,6,,,,,,,,,,,,"{'is_prediction': False, 'options': [{'id': '7159107', 'text': 'Missed Steak'}, {'id': '7159108', 'text': 'Good Chives'}, {'id': '7159109', 'text': 'Soy What?'}], 'resolved_option_id': None, 'total_stake_amount': None, 'total_vote_count': 0, 'tournament_id': None, 'user_selection': None, 'user_won_amount': None, 'voting_end_timestamp': 1618156147956}",,,,,,,,,
[],False,pangowin_bloob,,[],,text,t2_15mh16,False,False,[],False,False,1617896522,self.vegan,https://www.reddit.com/r/vegan/comments/mmujce/the_time_i_got_told_to_stop_indoctrinating_the/,{},mmujce,True,False,False,False,True,True,False,,[],dark,text,False,False,True,14,0,False,all_ads,/r/vegan/comments/mmujce/the_time_i_got_told_to_stop_indoctrinating_the/,False,6,1617896533,1,"When I was 18 I was more of a militant vegan. I'm sure everyone here has an instance where they had to explain to a child why they don't eat certain foods. This is one of those times. I babysat for a set of twins. a boy and a girl aged 7. Every night I would pour whole milk into their cups before bed.   


Kid: why don't you drink milk?

Me: uhh I don't think it's really good for you. ya know? milk is made for baby cows and I'm not a baby cow.""

Kid: oh, okay

and that was the end of that. cue to the next day. I get a phone call from their mother.

Angry mother: Did you tell my kid that milk was bad for her? because she's crying and refusing to drink milk because she said that you told her that milk was bad for her. now she's refusing to drink milk!

I explained to her what I said and her response

""well, I'd appreciate it if you kept your indoctrination to yourself when you're around my kids.""

yeah okay. I did after that. mostly because they would pay me $20 an hour to hang out and watch TV but this really bothered me. Omni's are really so triggered by the truth.",True,False,False,vegan,t5_2qhpm,587531,public,self,"The time I got told to stop ""indoctrinating"" the children I babysat.",0,[],1.0,https://www.reddit.com/r/vegan/comments/mmujce/the_time_i_got_told_to_stop_indoctrinating_the/,all_ads,6,,,,,,,,,,,,,,,,,,,,,
[],False,HranganMind,,[],,text,t2_5r63kccg,False,False,[],False,False,1617895841,self.vegan,https://www.reddit.com/r/vegan/comments/mmuauw/hello_vegans_i_am_wondering_if_you_could_help_me/,{},mmuauw,True,False,False,False,True,True,False,,[],dark,text,False,False,True,33,0,False,all_ads,/r/vegan/comments/mmuauw/hello_vegans_i_am_wondering_if_you_could_help_me/,False,6,1617895852,1,"I hope this is not an abuse of this subreddit, but I really want to hear this from actual vegans.  I don’t want to make assumptions and get things wrong.

I am writing a speculative fiction story and one of my characters is vegan.  That isn’t the reason I’m here, though.  

You see, in the world of my story, veganism has evolved and become recognized as a major religion.  That’s what I would love to hear real vegan ideas and opinions on.  

What do you think that would be like?
Would you like or dislike religious recognition or protection?
Do you think it would be good or bad?
What do you think would have to transpire for that to happen

Again, this is simply in the context of a science fiction story that I’m writing.  I’m not suggesting that this is happening in the real world or should or shouldn’t happen.  I only want to get input from real vegans.  I don’t want my story to have a caricature of vegans, but the portrayal of a possible living breathing society.

Thank you for your time.",True,False,False,vegan,t5_2qhpm,587528,public,self,Hello Vegans. I am wondering if you could help me understand your worldview better,0,[],1.0,https://www.reddit.com/r/vegan/comments/mmuauw/hello_vegans_i_am_wondering_if_you_could_help_me/,all_ads,6,,,,,,,,,,,,,,,,,,,,,
[],False,Edichai,,[],,text,t2_3vx8nsll,False,False,[],False,False,1617891593,self.vegan,https://www.reddit.com/r/vegan/comments/mmstve/allplants_referral_link/,{},mmstve,True,False,False,False,True,True,False,,[],dark,text,False,False,True,0,0,False,all_ads,/r/vegan/comments/mmstve/allplants_referral_link/,False,6,1617891604,1,"For everyone lives in the UK,

I’ve been trying ready meals from allplants. Some of them are quite impressive. My favourites are Teryaki Undo and tofu massaman curry.

It’s definitely cheaper than Deliveroo even without the £20 off. But bit pricey for its original price.

So if you want to try them, please use the link below. Much appreciated. 

[£20 off referral link](https://allplants.mention-me.com/m/ol/gc1iz-junbin-cai)",True,False,False,vegan,t5_2qhpm,587502,public,self,Allplants referral link,0,[],1.0,https://www.reddit.com/r/vegan/comments/mmstve/allplants_referral_link/,all_ads,6,,,,self,"{'enabled': False, 'images': [{'id': 'QofVsKMwoMqNGDygUSE_8WI-MoBj624fdDoJkTOck7U', 'resolutions': [{'height': 72, 'url': 'https://external-preview.redd.it/xNN8fOowDkVHHEDgEh1-J_aIQUVd6_KXeNkc_ZhXrNc.jpg?width=108&amp;crop=smart&amp;auto=webp&amp;s=f2a59fe08604aacf90d12a4b4c356fb7e5cd1ac1', 'width': 108}, {'height': 144, 'url': 'https://external-preview.redd.it/xNN8fOowDkVHHEDgEh1-J_aIQUVd6_KXeNkc_ZhXrNc.jpg?width=216&amp;crop=smart&amp;auto=webp&amp;s=93fd9f58e0050cfdc191cd6e110042947093f708', 'width': 216}, {'height': 213, 'url': 'https://external-preview.redd.it/xNN8fOowDkVHHEDgEh1-J_aIQUVd6_KXeNkc_ZhXrNc.jpg?width=320&amp;crop=smart&amp;auto=webp&amp;s=25cd41bab562041cb78a585a1e35b7a3ea5bd1e8', 'width': 320}, {'height': 426, 'url': 'https://external-preview.redd.it/xNN8fOowDkVHHEDgEh1-J_aIQUVd6_KXeNkc_ZhXrNc.jpg?width=640&amp;crop=smart&amp;auto=webp&amp;s=341b5790c7e1fd6efec9605eb929ff3c25dd8690', 'width': 640}, {'height': 640, 'url': 'https://external-preview.redd.it/xNN8fOowDkVHHEDgEh1-J_aIQUVd6_KXeNkc_ZhXrNc.jpg?width=960&amp;crop=smart&amp;auto=webp&amp;s=6223d6508ec90bd1187c25f68d0af87464813c18', 'width': 960}, {'height': 720, 'url': 'https://external-preview.redd.it/xNN8fOowDkVHHEDgEh1-J_aIQUVd6_KXeNkc_ZhXrNc.jpg?width=1080&amp;crop=smart&amp;auto=webp&amp;s=63fe08fbdc06150df04b6f7b168eaa0a0e607a59', 'width': 1080}], 'source': {'height': 800, 'url': 'https://external-preview.redd.it/xNN8fOowDkVHHEDgEh1-J_aIQUVd6_KXeNkc_ZhXrNc.jpg?auto=webp&amp;s=e4196260a2a7d7b3a40ce5cda1141ab04352425d', 'width': 1200}, 'variants': {}}]}",,,,,,,,,,,,,,,,
[],False,askallthequestions86,,[],,text,t2_79tztgoq,False,False,[],False,False,1617891127,self.vegan,https://www.reddit.com/r/vegan/comments/mmso7w/confused_about_red_dyes/,{},mmso7w,True,False,False,False,True,True,False,,[],dark,text,False,False,True,7,0,False,all_ads,/r/vegan/comments/mmso7w/confused_about_red_dyes/,False,6,1617891139,1,"I want to make a vegan tres leches cake and when I used to make it, I topped it with maraschino cherries.

I'm reading that due to carmine, they are not vegan. But most generic brands show Red 40, which is awfully unhealthy and petroleum based, but it's a once in a blue moon cake so I can deal with that.

I've also read carmine can go by Red #4. But not Red #40... Help please! And thank you :)",True,False,False,vegan,t5_2qhpm,587501,public,self,Confused about red dyes,0,[],1.0,https://www.reddit.com/r/vegan/comments/mmso7w/confused_about_red_dyes/,all_ads,6,,,,,,,,,,,,,,,,,,,,,
[],False,[deleted],,,,,,,,[],False,False,1617890294,self.vegan,https://www.reddit.com/r/vegan/comments/mmsdrt/plz_read/,{},mmsdrt,False,False,False,False,False,True,False,,[],dark,text,False,False,True,0,0,False,all_ads,/r/vegan/comments/mmsdrt/plz_read/,False,6,1617890305,1,,True,False,False,vegan,t5_2qhpm,587496,public,default,Plz read,0,[],1.0,https://www.reddit.com/r/vegan/comments/mmsdrt/plz_read/,all_ads,6,Health,e40086b4-f01f-11e2-8dd3-12313b0c8c59,Health,,,deleted,,,,,dark,,,,,,,,,,moderators
[],False,Appropriate_Bread122,,[],,text,t2_8etmtwvd,False,False,[],False,False,1617889956,self.vegan,https://www.reddit.com/r/vegan/comments/mms9v0/vegan_ethically_made_womens_shoes_that_are_ideal/,{},mms9v0,True,False,False,False,True,True,False,,[],dark,text,False,False,True,4,0,False,all_ads,/r/vegan/comments/mms9v0/vegan_ethically_made_womens_shoes_that_are_ideal/,False,6,1617889967,1,"
I suffer from chronic ankle and foot inflammation, tightness and pain stemming from a sprain sustained six years ago. I am currently working in an office position involving a significant amount of standing and walking.
In the past, I have worn Ara as well as Aetrex shoes. I am looking for a pair of shoes that are sturdy supportive and comfortable. I over-pronate when I walk, so I am wondering if perhaps there are ethically-made shoes that can help mitigate that. 
Does anyone know of any brands that I can try?",True,False,False,vegan,t5_2qhpm,587493,public,self,"Vegan, ethically made women’s shoes that are ideal for chronic ankle and foot inflammation and pain and suitable for work?",0,[],1.0,https://www.reddit.com/r/vegan/comments/mms9v0/vegan_ethically_made_womens_shoes_that_are_ideal/,all_ads,6,,,,,,,,,,,,,,,,,,,,,
[],False,Dr_ojboli,,[],,text,t2_6ee5z3qh,False,False,[],False,False,1617887725,self.vegan,https://www.reddit.com/r/vegan/comments/mmrjgj/what_did_u_have_for_ur_dinner/,{},mmrjgj,False,False,False,False,False,True,False,,[],dark,text,False,False,True,8,0,False,all_ads,/r/vegan/comments/mmrjgj/what_did_u_have_for_ur_dinner/,False,6,1617887905,0,"[removed]

[View Poll](https://www.reddit.com/poll/mmrjgj)",True,False,False,vegan,t5_2qhpm,587491,public,self,What did u have for Ur dinner ??,0,[],0.25,https://www.reddit.com/r/vegan/comments/mmrjgj/what_did_u_have_for_ur_dinner/,all_ads,6,Health,e40086b4-f01f-11e2-8dd3-12313b0c8c59,Health,,,automod_filtered,,,,,,,,,,,,,,,
[],False,diebuebin,,[],,text,t2_7kc8du5c,False,False,[],False,False,1617883528,self.vegan,https://www.reddit.com/r/vegan/comments/mmqb2t/cooking_vegan_for_my_german_grandparents/,{},mmqb2t,True,False,False,False,True,True,False,,[],dark,text,False,False,True,17,0,False,all_ads,/r/vegan/comments/mmqb2t/cooking_vegan_for_my_german_grandparents/,False,6,1617883540,1,"Hey there! :) My grandparents are so kind to have me at their place for a few months and they are very traditional (German) meat eaters. I offered to cook them dinner every weekend but now I don't know what best to cook for them to enjoy since they don't really like trying new things. Do you maybe have some tasty vegan dinner ideas for ""beginners"" regarding eating vegan? Thank you all so much! ☀️🌱",True,False,False,vegan,t5_2qhpm,587468,public,self,Cooking vegan for my German grandparents,0,[],1.0,https://www.reddit.com/r/vegan/comments/mmqb2t/cooking_vegan_for_my_german_grandparents/,all_ads,6,Question,3fa453f8-685e-11e9-862d-0ee93d557dce,Question,,,,,,,,,,,,,,,,,,
