all_awardings,allow_live_comments,author,author_flair_css_class,author_flair_richtext,author_flair_text,author_flair_type,author_fullname,author_patreon_flair,author_premium,awarders,can_mod_post,contest_mode,created_utc,domain,full_link,gildings,id,is_crosspostable,is_meta,is_original_content,is_reddit_media_domain,is_robot_indexable,is_self,is_video,link_flair_background_color,link_flair_css_class,link_flair_richtext,link_flair_template_id,link_flair_text,link_flair_text_color,link_flair_type,locked,media_only,no_follow,num_comments,num_crossposts,over_18,parent_whitelist_status,permalink,pinned,post_hint,preview,pwls,removed_by_category,retrieved_on,score,selftext,send_replies,spoiler,stickied,subreddit,subreddit_id,subreddit_subscribers,subreddit_type,thumbnail,thumbnail_height,thumbnail_width,title,total_awards_received,treatment_tags,upvote_ratio,url,url_overridden_by_dest,whitelist_status,wls,author_flair_template_id,author_flair_text_color,media,media_embed,secure_media,secure_media_embed,is_gallery,crosspost_parent,crosspost_parent_list
[],False,88scarlet88,,[],,text,t2_2m2dzuk,False,False,[],False,False,1617799313,self.vegan,https://www.reddit.com/r/vegan/comments/mm16i9/animal_agriculture_could_end_modern_medicine/,{},mm16i9,True,False,False,False,True,True,False,,Disturbing,[],dc972d74-f01f-11e2-8b35-12313b0cdc23,Disturbing,dark,text,False,False,True,7,0,False,all_ads,/r/vegan/comments/mm16i9/animal_agriculture_could_end_modern_medicine/,False,,,6,,1617799325,1,"I wasn’t aware of this and have not heard any activists mentioning this, but it’s a HUGE argument for veganism. I just heard the argument on Sam Harris’ new podcast (not vegan), due to the antibiotics we keep pumping into animals, we are becoming resistance to antibiotics. It is believed if we continue that we will become completely resistant to antibiotics, which would be the end of modern medicine.",True,False,False,vegan,t5_2qhpm,587081,public,self,,,Animal agriculture could end modern medicine,0,[],1.0,https://www.reddit.com/r/vegan/comments/mm16i9/animal_agriculture_could_end_modern_medicine/,,all_ads,6,,,,,,,,,
[],False,TheSmallGate,,[],,text,t2_8txae53u,False,False,[],False,False,1617798494,self.vegan,https://www.reddit.com/r/vegan/comments/mm0y0a/fellow_vegans/,{},mm0y0a,True,False,False,False,True,True,False,,,[],,,dark,text,False,False,True,3,0,False,all_ads,/r/vegan/comments/mm0y0a/fellow_vegans/,False,self,"{'enabled': False, 'images': [{'id': '0Y3iBHEMRFGcdbVatbrfkto_Mtmq8uHv-cA9qJ4iIUA', 'resolutions': [{'height': 56, 'url': 'https://external-preview.redd.it/b8XJBZSBwUqFdD3yE6fkbMHw8UfVnv51SbB9qTfbpIs.jpg?width=108&amp;crop=smart&amp;auto=webp&amp;s=6dd304e76b0b7be56a2d70caec04c2027a9db355', 'width': 108}, {'height': 113, 'url': 'https://external-preview.redd.it/b8XJBZSBwUqFdD3yE6fkbMHw8UfVnv51SbB9qTfbpIs.jpg?width=216&amp;crop=smart&amp;auto=webp&amp;s=3470f4bca3b52adcd786ec367208f1729f74f7f8', 'width': 216}, {'height': 167, 'url': 'https://external-preview.redd.it/b8XJBZSBwUqFdD3yE6fkbMHw8UfVnv51SbB9qTfbpIs.jpg?width=320&amp;crop=smart&amp;auto=webp&amp;s=ce8ed76fd02a2db6f4976c343d01dcad0c056414', 'width': 320}, {'height': 335, 'url': 'https://external-preview.redd.it/b8XJBZSBwUqFdD3yE6fkbMHw8UfVnv51SbB9qTfbpIs.jpg?width=640&amp;crop=smart&amp;auto=webp&amp;s=88546b39f8e5dfd625623f728a9269b16fc9b4d1', 'width': 640}, {'height': 503, 'url': 'https://external-preview.redd.it/b8XJBZSBwUqFdD3yE6fkbMHw8UfVnv51SbB9qTfbpIs.jpg?width=960&amp;crop=smart&amp;auto=webp&amp;s=7b3bdf7eb5556b127235471459221cebda3da90e', 'width': 960}, {'height': 566, 'url': 'https://external-preview.redd.it/b8XJBZSBwUqFdD3yE6fkbMHw8UfVnv51SbB9qTfbpIs.jpg?width=1080&amp;crop=smart&amp;auto=webp&amp;s=2f510b170172db9153c459e267d5ad9b85a372b3', 'width': 1080}], 'source': {'height': 629, 'url': 'https://external-preview.redd.it/b8XJBZSBwUqFdD3yE6fkbMHw8UfVnv51SbB9qTfbpIs.jpg?auto=webp&amp;s=02016a82512c7416d59fa54fe2a9a14011a6e3d3', 'width': 1200}, 'variants': {}}]}",6,,1617798505,1,"If you are into activism, we have some new tasks.    

1. talk to your local councils about putting vegan food on the menu. Remind them of the environmental factors as well as animal cruelty.  
2. talk to your schools and universities about vegan menus  

Thanks.

[The Vegan Society](https://www.vegansociety.com/)",True,False,False,vegan,t5_2qhpm,587076,public,self,,,Fellow vegans.,0,[],1.0,https://www.reddit.com/r/vegan/comments/mm0y0a/fellow_vegans/,,all_ads,6,,,,,,,,,
[],False,Little_Yeti_Biatch,,[],,text,t2_sc76v,False,False,[],False,False,1617798246,self.vegan,https://www.reddit.com/r/vegan/comments/mm0viy/best_vegan_documentary_recommendations/,{},mm0viy,True,False,False,False,True,True,False,,,[],,,dark,text,False,False,True,12,0,False,all_ads,/r/vegan/comments/mm0viy/best_vegan_documentary_recommendations/,False,,,6,,1617798257,1,"Hi, guys. My partner has reluctantly agreed to watch a vegan documentary with me this evening, but now I'm feeling the pressure to show the perfect film. What do you think will be the most effective? 

I think it would be best to focus on the ethical arguements before going onto environmental ones in another film another time. Earthlings is the only vegan documentary I've seen, or at least was able to watch up to a certain point. The problem that I have with Earthlings is that it opens with the pets segment, which I personally find one of the most distressing parts, but my partner already agrees in adopting animals, so I'm concerned we may not make it to the segment on animals used for food, which is the main bit I want us to see. There's also the issue with the footage being older and I believe mainly from the US, which opens up for false rationalisations that the scenes are irrelevant to our situation. The other documentaries I know of are Dominion and Land of Hope and Glory, which I think would be good since it's set in the UK where we are, but I'm not sure. 

What suggestions do you have? Which film do you think is the best to promote veganism? Thanks.",True,False,False,vegan,t5_2qhpm,587075,public,self,,,Best vegan documentary recommendations,0,[],1.0,https://www.reddit.com/r/vegan/comments/mm0viy/best_vegan_documentary_recommendations/,,all_ads,6,,,,,,,,,
[],False,da_aundare,,[],,text,t2_mnqlj,False,False,[],False,False,1617791821,self.vegan,https://www.reddit.com/r/vegan/comments/mlz85l/watching_movies/,{},mlz85l,True,False,False,False,True,True,False,,Discussion,[],0d26d52c-2ef1-11e5-8c17-0ec131dbf691,Discussion,dark,text,False,False,True,9,0,False,all_ads,/r/vegan/comments/mlz85l/watching_movies/,False,,,6,,1617791831,1,"This post may seem strange to a lot of you, but it is something that is in my mind for quite some time now. I don't mean documentaries or educational films, but movies we watch for entertainment and how becoming vegan has affected my perception of those.

Let me give you an example: I consider ""Forrest Gump"" as one of the greatest movies ever made. The story, characters and music are just phenomenal. But since I stopped eating animals, I just hate the whole Shrimp Boat arc, especially the scene where they start catching them big time. I think it is safe to assume that those were real shrimps and not just props. Would it make a difference? I mean, I had no problems killing whales in AC: Black Flag as I had no problems with killing humans there, too.

Now of course I know that this world is not vegan, the people I interact with and I rely upon aren't vegan (well most of them aren't), and most (song)writers and movie makers aren't either, and I still like their products. And I'm not really someone who needs a ""safespace"" to escape from this (not judging if someone does!), but scenes like the one I mentioned are just reminders that most people who watch them don't even consider this wrong or something.

So I guess I'm just curious if some of you have ever given things like this a thought or if it doesn't really bother you. Peace out.",True,False,False,vegan,t5_2qhpm,587044,public,self,,,Watching Movies,0,[],1.0,https://www.reddit.com/r/vegan/comments/mlz85l/watching_movies/,,all_ads,6,,,,,,,,,
[],False,the_year_2071,,[],,text,t2_9oagcyy3,False,False,[],False,False,1617789415,self.vegan,https://www.reddit.com/r/vegan/comments/mlyodu/zinc_and_other_supplementsdepression/,{},mlyodu,True,False,False,False,True,True,False,,,[],,,dark,text,False,False,True,7,0,False,all_ads,/r/vegan/comments/mlyodu/zinc_and_other_supplementsdepression/,False,,,6,,1617789425,1,"Do you supplement your diet? I noticed getting depressed and an inability to process sugar. After doing some research, I found I may be zinc deficient.

I've been vegan for about 20 years and been fairly antisocial at times but also content on my own. There's a condition called Pyroluria which is a deficiency of zinc and B6. 

Because of modern farming techniques, the soil is getting more and more depleted of minerals.

I found after supplementing with zinc and B6 I felt a lot better.

I think veganism is amazing but we may have to supplement. In fact it's thought that are 2 billion people who are zinc deficient, so it's not just about veganism/vegetarianism.",True,False,False,vegan,t5_2qhpm,587030,public,self,,,Zinc and Other Supplements/Depression,0,[],1.0,https://www.reddit.com/r/vegan/comments/mlyodu/zinc_and_other_supplementsdepression/,,all_ads,6,,,,,,,,,
[],False,AwaySituation,,[],vegan 3+ years,text,t2_9i7q9rd,False,False,[],False,False,1617789129,self.vegan,https://www.reddit.com/r/vegan/comments/mlym9a/which_organizationsactivists_should_i_analyse/,{},mlym9a,True,False,False,False,True,True,False,,,[],,,dark,text,False,False,True,3,0,False,all_ads,/r/vegan/comments/mlym9a/which_organizationsactivists_should_i_analyse/,False,,,6,,1617789140,1,"I'm analyzing the language and methods of animal rights advocacy. (If interested, I can post results by the end of April.)

So far, I'm looking at: The Animal Justice Project, Beyond Carnism, Cruelty Free International, Earthling Ed / Gary Yourofsky (speeches with million clicks), PETA and Peter Singer.

I'm trying to get all the important ones covered. Which am I missing?",True,False,False,vegan,t5_2qhpm,587031,public,self,,,Which organizations/activists should I analyse?,0,[],1.0,https://www.reddit.com/r/vegan/comments/mlym9a/which_organizationsactivists_should_i_analyse/,,all_ads,6,26d9dd0c-7bcd-11e9-9297-0e080eb1e388,dark,,,,,,,
[],False,1997birthed,,[],,text,t2_a15xtmkx,False,False,[],False,False,1617788641,self.vegan,https://www.reddit.com/r/vegan/comments/mlyiiu/im_loosing_it_over_some_of_the_merch_meow_wolf/,{},mlyiiu,True,False,False,False,True,True,False,,,[],,,dark,text,False,False,True,4,0,False,all_ads,/r/vegan/comments/mlyiiu/im_loosing_it_over_some_of_the_merch_meow_wolf/,False,,,6,,1617788651,1,"So I stumbled upon some Alternate reality commercials on YouTube and ""Omega Mart"" was a series of them for a grocery store. While some of the items are a bit questionable in their satirical humor (but surprisingly on the nose for what they're mimicking). It turns out they're also vegan and sorta funny? in a dark humor way at least. 

I do sorta feel like they also do a good job at making people stop and think for a few minutes as well about just why the products say what they do. \*Cough\* the lemonade \*Cough\*",True,False,False,vegan,t5_2qhpm,587031,public,self,,,I'm loosing it over some of the merch Meow Wolf has in it's Omega Mart store,0,[],1.0,https://www.reddit.com/r/vegan/comments/mlyiiu/im_loosing_it_over_some_of_the_merch_meow_wolf/,,all_ads,6,,,,,,,,,
[],False,charm_key,,[],,text,t2_bd9gtews,False,False,[],False,False,1617787420,self.vegan,https://www.reddit.com/r/vegan/comments/mly99z/facing_a_calorie_deficit/,{},mly99z,True,False,False,False,True,True,False,,Question,[],3fa453f8-685e-11e9-862d-0ee93d557dce,Question,dark,text,False,False,True,37,0,False,all_ads,/r/vegan/comments/mly99z/facing_a_calorie_deficit/,False,,,6,,1617787430,1,"I'm 20 M. 
I used to be a non vegetarian until a week ago, I saw a couple of documentaries like ""seaspiracy"", ""Game changers"", ""our planet"" which made me turn vegan. I was soo blind about the fact that I caused so much harm to the animals for my pleasure, but now no more. I'm going plant based.

I am into sports and fitness, I'm finding it difficult to find enough carbs and protein through my new vegan diet. Could you help me with good suggestions please???",True,False,False,vegan,t5_2qhpm,587025,public,self,,,Facing a calorie deficit,0,[],1.0,https://www.reddit.com/r/vegan/comments/mly99z/facing_a_calorie_deficit/,,all_ads,6,,,,,,,,,
[],False,NES_Rowan,,[],,text,t2_1dyx9kc5,False,False,[],False,False,1617785766,self.vegan,https://www.reddit.com/r/vegan/comments/mlxwlw/unrefutable_scientific_sources/,{},mlxwlw,True,False,False,False,True,True,False,,,[],,,dark,text,False,False,True,0,0,False,all_ads,/r/vegan/comments/mlxwlw/unrefutable_scientific_sources/,False,self,"{'enabled': False, 'images': [{'id': 'pvV6LuvNMjorUulDzaAaL0NmsyTHfdUqtgzdN8TINFU', 'resolutions': [{'height': 56, 'url': 'https://external-preview.redd.it/N5lv7xEXm-Lo-jhnaFqfPh1Sbz8I5Uh8KkqiwDDC5d0.jpg?width=108&amp;crop=smart&amp;auto=webp&amp;s=616dcbc3e8055d4ad1b61400947429137afc0a7b', 'width': 108}, {'height': 113, 'url': 'https://external-preview.redd.it/N5lv7xEXm-Lo-jhnaFqfPh1Sbz8I5Uh8KkqiwDDC5d0.jpg?width=216&amp;crop=smart&amp;auto=webp&amp;s=e71b3c22e177fe4d82305fd0c3f2dae3480bab1b', 'width': 216}, {'height': 168, 'url': 'https://external-preview.redd.it/N5lv7xEXm-Lo-jhnaFqfPh1Sbz8I5Uh8KkqiwDDC5d0.jpg?width=320&amp;crop=smart&amp;auto=webp&amp;s=751b917f418395dcba2f3669787f7dd5b9b05f84', 'width': 320}, {'height': 336, 'url': 'https://external-preview.redd.it/N5lv7xEXm-Lo-jhnaFqfPh1Sbz8I5Uh8KkqiwDDC5d0.jpg?width=640&amp;crop=smart&amp;auto=webp&amp;s=eea87272ce705a222cad4c4be3d64cbebde4350f', 'width': 640}, {'height': 504, 'url': 'https://external-preview.redd.it/N5lv7xEXm-Lo-jhnaFqfPh1Sbz8I5Uh8KkqiwDDC5d0.jpg?width=960&amp;crop=smart&amp;auto=webp&amp;s=015a8502ae7e693c71c173259828f8fb6872a08d', 'width': 960}, {'height': 567, 'url': 'https://external-preview.redd.it/N5lv7xEXm-Lo-jhnaFqfPh1Sbz8I5Uh8KkqiwDDC5d0.jpg?width=1080&amp;crop=smart&amp;auto=webp&amp;s=3920e634e856d52067789a293afa00a93096a1c1', 'width': 1080}], 'source': {'height': 630, 'url': 'https://external-preview.redd.it/N5lv7xEXm-Lo-jhnaFqfPh1Sbz8I5Uh8KkqiwDDC5d0.jpg?auto=webp&amp;s=27598d5d348e238710ba05e40a77e238709eb493', 'width': 1200}, 'variants': {}}]}",6,,1617785776,1,"After seeing lots of accusations of ""biased science"" and ""pseudoscientific methodology"" being levied at the vegan community, I thought I would share a source (and ask you lovely people to share others in the comments) that no reasonable human can disagree with. 

I present to you: [https://ourworldindata.org/](https://ourworldindata.org/)

OurWorldInData is an open access and open source research and data site that covers topics ranging from Health, Food and the Environment, Technology, Human Rights and many more. It is used in teaching by several of the top rated global universities, and in research and media by reputable journals and news sites. Furthermore, it largely draws from UN and UN sub-organisation data, as well as other sources such as the WHO, World Bank etc.  


As a taster, here is a link to their data on Global Land Use (including agricultural land): [https://ourworldindata.org/land-use](https://ourworldindata.org/land-use)

&amp;#x200B;

Use at your discretion. Please share any other great sources you know of!",True,False,False,vegan,t5_2qhpm,587018,public,self,,,Unrefutable Scientific Sources,0,[],1.0,https://www.reddit.com/r/vegan/comments/mlxwlw/unrefutable_scientific_sources/,,all_ads,6,,,,,,,,,
[],False,ProdicingWithPurpose,,[],,text,t2_a12g09q7,False,False,[],False,False,1617780439,self.vegan,https://www.reddit.com/r/vegan/comments/mlwssy/all_quality_no_sacrifice/,{},mlwssy,True,False,False,False,True,True,False,,,[],,,dark,text,False,False,True,2,0,False,all_ads,/r/vegan/comments/mlwssy/all_quality_no_sacrifice/,False,self,"{'enabled': False, 'images': [{'id': 'n7127Zml4GQ6VmbNozOHVulPM5oFFlI0-v0ssBjwrVY', 'resolutions': [{'height': 61, 'url': 'https://external-preview.redd.it/odZ1jnNYycdgd1NuExZdIgfvr1L8-z7aVCkCs2bGWOg.jpg?width=108&amp;crop=smart&amp;auto=webp&amp;s=1aba4d3a24bf7c1ecca363293b9c2edc0dee62ea', 'width': 108}, {'height': 122, 'url': 'https://external-preview.redd.it/odZ1jnNYycdgd1NuExZdIgfvr1L8-z7aVCkCs2bGWOg.jpg?width=216&amp;crop=smart&amp;auto=webp&amp;s=783d7d95e8430bee6b725b2aca88e2ed59be7baf', 'width': 216}, {'height': 182, 'url': 'https://external-preview.redd.it/odZ1jnNYycdgd1NuExZdIgfvr1L8-z7aVCkCs2bGWOg.jpg?width=320&amp;crop=smart&amp;auto=webp&amp;s=7e433c194c23b8f08b910da528f672da0c684cd8', 'width': 320}, {'height': 364, 'url': 'https://external-preview.redd.it/odZ1jnNYycdgd1NuExZdIgfvr1L8-z7aVCkCs2bGWOg.jpg?width=640&amp;crop=smart&amp;auto=webp&amp;s=6f9bfd513fb5317b5d9e8b98d6e2e71d8496f71f', 'width': 640}, {'height': 546, 'url': 'https://external-preview.redd.it/odZ1jnNYycdgd1NuExZdIgfvr1L8-z7aVCkCs2bGWOg.jpg?width=960&amp;crop=smart&amp;auto=webp&amp;s=053fdaf3b5665369f90a3879c267d0dc2c873b61', 'width': 960}, {'height': 614, 'url': 'https://external-preview.redd.it/odZ1jnNYycdgd1NuExZdIgfvr1L8-z7aVCkCs2bGWOg.jpg?width=1080&amp;crop=smart&amp;auto=webp&amp;s=aec65bfef77b70c4a013a49b6e001d687ada8d08', 'width': 1080}], 'source': {'height': 910, 'url': 'https://external-preview.redd.it/odZ1jnNYycdgd1NuExZdIgfvr1L8-z7aVCkCs2bGWOg.jpg?auto=webp&amp;s=5889475b6f061fd4c26d183adfb54c9a056e1611', 'width': 1600}, 'variants': {}}]}",6,,1617780450,1,"I promise not to spam this group, but with so many people from the vegan community collected in one place, I can't bypass the opportunity to share what I have been working on for the last year...

After 15 years of being vegan, I feel like our food options have advanced exponentially over the last 5 years, but I personally have found vegan and ethical fashion to still lag behind in terms of design and overall style. (At least to my taste!) 

So with that, I was lucky enough to team up with a couple of vegan co-founders to work on a new brand, which we have launched today. Introducing **Nōskin**

Let's be honest - spending a year in design and manufacturing, selecting our suppliers, and finding fabrics such as recycled Japanese denim and hemp blends does not come easy, and does not come cheap - but I truly believe our community is ready to embrace, and demand, an improvement in our clothing options - the way we have with food. 

We launch today with a small product line of footwear, outerwear and (pre-sale) denim. I would really appreciate if you could show your support by following our instagram: @ [noskin.co](https://noskin.co)

Or, visiting our website [www.noskin.co](https://www.noskin.co) and signing up for the mailing list. 

If you do see something you like - you can use the discount code below for 15% off.

redditvegan

&amp;#x200B;

Thanks for your support! :)",False,False,False,vegan,t5_2qhpm,586996,public,self,,,All Quality - No Sacrifice,0,[],1.0,https://www.reddit.com/r/vegan/comments/mlwssy/all_quality_no_sacrifice/,,all_ads,6,,,,,,,,,
[],False,Den-Ver,,[],,text,t2_n6s766c,False,False,[],False,False,1617779674,self.vegan,https://www.reddit.com/r/vegan/comments/mlwmk1/synthetic_meat_cultured_meat_is_not_vegan/,{},mlwmk1,True,False,False,False,True,True,False,,Question,[],3fa453f8-685e-11e9-862d-0ee93d557dce,Question,dark,text,False,False,True,10,0,False,all_ads,/r/vegan/comments/mlwmk1/synthetic_meat_cultured_meat_is_not_vegan/,False,,,6,,1617779684,1,"Synthetic meat still comes from animals. Although we don't get them from slaughter, it's still not vegan.

That doesn't mean it's bad or morally questionable (?)

This is the thing I'm wondering about. If artificial meat becomes the norm, it's a huge step in the right direction, but it might not bode well for the main concept veganism (abstain from animal products) in general. Does this mean, in the future, it's acceptable to refuse veganism as long as you don't contribute to slaughter?

Or maybe you think synthetic meat is vegan; if so, I want to know why you think so.

P.S. I'm not saying we shouldn't welcome artificial meat. I'm merely wondering about the definition of veganism, and what it means to become one in the future.",True,False,False,vegan,t5_2qhpm,586995,public,self,,,Synthetic meat/ cultured meat is NOT vegan.,0,[],1.0,https://www.reddit.com/r/vegan/comments/mlwmk1/synthetic_meat_cultured_meat_is_not_vegan/,,all_ads,6,,,,,,,,,
[],False,peperinus,,[],,text,t2_fyrqi,False,False,[],False,False,1617777676,self.vegan,https://www.reddit.com/r/vegan/comments/mlw5oi/is_there_such_thing_as_the_definitive_vegan/,{},mlw5oi,True,False,False,False,True,True,False,,Food,[],d9f9ddf0-f024-11e2-8ebb-12313b0c8c59,Food,dark,text,False,False,True,3,0,False,all_ads,/r/vegan/comments/mlw5oi/is_there_such_thing_as_the_definitive_vegan/,False,,,6,,1617777686,1,"I started a vegan diet by the beginning of 2021, and I've never felt better in my life, but I sometimes struggle to find good vegan recipes (a lot of recipes really suck), and I don't really know the fundamentals of vegan cooking, so I was wondering if there is any foolproof vegan cooking for dummies book/guide/youtube channel i could follow.",True,False,False,vegan,t5_2qhpm,586990,public,self,,,Is there such thing as the definitive vegan cooking guide?,0,[],1.0,https://www.reddit.com/r/vegan/comments/mlw5oi/is_there_such_thing_as_the_definitive_vegan/,,all_ads,6,,,,,,,,,
[],False,GreaterFinnMertens,,[],,text,t2_34fvt7zl,False,False,[],False,False,1617774693,self.vegan,https://www.reddit.com/r/vegan/comments/mlvg0s/cant_wait/,{},mlvg0s,True,False,False,False,True,True,False,,Food,[],d9f9ddf0-f024-11e2-8ebb-12313b0c8c59,Food,dark,text,False,False,True,0,0,False,all_ads,/r/vegan/comments/mlvg0s/cant_wait/,False,,,6,,1617774703,1,"I can't wait till technology advances to the point where we can print 3D meat without needing to kill animals to enjoy a juicy and tasty meat, I hate to remember that the meat I eat is from an innocent animal that has suffered a lot just to end up eaten by a living being superior on the food chain, but I can't stop eating meat because I barely eat, my diet is already messed up and meat really helps me not dying you know, and my family is quite poor so I have to eat what is on the table, also I enjoy eating meat, but I would enjoy it even more if a poor animal didn't had to be killed in order for me to enjoy it, when 3D printed food becomes a common thing, 100% going vegetarian.",True,False,False,vegan,t5_2qhpm,586981,public,self,,,Can't wait,0,[],1.0,https://www.reddit.com/r/vegan/comments/mlvg0s/cant_wait/,,all_ads,6,,,,,,,,,
[],False,Naquarius1234,,[],,text,t2_4gm3pxlf,False,False,[],False,False,1617768262,self.vegan,https://www.reddit.com/r/vegan/comments/mltt3y/are_my_headaches_and_feeling_spacey_because_i/,{},mltt3y,True,False,False,False,True,True,False,,Question,[],3fa453f8-685e-11e9-862d-0ee93d557dce,Question,dark,text,False,False,True,8,0,False,all_ads,/r/vegan/comments/mltt3y/are_my_headaches_and_feeling_spacey_because_i/,False,self,"{'enabled': False, 'images': [{'id': 'xpnF0Q9CK9ATrhHa6S9Npk1aNkg-zyp1QOC9zoqJWsQ', 'resolutions': [{'height': 60, 'url': 'https://external-preview.redd.it/qItDZvPqrcfTqqs6_TXWQ_awnJR789sxNDffn5MJgxs.jpg?width=108&amp;crop=smart&amp;auto=webp&amp;s=83ea5c090217718e9862fd303a81cf0279fb2243', 'width': 108}, {'height': 121, 'url': 'https://external-preview.redd.it/qItDZvPqrcfTqqs6_TXWQ_awnJR789sxNDffn5MJgxs.jpg?width=216&amp;crop=smart&amp;auto=webp&amp;s=a0eff10df24687f8507fe862ff5582b0acd625d9', 'width': 216}, {'height': 180, 'url': 'https://external-preview.redd.it/qItDZvPqrcfTqqs6_TXWQ_awnJR789sxNDffn5MJgxs.jpg?width=320&amp;crop=smart&amp;auto=webp&amp;s=43d050bdf1b53ba560087fdf9c809ff7d2c79d3a', 'width': 320}, {'height': 360, 'url': 'https://external-preview.redd.it/qItDZvPqrcfTqqs6_TXWQ_awnJR789sxNDffn5MJgxs.jpg?width=640&amp;crop=smart&amp;auto=webp&amp;s=d865047f76a9cfcc593162bf6096a50c4fb3c70a', 'width': 640}, {'height': 540, 'url': 'https://external-preview.redd.it/qItDZvPqrcfTqqs6_TXWQ_awnJR789sxNDffn5MJgxs.jpg?width=960&amp;crop=smart&amp;auto=webp&amp;s=d7a60c3c80fead6773b6e38ba83b2906d8d934a7', 'width': 960}, {'height': 607, 'url': 'https://external-preview.redd.it/qItDZvPqrcfTqqs6_TXWQ_awnJR789sxNDffn5MJgxs.jpg?width=1080&amp;crop=smart&amp;auto=webp&amp;s=4a655c905ac0880bd738ddf9fdf4349939809666', 'width': 1080}], 'source': {'height': 1125, 'url': 'https://external-preview.redd.it/qItDZvPqrcfTqqs6_TXWQ_awnJR789sxNDffn5MJgxs.jpg?auto=webp&amp;s=8eb285dc0c805b4f00c659f116388bfc9bba0fbf', 'width': 2000}, 'variants': {}}]}",6,,1617768272,1,"So I decided to go vegan 2 days ago. I've been fine until the last couple of hours. I have a headache, I feel like I'm clenching my jaw a little bit and I feel spacey. I just drank about 40g of protein from a vegan protein shake mix to see if it was a lack of protein. But I'm not sure if it's the protein, a lack of certain vitamins, or something unrelated. 

This is the meal plan I've been using:

https://fitmencook.com/vegan-meal-plan/",True,False,False,vegan,t5_2qhpm,586948,public,self,,,"Are my headaches and feeling ""spacey"" because i just went vegan a couple days ago?",0,[],1.0,https://www.reddit.com/r/vegan/comments/mltt3y/are_my_headaches_and_feeling_spacey_because_i/,,all_ads,6,,,,,,,,,
