all_awardings,allow_live_comments,author,author_flair_css_class,author_flair_richtext,author_flair_text,author_flair_type,author_fullname,author_patreon_flair,author_premium,awarders,can_mod_post,contest_mode,created_utc,domain,full_link,gildings,id,is_crosspostable,is_meta,is_original_content,is_reddit_media_domain,is_robot_indexable,is_self,is_video,link_flair_background_color,link_flair_richtext,link_flair_text_color,link_flair_type,locked,media_only,no_follow,num_comments,num_crossposts,over_18,parent_whitelist_status,permalink,pinned,post_hint,preview,pwls,removed_by_category,retrieved_on,score,selftext,send_replies,spoiler,stickied,subreddit,subreddit_id,subreddit_subscribers,subreddit_type,thumbnail,thumbnail_height,thumbnail_width,title,total_awards_received,treatment_tags,upvote_ratio,url,url_overridden_by_dest,whitelist_status,wls,is_gallery,link_flair_css_class,link_flair_template_id,link_flair_text,author_flair_template_id,author_flair_text_color,crosspost_parent,crosspost_parent_list,media,media_embed,secure_media,secure_media_embed,author_cakeday,poll_data,author_flair_background_color
[],False,DonSmo,,[],,text,t2_5xy4hr2u,False,False,[],False,False,1617057076,self.vegan,https://www.reddit.com/r/vegan/comments/mg1din/a_discussion_on_zoos/,{},mg1din,True,False,False,False,True,True,False,,[],dark,text,False,False,True,25,0,False,all_ads,/r/vegan/comments/mg1din/a_discussion_on_zoos/,False,,,6,,1617057088,1,"I know I'll probably get a lot of hate for this, but it's something I need to get off my chest and am genuinely interested if people are willing to have an adult conversation about this.

As a vegan and animal lover, I also... don't hate zoos. I follow a lot of vegan pages on instagram, watch vegan youtubers and over and over I see nothing but hate for zoos. Saying they should all be closed, and that everyone who visits one should be cancelled etc. Usually attached to some old photos from third world country zoos with animals living in horrible conditions. 

My belief is that in an ideal world, zoo's wouldn't exist and every animal would live freely in it's natural habitat. But sadly, we don't live in an ideal world, we live in a world filled with pollution, habitat destruction, hunting, mass scale farming, over-fishing destroying the oceans. And in this world zoo's sadly are vital for the care of wild animals. 

I work in this industry, and see it all from the inside, so I find it upsetting when some vegans are so quick to judge and so short-sighted on zoos. I work in a small town wildlife sanctuary. At this sanctuary yes, we do have animals on display that are captive animals and can't be released to the wild. And yes we charge people tickets to enter because that's the only funding we get. But behind the scenes we have a hospital where we rescue, rehab and release wild animals. Hundreds per year, who never see the public and have limited contact with humans. 

And what do we do when we get a case we can't handle? We take it to the zoo. We are a small establishment with limited facilities, but we have a good relationship with the local zoo which has an amazing big animal hospital.

We get everything from pelicans with fishing wire down their throats to wombats who have been hit by a car. But one thing is consistent to almost all of our rescues, and that is that they are needing to be rescued because of interference from humans in one way or another. We caused the problem, so we feel the need to help fix it. Also, my sanctuary is almost entirely volunteer run. We work long hours, mostly outdoors in all sorts of weather for zero pay, just because we are passionate about helping animals. 

I also recently visited another much larger wildlife sanctuary in a different state, which had about 200-300 animals on display, but in 2020 alone they rescued, rehabed then released 14,000 wild animals. Just in one year! And the truth about this is that no one else can really do this but zoos. People take injured native wildlife to vets, but vets rarely know how to treat animals outside of cats and dogs, and they usually just sit in a cage until they can be transferred to a zoo or specialised wildlife carer. 

Between breeding programs of endangered animals, to all the rescue work with zoo hospitals, to the extensive conservation work done worldwide to help ensure the future of wildlife etc zoos are now vital to our world if you like animals. I see this all from inside the industry so it's kind of frustrating to see vegans pointing to things like Tiger King or third world zoos' or other horrible, abusive attractions and using those to say all zoos are evil and should be closed. If all zoo's closed overnight it would be devastating for the world's wild animals. It's the sad truth. Zoo's aren't all made equal. Worldwide yes, there are some horrific, sad, abusive zoo's and wildlife ""Attractions"" that I wish would close as much as anyone, but that shouldn't diminish the good amazing zoos and the people who work at them. 

TLDR: I wish vegans would actually research what goes on at Zoos before judging them all so harshly, or judging them all by the worst examples of zoos on the planet.",True,False,False,vegan,t5_2qhpm,583649,public,self,,,A Discussion on Zoos,0,[],1.0,https://www.reddit.com/r/vegan/comments/mg1din/a_discussion_on_zoos/,,all_ads,6,,,,,,,,,,,,,,,
[],False,oviraptor12,,[],,text,t2_40fuuvhf,False,False,[],False,False,1617055281,self.vegan,https://www.reddit.com/r/vegan/comments/mg0qw3/macros/,{},mg0qw3,True,False,False,False,True,True,False,,[],dark,text,False,False,True,10,0,False,all_ads,/r/vegan/comments/mg0qw3/macros/,False,,,6,,1617055292,1,"I am looking for some advice to stick to. 
I am quite underweight and think this is down to not eating enough as shown recently when using Cronometer. 
I am aiming to gain weight but in a healthy way.
I am 50kg (110 lb) and around 174cm (5 ft 9”), 19 year old male. I do not strength train at the moment, I am only running about 30 minutes every day usually.
Currently I am eating about 2200 calories, around 20% protein, 55% carbs and 30% fats. 
I am concerned fat are too high but they are coming from whole sources such as nuts and seeds. 
Hoping someone can advise on a rough estimate of macros I should follow? 
Thank you",True,False,False,vegan,t5_2qhpm,583644,public,self,,,Macros,0,[],1.0,https://www.reddit.com/r/vegan/comments/mg0qw3/macros/,,all_ads,6,,,,,,,,,,,,,,,
[],False,w-e-z,,[],,text,t2_8ykop,False,False,[],False,False,1617052887,self.vegan,https://www.reddit.com/r/vegan/comments/mfzwi3/low_oxalate_non_bloating_vegan_meal_ideas/,{},mfzwi3,True,False,False,False,True,True,False,,[],dark,text,False,False,True,0,0,False,all_ads,/r/vegan/comments/mfzwi3/low_oxalate_non_bloating_vegan_meal_ideas/,False,,,6,,1617052898,1,"I am having trouble figuring out a diet that works for me. I get kidney stones rather fast when I have anything moderate to high in Oxalate(Spinach, yam, soy products, wheat, beans, avocados, nuts ect) and I bloat painfully from foods known to do so like Broccoli and Cauliflower. Bonus if they have calcium and protein as it's been suggested not using calcium supplements for Kidney stones but to get it naturally.

I am really at a loss for what to do, thank you for any help!",True,False,False,vegan,t5_2qhpm,583638,public,self,,,"Low Oxalate, non bloating Vegan meal Ideas?",0,[],1.0,https://www.reddit.com/r/vegan/comments/mfzwi3/low_oxalate_non_bloating_vegan_meal_ideas/,,all_ads,6,,,,,,,,,,,,,,,
[],False,gdanp23,,[],,text,t2_11klza,False,False,[],False,False,1617051015,self.vegan,https://www.reddit.com/r/vegan/comments/mfz77p/mezzetta_sliced_jalapeno_peppers_not_vegan/,{},mfz77p,True,False,False,False,True,True,False,,[],dark,text,False,False,True,5,0,False,all_ads,/r/vegan/comments/mfz77p/mezzetta_sliced_jalapeno_peppers_not_vegan/,False,,,6,,1617051025,1,"I love(d) Mezzetta sliced jalapeno peppers...but, when I inquired to confirm that their natural flavors were vegan, I was surprised to find out that the vinegar used in fact is not (there was no reply about the natural flavors, but it's now a moot point):

""Thank you for taking the time to write in and ask about our product. In regards to your email, I reached out to our Quality Assurance team, and this was there response:

Generally, we do not guarantee that any of our products without the vegan certification logo are vegan. For this particular product, the vinegar used was produced using a processing aid derived from eggs
 
Hopefully this was enough information for you to make a well informed decision.""

Unfortunately, that is enough information for me to stop eating them.",True,False,False,vegan,t5_2qhpm,583630,public,self,,,Mezzetta sliced jalapeno peppers - not vegan,0,[],1.0,https://www.reddit.com/r/vegan/comments/mfz77p/mezzetta_sliced_jalapeno_peppers_not_vegan/,,all_ads,6,,Food,d9f9ddf0-f024-11e2-8ebb-12313b0c8c59,Food,,,,,,,,,,,
[],False,DrawingCurious4161,,[],,text,t2_98df5rla,False,False,[],False,False,1617047107,self.vegan,https://www.reddit.com/r/vegan/comments/mfxrz0/calf_tightness_after_removing_coffee/,{},mfxrz0,True,False,False,False,True,True,False,,[],dark,text,False,False,False,6,0,False,all_ads,/r/vegan/comments/mfxrz0/calf_tightness_after_removing_coffee/,False,,,6,,1617047117,1,"Recently I’ve been having really bad tightness in my calves, no matter how much stretching or relaxing I did, they were just always tight. I didn’t know where else to post this I really don’t think veganism has anything to do with it lol but yeah I tried to quit caffeine and hadn’t had any in about 2 weeks. 

Well today I gave in and had a cup and my calves don’t feel tight anymore. I didn’t think the coffee and calf thing were related but literally my legs feel great. What gives?",True,False,False,vegan,t5_2qhpm,583615,public,self,,,Calf tightness after removing coffee?,0,[],1.0,https://www.reddit.com/r/vegan/comments/mfxrz0/calf_tightness_after_removing_coffee/,,all_ads,6,,,,,,,,,,,,,,,
[],False,opheliainsane,,[],,text,t2_aw9eys65,False,False,[],False,False,1617046766,self.vegan,https://www.reddit.com/r/vegan/comments/mfxnkr/help_needed_in_educating_my_friend/,{},mfxnkr,True,False,False,False,True,True,False,,[],dark,text,False,False,True,2,0,False,all_ads,/r/vegan/comments/mfxnkr/help_needed_in_educating_my_friend/,False,,,6,,1617046776,1," does anybody have some advice on educating my friend? I show her documentaries and she shuts them off because they are too ""graphic"" and ""scary"". I tell her to read articles but she refuses. When I show her a baby animal she coos but even though I hit her with real facts she point-blank REFUSES to go vegan, she says ""veganism is not for me! but I understand you are passionate about animals! good for you I'm proud!"" It seems to me that she is sheltering herself from the reality no matter what I do to show her the truth. She never gives me a reason as to WHY she won't go vegan; she simply says ""i get your point but I still think it is ok to eat meat. now can you please drop this subject?! I'm not going vegan.""

I understand that I need to be patient with her but it's been months and I just CAN'T do this fr. I don't have that much patience. I'm trying, I really am, because I know we were all raised a certain way and it can be hard to change; but WTF I DIDN'T REALIZE HOW FRUSTRATING IT CAN BE SOMETIMES AOLJFNHALJDGH

 How TF do I proceed?1 it's pissing me off that she is being so ignorant and she has so much apathy. It's starting to get in-between our friendship, in fact I've stopped texting her and calling her back. Now she thinks I hate her, but I don't hate her I'm just so FRUSTRATED. how can anyone be so fucking infuriating?!",True,False,False,vegan,t5_2qhpm,583615,public,self,,,help needed in educating my friend.,0,[],1.0,https://www.reddit.com/r/vegan/comments/mfxnkr/help_needed_in_educating_my_friend/,,all_ads,6,,,,,,,,,,,,,,,
[],False,kuracaos,,[],,text,t2_84uxu1rq,False,False,[],False,False,1617045273,self.vegan,https://www.reddit.com/r/vegan/comments/mfx38q/did_anyone_else_have_vegan_realizations_as_a_kid/,{},mfx38q,True,False,False,False,True,True,False,,[],dark,text,False,False,True,8,0,False,all_ads,/r/vegan/comments/mfx38q/did_anyone_else_have_vegan_realizations_as_a_kid/,False,,,6,,1617045284,1,"I remember when I was 5 or 6 years old, my parents took me on a boat trip during a holiday. After we got off the boat and took a stroll around the dock, I saw some men ""scaling"" fish with the back of a knife. It was a violent scraping, and scales were flying in the air. But the fish were still alive during the process, they were wildly flopping around on the workbench as the men tried to hold them down. As a little kid seeing this, I was utterly distraught and it literally traumatized me to some degree. The memory and the sheer callousness of it is still etched into my mind. 

A few years later when I was around 8, my mom had gone grocery shopping and prepared a dinner for the family. When she called me to the table, there was a rack of lamb sitting on a platter. Seeing the little ribcage on our table like that, is when the connection between the animal and my food suddenly became really salient. It wasn't food, it was part of a corpse. I remember being horrified, protesting to my parents about it, storming to my room crying. I knew how precious lambs were and would have done anything to protect them. Since then I had an aversion to any type of meat with visible bones in it. 

(Sidenote: My grandpa had a flock of sheep, and in the springtime I'd get to go and play with the lambs. Years later I would find out that he'd always choose the ""juiciest"" one to be butchered. And then we'd eat its flesh during Christmas dinners and other holidays. None of my family bothered to tell me where the meat came from.)

There are countless more examples. As a kid I saw animals frantically pacing back and forth in tiny zoo enclosures, watched lobsters get chucked into boiling pots of water, etc. I've always found it absolutely horrendous, yet I still didn't go vegan until I was 17. Perhaps most children are vegans at heart, but succumb to the pressure of conforming to social norms as they grow older. Especially being told the ""happy cows"" spiel and all that. Do any of you have similar stories?",True,False,False,vegan,t5_2qhpm,583609,public,self,,,"Did anyone else have ""vegan"" realizations as a kid?",0,[],1.0,https://www.reddit.com/r/vegan/comments/mfx38q/did_anyone_else_have_vegan_realizations_as_a_kid/,,all_ads,6,,Story,192cac22-7509-11e9-9af9-0e36ec779de6,Story,,,,,,,,,,,
[],False,WorriedAd9287,,[],,text,t2_487ebqpe,False,False,[],False,False,1617043746,self.vegan,https://www.reddit.com/r/vegan/comments/mfwihv/aborted_fetuses_in_food/,{},mfwihv,True,False,False,False,True,True,False,,[],dark,text,False,False,True,3,0,False,all_ads,/r/vegan/comments/mfwihv/aborted_fetuses_in_food/,False,,,6,,1617043756,1,"  We all know food has animal products, and as vegans, it is our job to avoid causing unnecessary harm to them by not eating animal products. 

  However, I've now learned that in addition, some of our food and beverages may also have aborted fetuses from babies, examples of vegan foods and drinks include Pepsi and its other drinks, gums, and coffee creamers. 

  As Vegans, I would like to know is it ok to eat these products, or should we boycott them? Is this cannibalism or can we eat this? This does sound creepy but, in my personal opinion, aborted fetuses aren't sentient yet and aren't really causing harm to anyone, but they could be unhealthy and addictive. 

  Tell me what you guys think.",True,False,False,vegan,t5_2qhpm,583606,public,self,,,Aborted Fetuses in food,0,[],1.0,https://www.reddit.com/r/vegan/comments/mfwihv/aborted_fetuses_in_food/,,all_ads,6,,,,,,,,,,,,,,,
[],False,its_spoopy_time,,[],,text,t2_957h9och,False,False,[],False,False,1617043705,self.vegan,https://www.reddit.com/r/vegan/comments/mfwhyx/perception_and_use_of_nonhuman_animal_images/,{},mfwhyx,True,False,False,False,True,True,False,,[],dark,text,False,False,False,2,0,False,all_ads,/r/vegan/comments/mfwhyx/perception_and_use_of_nonhuman_animal_images/,False,,,6,,1617043715,1,"Something I think about a lot lately is why we share some of the images we do, and how the fact that the images are of NH animals affects our sensitivity around them, even as vegans. Is this something that anyone else ever thinks about?

Like, sometimes it seems as though people share images of NH animal abuse with a generalized statement just sort of post those images without any real activism or intent, and its just to share here among other vegans, and of course the picture just gets upvotes, but no serious discussion is ever happens. It just makes me wonder: would this happen if it were a human in that picture? Are we really separating ourselves from speciesism if we're treating pictures depicting NH animal abuse in a different light than we are picture of human abuse? 

I just wonder if people think about what they are sharing and why, and what they hope to accomplish by sharing it, and if that sentiment would be deemed ""appropriate"" if it were the images of humans.

I  don't know, does anyone else think about this?",True,False,False,vegan,t5_2qhpm,583606,public,self,,,Perception and use of nonhuman animal images,0,[],1.0,https://www.reddit.com/r/vegan/comments/mfwhyx/perception_and_use_of_nonhuman_animal_images/,,all_ads,6,,,,,,,,,,,,,,,
[],False,jennyigotyour8675309,,[],,text,t2_4y6w5az3,False,False,[],False,False,1617043598,self.vegan,https://www.reddit.com/r/vegan/comments/mfwghs/i_passed_by_a_livestock_farm_during_my_run/,{},mfwghs,True,False,False,False,True,True,False,,[],dark,text,False,False,False,3,0,False,all_ads,/r/vegan/comments/mfwghs/i_passed_by_a_livestock_farm_during_my_run/,False,,,6,,1617043608,1,"It’s early in the evening and spring has come. The sun still hasn’t set. I passed by a farm in my area during my run. It was peaceful and quiet at this time but I felt sad because I know that the cows and ducks in the farm are anything BUT at peace. 

The large space they ‘seemingly’ have (the ones outside anyway) caught me by surprise, it wasn’t like the ones in Vegan documentaries where animals are cramped inside tight spaces. But it’s all the same, whether so called ‘free-range’ or not. They still face the same cruel and heartless fate they don’t deserve.

Seeing the farm made me sad and powerless. I can’t ignore it, I know I’ll go back and pass by (even if it gave me serial killer vibes and the smell is not the best). 

I’m still hopeful that someday, it’ll change. That we can find alternative jobs for these farmers and give all animals the respect they deserve.",True,False,False,vegan,t5_2qhpm,583605,public,self,,,I passed by a ‘livestock farm’ during my run,0,[],1.0,https://www.reddit.com/r/vegan/comments/mfwghs/i_passed_by_a_livestock_farm_during_my_run/,,all_ads,6,,,,,,,,,,,,,,,
[],False,ComradeCoconut,,[],,text,t2_ah7nvoj7,False,False,[],False,False,1617043028,self.vegan,https://www.reddit.com/r/vegan/comments/mfw8zh/the_amount_of_disrespect_towards_nonvegans_in/,{},mfw8zh,True,False,False,False,True,True,False,,[],dark,text,False,False,True,42,0,False,all_ads,/r/vegan/comments/mfw8zh/the_amount_of_disrespect_towards_nonvegans_in/,False,,,6,,1617043039,1,"So i have been going around reddit recently and have been seeing so much disrespect towards non-vegans and it truly disgusts me

vegans in other subreddits resorting to swearing instead of finishing a conversation

i have seen some vegans saying that ""culture dosnt matter"" and ""everyone can go vegan""

when in reality some of us cant go vegan and some of us have to respect our culture",True,False,False,vegan,t5_2qhpm,583598,public,self,,,The amount of disrespect towards non-vegans in vegan discords and subreddits,0,[],1.0,https://www.reddit.com/r/vegan/comments/mfw8zh/the_amount_of_disrespect_towards_nonvegans_in/,,all_ads,6,,Rant,93c0fe64-689e-11e5-b5be-0e7eccdaeabd,Rant,,,,,,,,,,,
[],False,KM9P,,[],,text,t2_azg4r7zv,False,False,[],False,False,1617041682,self.vegan,https://www.reddit.com/r/vegan/comments/mfvr2k/anyone_have_any_good_cookbook_recommendations/,{},mfvr2k,True,False,False,False,True,True,False,,[],dark,text,False,False,True,3,0,False,all_ads,/r/vegan/comments/mfvr2k/anyone_have_any_good_cookbook_recommendations/,False,,,6,,1617041693,1,"Hi guys, apologies in advance if this question has been asked a thousand times. 
I’m Looking to make the switch to becoming vegan and was wondering if anyone knows any good vegan cookbooks?

Being completely honest, I probably won’t make a full switch straight away and will do it in stages, for example have my usual breakfast but then have vegan lunch/dinner meals. 

I work out so I’m looking for a cookbook that’s high in protein, and also a cookbook that’s a “fake away” style for those cheat day feelings. I’m not fussy so I’ll eat anything but I’m also a Uni student so looking for recipes that aren’t too costly. 

Thanks !",True,False,False,vegan,t5_2qhpm,583598,public,self,,,Anyone have any good cookbook recommendations?,0,[],1.0,https://www.reddit.com/r/vegan/comments/mfvr2k/anyone_have_any_good_cookbook_recommendations/,,all_ads,6,,Question,3fa453f8-685e-11e9-862d-0ee93d557dce,Question,,,,,,,,,,,
[],False,pointyrockstudier,,[],,text,t2_6e8dby7z,False,False,[],False,False,1617041232,self.vegan,https://www.reddit.com/r/vegan/comments/mfvktc/vegan_poc_and_allies_discord_server/,{},mfvktc,True,False,False,False,True,True,False,,[],dark,text,False,False,True,6,0,False,all_ads,/r/vegan/comments/mfvktc/vegan_poc_and_allies_discord_server/,False,,,6,,1617041243,1,"Hey everyone,

My friends and I recently worked together to create a vegan discord server for POC and Allies to connect, learn,  and have a good time :) This server is a safe space, and a pretty darn wholesome community. 

If you’re interested Join here: https://discord.gg/XWE7qJSG

I hope you enjoy :)",True,False,False,vegan,t5_2qhpm,583598,public,self,,,Vegan POC and Allies discord server,0,[],1.0,https://www.reddit.com/r/vegan/comments/mfvktc/vegan_poc_and_allies_discord_server/,,all_ads,6,,Discussion,0d26d52c-2ef1-11e5-8c17-0ec131dbf691,Discussion,,,,,,,,,,,
