all_awardings,allow_live_comments,author,author_flair_css_class,author_flair_richtext,author_flair_template_id,author_flair_text,author_flair_text_color,author_flair_type,author_fullname,author_patreon_flair,author_premium,awarders,can_mod_post,contest_mode,created_utc,domain,full_link,gildings,id,is_crosspostable,is_meta,is_original_content,is_reddit_media_domain,is_robot_indexable,is_self,is_video,link_flair_background_color,link_flair_css_class,link_flair_richtext,link_flair_template_id,link_flair_text,link_flair_text_color,link_flair_type,locked,media_only,no_follow,num_comments,num_crossposts,over_18,parent_whitelist_status,permalink,pinned,pwls,retrieved_on,score,selftext,send_replies,spoiler,stickied,subreddit,subreddit_id,subreddit_subscribers,subreddit_type,thumbnail,title,total_awards_received,treatment_tags,upvote_ratio,url,url_overridden_by_dest,whitelist_status,wls,media,media_embed,post_hint,preview,secure_media,secure_media_embed,thumbnail_height,thumbnail_width,removed_by_category,crosspost_parent,crosspost_parent_list,poll_data
[],False,Toxic_Tornados_,,[],,,,text,t2_63ueanuy,False,False,[],False,False,1617140810,self.vegan,https://www.reddit.com/r/vegan/comments/mgquwt/if_you_have_a_dog_or_cat_do_you_give_it_a_vegan/,{},mgquwt,False,False,False,False,False,True,False,,,[],,,dark,text,False,False,True,0,0,False,all_ads,/r/vegan/comments/mgquwt/if_you_have_a_dog_or_cat_do_you_give_it_a_vegan/,False,6,1617140822,1,"[removed]

[View Poll](https://www.reddit.com/poll/mgquwt)",True,False,False,vegan,t5_2qhpm,583978,public,self,"If you have a dog or cat, do you give it a vegan diet?",0,[],1.0,https://www.reddit.com/r/vegan/comments/mgquwt/if_you_have_a_dog_or_cat_do_you_give_it_a_vegan/,,all_ads,6,,,,,,,,,moderator,,,
[],False,recklessrawly,,[],,,,text,t2_70ngy7gn,False,False,[],False,False,1617140150,self.vegan,https://www.reddit.com/r/vegan/comments/mgqmyk/can_you_give_me_a_definition_of_human_that/,{},mgqmyk,True,False,False,False,True,True,False,,Discussion,[],0d26d52c-2ef1-11e5-8c17-0ec131dbf691,Discussion,dark,text,False,False,True,14,0,False,all_ads,/r/vegan/comments/mgqmyk/can_you_give_me_a_definition_of_human_that/,False,6,1617140160,1,"This is something I’ve been thinking about lately. If the answer is that no such definition exists, why do you think we, as a society, are so focused on the divide between human and animal?

Well, besides the fact that Aristotle’s dumbass decided to hierarchically organize life because humans love to organize in a way that feeds their false superiority complexes. 
(Referencing: Aristotle’s Scala Naturae or “Natural Ladder”)",True,False,False,vegan,t5_2qhpm,583975,public,self,Can you give me a definition of “human” that applies to all humans but no other species?,0,[],1.0,https://www.reddit.com/r/vegan/comments/mgqmyk/can_you_give_me_a_definition_of_human_that/,,all_ads,6,,,,,,,,,,,,
[],False,VioletIsntHere,,[],70cd74e0-f01f-11e2-be4e-12313d05241f,vegan,dark,text,t2_36tk7nqq,False,False,[],False,False,1617139485,self.vegan,https://www.reddit.com/r/vegan/comments/mgqexx/something_hit_me_today_and_i_cant_believe_ive/,{},mgqexx,True,False,False,False,True,True,False,,Discussion,[],0d26d52c-2ef1-11e5-8c17-0ec131dbf691,Discussion,dark,text,False,False,True,11,0,False,all_ads,/r/vegan/comments/mgqexx/something_hit_me_today_and_i_cant_believe_ive/,False,6,1617139496,1,"So we all know there’s a large number of people out there who won’t go vegan because they just refuse to believe that animals are exploited and treated badly in animal agriculture industries. And it kind of makes sense. Most of us didn’t realise how bad it was either, until we did some research and went vegan ourselves.

But then I realised.

NOBODY is denying that humans are exploited in big industries. People don’t deny the existence of sweat shops, and child labour, and poor working conditions, and slave labour. We all know that people suffer for capitalistic gain.

So why do we have such a hard time believing that animals suffer too? 

Animals are even more voiceless. Even easier to ignore. Of COURSE in a society that can’t even treat humans humanely we’re not going to treat animals with compassion.

I just can’t believe I didn’t think of this sooner.",True,False,False,vegan,t5_2qhpm,583971,public,self,"Something hit me today, and I can’t believe I’ve never thought of it before.",0,[],1.0,https://www.reddit.com/r/vegan/comments/mgqexx/something_hit_me_today_and_i_cant_believe_ive/,,all_ads,6,,,,,,,,,,,,
[],False,mysinfulsorrow,,[],,,,text,t2_835g9,False,False,[],False,False,1617137311,self.vegan,https://www.reddit.com/r/vegan/comments/mgpn7b/honest_question_about_this_sub_and_how/,{},mgpn7b,True,False,False,False,True,True,False,,Question,[],3fa453f8-685e-11e9-862d-0ee93d557dce,Question,dark,text,False,False,True,29,0,False,all_ads,/r/vegan/comments/mgpn7b/honest_question_about_this_sub_and_how/,False,6,1617137323,1,"On mobile so the formating my be wonky.

Like most people I've eaten meat all my life. I met a good friend online who's been vegan for about 5 years now. He's helped me find alternatives and been very welcoming and accepting that changing your entire lifestyle is difficult much like changing your religion isn't an overnight rewire of your brain. I know veganism is more than a diet, its an ethical at its core. Ive been looking for resources and groups to help me keep my mind on the goal of being a better person and helping build a better world for animals and humans alike. 

I still have thoughts of eating meat and can't seem to tear the wall down between the animals I want to save and the cravings I still get. Ive changes almost all of my diet apart from eggs and fish which are the last 2 mental walls I have to overcome but I still crave meat.

 This brings me to the question I posed in the title. Why does this subreddit seem so hostile? From the posts I've read I expect to be called names and down voted for my curiosity. Not everyone is the same, in the same place mentally, or wired the same way. Some people need support and help and you'd think the subreddit devoted to this cause would be more welcoming to changing hearts and minds. 

Im really anxious about posting this, I usually lurk across all of reddit but this means a lot to me and am disappointed to see this behavior from people I wish to be like.",True,False,False,vegan,t5_2qhpm,583957,public,self,Honest question about this sub and how unwelcoming it seems.,0,[],1.0,https://www.reddit.com/r/vegan/comments/mgpn7b/honest_question_about_this_sub_and_how/,,all_ads,6,,,,,,,,,,,,
[],False,Strange-Situation239,,[],,,,text,t2_8x9jvt83,False,False,[],False,False,1617135410,self.vegan,https://www.reddit.com/r/vegan/comments/mgoyrf/vegan_need_for_school_project/,{},mgoyrf,True,False,False,False,True,True,False,,,[],,,dark,text,False,False,True,1,0,False,all_ads,/r/vegan/comments/mgoyrf/vegan_need_for_school_project/,False,6,1617135421,1,Hello Vegans of reddit I am doing a research project on Food Choices and  Veganism for Chico State University I need a volunteer that is a vegan for a interview over zoom it is completely  confidential your name or image will not be used in any shape well or form so if you can help me out it will be much appreciated,True,False,False,vegan,t5_2qhpm,583947,public,self,Vegan need for School Project,0,[],1.0,https://www.reddit.com/r/vegan/comments/mgoyrf/vegan_need_for_school_project/,,all_ads,6,,,,,,,,,,,,
[],False,pixelperfect99,,[],,,,text,t2_5nxlz15y,False,False,[],False,False,1617135336,self.vegan,https://www.reddit.com/r/vegan/comments/mgoxr4/what_is_the_best_name_for_an_veganfriendly/,{},mgoxr4,True,False,False,False,True,True,False,,Question,[],3fa453f8-685e-11e9-862d-0ee93d557dce,Question,dark,text,False,False,True,3,0,False,all_ads,/r/vegan/comments/mgoxr4/what_is_the_best_name_for_an_veganfriendly/,False,6,1617135347,1,"We are building an vegan-friendly product marketplace and would love to have your feedback on the best name for it.

[View Poll](https://www.reddit.com/poll/mgoxr4)",True,False,False,vegan,t5_2qhpm,583948,public,self,What is the Best name for an vegan-friendly marketplace?,0,[],1.0,https://www.reddit.com/r/vegan/comments/mgoxr4/what_is_the_best_name_for_an_veganfriendly/,,all_ads,6,,,,,,,,,,,,"{'is_prediction': False, 'options': [{'id': '6964705', 'text': 'viablee'}, {'id': '6964706', 'text': 'ecopock'}, {'id': '6964707', 'text': 'wimtu'}], 'resolved_option_id': None, 'total_stake_amount': None, 'total_vote_count': 0, 'tournament_id': None, 'user_selection': None, 'user_won_amount': None, 'voting_end_timestamp': 1617394536589}"
[],False,inthewild4ever,,[],,,,text,t2_6qmv22wy,False,False,[],False,False,1617134777,self.vegan,https://www.reddit.com/r/vegan/comments/mgoq6z/i_just_switched_over/,{},mgoq6z,True,False,False,False,True,True,False,,,[],,,dark,text,False,False,False,11,0,False,all_ads,/r/vegan/comments/mgoq6z/i_just_switched_over/,False,6,1617134788,1,"You know I never thought of myself ever being vegan, because it just didn't seem to fit for me, but after evaluating my choices and my extreme fear of getting cancer, I decided to switch. Nowadays I am eating 2 meals a day and eating 1,800 calories a day, I am doing intermittent fasting 16:8. This is usually what I eat in a day now.

**Breakfast**:2 cups of cheerios 1 cup of milk, smoothie(banana, 3/4 cup milk, 2 tbsp peanut butter), peanut butter and jelly sandwich, 3/4 cup of milk, 1 cup of carrots

**Dinner** spaghetti(3oz spaghetti, 1/2 cup sauce, garlic powder,1/2 cup beans), 2 cups of broccoli**,** 1/8 block of tofu, 8oz grape juice, 1oz peanuts 

The hardest part was giving up parmesan cheese because it is a good-tasting food, but I substituted it with garlic powder. I do not expect to be doing activism though because I am an introverted person and I try to stay away from people at all costs. I only go outside for 15 minutes a day because I feel sick and frustrated when around other people. I know this is a very lengthy post, and I'm sorry for this diatribe about this stuff, but thank you for reading.",True,False,False,vegan,t5_2qhpm,583947,public,self,I just switched over,0,[],1.0,https://www.reddit.com/r/vegan/comments/mgoq6z/i_just_switched_over/,,all_ads,6,,,,,,,,,,,,
[],False,scarlett_ibis,,[],,,,text,t2_4xx22hqt,False,False,[],False,False,1617133817,self.vegan,https://www.reddit.com/r/vegan/comments/mgodfu/looking_for_advice_on_what_to_feed_my_kitties/,{},mgodfu,True,False,False,False,True,True,False,,,[],,,dark,text,False,False,True,29,0,False,all_ads,/r/vegan/comments/mgodfu/looking_for_advice_on_what_to_feed_my_kitties/,False,6,1617133830,1,"Hey everyone, hopefully this isn’t against the rules. I believe that the only responsible way to own carnivorous pets is to feed them what they need to thrive, which is meat. I also have a cat with health problems so he needs a special wet food for his urinary tract issues. I have been feeding them fish-based wet cat food but after watching Seaspiracy I’m a little torn on what causes the least amount of harm. What wet food do you feed your cats? 

I’m really not looking for a lecture or debate on whether or not I should feed my cats meat. I’m really just looking for advice here from others in a similar situation!",True,False,False,vegan,t5_2qhpm,583941,public,self,Looking for advice on what to feed my kitties,0,[],1.0,https://www.reddit.com/r/vegan/comments/mgodfu/looking_for_advice_on_what_to_feed_my_kitties/,,all_ads,6,,,,,,,,,,,,
[],False,Kanevictory,,[],,,,text,t2_8z1z3u2f,False,False,[],False,False,1617131338,self.vegan,https://www.reddit.com/r/vegan/comments/mgnh6c/i_need_help_from_a_meat_eater/,{},mgnh6c,True,False,False,False,True,True,False,,Question,[],3fa453f8-685e-11e9-862d-0ee93d557dce,Question,dark,text,False,False,True,47,0,False,all_ads,/r/vegan/comments/mgnh6c/i_need_help_from_a_meat_eater/,False,6,1617131349,1,"Alright, I am in 7th grade and in middle school and have 3 sisters and 2 brothers. My sister (around 9) turned vegan because of a website she saw about slaughtering.

I need help because we are a omnivorous family, we usually eat meat and vegetables. One night my mom cooked steak while my friends were over and we were chilling. She practically slapped the meat off the grill and told us we were “EVIL SICK BASTARDS” for eating meat. My mom punished her but it didn’t stop her for hating on my family for eating meat. Similar experiences have happened, but this was one of them.",True,False,False,vegan,t5_2qhpm,583927,public,self,I need help from a meat eater,0,[],1.0,https://www.reddit.com/r/vegan/comments/mgnh6c/i_need_help_from_a_meat_eater/,,all_ads,6,,,,,,,,,,,,
[],False,drunkelwaynard,,[],,,,text,t2_4optr779,False,False,[],False,False,1617130482,self.vegan,https://www.reddit.com/r/vegan/comments/mgn5tm/yall_are_a_bunch_of_assholes/,{},mgn5tm,True,False,False,False,True,True,False,,Uplifting,[],d6a5fb70-f024-11e2-8dba-12313b0ae2ae,Uplifting,dark,text,False,False,True,0,0,False,all_ads,/r/vegan/comments/mgn5tm/yall_are_a_bunch_of_assholes/,False,6,1617130493,1,Lot of ignorance in the world out there. You can’t make progress by being gatekeepers. Progress is progress. This group is very similar to the people at the gym that make fun of people who don’t belong. Or people who obsess over the word poser. I’m ready for the downvotes. Better than being holier than everyone around me.,True,False,False,vegan,t5_2qhpm,583926,public,self,Y’all are a bunch of assholes,0,[],1.0,https://www.reddit.com/r/vegan/comments/mgn5tm/yall_are_a_bunch_of_assholes/,,all_ads,6,,,,,,,,,,,,
[],False,kindsoul121,,[],,,,text,t2_9967t5ep,False,False,[],False,False,1617127370,self.vegan,https://www.reddit.com/r/vegan/comments/mgm0ok/please_be_kind_to_nonvegans/,{},mgm0ok,True,False,False,False,True,True,False,,Uplifting,[],d6a5fb70-f024-11e2-8dba-12313b0ae2ae,Uplifting,dark,text,False,False,True,20,0,False,all_ads,/r/vegan/comments/mgm0ok/please_be_kind_to_nonvegans/,False,6,1617127381,1,"Any sort of hatred towards non-vegans hurts our cause. It makes them less likely to work with us or even be willing to go vegan ourselves. It is critical that we recognize that we are not fighting each other. Instead we are fighting a system where animals and people are getting hurt. SPREADING HATRED IS NOT THE ANSWER. Please be kind. Not everyone can go vegan. I have a close friend who is allergic to many vegetables and fruits. 
Fighting fire with fire just means everyone gets burned. The best way to fight hatred, greed and violence is to be gentle, kind and respectful. 
I care about you guys, I hope you are doing well. Please take care of yourself and this beautiful planet we call home",True,False,False,vegan,t5_2qhpm,583910,public,self,Please be kind to non-vegans,0,[],1.0,https://www.reddit.com/r/vegan/comments/mgm0ok/please_be_kind_to_nonvegans/,,all_ads,6,,,,,,,,,,,,
[],False,scar_tet,,[],,,,text,t2_ap27z0hl,False,False,[],False,False,1617127362,self.vegan,https://www.reddit.com/r/vegan/comments/mgm0kx/i_have_been_considering_going_vegan_does_anyone/,{},mgm0kx,True,False,False,False,True,True,False,,,[],,,dark,text,False,False,True,11,0,False,all_ads,/r/vegan/comments/mgm0kx/i_have_been_considering_going_vegan_does_anyone/,False,6,1617127373,1,"For some context: I am 15 years old. I have always thought about veganism and the pros and cons associated with both sides. I have wanted to try it out for a while. I have never attempted it before, but the biggest reason why I haven't is because of my family. The rest of my family eats meat and animal products. I would feel bad making them alter their diets for me. Should I talk to my parents about it now, or should I wait to be vegan until I grow up and move out?",True,False,False,vegan,t5_2qhpm,583910,public,self,I have been considering going vegan.. Does anyone have any good arguments?,0,[],1.0,https://www.reddit.com/r/vegan/comments/mgm0kx/i_have_been_considering_going_vegan_does_anyone/,,all_ads,6,,,,,,,,,,,,
[],False,sandralannister,,[],,,,text,t2_2g4znlmk,False,False,[],False,False,1617126089,self.vegan,https://www.reddit.com/r/vegan/comments/mgljv5/how_do_vegans_feel_about_vegetariansserious/,{},mgljv5,True,False,False,False,True,True,False,,Question,[],3fa453f8-685e-11e9-862d-0ee93d557dce,Question,dark,text,False,False,True,44,0,False,all_ads,/r/vegan/comments/mgljv5/how_do_vegans_feel_about_vegetariansserious/,False,6,1617126100,1,Aspiring vegan here and just want to know honest opinions with no hate. I am aware it’s inconsistent to not eat meat but still have animal byproducts. But do vegans acknowledge that their lifestyle is already an improvement? Or are they considered just as bad as meat eaters? Please feel free to elaborate. Thanks,True,False,False,vegan,t5_2qhpm,583901,public,self,How do vegans feel about vegetarians?(Serious),0,[],1.0,https://www.reddit.com/r/vegan/comments/mgljv5/how_do_vegans_feel_about_vegetariansserious/,,all_ads,6,,,,,,,,,,,,
[],False,vystriss,,[],,,,text,t2_12v0yk,False,False,[],False,False,1617124288,self.vegan,https://www.reddit.com/r/vegan/comments/mgkvwo/share_your_cold_lunch_options_please/,{},mgkvwo,True,False,False,False,True,True,False,,Food,[],d9f9ddf0-f024-11e2-8ebb-12313b0c8c59,Food,dark,text,False,False,True,12,0,False,all_ads,/r/vegan/comments/mgkvwo/share_your_cold_lunch_options_please/,False,6,1617124299,1,"Hi everyone! My whole family made the switch to veganism a few weeks ago thanks to the documentary Dominion. I have to say, it's been much easier than I imagined thanks to all of the resources online, including this sub. What I am struggling with is lunch options for my husband to take to work. He works in construction, so he needs a calorie dense meal and does not have access to a microwave. He's been living off burritos and tofurkey sandwiches, but I'd like to have more options for him, and cold leftovers aren't his cup of tea. Please hit me with all of your hearty non-heated lunch suggestions! Thanks in advance!",True,False,False,vegan,t5_2qhpm,583886,public,self,Share your cold lunch options please!,0,[],1.0,https://www.reddit.com/r/vegan/comments/mgkvwo/share_your_cold_lunch_options_please/,,all_ads,6,,,,,,,,,,,,
[],False,Arsenal_o_S_D,,[],,,,text,t2_5iz41mr0,False,False,[],False,False,1617123998,self.vegan,https://www.reddit.com/r/vegan/comments/mgks3d/vegans_are_obnoxious_moralizers_because_they/,{},mgks3d,True,False,False,False,True,True,False,,,[],,,dark,text,False,False,True,3,0,False,all_ads,/r/vegan/comments/mgks3d/vegans_are_obnoxious_moralizers_because_they/,False,6,1617124010,1,"I used to think veganism is just a fad virtue signal, and while I maintain that the messaging on the issue can be better sometimes I now have every sympathy for their attitude and have decided to become a vegan myself.

Realizing the moral implications of meat eating it is like waking up from a fever dream in cold sweat. It's like those horror stories where the protagonist came out of a trance induced by some Lovecraftian menace, and realize that everyone else is still in that trance, and are being controlled to slaughter and torture for pleasure. You desperately cry unto them, pleading, begging for everyone to wake up, to recognize what's happening, only to be met by zombie-like, reactionary out-lash.

When you truly understand what the animal products industry is doing, outrage, frustration and despair are **the most natural** response. Of course in activism the tone and language must be carefully managed as to not provoke a reaction from the public, but after becoming a vegan I absolutely get why people in the movement have this emotional outcry for others to change.",True,False,False,vegan,t5_2qhpm,583886,public,self,"Vegans are obnoxious moralizers... because they realize tens of thousands of holocaust-tier atrocities are being committed every year, for decades, just for fleeting tastes",0,[],1.0,https://www.reddit.com/r/vegan/comments/mgks3d/vegans_are_obnoxious_moralizers_because_they/,,all_ads,6,,,,,,,,,,,,
[],False,bibimbapdroptop,,[],,,,text,t2_5w2shmni,False,False,[],False,False,1617122843,self.vegan,https://www.reddit.com/r/vegan/comments/mgkcew/what_plantscompanies_should_we_avoid/,{},mgkcew,True,False,False,False,True,True,False,,,[],,,dark,text,False,False,True,5,0,False,all_ads,/r/vegan/comments/mgkcew/what_plantscompanies_should_we_avoid/,False,6,1617122853,1,"My goal of being vegan is to minimize the suffering of others as much as possible. I feel in order to live by this standard I must consider the ecological/environmental impact of everything I eat. 


Unfortunately, just about everything we eat will have a negative impact in some way. It could be habitat destruction, inefficient use of scarce resources, heavy pesticide use or energy intensive production methods. Obviously, plants are going to be less negative than cows, chickens, pigs, fish, etc. 


But are there plants that are too negative to be considered ethical? I know palm oil is something a lot of people avoid due to the habitat destruction it causes. I've heard almonds use more water than is worth the protein they produce. 


Are there certain companies with overly negative production methods?",True,False,False,vegan,t5_2qhpm,583883,public,self,What plants/companies should we avoid?,0,[],1.0,https://www.reddit.com/r/vegan/comments/mgkcew/what_plantscompanies_should_we_avoid/,,all_ads,6,,,,,,,,,,,,
[],False,Beknbee,,[],,,,text,t2_3y1k0l8l,False,False,[],False,False,1617122622,self.vegan,https://www.reddit.com/r/vegan/comments/mgk9fh/im_curious_why_did_you_choose_to_go_vegan_and/,{},mgk9fh,True,False,False,False,True,True,False,,,[],,,dark,text,False,False,True,23,0,False,all_ads,/r/vegan/comments/mgk9fh/im_curious_why_did_you_choose_to_go_vegan_and/,False,6,1617122633,1,"Hello! 

Obligatory ""I'm not a vegan"", but I've been enjoying more tofu and plant-based meals as of late. I still don't mind eating meat, but I prefer not to when I have the option.

I did have a genuine question though. If you raised your own chickens just for fun, would you eat their eggs? I ask because I used to raise poultry (not for meat purposes), and they were always producing eggs. The hens, if no rooster was present, would rarely be broody (they were rarely broody even with a rooster), so the eggs were just left in the nest. I understand going vegan out of concern for animals and their treatment, but in this case, no animal is being harmed and it keeps animals like snakes and raccoons out of your coop because they know there are no eggs. Is there anything that makes eating these eggs unethical in your eyes, or would it be okay because you own these chickens and they're free-range - not being forced to live in terrible conditions to maximize production?

I'm just genuinely curious! I choose vegan options at the store when possible (if I have the budget for it since it can get expensive), but I spent the majority of my childhood raising chickens and just couldn't get this question out of my head. **I do understand not wanting to buy eggs in the store because of the horrible conditions they keep chickens in.** 

(I would also just genuinely like to know what made you choose to go vegan, questions aside! Did you start out vegetarian first, or did you hop right in?)

I hope none of my questions offend and thank you for taking the time to read this! I just want to become more educated on the topic and understand it from a different perspective. 

(I chose to post this here not r/DebateAVegan because I wasn't interested in a debate, I just wanted to understand veganism more. If you feel like it may belong better there, then I can move it!",True,False,False,vegan,t5_2qhpm,583879,public,self,I'm curious - why did you choose to go vegan and would you eat eggs if they were your own free-range chickens?,0,[],1.0,https://www.reddit.com/r/vegan/comments/mgk9fh/im_curious_why_did_you_choose_to_go_vegan_and/,,all_ads,6,,,,,,,,,,,,
