all_awardings,allow_live_comments,author,author_flair_css_class,author_flair_richtext,author_flair_text,author_flair_type,author_fullname,author_patreon_flair,author_premium,awarders,can_mod_post,contest_mode,created_utc,domain,full_link,gildings,id,is_crosspostable,is_gallery,is_meta,is_original_content,is_reddit_media_domain,is_robot_indexable,is_self,is_video,link_flair_background_color,link_flair_css_class,link_flair_richtext,link_flair_template_id,link_flair_text,link_flair_text_color,link_flair_type,locked,media_only,no_follow,num_comments,num_crossposts,over_18,parent_whitelist_status,permalink,pinned,pwls,removed_by_category,retrieved_on,score,selftext,send_replies,spoiler,stickied,subreddit,subreddit_id,subreddit_subscribers,subreddit_type,thumbnail,title,total_awards_received,treatment_tags,upvote_ratio,url,url_overridden_by_dest,whitelist_status,wls,crosspost_parent,crosspost_parent_list,media,media_embed,post_hint,preview,secure_media,secure_media_embed,thumbnail_height,thumbnail_width,author_flair_template_id,author_flair_text_color,media_metadata,poll_data
[],False,OutlandishnessNew112,,[],,text,t2_8n76lmrl,False,False,[],False,False,1618512752,self.vegan,https://www.reddit.com/r/vegan/comments/mrlcw5/accidentally_ate_non_vegan_bread/,{},mrlcw5,True,,False,False,False,True,True,False,,Advice,[],3ae8cb6e-685e-11e9-90e6-0eb95b81be6a,Advice,dark,text,False,False,True,5,0,False,all_ads,/r/vegan/comments/mrlcw5/accidentally_ate_non_vegan_bread/,False,6,,1618512763,1,My family is not vegan but my mom knows I am and always is very considerate about it. Today she bought some bread and offered me some stating clearly that it was vegan. I believed her and had the bread only to find out a stomachache later that the bread contains milk and egg! I literally want to cry I feel horrible. How do you cope with this?,True,False,False,vegan,t5_2qhpm,589991,public,self,Accidentally Ate Non Vegan Bread,0,[],1.0,https://www.reddit.com/r/vegan/comments/mrlcw5/accidentally_ate_non_vegan_bread/,,all_ads,6,,,,,,,,,,,,,,
[],False,AnointedWithOil,,[],,text,t2_8vpj9848,False,False,[],False,False,1618512719,self.vegan,https://www.reddit.com/r/vegan/comments/mrlcgj/parents_always_cook_junk_for_my_younger_sister/,{},mrlcgj,True,,False,False,False,True,True,False,,,[],,,dark,text,False,False,True,4,0,False,all_ads,/r/vegan/comments/mrlcgj/parents_always_cook_junk_for_my_younger_sister/,False,6,,1618512730,1,"Fried foods, soda, McDonalds, bacon, eggs, ham, cheese, etc.

It pains me to see my family living so unconsciously. I always bring it up how my parents are enabling her to live a unhealthy lifestyle. My sister already struggles with depression and anxiety, she doesn't exercise, get out much, and has very poor sleeping habits. On top of this her diet is out of whack completely.

**How do I reach out to them** It hurts me to see this",True,False,False,vegan,t5_2qhpm,589991,public,self,Parents always cook junk for my younger sister,0,[],1.0,https://www.reddit.com/r/vegan/comments/mrlcgj/parents_always_cook_junk_for_my_younger_sister/,,all_ads,6,,,,,,,,,,,,,,
[],False,daking999,,[],,text,t2_10w9bb,False,False,[],False,False,1618511855,self.vegan,https://www.reddit.com/r/vegan/comments/mrl14g/rip_oat_milk_long_live_roat_milk/,{},mrl14g,True,,False,False,False,True,True,False,,,[],,,dark,text,False,False,True,0,0,False,all_ads,/r/vegan/comments/mrl14g/rip_oat_milk_long_live_roat_milk/,False,6,,1618511867,1,"I've been experimenting with homemade oat milk to a) reduce packaging waste b) make my shopping lighter. Recently discovered rice milk is also a thing... a really thin, unsatisfying thing. BUT, I thought, what about ROAT MILK. 50% rice 50% oats... sweetness from the rice, creaminess from the oats. Have others tried this? I'm pretty pleased with the results so far. (Full disclosure I am cheating with xantham gum, amylase, a splash of vegetable oil and a teaspoon of sugar).",True,False,False,vegan,t5_2qhpm,589985,public,self,RIP Oat Milk... long live Roat milk!,0,[],1.0,https://www.reddit.com/r/vegan/comments/mrl14g/rip_oat_milk_long_live_roat_milk/,,all_ads,6,,,,,,,,,,,,,,
[],False,torycole,,[],,text,t2_8bf3w,False,False,[],False,False,1618511054,self.vegan,https://www.reddit.com/r/vegan/comments/mrkr81/still_drinking_coffee/,{},mrkr81,True,,False,False,False,True,True,False,,,[],,,dark,text,False,False,False,9,0,False,all_ads,/r/vegan/comments/mrkr81/still_drinking_coffee/,False,6,,1618511065,1,"
hello fellow vegans,

just wondering how many long-term vegans might still be drinking coffee. 

i’m only three years vegan. Gave up coffee about three years ago￼￼.  I have no idea if there’s any ethical issues with coffee. either with how it’s grown or how the workers￼￼ are treated. ￼

I heard it inhibits your body’s ability to absorb iron. and since iron consumption is already an issue for vegans. a little bird told me it’s best to cut it out. ￼￼

any thoughts?",True,False,False,vegan,t5_2qhpm,589980,public,self,still drinking coffee?,0,[],1.0,https://www.reddit.com/r/vegan/comments/mrkr81/still_drinking_coffee/,,all_ads,6,,,,,,,,,,,,,,
[],False,One_Walrus_4153,,[],,text,t2_a4h2w3ao,False,False,[],False,False,1618510011,self.vegan,https://www.reddit.com/r/vegan/comments/mrkdv0/a_indian_village_lived_in_darkness_for_35_days_to/,{},mrkdv0,True,,False,False,False,True,True,False,,,[],,,dark,text,False,False,True,2,0,False,all_ads,/r/vegan/comments/mrkdv0/a_indian_village_lived_in_darkness_for_35_days_to/,False,6,,1618510022,1,"A village called ""pothakudi"" located in sivagangai district of Tamilnadu,India. A sparrow has hatched its eggs and formed its nest in village main board. To leave this sparrow and its eggs undisturbed the villagers collectively decided not to Switch on lights till the eggs are hatched!

https://preview.redd.it/mn30or2bmdt61.png?width=602&amp;format=png&amp;auto=webp&amp;s=52aca31f9e6f51fbac690bcdcc340b8e92508d6e

Karpuraja, who initially spotted the sparrow and its eggs said,

&gt;""Nearly 100 families are there in this region and around 35 streetlights are used here. One day, when we were passing by the switch board, we noticed that a sparrow had laid three eggs. We immediately took pictures of them and posted it in our village WhatsApp group, and asked people to cooperate and not use electricity connected to the switch box so that the eggs hatch and the bird grows.""  


&amp;#x200B;

https://preview.redd.it/oz5i2uh7mdt61.png?width=602&amp;format=png&amp;auto=webp&amp;s=674311bce158e3943d640240a0bff193092d8c4a

35 streetlights were connected to this switchboard but still these villagers don't operate this switchboard to avoid accidentally damaging sparrow's eggs.Even women who are usually worried about going out in dark decided to keep their fear away to help the sparrow!

Nowadays, it's rare to see sparrows in cities.

&amp;#x200B;

https://preview.redd.it/ds2a0y7fmdt61.png?width=602&amp;format=png&amp;auto=webp&amp;s=75b947b053c5b8c7589471b8cf26c60f506fc231

When cellphone towers in cities are getting increased for our comfort without considering their effects on sparrows , these villagers kept themselves in darkness so that sparrow's offsprings can see the light.

***This Indian villagers love towards a single sparrow amazed me today.***

*Image source : Google.*

[To Save A Sparrow's Life, Villagers Live In Darkness For 35 Days](https://menglish.sakshi.com/amp/news/national/villagers-live-darkness-35-days-tamil-nadu-save-sparrow-121923)

CREDIT - [https://www.quora.com/profile/Kathir-Chidhambara-Pandy](https://www.quora.com/profile/Kathir-Chidhambara-Pandy)",True,False,False,vegan,t5_2qhpm,589978,public,https://b.thumbs.redditmedia.com/J1DL8_iENeZPmiQhNOz7YmN4HLnxg9935W73LAuuqdg.jpg,A Indian village lived in darkness for 35 days to save a sparrow and its eggs.,0,[],1.0,https://www.reddit.com/r/vegan/comments/mrkdv0/a_indian_village_lived_in_darkness_for_35_days_to/,,all_ads,6,,,,,self,"{'enabled': False, 'images': [{'id': '_5XM0DTAwEq-9OGwZ-wPBjiYli92H3n6dR8I7tP_Mss', 'resolutions': [{'height': 81, 'url': 'https://external-preview.redd.it/cDt3nYtSpJkyvwRkQnKGGObj71lsJLXKG3C5_gJf2Ek.jpg?width=108&amp;crop=smart&amp;auto=webp&amp;s=db783acca05409ab6b93fc3a604e2ae2e5e0e1af', 'width': 108}, {'height': 162, 'url': 'https://external-preview.redd.it/cDt3nYtSpJkyvwRkQnKGGObj71lsJLXKG3C5_gJf2Ek.jpg?width=216&amp;crop=smart&amp;auto=webp&amp;s=596d06a928b07bff53a1ad34eff8eccc55110c9e', 'width': 216}, {'height': 240, 'url': 'https://external-preview.redd.it/cDt3nYtSpJkyvwRkQnKGGObj71lsJLXKG3C5_gJf2Ek.jpg?width=320&amp;crop=smart&amp;auto=webp&amp;s=5e70400dfb5b415bcab39001ea63480cbfd7c23f', 'width': 320}], 'source': {'height': 300, 'url': 'https://external-preview.redd.it/cDt3nYtSpJkyvwRkQnKGGObj71lsJLXKG3C5_gJf2Ek.jpg?auto=webp&amp;s=ecec77484a3838cfb1bd5c855920cea25c8b3bae', 'width': 400}, 'variants': {}}]}",,,140.0,140.0,,,"{'ds2a0y7fmdt61': {'e': 'Image', 'id': 'ds2a0y7fmdt61', 'm': 'image/png', 'p': [{'u': 'https://preview.redd.it/ds2a0y7fmdt61.png?width=108&amp;crop=smart&amp;auto=webp&amp;s=c9f9f4b184c9660921b1b977d0aa31145a335cd4', 'x': 108, 'y': 81}, {'u': 'https://preview.redd.it/ds2a0y7fmdt61.png?width=216&amp;crop=smart&amp;auto=webp&amp;s=8896436f3d7e7debc4e9ece60c017b5be08913d8', 'x': 216, 'y': 162}, {'u': 'https://preview.redd.it/ds2a0y7fmdt61.png?width=320&amp;crop=smart&amp;auto=webp&amp;s=16e7a776c11f9da0ac112107be211ab0de59e8a1', 'x': 320, 'y': 240}], 's': {'u': 'https://preview.redd.it/ds2a0y7fmdt61.png?width=602&amp;format=png&amp;auto=webp&amp;s=75b947b053c5b8c7589471b8cf26c60f506fc231', 'x': 602, 'y': 452}, 'status': 'valid'}, 'mn30or2bmdt61': {'e': 'Image', 'id': 'mn30or2bmdt61', 'm': 'image/png', 'p': [{'u': 'https://preview.redd.it/mn30or2bmdt61.png?width=108&amp;crop=smart&amp;auto=webp&amp;s=a1912318335f9d6a538fc2324972b2e7cf0a071a', 'x': 108, 'y': 115}, {'u': 'https://preview.redd.it/mn30or2bmdt61.png?width=216&amp;crop=smart&amp;auto=webp&amp;s=7cfb6b2d6809ce7247dc6ec1467f0355e263da66', 'x': 216, 'y': 231}, {'u': 'https://preview.redd.it/mn30or2bmdt61.png?width=320&amp;crop=smart&amp;auto=webp&amp;s=52d78a55ef266e91df2172fb95b1d5d90e4ec887', 'x': 320, 'y': 342}], 's': {'u': 'https://preview.redd.it/mn30or2bmdt61.png?width=602&amp;format=png&amp;auto=webp&amp;s=52aca31f9e6f51fbac690bcdcc340b8e92508d6e', 'x': 602, 'y': 645}, 'status': 'valid'}, 'oz5i2uh7mdt61': {'e': 'Image', 'id': 'oz5i2uh7mdt61', 'm': 'image/png', 'p': [{'u': 'https://preview.redd.it/oz5i2uh7mdt61.png?width=108&amp;crop=smart&amp;auto=webp&amp;s=df75c6eda31d38a613567833e0e921a72a79e3d8', 'x': 108, 'y': 74}, {'u': 'https://preview.redd.it/oz5i2uh7mdt61.png?width=216&amp;crop=smart&amp;auto=webp&amp;s=9337f3267e1eba92852969e573e3c2653ecb9622', 'x': 216, 'y': 149}, {'u': 'https://preview.redd.it/oz5i2uh7mdt61.png?width=320&amp;crop=smart&amp;auto=webp&amp;s=3af577f5d4d1b5729bdfc9e3a4067919199fd260', 'x': 320, 'y': 221}], 's': {'u': 'https://preview.redd.it/oz5i2uh7mdt61.png?width=602&amp;format=png&amp;auto=webp&amp;s=674311bce158e3943d640240a0bff193092d8c4a', 'x': 602, 'y': 417}, 'status': 'valid'}}",
[],False,698cc,,[],,text,t2_6awvitgk,False,False,[],False,False,1618508441,self.vegan,https://www.reddit.com/r/vegan/comments/mrju7h/i_made_a_vegan_calculator_app_to_see_the_impact/,{},mrju7h,True,,False,False,False,True,True,False,,,[],,,dark,text,False,False,True,1,0,False,all_ads,/r/vegan/comments/mrju7h/i_made_a_vegan_calculator_app_to_see_the_impact/,False,6,,1618508451,1,"I've been working on this project for a while and finally happy to release it to the public! The app takes the day you started your diet (vegan or veggie) and [shows you lives saved, water saved, emissions saved and land saved](https://i.imgur.com/njz7w9p.png) using the results of peer-reviewed studies.

It's completely free and I make no profit from it - sadly only on Android devices for now due to Apple's steep licensing costs.

Feel free to check it out here: [https://play.google.com/store/apps/details?id=me.jckpn.leafy](https://play.google.com/store/apps/details?id=me.jckpn.leafy)

All the best :)",True,False,False,vegan,t5_2qhpm,589967,public,self,I made a vegan calculator app to see the impact your diet has had!,0,[],1.0,https://www.reddit.com/r/vegan/comments/mrju7h/i_made_a_vegan_calculator_app_to_see_the_impact/,,all_ads,6,,,,,self,"{'enabled': False, 'images': [{'id': 'Nsbw-UJIY1cEUzvgB8oO6f6lh8xB9-aBPnsCRFjpca4', 'resolutions': [{'height': 192, 'url': 'https://external-preview.redd.it/J-AHvyuxm35J6bke4ASaLwO8KWF0rtfzmRkQZY-62Jk.png?width=108&amp;crop=smart&amp;auto=webp&amp;s=6b543fead791c5ef04b9024d61bb1010f01c235e', 'width': 108}, {'height': 384, 'url': 'https://external-preview.redd.it/J-AHvyuxm35J6bke4ASaLwO8KWF0rtfzmRkQZY-62Jk.png?width=216&amp;crop=smart&amp;auto=webp&amp;s=e811c79c1d90d0792f5f09635b5f9f9b9c25e002', 'width': 216}, {'height': 569, 'url': 'https://external-preview.redd.it/J-AHvyuxm35J6bke4ASaLwO8KWF0rtfzmRkQZY-62Jk.png?width=320&amp;crop=smart&amp;auto=webp&amp;s=f8be0422bccc9107c77d1112bd7ed6939b3f5a7d', 'width': 320}], 'source': {'height': 1135, 'url': 'https://external-preview.redd.it/J-AHvyuxm35J6bke4ASaLwO8KWF0rtfzmRkQZY-62Jk.png?auto=webp&amp;s=fea8d7ab346a87b4113f21a9516e2f6c0beb26d2', 'width': 638}, 'variants': {}}]}",,,,,,,,
[],False,Pedro303,,[],,text,t2_37pds7di,False,False,[],False,False,1618507809,self.vegan,https://www.reddit.com/r/vegan/comments/mrjmb4/does_milk_consumption_increase_survival_chances/,{},mrjmb4,True,,False,False,False,True,True,False,,,[],,,dark,text,False,False,True,8,0,False,all_ads,/r/vegan/comments/mrjmb4/does_milk_consumption_increase_survival_chances/,False,6,,1618507820,1,"I recently came across a YouTube video that I watched several times over. This was a question posed to sadguru jaggi vasudev on on the cruelty to bovines by consuming milk. Sadguru responded to the query saying that it is better if we consume milk because the alternative is worse for the cow and it would land up at the abattoir. Also if something is not useful to human society we do not let it survive. He provides the example of dogs being tied up or caged. If dogs are let loose, things could be worse for civilization, he argues. 
I see a point in what Sadguru says and am bit confused on the macro factors of going vegan. Wanted to know the community's thoughts. 

[milk consumption ](https://youtu.be/SZ0ClM2pyl4)",True,False,False,vegan,t5_2qhpm,589963,public,self,Does milk consumption increase survival chances for the cow?,0,[],1.0,https://www.reddit.com/r/vegan/comments/mrjmb4/does_milk_consumption_increase_survival_chances/,,all_ads,6,,,,,self,"{'enabled': False, 'images': [{'id': '6sNl5fCw79-5rPKPB0ItssWV5vtUJJ7fyU0hXNfQNBM', 'resolutions': [{'height': 81, 'url': 'https://external-preview.redd.it/4z-n7M05ILhUKagBcenGCjCZvOzYLoKmjyhXXNQafXc.jpg?width=108&amp;crop=smart&amp;auto=webp&amp;s=4def30c8dc6c57a5ab59a7e1c009fd0dbc5d9747', 'width': 108}, {'height': 162, 'url': 'https://external-preview.redd.it/4z-n7M05ILhUKagBcenGCjCZvOzYLoKmjyhXXNQafXc.jpg?width=216&amp;crop=smart&amp;auto=webp&amp;s=2af122e5db1999dd34d9e198217d7f54254363a1', 'width': 216}, {'height': 240, 'url': 'https://external-preview.redd.it/4z-n7M05ILhUKagBcenGCjCZvOzYLoKmjyhXXNQafXc.jpg?width=320&amp;crop=smart&amp;auto=webp&amp;s=154c6eead399edd77ad938ba064477480ccc74e1', 'width': 320}], 'source': {'height': 360, 'url': 'https://external-preview.redd.it/4z-n7M05ILhUKagBcenGCjCZvOzYLoKmjyhXXNQafXc.jpg?auto=webp&amp;s=df6312c7631809785e1e0e717bbac41dab3b36f6', 'width': 480}, 'variants': {}}]}",,,,,,,,
[],False,RedTomahto,,[],transitioning to veganism,text,t2_6grz2lho,False,False,[],False,False,1618506917,self.vegan,https://www.reddit.com/r/vegan/comments/mrjaof/any_delicious_spreads/,{},mrjaof,True,,False,False,False,True,True,False,,Food,[],d9f9ddf0-f024-11e2-8ebb-12313b0c8c59,Food,dark,text,False,False,True,6,0,False,all_ads,/r/vegan/comments/mrjaof/any_delicious_spreads/,False,6,,1618506929,1,"Hi, I want to transition to veganism and I'm just trying to find all the information I'll need for that. I still have some butter, cheese etc and fish in the freezer so I'm focused for now on not buying any more meat while eating what I have from time to time and incorporating more vegan recipes so that when I don't have any more meat, I won't buy any more and will be comfortable with cooking all vegan.

Anyway, would anyone recommend any spreads and stuff to put on bread and rolls? My absolutely favourite food is bread with butter and tomato lol, but after I finish the butter I have, I want to still be good with eating that, without butter.

I don't really like the taste of margarine, do you have other recommendations? Also if you have any recipes for pates and similar I'd be very grateful as I love pate with beans and would like to try other things like that :)",True,False,False,vegan,t5_2qhpm,589952,public,self,Any delicious spreads?,0,[],1.0,https://www.reddit.com/r/vegan/comments/mrjaof/any_delicious_spreads/,,all_ads,6,,,,,,,,,,,b794b724-b0b8-11e5-a63f-0ec593770487,dark,,
[],False,oshi_gus_oshi,,[],,text,t2_5p40cgi5,False,False,[],False,False,1618505886,self.vegan,https://www.reddit.com/r/vegan/comments/mrixjg/vegan_sneakers_list/,{},mrixjg,True,,False,False,False,True,True,False,,Clothing-Shoes,[],e091b0f2-f024-11e2-bc81-12313b0cdc23,Clothing &amp; Shoes,dark,text,False,False,True,4,0,False,all_ads,/r/vegan/comments/mrixjg/vegan_sneakers_list/,False,6,,1618505896,1,"Hey guys, I'm posting this because a lot of people think there are not a lot of vegan sneakers out there, so here it go
(I'm open to critics, and if any of these aren't vegan, comment and I'll edit the post)

Nike space hippies (all of them)
New balance vision racer (all colorways)
Adidas Yeezy 700 v3 (all colorways)
Adidas x Sean whotherspoon super earth
Asics x Sean whotherspoon gel 3
Nike air 270
Nike air fear of god (all of them)
Nike air 720
Off white x nike air jordan 5 ""sail""
Yeezy boost 380 (all colorways)
Nike air presto (all colorways)
Adidas yeezy QNTM (seal teal colorway only)
Nike cosmic unity (natural colorway)
Adidas x sean whotherspoon ZX 8000 super earth
Adidas yeezy foam runners (all colorways)
Converse x Off white chuck 70s (all colorways)
Adidas ZX1000 (all colorways)
Adidas Yeezy 450 (all colorways)
Nike Dunk low SP (city market colorway)
Adidas ultraboost 21 (all colorways)
Stussy x Nike hand dyed air force 1
Nike Cosmic unity (green glow)
Yeezy boost 350 V2 (all colorways)
Nike Go FlyEase (all colorways)
Reebok x STORY MFG. Club C 85
Nike SB Blazer court

(Some of these have synthetic leather, so before you give a hate comment, search for the materials on the sneaker)",True,False,False,vegan,t5_2qhpm,589945,public,self,Vegan sneakers list,0,[],1.0,https://www.reddit.com/r/vegan/comments/mrixjg/vegan_sneakers_list/,,all_ads,6,,,,,,,,,,,,,,
[],False,quirkyturtle777,,[],,text,t2_377ekufq,False,False,[],False,False,1618504073,self.vegan,https://www.reddit.com/r/vegan/comments/mriauw/my_pet_rats/,{},mriauw,True,,False,False,False,True,True,False,,,[],,,dark,text,False,False,True,2,0,False,all_ads,/r/vegan/comments/mriauw/my_pet_rats/,False,6,,1618504084,1,"My pet rats may need more protein. They’ve been raised as vegans. I don’t want health problems. I’m a new vegan (6 months). Suggestions? I want to give them eggs. Or, mealworms. They seem opposed... but I’m looking for best interest. Options? I know there are options... I’m just not seeing it . Thanks.",True,False,False,vegan,t5_2qhpm,589930,public,self,My pet rats!,0,[],1.0,https://www.reddit.com/r/vegan/comments/mriauw/my_pet_rats/,,all_ads,6,,,,,,,,,,,,,,
[],False,NaturalShoulder5102,,[],,text,t2_7ttwchtm,False,False,[],False,False,1618502648,self.vegan,https://www.reddit.com/r/vegan/comments/mrhspb/is_there_a_correlation_between_veganism_and/,{},mrhspb,True,,False,False,False,True,True,False,,Question,[],3fa453f8-685e-11e9-862d-0ee93d557dce,Question,dark,text,False,False,True,95,0,False,all_ads,/r/vegan/comments/mrhspb/is_there_a_correlation_between_veganism_and/,False,6,,1618502659,1,"Im curious being both vegan and antinatalist and noticed that there are others

[View Poll](https://www.reddit.com/poll/mrhspb)",True,False,False,vegan,t5_2qhpm,589923,public,self,Is there a correlation between veganism and antinatalist ideas,0,[],1.0,https://www.reddit.com/r/vegan/comments/mrhspb/is_there_a_correlation_between_veganism_and/,,all_ads,6,,,,,,,,,,,,,,"{'is_prediction': False, 'options': [{'id': '7314576', 'text': 'Vegan'}, {'id': '7314577', 'text': 'Vegan and antinatalist'}], 'resolved_option_id': None, 'total_stake_amount': None, 'total_vote_count': 0, 'tournament_id': None, 'user_selection': None, 'user_won_amount': None, 'voting_end_timestamp': 1618761849006}"
[],True,naeramarth2,,[],,text,t2_4ruh36w0,False,True,[],False,False,1618498849,self.vegan,https://www.reddit.com/r/vegan/comments/mrgh89/do_you_eat_at_andor_support_nonvegan_restaurants/,{},mrgh89,True,,False,False,False,True,True,False,,Question,[],3fa453f8-685e-11e9-862d-0ee93d557dce,Question,dark,text,False,False,True,21,0,False,all_ads,/r/vegan/comments/mrgh89/do_you_eat_at_andor_support_nonvegan_restaurants/,False,6,,1618498860,1,"I haven't seen anyone on here ask this question. I recognize that there could be some variances here in opinion. Perhaps you refuse to eat at any non-vegan restaurants because even if you order a salad or something, that money still goes to the establishment, which in turn puts your money towards buying meat to sell. Perhaps you don't have much of a choice due to your social situation around family. Perhaps you don't mind eating at non-vegan restaurants for whatever reason. Give me your thoughts. 

[View Poll](https://www.reddit.com/poll/mrgh89)",True,False,False,vegan,t5_2qhpm,589902,public,self,Do you eat at and/or support non-vegan restaurants?,0,[],1.0,https://www.reddit.com/r/vegan/comments/mrgh89/do_you_eat_at_andor_support_nonvegan_restaurants/,,all_ads,6,,,,,,,,,,,,,,"{'is_prediction': False, 'options': [{'id': '7313287', 'text': 'I eat at non-vegan restaurants, and have little to no problems supporting them.'}, {'id': '7313288', 'text': ""I eat at non-vegan restaurants, but I don't support them.""}, {'id': '7313289', 'text': ""I don't eat at or support non-vegan restaurants.""}], 'resolved_option_id': None, 'total_stake_amount': None, 'total_vote_count': 0, 'tournament_id': None, 'user_selection': None, 'user_won_amount': None, 'voting_end_timestamp': 1618758049527}"
[],False,sajidhunxai78,,[],,text,t2_azlesxq9,False,False,[],False,False,1618496550,self.vegan,https://www.reddit.com/r/vegan/comments/mrfpl3/minced_meat/,{},mrfpl3,True,,False,False,False,True,True,False,,Food,[],d9f9ddf0-f024-11e2-8ebb-12313b0c8c59,Food,dark,text,False,False,False,0,0,False,all_ads,/r/vegan/comments/mrfpl3/minced_meat/,False,6,,1618496561,1,"Preparation [minced beef or Keema](https://gbfoodrecipes.blogspot.com/2020/09/minced-meatlamb-keema-with-peas.html)

*Processing img umplzmqmjct61...*

* Peel the onions, garlic and ginger, wash the chillies and remove the stems. Chop everything as finely as possible. Heat the oil in a large pan or in a wok and sauté the mixture over medium heat until the onions are lightly browned. Now add the minced meat and fry for about 5 minutes. Keep mixing the mince with the onion mixture and pounding it so that it is nice and crumbly.
* Dust with cumin, coriander, paprika and turmeric and fry for 1 minute. Stir in the tomato paste, season with salt and pepper and fry for 1 minute. Then mix in the yogurt with a little water, put the lid on and simmer on a low heat for about 15 minutes. Pour in some water every now and then (about 200-250 ml in total).
* Stir in the slightly thawed or frozen peas and stew everything for another 15-25 minutes. At the end of the cooking time, season with garam masala, lemon juice, salt and pepper and let steep for 5 minutes. Serve with rice or bread.",True,False,False,vegan,t5_2qhpm,589893,public,self,MINCED MEAT,0,[],1.0,https://www.reddit.com/r/vegan/comments/mrfpl3/minced_meat/,,all_ads,6,,,,,self,"{'enabled': False, 'images': [{'id': 'rkelUGNtWb9KiNbCQxPtGApxbXpal_rrre8gI24U6jU', 'resolutions': [{'height': 108, 'url': 'https://external-preview.redd.it/7xxAIGuPAK1wduzlv2CxLuNXGdQCtEa8Qzv5Hq8-Fuk.jpg?width=108&amp;crop=smart&amp;auto=webp&amp;s=73e8b18ac4e649fab24ba86c60ebf242f08b32ca', 'width': 108}, {'height': 216, 'url': 'https://external-preview.redd.it/7xxAIGuPAK1wduzlv2CxLuNXGdQCtEa8Qzv5Hq8-Fuk.jpg?width=216&amp;crop=smart&amp;auto=webp&amp;s=6f6f9e7cedc350c3f4c6c886b96946f7dc53eddf', 'width': 216}, {'height': 320, 'url': 'https://external-preview.redd.it/7xxAIGuPAK1wduzlv2CxLuNXGdQCtEa8Qzv5Hq8-Fuk.jpg?width=320&amp;crop=smart&amp;auto=webp&amp;s=2743acc22718c548f9a27afdd5a203ce53ac5d0d', 'width': 320}], 'source': {'height': 500, 'url': 'https://external-preview.redd.it/7xxAIGuPAK1wduzlv2CxLuNXGdQCtEa8Qzv5Hq8-Fuk.jpg?auto=webp&amp;s=7586a18fd61bb8181022398f6bdb42741850eb3d', 'width': 500}, 'variants': {}}]}",,,,,,,{'umplzmqmjct61': {'status': 'unprocessed'}},
