all_awardings,allow_live_comments,author,author_flair_css_class,author_flair_richtext,author_flair_text,author_flair_type,author_fullname,author_patreon_flair,author_premium,awarders,can_mod_post,contest_mode,created_utc,domain,full_link,gildings,id,is_crosspostable,is_meta,is_original_content,is_reddit_media_domain,is_robot_indexable,is_self,is_video,link_flair_background_color,link_flair_richtext,link_flair_text_color,link_flair_type,locked,media,media_embed,media_only,no_follow,num_comments,num_crossposts,over_18,parent_whitelist_status,permalink,pinned,post_hint,preview,pwls,retrieved_on,score,secure_media,secure_media_embed,selftext,send_replies,spoiler,stickied,subreddit,subreddit_id,subreddit_subscribers,subreddit_type,thumbnail,thumbnail_height,thumbnail_width,title,total_awards_received,treatment_tags,upvote_ratio,url,url_overridden_by_dest,whitelist_status,wls,link_flair_css_class,link_flair_template_id,link_flair_text,crosspost_parent,crosspost_parent_list,removed_by_category,author_flair_template_id,author_flair_text_color,poll_data
[],False,haipoio,,[],,text,t2_5f4v5qcd,False,False,[],False,False,1618000931,self.vegan,https://www.reddit.com/r/vegan/comments/mnq7s2/how_veganism_helped_my_eating_disorder/,{},mnq7s2,True,False,False,False,True,True,False,,[],dark,text,False,,,False,True,0,0,False,all_ads,/r/vegan/comments/mnq7s2/how_veganism_helped_my_eating_disorder/,False,,,6,1618000941,1,,,"Ever since I was 12 I had issues with food. I always wanted to be thin but always found it difficult to do long term, I loved eating and I loved food. 

When I was 13 I went from a 22 BMI to 18 BMI in a little over a month because I was starving myself. People started to notice and I was basically forced to eat more until I gained the weight back. Later that year I started throwing up my food to avoid gaining weight. I would regularly pass out. 

When I was 14 I came across a vegan YouTuber and my first reaction was “how fucking stupid” but then after listening and looking at more vegan youtubers and eventually watching ‘earthlings’ I knew I could no longer support the meat or dairy industry. 

I went whole-food vegan. And after a few months I noticed I was at my desired weight (about 135lbs and 19.5 BMI) it took no effort whatsoever either. Months go by and I wouldn’t lose or gain any weight despite not looking at my calorie consumption and eating plenty of food. I also felt happier and had more energy. 

Fast forward to today I’m 22 years old and have had no issues with my eating disorder. I’m still at around 135lbs average and I couldn’t be happier. 

I know this probably won’t be the case for everyone but it was a really nice bonus to not supporting animal suffering.",True,False,False,vegan,t5_2qhpm,587940,public,self,,,How Veganism helped my eating disorder.,0,[],1.0,https://www.reddit.com/r/vegan/comments/mnq7s2/how_veganism_helped_my_eating_disorder/,,all_ads,6,Story,192cac22-7509-11e9-9af9-0e36ec779de6,Story,,,,,,
[],False,NoWayIJustDidThat,,[],,text,t2_43u71ct7,False,False,[],False,False,1618000845,self.vegan,https://www.reddit.com/r/vegan/comments/mnq6pv/vegan_vitamins/,{},mnq6pv,True,False,False,False,True,True,False,,[],dark,text,False,,,False,True,0,0,False,all_ads,/r/vegan/comments/mnq6pv/vegan_vitamins/,False,,,6,1618000856,1,,,"I’ve been a vegan for about 8 months, never took ANY supplements, recently though I have been going through fatigue and memory loss. My body has also been craving meat.

I had a SUPER smooth transition into veganism, and to see myself actually want some meat makes me wonder if the memory loss and fatigue can be attributed to lack of vitamins that I would be getting from meat. 

I don’t mind wasting some money on vitamins because I probably can’t see a doctor for a week and this has all been a lot of trouble for my mental health. What would you guys recommend in the mean time?


Anyone who helps, thank you so much and I hope you have a great day!",True,False,False,vegan,t5_2qhpm,587940,public,self,,,Vegan &amp; Vitamins,0,[],1.0,https://www.reddit.com/r/vegan/comments/mnq6pv/vegan_vitamins/,,all_ads,6,,,,,,,,,
[],False,aerishey,,[],,text,t2_3wdexlid,False,False,[],False,False,1617999116,self.vegan,https://www.reddit.com/r/vegan/comments/mnplou/im_writing_my_masters_final_thesis_on_veganism/,{},mnplou,True,False,False,False,True,True,False,,[],dark,text,False,,,False,True,5,0,False,all_ads,/r/vegan/comments/mnplou/im_writing_my_masters_final_thesis_on_veganism/,False,self,"{'enabled': False, 'images': [{'id': 'DNZ5s_rRwRkgr65ONBN36G-t2-qyPPcitLQqnx0kfEA', 'resolutions': [{'height': 56, 'url': 'https://external-preview.redd.it/LZ0Ocnnx_BsX5nF1ewJFeYhxisCFZ1B9BwATltxSX7Y.jpg?width=108&amp;crop=smart&amp;auto=webp&amp;s=c0dd1f37e1db239679b460c8eebdd06a14c5b36e', 'width': 108}, {'height': 113, 'url': 'https://external-preview.redd.it/LZ0Ocnnx_BsX5nF1ewJFeYhxisCFZ1B9BwATltxSX7Y.jpg?width=216&amp;crop=smart&amp;auto=webp&amp;s=092d727d966962b53bfad33bf09f4de7ef60748f', 'width': 216}, {'height': 168, 'url': 'https://external-preview.redd.it/LZ0Ocnnx_BsX5nF1ewJFeYhxisCFZ1B9BwATltxSX7Y.jpg?width=320&amp;crop=smart&amp;auto=webp&amp;s=7f2324d94d4848a6288e8e4fe4eedc51b4187b7b', 'width': 320}, {'height': 336, 'url': 'https://external-preview.redd.it/LZ0Ocnnx_BsX5nF1ewJFeYhxisCFZ1B9BwATltxSX7Y.jpg?width=640&amp;crop=smart&amp;auto=webp&amp;s=b4f33554a657a125ec6788b51800770eecdc248f', 'width': 640}, {'height': 504, 'url': 'https://external-preview.redd.it/LZ0Ocnnx_BsX5nF1ewJFeYhxisCFZ1B9BwATltxSX7Y.jpg?width=960&amp;crop=smart&amp;auto=webp&amp;s=92ef37dfef4a05f40a1fad76de5edaf5f2c3b681', 'width': 960}, {'height': 567, 'url': 'https://external-preview.redd.it/LZ0Ocnnx_BsX5nF1ewJFeYhxisCFZ1B9BwATltxSX7Y.jpg?width=1080&amp;crop=smart&amp;auto=webp&amp;s=3754a41f91c739e0fd421521ccb418f180a2fe1d', 'width': 1080}], 'source': {'height': 630, 'url': 'https://external-preview.redd.it/LZ0Ocnnx_BsX5nF1ewJFeYhxisCFZ1B9BwATltxSX7Y.jpg?auto=webp&amp;s=d08dd9749ec64727d9e0cda2e9a58fa919477520', 'width': 1200}, 'variants': {}}]}",6,1617999128,1,,,"Hi, it's a bit different than most post here, I hope it's okay :) I'm a psychology student at the University of Pécs, Hungary, and as my final thesis, I'm researching the relationship between nature, humans and animals, and the beliefs and values connected to these concepts.

It takes 15-20 minutes to fill out the questionnaire, it's completely anonymous, and I use the data only for research purposes: [https://forms.gle/19eD6BjaGiG8xMuT6](https://forms.gle/19eD6BjaGiG8xMuT6)

I'm looking for vegan, vegetarian and non-vegan/vegetarian participants, so really, anyone can fill out the questionnaire, and each and every participant helps me so much!

So, thank you so much to those who fill the form out, or share with people who might be interested in this :) (also, do any of you have any tips where else can I share this link?) have a great day!",True,False,False,vegan,t5_2qhpm,587928,public,self,,,"I'm writing my master's final thesis on veganism, and it would be awesome if you could help me with it! 🌼",0,[],1.0,https://www.reddit.com/r/vegan/comments/mnplou/im_writing_my_masters_final_thesis_on_veganism/,,all_ads,6,,,,,,,,,
[],False,ThePoser_,,[],,text,t2_3v3wmecp,False,False,[],False,False,1617998219,self.vegan,https://www.reddit.com/r/vegan/comments/mnpaiq/cant_go_vegan_or_vegetarian/,{},mnpaiq,True,False,False,False,True,True,False,,[],dark,text,False,,,False,True,16,0,False,all_ads,/r/vegan/comments/mnpaiq/cant_go_vegan_or_vegetarian/,False,,,6,1617998230,1,,,"I love all animals and always wanted to go vegan.  I have a long list of allergies including most fruits and vegetables, tree nuts, soy, and gluten.  I also have Eosinophilic Esophagitis which can basically cause me to have a reaction to food i’ve never been allergic to before. 

I was malnourished most of my life without knowing it until I was diagnosed. I had to go to dietitian to basically help me find out what to eat to stay healthy.  They recommended not to go vegetarian or vegan because of my long list of allergies.  

Some, not all, vegans say that you’re morally wrong and can’t love animals if you are not vegan, but I genuinely love ALL animals.  It hurts my heart a bit.  I just wanted to bring this up because I don’t see many people list allergies and conditions as an honest reason that they can not go vegan.  Share your thoughts. Thank you for reading :)",True,False,False,vegan,t5_2qhpm,587929,public,self,,,Can’t Go Vegan or Vegetarian,0,[],1.0,https://www.reddit.com/r/vegan/comments/mnpaiq/cant_go_vegan_or_vegetarian/,,all_ads,6,,,,,,,,,
[],False,cleopatronn,,[],,text,t2_9of6w09j,False,False,[],False,False,1617992961,self.vegan,https://www.reddit.com/r/vegan/comments/mnniq7/just_curious/,{},mnniq7,True,False,False,False,True,True,False,,[],dark,text,False,,,False,True,6,0,False,all_ads,/r/vegan/comments/mnniq7/just_curious/,False,,,6,1617992971,1,,,"What are peoples thoughts on meat alternatives. If veganism is promoted because it’s healthy can we really justify the consumption of equally processed ‘vegan’ foods? I’m not necessarily sure that veganism and healthy are synonymous.

Just curious to your thoughts. I recently cut back on a lot of vegan ‘fish fillets’ and ‘meat’ etc. Because I find the be just as processed and unhealthy as the foods in an ‘unhealthy’ (non-vegan diet).",True,False,False,vegan,t5_2qhpm,587910,public,self,,,Just curious,0,[],1.0,https://www.reddit.com/r/vegan/comments/mnniq7/just_curious/,,all_ads,6,Question,3fa453f8-685e-11e9-862d-0ee93d557dce,Question,,,,,,
[],False,waterdrippingsnake,,[],,text,t2_b8r2a4sc,False,False,[],False,False,1617992768,self.vegan,https://www.reddit.com/r/vegan/comments/mnnggn/rant_trying_almond_milk_for_the_first_time/,{},mnnggn,True,False,False,False,True,True,False,,[],dark,text,False,,,False,True,13,0,False,all_ads,/r/vegan/comments/mnnggn/rant_trying_almond_milk_for_the_first_time/,False,,,6,1617992779,1,,,"**rant:**
ArrrrghI I was SO excited to try oatly oatmilk. I went to 3(!) Different local stores and nobody had it :( I know i can order online and check the other stores in other parts of town but ahhh wish I could just walk to the store and buy! None of them even had oat milk.


But i wanted to try something so I grabbed one (and the only) vegan milk they had - almond milk. I just got home and I'm really excited to try it. None of my friends are vegans so they don't understand the excitement. I'm skeptical that I will like it , because I'm VERY picky. But i hope that I'm wrong! Gonna grab a glass right after i post this.  I'm always excited to try new vegan products (new to me), and i really I wanted to share my excitement and i hope it's ok. (If I'm posting in the wrong sub please guide me!)


Do you guys felt this kind of excitement when you first went vegan and tried new stuff? And what milk is you guys' favorite?",True,False,False,vegan,t5_2qhpm,587908,public,self,,,Rant + trying almond milk for the first time,0,[],1.0,https://www.reddit.com/r/vegan/comments/mnnggn/rant_trying_almond_milk_for_the_first_time/,,all_ads,6,Victory,9a0f74d0-689e-11e5-9c44-0e53d95baa8f,Small Victories,,,,,,
[],False,mupoger,,[],,text,t2_acbpw0fa,False,False,[],False,False,1617992001,self.vegan,https://www.reddit.com/r/vegan/comments/mnn71w/lets_say_youre_at_a_restaurant_with_your_nephew/,{},mnn71w,True,False,False,False,True,True,False,,[],dark,text,False,,,False,True,8,0,False,all_ads,/r/vegan/comments/mnn71w/lets_say_youre_at_a_restaurant_with_your_nephew/,False,,,6,1617992012,1,,,"Would love to hear what you think about this in the comments as well.

[View Poll](https://www.reddit.com/poll/mnn71w)",True,False,False,vegan,t5_2qhpm,587902,public,self,,,Let's say you're at a restaurant with your nephew and he wants to eat a steak. You are the one paying. Would you buy it for him or talk him out of it?,0,[],1.0,https://www.reddit.com/r/vegan/comments/mnn71w/lets_say_youre_at_a_restaurant_with_your_nephew/,,all_ads,6,Question,3fa453f8-685e-11e9-862d-0ee93d557dce,Question,,,,,,"{'is_prediction': False, 'options': [{'id': '7185370', 'text': 'Me being vegan also means not buying meat for others. Would talk him out of it.'}, {'id': '7185371', 'text': 'My nephew can eat what he wants. I would pay for his steak.'}], 'resolved_option_id': None, 'total_stake_amount': None, 'total_vote_count': 0, 'tournament_id': None, 'user_selection': None, 'user_won_amount': None, 'voting_end_timestamp': 1618337601450}"
[],False,FuckBoyPutin,,[],,text,t2_o1619,False,False,[],False,False,1617991217,self.vegan,https://www.reddit.com/r/vegan/comments/mnmxfx/what_are_your_experiences_with_being_vegan_in/,{},mnmxfx,True,False,False,False,True,True,False,,[],dark,text,False,,,False,True,3,0,False,all_ads,/r/vegan/comments/mnmxfx/what_are_your_experiences_with_being_vegan_in/,False,,,6,1617991232,1,,,"I will be traveling to Colombia in a few months and am a little nervous about finding vegan products there as well as navigating being vegan in a different culture. I speak Spanish fairly well, but am in no way prepared to have an in-depth discussion about the philosophy and ethics of veganism should someone ask me. 

What are y'all's experiences?",True,False,False,vegan,t5_2qhpm,587902,public,self,,,What Are Your Experiences With Being Vegan in Foreign Countries?,0,[],1.0,https://www.reddit.com/r/vegan/comments/mnmxfx/what_are_your_experiences_with_being_vegan_in/,,all_ads,6,Question,3fa453f8-685e-11e9-862d-0ee93d557dce,Question,,,,,,
[],False,FuckBoyPutin,,[],,text,t2_o1619,False,False,[],False,False,1617991023,self.vegan,https://www.reddit.com/r/vegan/comments/mnmuy7/traveling_with_limited_food_options_what_to_take/,{},mnmuy7,True,False,False,False,True,True,False,,[],dark,text,False,,,False,False,4,0,False,all_ads,/r/vegan/comments/mnmuy7/traveling_with_limited_food_options_what_to_take/,False,,,6,1617991034,1,,,"Hey y'all,

I will be going on a trip for 2 weeks where I may or may not always have access to vegan food and even if I do, it may not be super filling/healthy. I will, however, have access to a microwave. What are some food items that you travel with so that you don't go hungry when there's nothing to eat aside from protein bars and nuts/seeds?",True,False,False,vegan,t5_2qhpm,587900,public,self,,,Traveling With Limited Food Options - What to Take?,0,[],1.0,https://www.reddit.com/r/vegan/comments/mnmuy7/traveling_with_limited_food_options_what_to_take/,,all_ads,6,,,,,,,,,
[],False,makenaaa,,[],,text,t2_hgti8r1,False,False,[],False,False,1617990836,self.vegan,https://www.reddit.com/r/vegan/comments/mnmsnq/what_are_your_staple_salad_bowl_dressing/,{},mnmsnq,True,False,False,False,True,True,False,,[],dark,text,False,,,False,True,6,0,False,all_ads,/r/vegan/comments/mnmsnq/what_are_your_staple_salad_bowl_dressing/,False,,,6,1617990847,1,,,"Looking for suggestions on staple pantry/fridge items for salad or bowl dressings? Trying to eat more salads and am looking for easy ideas for dressings! What are your staple items/recipes?

Trying to keep it to a few easy, quick ideas for salad / veggie &amp; grain bowls that I don’t have to bring out the vitamix for (small cusinart food processor is on our list eventually!). But if I have to, that’s ok... Good to have other ideas.

My current staples are tahini, lemon juice, maple syrup, olive oil, and balsamic. 

I make a really good cashew cream but that’s more effort as it requires boiling the cashews.",True,False,False,vegan,t5_2qhpm,587898,public,self,,,What are your staple salad / bowl dressing ingredients?,0,[],1.0,https://www.reddit.com/r/vegan/comments/mnmsnq/what_are_your_staple_salad_bowl_dressing/,,all_ads,6,Food,d9f9ddf0-f024-11e2-8ebb-12313b0c8c59,Food,,,,,,
[],False,SketchyHippopotamus,,[],,text,t2_b3a90,False,False,[],False,False,1617990020,self.vegan,https://www.reddit.com/r/vegan/comments/mnmiuf/folks_who_are_vegans_for_environmental_reasons/,{},mnmiuf,True,False,False,False,True,True,False,,[],dark,text,False,,,False,True,15,0,False,all_ads,/r/vegan/comments/mnmiuf/folks_who_are_vegans_for_environmental_reasons/,False,,,6,1617990031,1,,,"While I’m not vegan I almost never eat meat, usually only for large celebrations and I never cook it myself (too much hassle)

My main reason for cutting back is the environmental impact and the cruelty of factory farms but I friend who’s a bird hunter offered me 6 English sparrows that he hunts specifically to help conservation efforts. 

Outside of whether you could stomach it, would you consider it okay for yourself to eat those?",True,False,False,vegan,t5_2qhpm,587891,public,self,,,Folks who are Vegans for environmental reasons: would you eat meat if it was an invasive deliberately hunted to protect native species?,0,[],1.0,https://www.reddit.com/r/vegan/comments/mnmiuf/folks_who_are_vegans_for_environmental_reasons/,,all_ads,6,Question,3fa453f8-685e-11e9-862d-0ee93d557dce,Question,,,,,,
[],False,CborgCyborg,,[],,text,t2_aqdvr1mp,False,False,[],False,False,1617989401,self.vegan,https://www.reddit.com/r/vegan/comments/mnmb9n/if_you_are_against_the_torture_of_innocent/,{},mnmb9n,True,False,False,False,True,True,False,,[],dark,text,False,,,False,False,1,0,False,all_ads,/r/vegan/comments/mnmb9n/if_you_are_against_the_torture_of_innocent/,False,,,6,1617989412,1,,,"If you don’t know what fox hunting it, let me tell you. Fox hunting is when a group of people get together with their trained hounds, find an area with foxes(sometimes trapping them in a caged in field), set their dogs on them, and watch as their hounds chase them down and rip them to shreds a while the fox is still alive. Why do people do this, you might ask? It’s not to keep their population down. It’s not for their fur. It’s not even to “protect” livestock. It’s for entertainment. Sick, morbid, disgusting, human entertainment. It doesn’t matter who you are. Most people can(should) look at this after being educated on it and go “wow. That is evil.” Please join me in helping the fight to get this more securely banned. It’s not just foxes either. Badgers, birds, etc. There are so many people in Britain who are standing up to this but the sad fact is, there are a lot of people defending it too. They need our help. Please at least look at the Reddit description. Thank you and have a great Friday!",True,False,False,vegan,t5_2qhpm,587889,public,self,,,"If you are against the torture of innocent animals with no reason whatsoever(although they might claim they have one), please join r/EndFoxHunting",0,[],1.0,https://www.reddit.com/r/vegan/comments/mnmb9n/if_you_are_against_the_torture_of_innocent/,,all_ads,6,,,,,,,,,
[],False,one4america,,[],,text,t2_z3j6uht,False,False,[],False,False,1617989127,self.vegan,https://www.reddit.com/r/vegan/comments/mnm7zw/vegan_and_oral/,{},mnm7zw,True,False,False,False,True,True,False,,[],dark,text,False,,,False,True,6,0,False,all_ads,/r/vegan/comments/mnm7zw/vegan_and_oral/,False,,,6,1617989138,1,,,"Look I know this is pretty inappropriate, and not the stuff people come to see in this forum... But .... I was talking with some buddies and long story short is we got to discussing if a vegan can ""swallow"" after performing oral?

By definition I don't think they can, but a vegetarian could, because it is an animal product. So we got to discussing whether or not that would stop anyone from ""swallowing"" vs it being a personal preference.",True,False,False,vegan,t5_2qhpm,587885,public,self,,,Vegan and Oral,0,[],1.0,https://www.reddit.com/r/vegan/comments/mnm7zw/vegan_and_oral/,,all_ads,6,,,,,,,,,
[],False,cinnamon_noodles,,[],,text,t2_ahakhieh,False,False,[],False,False,1617985117,self.vegan,https://www.reddit.com/r/vegan/comments/mnksb5/hi_everyone_i_made_a_discord_for_vegan_young/,{},mnksb5,True,False,False,False,True,True,False,,[],dark,text,False,,,False,True,1,0,False,all_ads,/r/vegan/comments/mnksb5/hi_everyone_i_made_a_discord_for_vegan_young/,False,self,"{'enabled': False, 'images': [{'id': 'SjJNwCkwpgeY6H5U27tU5aoZE8zmTePy2HsyUeNN-hc', 'resolutions': [{'height': 108, 'url': 'https://external-preview.redd.it/vCGAv5Tkm6nPzZ6zVGkii721x2WPmEVNw_P40zFrD4s.jpg?width=108&amp;crop=smart&amp;auto=webp&amp;s=dfbfb8dd5eeaa5d0562635f8e0ab1d8562f586cd', 'width': 108}, {'height': 216, 'url': 'https://external-preview.redd.it/vCGAv5Tkm6nPzZ6zVGkii721x2WPmEVNw_P40zFrD4s.jpg?width=216&amp;crop=smart&amp;auto=webp&amp;s=6639e0bb778f7c904b8729da19058d295abc874e', 'width': 216}], 'source': {'height': 256, 'url': 'https://external-preview.redd.it/vCGAv5Tkm6nPzZ6zVGkii721x2WPmEVNw_P40zFrD4s.jpg?auto=webp&amp;s=2348481f10ea076d5e17c99eb0652d4ac728f913', 'width': 256}, 'variants': {}}]}",6,1617985127,1,,,"I'm 18 and because of the pandemic I've been feeling really lonely and I have no vegan friends.   
I thought of making a discord server and I finally made it. 

I made some channels about veganism, like: recipes, advice, fitness etc. But there are also some channels about school, lgbtq+, mental health, journalling etc.  
I'm willing to add channels if there's need for it. I just really want to talk to other people around my age.  

Here's the link for anyone interested: [https://discord.gg/uVmYMR3G](https://discord.gg/uVmYMR3G)",True,False,False,vegan,t5_2qhpm,587877,public,self,,,"Hi everyone, I made a discord for vegan young adults/teens",0,[],1.0,https://www.reddit.com/r/vegan/comments/mnksb5/hi_everyone_i_made_a_discord_for_vegan_young/,,all_ads,6,,,,,,,,,
[],False,JeremyWheels,,[],,text,t2_6cfggsmq,False,False,[],False,False,1617985031,self.vegan,https://www.reddit.com/r/vegan/comments/mnkr4t/thoughts_on_going_almost_vegan_but_continuing_to/,{},mnkr4t,True,False,False,False,True,True,False,,[],dark,text,False,,,False,True,30,0,False,all_ads,/r/vegan/comments/mnkr4t/thoughts_on_going_almost_vegan_but_continuing_to/,False,,,6,1617985042,1,,,"Hey all,

New member here and gradually getting closer &amp; closer being Vegan.  Not finding it easy but it's a process.

I live in Scotland where we have a massive overpopulation of wild Deer as they have no natural predators left.  There are government targets for their culling as they cause issues such as preventing natural and commercial forest regeneration &amp; a lot of car accidents.

Given that they live wild, legally have to be culled by highly trained professionals (at least the ones that I would be buying were) and could potentially be carbon positive given the tree regeneration they suppress while alive and that they will be pretty locally shot....is there any reason why I shouldn't eat their meat?

Looking forward to diving into the sub...hoping it'll give me some motivation during moments of weakness!",True,False,False,vegan,t5_2qhpm,587877,public,self,,,Thoughts on going 'almost vegan' but continuing to eat Wild Venison?,0,[],1.0,https://www.reddit.com/r/vegan/comments/mnkr4t/thoughts_on_going_almost_vegan_but_continuing_to/,,all_ads,6,,,,,,,,,
[],False,rhinestoneeyesss,,[],vegan,text,t2_8ef82de7,False,False,[],False,False,1617982369,self.vegan,https://www.reddit.com/r/vegan/comments/mnjs1z/how_to_be_vegan_and_lazy/,{},mnjs1z,True,False,False,False,True,True,False,,[],dark,text,False,,,False,False,14,0,False,all_ads,/r/vegan/comments/mnjs1z/how_to_be_vegan_and_lazy/,False,,,6,1617982380,1,,,Recently I have been drowning in school work and I don’t have the time or energy to meal prep recently. Because of this my diet has not been the best and I’m definitely not getting enough protein and nutrients I need. What are some of your go to EASY AND FAST meals when you are way too lazy to cook something up?,True,False,False,vegan,t5_2qhpm,587867,public,self,,,How to be vegan and lazy?,0,[],1.0,https://www.reddit.com/r/vegan/comments/mnjs1z/how_to_be_vegan_and_lazy/,,all_ads,6,Question,3fa453f8-685e-11e9-862d-0ee93d557dce,Question,,,,70cd74e0-f01f-11e2-be4e-12313d05241f,dark,
[],False,boozypeach,,[],,text,t2_3whdfii5,False,False,[],False,False,1617981031,self.vegan,https://www.reddit.com/r/vegan/comments/mnjajh/mom_just_got_diagnosed_with_collangeous_colitis/,{},mnjajh,True,False,False,False,True,True,False,,[],dark,text,False,,,False,True,7,0,False,all_ads,/r/vegan/comments/mnjajh/mom_just_got_diagnosed_with_collangeous_colitis/,False,,,6,1617981042,1,,,"My mom became vegetarian a month ago after she saw me live as a vegan for the past 4 years. She was planning on making the jump to veganism, but she just got diagnosed with collangeous colitis. I’ve tried to do some research but there doesn’t seem to be much information about this diet along with a vegan diet. I’m at a loss for recipe suggestions. If anyone has even an inkling of an idea for recipes, I would be SO grateful. 

She cannot have:
-dairy
-gluten
-beans, peas, legumes
-dried fruits and berries
-fruits with pulp and seeds
-high fiber foods
-spicy foods
-high-fat foods
-nuts
-popcorn
-raw vegetables
-sugar
-seeds

From what I can tell, these are “safe foods”:
-bananas
-cantaloupe
-honeydew
-cooked fruits
-avocados
-fully cooked, seedless, skinless, non-cruciferous vegetables
-asparagus tips
-cucumbers
-potatoes
-squash
-sauerkraut
-tempeh",True,False,False,vegan,t5_2qhpm,587857,public,self,,,Mom just got diagnosed with Collangeous Colitis... she and I are totally lost.,0,[],1.0,https://www.reddit.com/r/vegan/comments/mnjajh/mom_just_got_diagnosed_with_collangeous_colitis/,,all_ads,6,,,,,,,,,
