[],False,Katie_hobbs,,[],,text,t2_7achl86y,False,False,[],False,False,1617980860,self.vegan,https://www.reddit.com/r/vegan/comments/mnj8fn/looking_to_interview_an_exslaughterhouse_worker/,{},mnj8fn,True,False,False,False,True,True,False,,[],dark,text,False,,,False,True,2,0,False,all_ads,/r/vegan/comments/mnj8fn/looking_to_interview_an_exslaughterhouse_worker/,False,,,6,1617980871,1,,,"I'm a Canadian journalism student writing an article on the COVID-19 outbreaks at slaughterhouses. I'd love to interview someone who used to work at a slaughterhouse and is now vegan.

This could be an anonymous interview (that is, your name won't be published), but I would still need your contact info. for verification purposes. 

Many thanks!",True,False,False,vegan,t5_2qhpm,587857,public,self,,,Looking to interview an ex-slaughterhouse worker,0,[],1.0,https://www.reddit.com/r/vegan/comments/mnj8fn/looking_to_interview_an_exslaughterhouse_worker/,,all_ads,6,,,,,,,,,
[],False,drguillen13,,[],,text,t2_y8qru,False,False,[],False,False,1617979710,self.vegan,https://www.reddit.com/r/vegan/comments/mnitjk/tea_enthusiast_and_vegancurious_looking_for/,{},mnitjk,True,False,False,False,True,True,False,,[],dark,text,False,,,False,False,7,0,False,all_ads,/r/vegan/comments/mnitjk/tea_enthusiast_and_vegancurious_looking_for/,False,,,6,1617979720,1,,,"As the title suggests, I've been trying to find a good creamer/milk alternative for my morning black tea. Almond and oat milk just don't cut it, and the vegan creamers I can find at grocery stores around me are all made for coffee (which taste terrible in tea). Does anyone have any good recommendations?",True,False,False,vegan,t5_2qhpm,587847,public,self,,,Tea Enthusiast and Vegan-Curious Looking for Milk-Alternatives in Tea.,0,[],1.0,https://www.reddit.com/r/vegan/comments/mnitjk/tea_enthusiast_and_vegancurious_looking_for/,,all_ads,6,Question,3fa453f8-685e-11e9-862d-0ee93d557dce,Question,,,,,,
[],False,uponthelilypad,,[],,text,t2_9b67fnvz,False,False,[],False,False,1617979209,self.vegan,https://www.reddit.com/r/vegan/comments/mnin9f/veganism_helps_me_stop_binging/,{},mnin9f,True,False,False,False,True,True,False,,[],dark,text,False,,,False,True,3,0,False,all_ads,/r/vegan/comments/mnin9f/veganism_helps_me_stop_binging/,False,,,6,1617979220,1,,,"Unfortunately, I have been in a binge cycle since March 2020. Literally the only relief I had from it was when I was vegan. 

A few months ago I was watching a lot of vegan media on YouTube and I went vegan again (previously was vegan a few years ago) and it really helped me to stop binging!! It was such a great thing and I felt so good in so many ways. 

Then, after a while, I had one big binge and I ate animal products in it. It's been about 2 weeks of me not eating vegan again since then and it 100% just stems from me being unconscious to my truer wants and being out of control to the binging. 

My stomach has been in constant pain from the meat and dairy products honestly. I think it's incredible how once you stop something you realize what a strange ""normal"" you were accustomed too. 

I also quit coffee 2 months ago and I used to think I just naturally went to sleep at 11 pm-1 am but now I get proper tired between 9-10 pm. 
I feel like the same happened with animal products; I'm now really aware of how crazily they wreck up my digestion! 

Anyway, I need to get back on track so I'm buckling down today and going back to being vegan. I know it's an important thing to me for many reasons; the animals, health, human exploitation, and the environment. 

Just wanted to share, thanks. :) 
Also please don't judge me for binging. :( I'm embarrassed about it honestly but maybe someone else can relate?",True,False,False,vegan,t5_2qhpm,587847,public,self,,,Veganism helps me stop binging.,0,[],1.0,https://www.reddit.com/r/vegan/comments/mnin9f/veganism_helps_me_stop_binging/,,all_ads,6,Discussion,0d26d52c-2ef1-11e5-8c17-0ec131dbf691,Discussion,,,,,,
[],False,Sshortcakez101,,[],,text,t2_5r4jjvkv,False,False,[],False,False,1617976149,self.vegan,https://www.reddit.com/r/vegan/comments/mnhlqx/avocados_and_ethics_not_vegan/,{},mnhlqx,True,False,False,False,True,True,False,,[],dark,text,False,,,False,True,15,0,False,all_ads,/r/vegan/comments/mnhlqx/avocados_and_ethics_not_vegan/,False,self,"{'enabled': False, 'images': [{'id': 'jnuCyobYtP49rwkJhJyuAARIPHrJaCzVlnP34z6OWok', 'resolutions': [{'height': 80, 'url': 'https://external-preview.redd.it/aV_uSGPsCpp0G2_Punpuztn7JjEBs0Rn0IA6ggfHXSE.jpg?width=108&amp;crop=smart&amp;auto=webp&amp;s=37cfe64918c53fda681be3ffebda75fa15a52960', 'width': 108}, {'height': 161, 'url': 'https://external-preview.redd.it/aV_uSGPsCpp0G2_Punpuztn7JjEBs0Rn0IA6ggfHXSE.jpg?width=216&amp;crop=smart&amp;auto=webp&amp;s=0965fc95c0653ce9817725927d525bef7b363974', 'width': 216}, {'height': 239, 'url': 'https://external-preview.redd.it/aV_uSGPsCpp0G2_Punpuztn7JjEBs0Rn0IA6ggfHXSE.jpg?width=320&amp;crop=smart&amp;auto=webp&amp;s=f3c7a67eae691e988ecdaa8721ab7fd6d192e311', 'width': 320}, {'height': 479, 'url': 'https://external-preview.redd.it/aV_uSGPsCpp0G2_Punpuztn7JjEBs0Rn0IA6ggfHXSE.jpg?width=640&amp;crop=smart&amp;auto=webp&amp;s=b8d3f5502c9e02a9fc46f96b9bec1380ee800b59', 'width': 640}, {'height': 719, 'url': 'https://external-preview.redd.it/aV_uSGPsCpp0G2_Punpuztn7JjEBs0Rn0IA6ggfHXSE.jpg?width=960&amp;crop=smart&amp;auto=webp&amp;s=2b2aa7b2643fe42880b8a799ed6ff8732fad8381', 'width': 960}], 'source': {'height': 749, 'url': 'https://external-preview.redd.it/aV_uSGPsCpp0G2_Punpuztn7JjEBs0Rn0IA6ggfHXSE.jpg?auto=webp&amp;s=96e1658cad8270edaa179822f3deacd8e4649f94', 'width': 1000}, 'variants': {}}]}",6,1617976160,1,,,"I was inspired by watching Rotten on Netflix, and the subsequent research I did after that. 

The avocado industry has skyrocketed in the last 10 years, being marketed as a super food, trendy and a status symbol. 

With this boom, comes issues. Most of the US's avocados come from Mexico, where the industry has been contributing to habitat loss, climate change and loss of eco systems, as well as funding drug cartels. Who then, in turn, harass, kidnap and kill locals. 

Avocados are water hungry fruits, taking about 1000 litres of water to produce 1kg. In Chile, one of the main providers to Europe, local avocado farmers are being run out of business because they can't afford the water needed for their crops. Rivers have dried up, wells are drying up and the elite control the precious resource. I'm sure you can extrapolate what it means for the environment and human rights when the water drys up and is seen as a commodity, but those who have spoken up about it have received death threats. 

So what can you do? 

For Europe, buying the fruit from Spain ensures its traveled less, and ethically produced. 
For the US, its not that simple. Even home grown crop has its issues, because they need so much water, it contributes to the desertification of already arid states. 

Obviously, these options aren't perfect. The best you could do is decrease the amount you eat avocado, or stop altogether.  

If you want to find out more - 

https://www.peacefuldumpling.com/avocado-deforestation-cartels-droughts-wildlife-loss

https://sustainablefoodtrust.org/articles/why-our-love-for-avocados-is-not-sustainable/

https://www.google.com/amp/s/amp.theguardian.com/food/shortcuts/2018/dec/10/should-you-stop-eating-blood-avocados",True,False,False,vegan,t5_2qhpm,587838,public,self,,,Avocados and ethics - not vegan?,0,[],1.0,https://www.reddit.com/r/vegan/comments/mnhlqx/avocados_and_ethics_not_vegan/,,all_ads,6,Disturbing,dc972d74-f01f-11e2-8b35-12313b0cdc23,Disturbing,,,,,,
[],False,alwaysitchylena,,[],,text,t2_tv1wi,False,False,[],False,False,1617976108,self.vegan,https://www.reddit.com/r/vegan/comments/mnhlal/i_hate_when_people_say_they_dont_eat_meat_much/,{},mnhlal,True,False,False,False,True,True,False,,[],dark,text,False,,,False,True,20,0,False,all_ads,/r/vegan/comments/mnhlal/i_hate_when_people_say_they_dont_eat_meat_much/,False,,,6,1617976119,1,,,"My co-worked asked about why I'm vegan etc eventually she said how she doesn't eat meat much, and how shes very specific where she gets her meat from. 🙄

I hate when people say that, I used to get that experience when I told people I don't drink alcohol anymore. They're always like Ooohhh I dont really either!  Like nah... you do. I don't, at all. No alcohol free Tuesdays. I do not drink period. 

Same goes for veganism. I'm not a vegan part time... but people just havvvvvvee to tell you this. Cognitive dissonance. 🙄😒",True,False,False,vegan,t5_2qhpm,587837,public,self,,,I hate when people say they don't eat meat much,0,[],1.0,https://www.reddit.com/r/vegan/comments/mnhlal/i_hate_when_people_say_they_dont_eat_meat_much/,,all_ads,6,,,,,,,,,
[],False,quidiuris,,[],,text,t2_2n3ymh1l,False,False,[],False,False,1617973782,self.vegan,https://www.reddit.com/r/vegan/comments/mngucm/rhythm_108_delicious_vegan_chocolate/,{},mngucm,True,False,False,False,True,True,False,,[],dark,text,False,,,False,True,1,0,False,all_ads,/r/vegan/comments/mngucm/rhythm_108_delicious_vegan_chocolate/,False,,,6,1617973810,1,,,"I have to share this because Rhythm 108’s chocolate is genuinely the best I’ve ever tasted, and I haven’t seen any posts about them on here. Their website is: https://rhythm108.com/


If you’re buying straight from their website, they ship to UK, Switzerland, Germany, Belgium, Netherlands, France, and Ireland (sorry US, but I guess they might ship in the future). You can get most of their stuff from Sainsbury’s if you’re in the UK.",True,False,False,vegan,t5_2qhpm,587832,public,self,,,Rhythm 108 — delicious vegan chocolate,0,[],1.0,https://www.reddit.com/r/vegan/comments/mngucm/rhythm_108_delicious_vegan_chocolate/,,all_ads,6,,,,,,,,,
[],False,GustaQL,,[],transitioning to veganism,text,t2_3hpl215s,False,False,[],False,False,1617973505,self.vegan,https://www.reddit.com/r/vegan/comments/mngr8t/you_go_to_a_party_there_are_10_people_there_and/,{},mngr8t,True,False,False,False,True,True,False,,[],dark,text,False,,,False,True,37,0,False,all_ads,/r/vegan/comments/mngr8t/you_go_to_a_party_there_are_10_people_there_and/,False,,,6,1617973545,1,,,"So, more meat will be eaten if you dont eat meat. What would you do?

[View Poll](https://www.reddit.com/poll/mngr8t)",True,False,False,vegan,t5_2qhpm,587831,public,self,,,"You go to a party. there are 10 people there and you are deciding what is for dinner. you are the only vegan there. They challenge you by saying that if you eat a regular burger, the other 9 people will eat a vegan diner, but if you eat a vegan diner, then the rest of the party will eat a rgulr brgr",0,[],1.0,https://www.reddit.com/r/vegan/comments/mngr8t/you_go_to_a_party_there_are_10_people_there_and/,,all_ads,6,,,,,,,b794b724-b0b8-11e5-a63f-0ec593770487,dark,"{'is_prediction': False, 'options': [{'id': '7179380', 'text': 'Yeah I will eat 1 burger to keep 9 burgers from getting bought'}, {'id': '7179381', 'text': 'I prefer to not eat a burger'}, {'id': '7179382', 'text': 'show results'}], 'resolved_option_id': None, 'total_stake_amount': None, 'total_vote_count': 1, 'tournament_id': None, 'user_selection': None, 'user_won_amount': None, 'voting_end_timestamp': 1618232706081}"
