[],False,BikingInBasel43,,[],vegan newbie,text,t2_8g9t15b5,False,False,[],False,False,1617040824,self.vegan,https://www.reddit.com/r/vegan/comments/mfvf0n/when_was_the_first_seed_planted_into_your_mind/,{},mfvf0n,True,False,False,False,True,True,False,,[],dark,text,False,False,True,28,0,False,all_ads,/r/vegan/comments/mfvf0n/when_was_the_first_seed_planted_into_your_mind/,False,,,6,,1617040836,1,"First of all, I wanna apologize for my bad english, I'm not a native speaker, but I want to share my story and hear about yours.

When I was young I thought vegans were crazy and I remember joking around with my brother about those protein-deficient and opinion-forcing plant eaters. I knew about the facts of the inhumane circumstances of lifestock farming and the outrageous consequences for our enviroment, but never reflected on them.

This all changed when I was 13 in early 2016, I was eating my favourite dish - spaghetti bolognese - when I scrolled through the trending YouTube videos and a video called ""Fleischkonsum zerstört unseren Planeten"" (meat consumption destroys our planet) by the german vegan ""influencer"" Luna Darko came into my sight, she would influence me pretty much in the following year on what person I want to be in the future, she seemed pretty smart and empathic, and often talked about self-love, self discovery, feminism etc. (sadly she deleted this video and distanced herself from the label 'vegan' last year). At this time I was very open and interested in enviromental topics, so I clicked on this video, I remember listening to what she had to say, she sounded very calm, polite and friendly, but you could also tell that this was a very important topic to her, she talked mostly about the eniviroment, but also about the connections to starvation, deseases and health issues and ethics, I remember when she said ""I know this might be the least convincing point for most people, which I think is very sad, cause we should care about this, but a pig has the same cognitive capability as a 3 year old human"", but for me it was one of the most convincing points, beside those about the complex social structures and emotions of cows and chickens. In the following days I gave frequent thoughts on this matter and decided that I want to be vegan myself someday - but not now. My father cooked much meat at this time and I don't wanted the social stigma of a male vegan.

For some reason I didn't even made a first step in the following years, but I knew that becoming vegan was the only right thing to do. I informed myself further on this topic and often argued in favor of veganism, but when a dairy or meat product was on my plate I forgot about it. I devoloped a hobby in cooking in 2017 and became the chef of what I eat, I reduced my flesh consumption, but still ate much of it.

This changed in March 2020 when my school stopped because of a global zoonotic pandemic and I decided to make the first step and got veggie. I knew that this wasn't enough and that I still wanted to be vegan someday, but I loved cheese, which of course I knew isn't a proper reason to eat it, but nevertheless I still ate it. My father, with whom I live with, was very supportive, beside often making stupid jokes and statements.

I became very interested in health topics, and started practising and eating more vegetables, fruits, legumes and whole grains. I read many books and articles and nearly became obsessed with nutrition, so I discovered Niko Rittenau (german vegan nutritionist) and Dr. Michael Greger and read their books ""Vegan-Klischee ade"" (maybe the best book on nutrition, critical nutrients and debunking nutrition based stereotypes about veganism, sadly it's only available in german) and ""How not to die"", which had many shocking facts in it. So I decided to finally go vegan on my 1st anniversary of becoming vegetarian.

It's been one week and it's a miracle - There were 2/3 days in which I craved for cheese, but now, I don't even miss it anymore, despite our fridge being full of it. I am very happy that I'm finally vegan and regret that I haven't done it sooner.

But now I'm excited to hear about how your first seed was planted.",True,False,False,vegan,t5_2qhpm,583593,public,self,,,When was the first seed planted into your mind and how long did it take for you to go vegan?,0,[],1.0,https://www.reddit.com/r/vegan/comments/mfvf0n/when_was_the_first_seed_planted_into_your_mind/,,all_ads,6,,Discussion,0d26d52c-2ef1-11e5-8c17-0ec131dbf691,Discussion,74f7ac8e-f01f-11e2-9c31-12313b0cdc23,dark,,,,,,,,,
[],False,Some_Random_Vegan,,[],,text,t2_aqt4bdzg,False,False,[],False,False,1617038679,self.vegan,https://www.reddit.com/r/vegan/comments/mfum33/what_milk_is_better/,{},mfum33,True,False,False,False,True,True,False,,[],dark,text,False,False,False,5,0,False,all_ads,/r/vegan/comments/mfum33/what_milk_is_better/,False,,,6,,1617038690,1,"

[View Poll](https://www.reddit.com/poll/mfum33)",True,False,False,vegan,t5_2qhpm,583588,public,self,,,What Milk Is Better,0,[],1.0,https://www.reddit.com/r/vegan/comments/mfum33/what_milk_is_better/,,all_ads,6,,Question,3fa453f8-685e-11e9-862d-0ee93d557dce,Question,,,,,,,,,,"{'is_prediction': False, 'options': [{'id': '6938774', 'text': 'Soy'}, {'id': '6938775', 'text': 'Oat'}, {'id': '6938776', 'text': 'Almond'}, {'id': '6938777', 'text': 'Coconut'}, {'id': '6938778', 'text': 'Cashew'}, {'id': '6938779', 'text': 'Other'}], 'resolved_option_id': None, 'total_stake_amount': None, 'total_vote_count': 1, 'tournament_id': None, 'user_selection': None, 'user_won_amount': None, 'voting_end_timestamp': 1617643479000}",
[],False,MediumLocation5273,,[],,text,t2_81pd4cg1,False,False,[],False,False,1617038303,self.vegan,https://www.reddit.com/r/vegan/comments/mfuh4a/why_dont_more_of_us_suggest_a_gradual_change_away/,{},mfuh4a,True,False,False,False,True,True,False,,[],dark,text,False,False,True,65,0,False,all_ads,/r/vegan/comments/mfuh4a/why_dont_more_of_us_suggest_a_gradual_change_away/,False,,,6,,1617038313,1,"I understand the moral argument, and it makes me mad thinking about it, but asking someone to quit meat immediately is like asking a meth addict to quit cold turkey, it won’t work and it will disconnect us from them.

The problem I find with most people is that they truly have no exposure to vegan meals or ideology. That’s why so many people think food is only a meal if it has meat. And why they think that vegans are hippies.

Supporting a gradual change will at very least introduce new options for meals, leading to less death, and at best will make the future change much easier.

Maybe most of you agree, and it’s only the most vocal and public activists that support this kind of thinking (if so, should we change that?), or maybe I’m wrong, let me know what you think!

Sorry if this was an old topic, I couldn’t find a recent one.",True,False,False,vegan,t5_2qhpm,583583,public,self,,,Why don’t more of us suggest a gradual change away from animal products rather than an immediate switch to veganism.,0,[],1.0,https://www.reddit.com/r/vegan/comments/mfuh4a/why_dont_more_of_us_suggest_a_gradual_change_away/,,all_ads,6,,Discussion,0d26d52c-2ef1-11e5-8c17-0ec131dbf691,Discussion,,,,,,,,,,,
[],False,TheVSFMarket,,[],,text,t2_b502g55x,False,False,[],False,False,1617034808,self.vegan,https://www.reddit.com/r/vegan/comments/mft68r/the_vegan_soul_food_market_market_bites_episode_1/,{},mft68r,True,False,False,False,True,True,False,,[],dark,text,False,False,True,0,0,False,all_ads,/r/vegan/comments/mft68r/the_vegan_soul_food_market_market_bites_episode_1/,False,,,6,,1617034818,1,"(From Description on Youtube)

Welcome Non-Vegans and Vegan's Alike!  Even though we are targeting the Black community across the Diaspora and Africa, we welcome the world to be enriched and enlightened by our food, culture, and humanity.  This is a vegan lifestyle platform using a website/app and videos. 

Submissions from all who love vegan food is welcome.",True,False,False,vegan,t5_2qhpm,583563,public,self,,,The Vegan Soul Food Market: Market Bites Episode 1 on YouTube,0,[],1.0,https://www.reddit.com/r/vegan/comments/mft68r/the_vegan_soul_food_market_market_bites_episode_1/,,all_ads,6,,,,,,,,,,,,,,,
[],False,1997birthed,,[],,text,t2_a15xtmkx,False,False,[],False,False,1617033923,self.vegan,https://www.reddit.com/r/vegan/comments/mfsu5m/your_favorite_mushroomless_meat_substitutes/,{},mfsu5m,True,False,False,False,True,True,False,,[],dark,text,False,False,True,2,0,False,all_ads,/r/vegan/comments/mfsu5m/your_favorite_mushroomless_meat_substitutes/,False,,,6,,1617033933,1,"So I’m making this post to try and find some palatable meat substitutes I can share with my dad. Lately he’s been much more open to trying meat substitutes with me (before he would buy me vegan meat, but wouldn’t really want to try any so that was nice at least). 

The problem im running into unfortunately is that alot of the tastier ones ive had contain mushrooms in the ingredients and he’s highly allergic. So instead of buying up a ton of obscure brands ive never tried, I’m hoping some of you might have some good ideas on what I could get.",True,False,False,vegan,t5_2qhpm,583558,public,self,,,Your favorite mushroomless meat substitutes?,0,[],1.0,https://www.reddit.com/r/vegan/comments/mfsu5m/your_favorite_mushroomless_meat_substitutes/,,all_ads,6,,,,,,,,,,,,,,,
[],False,sometinecool,,[],,text,t2_9i4h7,False,False,[],False,False,1617031275,self.vegan,https://www.reddit.com/r/vegan/comments/mfrvyh/why_is_oat_milk_so_expensive/,{},mfrvyh,True,False,False,False,True,True,False,,[],dark,text,False,False,True,7,0,False,all_ads,/r/vegan/comments/mfrvyh/why_is_oat_milk_so_expensive/,False,,,6,,1617031286,1,"It's water, oats, suger and a dash of oil. Why are these companies charging €2.50-€4 for a shitty 1l carten while I'm seeing cows milk for half the price and twice as much! I get that dairy farms and products are subsidised hence the cheap price but I'm guessing grain farmers are the same right? 

Also it is probably the cheapest non dairy milk to make and the most sustainable as almost every county as a supply of oats growing somewhere in their country. Its not like we have to import a shit tonne to make the stuff. Am I missing something here? Can some explain this to me?",True,False,False,vegan,t5_2qhpm,583544,public,self,,,Why is oat milk so expensive!,0,[],1.0,https://www.reddit.com/r/vegan/comments/mfrvyh/why_is_oat_milk_so_expensive/,,all_ads,6,,Question,3fa453f8-685e-11e9-862d-0ee93d557dce,Question,,,,,,,,,,,
[],False,gplusplus314,,[],,text,t2_z1jzcop,False,False,[],False,False,1617026729,self.vegan,https://www.reddit.com/r/vegan/comments/mfqa8i/any_musicians_in_here_have_you_noticed_any/,{},mfqa8i,True,False,False,False,True,True,False,,[],dark,text,False,False,False,8,0,False,all_ads,/r/vegan/comments/mfqa8i/any_musicians_in_here_have_you_noticed_any/,False,,,6,,1617026753,1,"This post is a bit odd for this subreddit, but I think it’s sufficiently on-topic. First, my brief background is that I’ve been a musician for about 20 years and I’ve been *mostly* vegan for about 2 months. Lifestyle changes take work and time, so please forgive me for the “mostly” qualifier. I’m sure you all understand. 🙂

Anyhow, I immediately (within a day or two) started noticing measurable and subjective improvements in my health. My resting heart rate has lowered from 72 to 56 on average - holy smokes! My wedding ring is also looser. And that brings me to the subjective part. 

It’s fairly well known that a plant based diet lowers inflammation throughout the entire body as compared to a, for lack of a better term, “typical American diet.” But what I didn’t expect was that this would directly transfer to my ability to play my instrument. 

I’m a percussionist, which is basically a pompous high-brow term for drummer (badum-tschhh). When it comes to almost any instrument, a lot boils down to your technique, which determines your energy output and physical stress on soft tissue and joints. Well, in my case, my muscles have been able to fly through music and exercises as if I were 10 years younger, which was actually my peak physical condition. I get less tired, I’m less sore, and I recover much faster. My muscles aren’t are swollen after intense playing and I’m ready to go in less than half the recovery time. 

It’s insane. 

I wanted to share this because it has boosted my mood beyond anything I ever expected. I’m finally jazzed (😏) about drumming again after a 2 year hiatus due to various reasons. I didn’t think an unrelated lifestyle change would make such a huge impact, but it really did. 

Also related, my wife is also a musician (flutist) and she has reported a similar experience. 

I’ve been skeptical my whole life about vegan/plant-based diet/lifestyle. I really wish I tried this sooner. I just feel so much better overall. A boost toward getting back into my passion is seriously heart warming, too.",True,False,False,vegan,t5_2qhpm,583520,public,self,,,Any musicians in here? Have you noticed any changes while on a vegan diet? I have!,0,[],1.0,https://www.reddit.com/r/vegan/comments/mfqa8i/any_musicians_in_here_have_you_noticed_any/,,all_ads,6,,Uplifting,d6a5fb70-f024-11e2-8dba-12313b0ae2ae,Uplifting,,,,,,,,,,,
[],False,Genestrash,,[],,text,t2_ari0e3da,False,False,[],False,False,1617025268,self.vegan,https://www.reddit.com/r/vegan/comments/mfptb5/podcast_episode_can_dogs_and_cats_eat_cultured/,{},mfptb5,True,False,False,False,True,True,False,,[],dark,text,False,False,True,2,0,False,all_ads,/r/vegan/comments/mfptb5/podcast_episode_can_dogs_and_cats_eat_cultured/,False,self,"{'enabled': False, 'images': [{'id': 'llZH1O7Oj5QgHSd3g5UUpHdciGpy8y6uisOZOGrOJgY', 'resolutions': [{'height': 108, 'url': 'https://external-preview.redd.it/WxZO8Socad1K0GusEkhGSKxcYEw615h6cllu2iwL9C4.jpg?width=108&amp;crop=smart&amp;auto=webp&amp;s=b3d54ef024c430e526cdb9c4f4f70eebbe959ccc', 'width': 108}, {'height': 216, 'url': 'https://external-preview.redd.it/WxZO8Socad1K0GusEkhGSKxcYEw615h6cllu2iwL9C4.jpg?width=216&amp;crop=smart&amp;auto=webp&amp;s=7862821bdece02a4570fa429439bb7e3f66d5543', 'width': 216}, {'height': 320, 'url': 'https://external-preview.redd.it/WxZO8Socad1K0GusEkhGSKxcYEw615h6cllu2iwL9C4.jpg?width=320&amp;crop=smart&amp;auto=webp&amp;s=8f9e3da79f34d11ff1c52ea29dfddb54620c86f0', 'width': 320}, {'height': 640, 'url': 'https://external-preview.redd.it/WxZO8Socad1K0GusEkhGSKxcYEw615h6cllu2iwL9C4.jpg?width=640&amp;crop=smart&amp;auto=webp&amp;s=62cd67f0394061bd31eb400fb77bd9593587b8b7', 'width': 640}, {'height': 960, 'url': 'https://external-preview.redd.it/WxZO8Socad1K0GusEkhGSKxcYEw615h6cllu2iwL9C4.jpg?width=960&amp;crop=smart&amp;auto=webp&amp;s=8761fec2bc49d021653585ac9fae2cd8139d804a', 'width': 960}, {'height': 1080, 'url': 'https://external-preview.redd.it/WxZO8Socad1K0GusEkhGSKxcYEw615h6cllu2iwL9C4.jpg?width=1080&amp;crop=smart&amp;auto=webp&amp;s=6ec6e801b4c42d6d7a6db12f1c67e9c0f6906987', 'width': 1080}], 'source': {'height': 3000, 'url': 'https://external-preview.redd.it/WxZO8Socad1K0GusEkhGSKxcYEw615h6cllu2iwL9C4.jpg?auto=webp&amp;s=c0c9149c271d5c507680dd873fff033bf97494a9', 'width': 3000}, 'variants': {}}]}",6,,1617025329,1,"**Teach Me About Doggies** episode 41: [Can dogs and cats eat cultured meat?](https://teachmeaboutdoggies.libsyn.com/website/41-can-dogs-and-cats-eat-cultured-meat)

Episode description: Joshua Errett of Because Animals teaches us about the history of pet food, why ""lab-grown meat"" is a misnomer, and how his company is changing the way we feed our dogs and cats.",True,False,False,vegan,t5_2qhpm,583513,public,self,,,Podcast episode: Can dogs and cats eat cultured meat? 🐕🐈🍗,0,[],1.0,https://www.reddit.com/r/vegan/comments/mfptb5/podcast_episode_can_dogs_and_cats_eat_cultured/,,all_ads,6,,,,,,,,,,,,,,,
[],False,MANewbie,,[],,text,t2_109uix,False,False,[],False,False,1617022125,self.vegan,https://www.reddit.com/r/vegan/comments/mfoujf/human_nature_a_new_not_so_graphic_documentary/,{},mfoujf,True,False,False,False,True,True,False,,[],dark,text,False,False,True,0,0,False,all_ads,/r/vegan/comments/mfoujf/human_nature_a_new_not_so_graphic_documentary/,False,self,"{'enabled': False, 'images': [{'id': 'BoES2rPsFrZiHDfebMMX8M1BmwJJn3N1N8mhDV1lcGs', 'resolutions': [{'height': 81, 'url': 'https://external-preview.redd.it/MqVWbGd8EiBiPKU4qkHgBluL3HiCfICZb0cQ1mFDwyE.jpg?width=108&amp;crop=smart&amp;auto=webp&amp;s=f2ef216fe4afb49c6940111cabc422f4bf41c078', 'width': 108}, {'height': 162, 'url': 'https://external-preview.redd.it/MqVWbGd8EiBiPKU4qkHgBluL3HiCfICZb0cQ1mFDwyE.jpg?width=216&amp;crop=smart&amp;auto=webp&amp;s=a27c57eea3bb350b482019ab38cf18960277ef4a', 'width': 216}, {'height': 240, 'url': 'https://external-preview.redd.it/MqVWbGd8EiBiPKU4qkHgBluL3HiCfICZb0cQ1mFDwyE.jpg?width=320&amp;crop=smart&amp;auto=webp&amp;s=1c2df2966e69c04eafa51fffeac9ebf463037db9', 'width': 320}], 'source': {'height': 360, 'url': 'https://external-preview.redd.it/MqVWbGd8EiBiPKU4qkHgBluL3HiCfICZb0cQ1mFDwyE.jpg?auto=webp&amp;s=c7486986bea7b25539879e3a1cb069cdcdf115aa', 'width': 480}, 'variants': {}}]}",6,,1617022136,1,"Link: [https://www.youtube.com/watch?v=IGwx2ByvSm4](https://www.youtube.com/watch?v=IGwx2ByvSm4)   
It has subtitles for English, Spanish, French, German, Greek, Hungarian, Italian  


It was produced in Romania, and exposes the common horrible practices in regards to how we treat animals, not only in industry but also in the common rural households (which we often portray as ""oh, so idyllic and heaven-like for all the sweet animals that we exploit"")",True,False,False,vegan,t5_2qhpm,583507,public,self,,,"""Human Nature"" - a new (""not so graphic"") documentary about the horrible practices",0,[],1.0,https://www.reddit.com/r/vegan/comments/mfoujf/human_nature_a_new_not_so_graphic_documentary/,,all_ads,6,,,,,,,,,,,,,,,
[],False,florafordays49,,[],,text,t2_aa7er27c,False,False,[],False,False,1617021794,self.vegan,https://www.reddit.com/r/vegan/comments/mfor4i/relationship_advice_for_those_dating_non_vegans/,{},mfor4i,True,False,False,False,True,True,False,,[],dark,text,False,False,True,67,0,False,all_ads,/r/vegan/comments/mfor4i/relationship_advice_for_those_dating_non_vegans/,False,,,6,,1617021805,1,"My bf is usually considerate about my being vegan. However, last night I kind of teased out his opinion and I finally got him to say it. He thinks it's ""silly"" that I always have to ask if something is vegan before eating. He said he knows I mean well, but it's too much of an inconvenience for me. 

I guess he doesn't respect or understand my reasons. He's also said he respected people who are dairy free bc they get sick from eating dairy than people who choose to be dairy free for moral reasons. 

Part of me wants to educate him but I know he's got the wool over his eyes and will likely never give up meat or even dairy. I told him it's harder for him to take care of his dog and more inconvenient to have a pet than it is for me to be vegan. 

I am really in love so I'm not considering ending things over this but how do you agree to disagree while maintaining mutual respect?",True,False,False,vegan,t5_2qhpm,583506,public,self,,,Relationship advice for those dating non vegans?,0,[],1.0,https://www.reddit.com/r/vegan/comments/mfor4i/relationship_advice_for_those_dating_non_vegans/,,all_ads,6,,,,,,,,,,,,,,,
