all_awardings,allow_live_comments,author,author_flair_css_class,author_flair_richtext,author_flair_text,author_flair_type,author_fullname,author_patreon_flair,author_premium,awarders,can_mod_post,contest_mode,created_utc,domain,full_link,gildings,id,is_crosspostable,is_meta,is_original_content,is_reddit_media_domain,is_robot_indexable,is_self,is_video,link_flair_background_color,link_flair_richtext,link_flair_text_color,link_flair_type,locked,media_only,no_follow,num_comments,num_crossposts,over_18,parent_whitelist_status,permalink,pinned,post_hint,preview,pwls,removed_by_category,retrieved_on,score,selftext,send_replies,spoiler,stickied,subreddit,subreddit_id,subreddit_subscribers,subreddit_type,thumbnail,thumbnail_height,thumbnail_width,title,total_awards_received,treatment_tags,upvote_ratio,url,url_overridden_by_dest,whitelist_status,wls,is_gallery,link_flair_css_class,link_flair_template_id,link_flair_text,media,media_embed,secure_media,secure_media_embed,crosspost_parent,crosspost_parent_list,author_flair_template_id,author_flair_text_color,author_flair_background_color,poll_data
[],False,Gillett1998,,[],,text,t2_1j2f4rg,False,False,[],False,False,1617725410,self.vegan,https://www.reddit.com/r/vegan/comments/mlf6f4/ethical_meat_from_pestsinvasive_species/,{},mlf6f4,True,False,False,False,True,True,False,,[],dark,text,False,False,True,46,0,False,all_ads,/r/vegan/comments/mlf6f4/ethical_meat_from_pestsinvasive_species/,False,,,6,,1617725421,1,"I was wondering what people's opinions are regarding eating meat from invasive species/pests? I understand for alot of people they aren't vegan for environmental reasons and rather the animal rights, however for example in the UK, there are more deers than there have ever been (Due to predator extinction and the decrease in hunting), if they are left alone they completely destroy the landscape and environment (largely through preventing regeneration). Anyway I was wondering how people feel about this and whether as a vegan you can agree with it?",True,False,False,vegan,t5_2qhpm,586705,public,self,,,Ethical meat from pests/invasive species,0,[],1.0,https://www.reddit.com/r/vegan/comments/mlf6f4/ethical_meat_from_pestsinvasive_species/,,all_ads,6,,Question,3fa453f8-685e-11e9-862d-0ee93d557dce,Question,,,,,,,,,,
[],False,cc626,,[],,text,t2_5jvfzker,False,False,[],False,False,1617723790,self.vegan,https://www.reddit.com/r/vegan/comments/mlek9v/mellow_mushroom_plow_wings_off_menu/,{},mlek9v,True,False,False,False,True,True,False,,[],dark,text,False,False,False,2,0,False,all_ads,/r/vegan/comments/mlek9v/mellow_mushroom_plow_wings_off_menu/,False,,,6,,1617723800,1,I love mellow mushroom and I always get the Thai dye but I couldn’t find it online. I went ahead and just called to ask if it was available and they said it was! I then asked about the seitan philly and she told me they were out of the seitan but had vean wings that came with vegan ranch! I was so excited and ecstatic to find they were plow wings! Anyway I can’t find them anywhere online or on their menu!!!! But if you ask they have them available!!! I was wondering if anyone knew about these or what???,True,False,False,vegan,t5_2qhpm,586694,public,self,,,Mellow Mushroom Plow Wings (off menu?),0,[],1.0,https://www.reddit.com/r/vegan/comments/mlek9v/mellow_mushroom_plow_wings_off_menu/,,all_ads,6,,,,,,,,,,,,,,
[],False,MinimumPurpose4556,,[],,text,t2_7viwj66l,False,False,[],False,False,1617720281,self.vegan,https://www.reddit.com/r/vegan/comments/mld9qz/homework/,{},mld9qz,True,False,False,False,True,True,False,,[],dark,text,False,False,True,236,0,False,all_ads,/r/vegan/comments/mld9qz/homework/,False,,,6,,1617720292,1,I got an F for not meeting the requirements of my homework. I was supposed to record an experiment with eggs and gelatin for my chemistry class. I politely wrote to my teacher why I wouldn’t do it and I handed in a paper detailing what was supposed to happen and why. I also asked if I could record a different experiment to which she said no. She also gave me an F and told me that it wasn’t hard and that I should have done it regardles of my views. It wasn’t fair but i will gladly get an F if it means I am not contributing to the suffering of those animals.,True,False,False,vegan,t5_2qhpm,586669,public,self,,,Homework,0,[],1.0,https://www.reddit.com/r/vegan/comments/mld9qz/homework/,,all_ads,6,,Rant,93c0fe64-689e-11e5-b5be-0e7eccdaeabd,Rant,,,,,,,,,,
[],False,Slapajack,,[],,text,t2_ejs1i,False,False,[],False,False,1617710842,self.vegan,https://www.reddit.com/r/vegan/comments/mla4gh/worries_about_longterm_effects_of_veganism_from_a/,{},mla4gh,True,False,False,False,True,True,False,,[],dark,text,False,False,True,18,0,False,all_ads,/r/vegan/comments/mla4gh/worries_about_longterm_effects_of_veganism_from_a/,False,,,6,,1617710852,1,"Hey y'all,

I've been vegan for a bit more than a year now, and I generally feel fine. Lately, however, I've fallen into a hole of testimonies from people who started noticing bad health effects from their vegan diets after 2 years (or more). I don't know what to believe, because evidence seems to be scarce on either side (it's basically anecdotal all the time), but I really am worried that I am ruining my body by sticking to my ideals.
I really feel disgusted at the thought of going back to eating animal products, but all this stuff is making me scared that there is no way to maintain this diet for several decades without it affecting my health. 

I don't mean to discourage anyone reading this from engaging with a vegan diet! I'm just having a lot of doubts and I don't know how to deal with them.",True,False,False,vegan,t5_2qhpm,586622,public,self,,,Worries about long-term effects of veganism from a short-term vegan,0,[],1.0,https://www.reddit.com/r/vegan/comments/mla4gh/worries_about_longterm_effects_of_veganism_from_a/,,all_ads,6,,Health,e40086b4-f01f-11e2-8dd3-12313b0c8c59,Health,,,,,,,,,,
[],False,Hidemonsitsmeyaboi,,[],,text,t2_dpv5iys,False,False,[],False,False,1617709579,self.vegan,https://www.reddit.com/r/vegan/comments/ml9r1h/i_forgot_how_to_use_cheese/,{},ml9r1h,True,False,False,False,True,True,False,,[],dark,text,False,False,True,26,0,False,all_ads,/r/vegan/comments/ml9r1h/i_forgot_how_to_use_cheese/,False,,,6,,1617709590,1,"I've been getting vegan cheese for over a year now but since I cut out gluten (not bc of mumbo jumbo shit I'm actually gluten intolerant)  and I don't invest in them expensive gluten free breads anymore I literally don't know what to do with the yellow vegan cheese,I only bought it in the first place because it was on sale and wanted to boost the vegan cheese sales,no clue what to do with it. It melts just like dairy cheese,taste great,I have vegan feta which I usually put alongside any savoury dish but the yellow cheese idk what to do with...how do you guys eat cheese outside of the regular grilled cheese sandwich? Like unless you pair it with bread or something it doesn't make much sense does it? 


P.S. I don't understand people who don't like vegan cheese,maybe you haven't tried the right vegan cheese? dairy cheese smells like vomit, don't miss it at all",True,False,False,vegan,t5_2qhpm,586614,public,self,,,I forgot how to use cheese?,0,[],1.0,https://www.reddit.com/r/vegan/comments/ml9r1h/i_forgot_how_to_use_cheese/,,all_ads,6,,,,,,,,,,,,,,
[],False,rossonerijoe87,,[],,text,t2_5rjvptw1,False,False,[],False,False,1617707683,self.vegan,https://www.reddit.com/r/vegan/comments/ml98wy/wife_to_be_and_myself_have_been_vegan_now_for_a/,{},ml98wy,True,False,False,False,True,True,False,,[],dark,text,False,False,True,8,0,False,all_ads,/r/vegan/comments/ml98wy/wife_to_be_and_myself_have_been_vegan_now_for_a/,False,,,6,,1617707693,1,"We have been vegan now for a few months. Both enjoying every minute of it and wish we'd both done it alot sooner. 

Anyways our wedding is coming up soon and obviously our attire isn't vegan which has been playing on my mind for a bit now. Obviously when we booked our wedding and attire we weren't vegan. I can obviously wear a synthetic sporran, shoes etc..it can be changed no problem but as all the kilts for all the groomsmen have been measured and paid for it's a tough one to just cancel it when the wedding is approaching soon. It was all also paid for as a gift from my Dad which makes it even tougher.


Only positive I can see is that it's a hire and not an outright purchase. Just wanted another person's opinion and take on this subject as it's messing with my mind. It'd be really appreciated.

Thanks 😊",True,False,False,vegan,t5_2qhpm,586607,public,self,,,"Wife to be and myself have been vegan now for a few months, wedding is coming up soon. Kilt hire and wedding dress has been booked, fitted and paid for before going Vegan. What to do?",0,[],1.0,https://www.reddit.com/r/vegan/comments/ml98wy/wife_to_be_and_myself_have_been_vegan_now_for_a/,,all_ads,6,,,,,,,,,,,,,,
[],False,JonoKermin,,[],,text,t2_rm4h2,False,False,[],False,False,1617702502,self.vegan,https://www.reddit.com/r/vegan/comments/ml80cn/carrageenan_free_omega3_with_dha_and_epa_uk/,{},ml80cn,True,False,False,False,True,True,False,,[],dark,text,False,False,True,1,0,False,all_ads,/r/vegan/comments/ml80cn/carrageenan_free_omega3_with_dha_and_epa_uk/,False,,,6,,1617702513,1,"Have been trying to get some Omega-3 suppliments for my partner and I, but they suffer with indigestion problems. Have read that Carrageenan can cause inflammation so wanted to avoid it and get some suppliments that are less about the ALA (eat plenty of flaxseed) and more about the DHA and EPA. Has anyone found this mythical entity yet? Have been searching high and low online for a UK supplier but with no luck. Any suggestions would be appreciated please!

In short, Omega-3 with DHA and EPA but with no Carrageenan?

Thanks!",True,False,False,vegan,t5_2qhpm,586578,public,self,,,Carrageenan free Omega-3? WITH DHA and EPA? UK,0,[],1.0,https://www.reddit.com/r/vegan/comments/ml80cn/carrageenan_free_omega3_with_dha_and_epa_uk/,,all_ads,6,,,,,,,,,,,,,,
[],False,EasySiamesy,,[],,text,t2_b5eo0mfh,False,False,[],False,False,1617693695,self.vegan,https://www.reddit.com/r/vegan/comments/ml62u6/any_fellow_vegans_have_experience_with_dry_hair/,{},ml62u6,True,False,False,False,True,True,False,,[],dark,text,False,False,True,16,0,False,all_ads,/r/vegan/comments/ml62u6/any_fellow_vegans_have_experience_with_dry_hair/,False,,,6,,1617693705,1,"I’ve been trying everything under the sun to repair my skin’s moisture barrier. My face constantly feels tight &amp; stingy and I have enlarged pores. It’s been around 4 years since my complexion appeared bright &amp; dewy. Like I said, I’ve tried everything. My hair is also dry and full of split ends. 


I’ll eventually once again see a doctor about it(last one I saw had zero suggestions) but I’m wondering if anyone else is having this problem or has recovered from this problem. 


Note: it didn’t start when I became vegan. I’ve been a vegan for many years.  I don’t get the recommended amount of protein for my size(overweight) but I generally get at least 40 grams a day. I also take flax oil, an omega blend, a multi, D, calcium, iron, &amp; a few other supplements.",True,False,False,vegan,t5_2qhpm,586520,public,self,,,Any fellow vegans have experience with dry hair &amp; skin(loss of moisture barrier)? What were you missing?,0,[],1.0,https://www.reddit.com/r/vegan/comments/ml62u6/any_fellow_vegans_have_experience_with_dry_hair/,,all_ads,6,,Health,e40086b4-f01f-11e2-8dd3-12313b0c8c59,Health,,,,,,,,,,
[],False,GuiltyPapaya1456,,[],,text,t2_88w4e4m1,False,False,[],False,False,1617693348,self.vegan,https://www.reddit.com/r/vegan/comments/ml5zrd/a_very_sad_situation_a_call_for_advice/,{},ml5zrd,True,False,False,False,True,True,False,,[],dark,text,False,False,True,7,0,False,all_ads,/r/vegan/comments/ml5zrd/a_very_sad_situation_a_call_for_advice/,False,,,6,,1617693358,1,"Hello everyone, thank you in advance for taking the time to read.   


We'll cut straight to the chase here. I recently accepted a new job (I am a bartender) at a bar which has been absolutely great, although the building is rather old. Why that's worth bringing up is because it allows the entry of at least several mice. You can probably imagine the attitude towards them harboured by the nonvegan management (who are honestly good people, just not ones who happen to be vegan).   


I am vegan myself and love animals. But, I am also aware of the sanitation issues they present in this case, which are made even more pressing in an environment such as a restaurant or bar, so I am really torn on this one. 

&amp;#x200B;

The management has set up traps around the place, which is painful enough for me to see, but my biggest point of contention is that they are using glue traps to get the poor little guys who just wanted to come in from the cold and eat some pub food (don't we all?). I am sure I don't need to tell you how horribly and gratuitously cruel those things are.   


I am just wondering, as a vegan, what is the course of action I should take that best balances practicality and compassion? I know welfarism is seen by many vegans as a tepid half measure against animal suffering, which I have nuanced feelings about, but maybe I could at least get them to use a quicker acting trap, or ideally something much much much more humane in place of that horrendous way to die. Only catch is, nobody else there is vegan, and we all know how much people traditionally sympathise with mice (or the idea of doing anything a vegan says), so I feel like this will be an uphill climb. Furthermore, I am, as I said, very new at my job, and I must admit I would ideally like to evade being labelled as 'that guy' who gets a new job and then feels entitled to tell the management how to run their business. 

&amp;#x200B;

I'm sure I have forgotten pertinent details, but that's all I have for now. Feel free to ask for any clarification you may wish for and I will comment back. I don't know what to do, but I feel as though something absolutely must be done. Thus, I turn to you, my fine vegan comrades, to give me your kind and rational perspectives.",True,False,False,vegan,t5_2qhpm,586521,public,self,,,A very sad situation; A call for advice.,0,[],1.0,https://www.reddit.com/r/vegan/comments/ml5zrd/a_very_sad_situation_a_call_for_advice/,,all_ads,6,,,,,,,,,,,,,,
[],False,Heyguysloveyou,,[],,text,t2_3p6lxfqj,False,False,[],False,False,1617693173,self.vegan,https://www.reddit.com/r/vegan/comments/ml5y9y/i_am_vegan_since_almost_a_year_now_and_i_feel/,{},ml5y9y,True,False,False,False,True,True,False,,[],dark,text,False,False,True,17,0,False,all_ads,/r/vegan/comments/ml5y9y/i_am_vegan_since_almost_a_year_now_and_i_feel/,False,,,6,,1617693184,1,"My heart gets sometimes very heavy to a point, where it feels like someone is pressing on it.  
I have this since a while now and I asked my sister (she is a nurse) two months ago, what she thinks this could be.

She says, it's normal for my age. Something about the heart making new cells and she having the same problem at my age.

I was glad and it even stopped for a while after that. I also stopped drinking cola after that.

However since a few weeks it's back and worse than ever. I went to the doctor a few months too and told him about it. He checked my blood and said everything was good, my heart beat was normal too and he pretty much gave me the same answer as my sister.

However it really hurts sometimes now.

Vegans have lower risks for cancer and heart failure, so I doubt it has anything to do with my diet, but I thought I still ask if anyone knows something.

I take my B12 supplements almost everyday and don't go through much stress right now.

I am 19 years old, male, 6 feet and weigh around 60 kg.",True,False,False,vegan,t5_2qhpm,586521,public,self,,,"I am vegan since almost a year now and I feel great, I even gained some weight, however my heart troubles me a bit.",0,[],1.0,https://www.reddit.com/r/vegan/comments/ml5y9y/i_am_vegan_since_almost_a_year_now_and_i_feel/,,all_ads,6,,Health,e40086b4-f01f-11e2-8dd3-12313b0c8c59,Health,,,,,,,,,,
[],False,idontinhale,,[],,text,t2_59swk813,False,False,[],False,False,1617686458,self.vegan,https://www.reddit.com/r/vegan/comments/ml4cao/there_is_nothing_like_dating_another_vegan/,{},ml4cao,True,False,False,False,True,True,False,,[],dark,text,False,False,True,65,0,False,all_ads,/r/vegan/comments/ml4cao/there_is_nothing_like_dating_another_vegan/,False,,,6,,1617686469,1,"My gf and I have only been together for two months. She knew I had no plans for Easter because I’m not close with my family and texted me last night asking if I wanted to hang out. I said yes of course! 

When she got here, she handed me three heavy containers full of food. There was tofurkey, stuffing, chickpea cordon bleu, scalloped potatoes, and dessert. I was completely blown away by the amount of effort she put into making sure I had an amazing vegan feast. After being sad and eating only two Boca chik’n patties all day, I inhaled the food lol

Holidays suck for me but my gf made it a million times better. I’m going to cherish this woman :)",True,False,False,vegan,t5_2qhpm,586491,public,self,,,There is nothing like dating another vegan!,0,[],1.0,https://www.reddit.com/r/vegan/comments/ml4cao/there_is_nothing_like_dating_another_vegan/,,all_ads,6,,,,,,,,,,,,,,
[],False,NjalUlf,,[],,text,t2_4xpicnsj,False,False,[],False,False,1617685765,self.vegan,https://www.reddit.com/r/vegan/comments/ml45zh/what_did_you_think_of_seaspiracy/,{},ml45zh,True,False,False,False,True,True,False,,[],dark,text,False,False,True,1,0,False,all_ads,/r/vegan/comments/ml45zh/what_did_you_think_of_seaspiracy/,False,,,6,,1617685775,1,"I have yet to get the chance to watch it, but I see there are plenty of ""DEBUNKED"" videos on youtube, and other non-vegan people talking about how great it was. I only know one IRL vegan that saw it and he said it was basically a mixed bag of nuts. Meaning some was good, some was bad but ok altogether.",True,False,False,vegan,t5_2qhpm,586488,public,self,,,What did you think of Seaspiracy?,0,[],1.0,https://www.reddit.com/r/vegan/comments/ml45zh/what_did_you_think_of_seaspiracy/,,all_ads,6,,,,,,,,,,,,,,
[],False,dantedantex,,[],,text,t2_5nuzqt59,False,False,[],False,False,1617685603,self.vegan,https://www.reddit.com/r/vegan/comments/ml44j0/i_saw_chickens_today3/,{},ml44j0,True,False,False,False,True,True,False,,[],dark,text,False,False,True,4,0,False,all_ads,/r/vegan/comments/ml44j0/i_saw_chickens_today3/,False,,,6,,1617685615,1,"i was with my mom, she was the one who noticed them first. she said ""awww look at them!! so cute"", and i instantly replied ""yeah, they were especially cuter being dead and cooked on your plate this morning!"" her smile vanished instantly lol...

Also something very strange happened; my mom tried to get close to them but they just kept running away from her?? but when i tried, they would let me pet them and even grab them for a couple of seconds... did they sense she is a monster? or maybe i just have a strong connection with animals? or both??? something simmilar happens with my cats",True,False,False,vegan,t5_2qhpm,586487,public,self,,,i saw chickens today&lt;3,0,[],0.99,https://www.reddit.com/r/vegan/comments/ml44j0/i_saw_chickens_today3/,,all_ads,6,,Story,192cac22-7509-11e9-9af9-0e36ec779de6,Story,,,,,,,,,,
[],False,ghown1365,,[],,text,t2_2jaro403,False,False,[],False,False,1617683235,self.vegan,https://www.reddit.com/r/vegan/comments/ml3hqw/not_all_vegan_chocolates_is_cruelty_free/,{},ml3hqw,True,False,False,False,True,True,False,,[],dark,text,False,False,True,18,0,False,all_ads,/r/vegan/comments/ml3hqw/not_all_vegan_chocolates_is_cruelty_free/,False,,,6,,1617683245,1,"If you count humans as animals and your going vegan then you should know majority of cocoa is produced using child labor and those children are abused. Nestle, Hershy's, and Mars bars get there cocoa from those areas that use slavery. So KitKat vegan bar still probably got there cocoa from child labor areas. And some 'vegan' chocolates get there cocoa from there too. I'm not vegan myself but just warning you. 

And I know vegans feel horrible when they eat something that involved cruelty. But it's just that it seems like vegans, and vegan brands ignore that some food that is vegan itself is sometimes non vegan produces by using slaves. If vegan brands say animal cruelty free it might not be true. Humans are animals too. It's surprising to because peta promotes chocolate vegan brands and some of them get there cocoa from the areas the use child labor. I guess peta doesn't count humans as cruelty free.",True,False,False,vegan,t5_2qhpm,586472,public,self,,,Not all vegan chocolates is cruelty free.,0,[],1.0,https://www.reddit.com/r/vegan/comments/ml3hqw/not_all_vegan_chocolates_is_cruelty_free/,,all_ads,6,,,,,,,,,,,,,,
[],False,StressBunnySD,,[],,text,t2_8xw549hl,False,False,[],False,False,1617682936,self.vegan,https://www.reddit.com/r/vegan/comments/ml3elh/need_some_nice_words_pls/,{},ml3elh,True,False,False,False,True,True,False,,[],dark,text,False,False,True,20,0,False,all_ads,/r/vegan/comments/ml3elh/need_some_nice_words_pls/,False,,,6,,1617682947,1,"Hi all , please shoot me some words of encouragement . I been vegan a little over 6 months now , and I’m really happy with the decision I’ve made morally , I just already struggle w so much social anxiety and don’t have any vegan friends . Today my friend forgot her wallet when we went on a walk and was looking to buy some oat milk , I told her I could pay for it and she Venmo me, but when we got to the store they only had milk and I told her sorry but I don’t feel comfortable buying it for her. She got really quiet and the rest of the walk was so uncomfortable. I know I made the choice I feel best about . I don’t want to compromise my principles . But there’s just so many little moments like these that feel so unfair . Why should I feel rejected for standing up for what I believe ?? I even apologized when I said it . Ug . Pls send me encouraging words . I just feel so sensitive and annoying and I know part of this process is gonna be isolating and there’s no way around it . Pls send lovvve ❤️",True,False,False,vegan,t5_2qhpm,586470,public,self,,,Need some nice words pls ❤️,0,[],1.0,https://www.reddit.com/r/vegan/comments/ml3elh/need_some_nice_words_pls/,,all_ads,6,,,,,,,,,,,,,,
[],False,IdumpedMincraft,,[],,text,t2_3fhl0f5b,False,False,[],False,False,1617682580,self.vegan,https://www.reddit.com/r/vegan/comments/ml3auk/no_dogs_and_cats_are_not_meant_to_be_vegan/,{},ml3auk,True,False,False,False,True,True,False,,[],dark,text,False,False,True,7,0,False,all_ads,/r/vegan/comments/ml3auk/no_dogs_and_cats_are_not_meant_to_be_vegan/,False,,,6,,1617682591,1,"People are omnivores, and omnivores can survive on a solely plant based diet. However, while animals like dogs can eat plenty of plants and be perfectly fine, their bodies simply cannot survive on plant/plant based diets. The same goes for cats.

If you are giving one of your pets (that are naturally meat eaters) only plants, it is indefinitely going to hurt them. This post isn't to be mean but I thought some people might need to hear it :)",True,False,False,vegan,t5_2qhpm,586470,public,self,,,"No, dogs and cats are not meant to be vegan.",0,[],1.0,https://www.reddit.com/r/vegan/comments/ml3auk/no_dogs_and_cats_are_not_meant_to_be_vegan/,,all_ads,6,,Wildlife,043b2238-2ef1-11e5-ab94-0e610b6925bb,Wildlife,,,,,,,,,,
[],False,Upstairs_Hedgehog_23,,[],,text,t2_amum94h3,False,False,[],False,False,1617680658,self.vegan,https://www.reddit.com/r/vegan/comments/ml2qoo/what_are_your_thoughts_on_dominion/,{},ml2qoo,True,False,False,False,True,True,False,,[],dark,text,False,False,True,17,0,False,all_ads,/r/vegan/comments/ml2qoo/what_are_your_thoughts_on_dominion/,False,,,6,,1617680668,1,"Really don’t know what to think of the doc. Like knew aussies were crazy but like that crazy?!?!. I think it should be more a doc for change within agri sector in Australia more then a vegan doc. Geniuses who made it anyway making money from free footage. What are the thought??🤔🤔

[View Poll](https://www.reddit.com/poll/ml2qoo)",True,False,False,vegan,t5_2qhpm,586461,public,self,,,What are your thoughts on Dominion,0,[],1.0,https://www.reddit.com/r/vegan/comments/ml2qoo/what_are_your_thoughts_on_dominion/,,all_ads,6,,,,,,,,,,,,,,"{'is_prediction': False, 'options': [{'id': '7100712', 'text': 'Yes'}, {'id': '7100713', 'text': 'No'}, {'id': '7100714', 'text': 'Good for the wrong/different reason'}], 'resolved_option_id': None, 'total_stake_amount': None, 'total_vote_count': 0, 'tournament_id': None, 'user_selection': None, 'user_won_amount': None, 'voting_end_timestamp': 1617939857000}"
