all_awardings,allow_live_comments,author,author_flair_css_class,author_flair_richtext,author_flair_text,author_flair_type,author_fullname,author_patreon_flair,author_premium,awarders,can_mod_post,contest_mode,created_utc,domain,full_link,gildings,id,is_crosspostable,is_meta,is_original_content,is_reddit_media_domain,is_robot_indexable,is_self,is_video,link_flair_background_color,link_flair_richtext,link_flair_text_color,link_flair_type,locked,media_only,no_follow,num_comments,num_crossposts,over_18,parent_whitelist_status,permalink,pinned,pwls,retrieved_on,score,selftext,send_replies,spoiler,stickied,subreddit,subreddit_id,subreddit_subscribers,subreddit_type,thumbnail,title,total_awards_received,treatment_tags,upvote_ratio,url,whitelist_status,wls,link_flair_css_class,link_flair_template_id,link_flair_text,post_hint,preview,removed_by_category,thumbnail_height,thumbnail_width,url_overridden_by_dest,author_flair_template_id,author_flair_text_color,poll_data,media,media_embed,secure_media,secure_media_embed,is_gallery,crosspost_parent,crosspost_parent_list,author_flair_background_color,banned_by
[],False,vystriss,,[],,text,t2_12v0yk,False,False,[],False,False,1617911371,self.vegan,https://www.reddit.com/r/vegan/comments/mmzwmh/i_had_no_ideas_vegetarians_hated_vegans_so_much/,{},mmzwmh,True,False,False,False,True,True,False,,[],dark,text,False,False,True,92,0,False,all_ads,/r/vegan/comments/mmzwmh/i_had_no_ideas_vegetarians_hated_vegans_so_much/,False,6,1617911382,1,"Holy Moly!  Almost a decade long vegetarian who went vegan \~5 weeks ago after watching Dominion with my family.  I posted in the subreddit vegetarianism (that is for both vegans and vegetarians) this morning asking (seriously) vegetarians there why they choose to be vegetarian over vegan.  I told my story (I was one of those ""I can't go with cheese"" people), asked other's to share theirs, and responded to comments in an encouraging and supportive way.  I was straight up flabbergasted by the way some people responded back, as well as some of the PMs I received attacking me and my family?!  Good lawd!  I knew it was going to be rough hearing all the opinions from meat-eaters but did not expect that from vegetarians.  I brought it upon myself I suppose haha.  Bless my little naïve heart.",True,False,False,vegan,t5_2qhpm,587612,public,self,I had no ideas vegetarians hated vegans so much!,0,[],1.0,https://www.reddit.com/r/vegan/comments/mmzwmh/i_had_no_ideas_vegetarians_hated_vegans_so_much/,all_ads,6,,,,,,,,,,,,,,,,,,,,,
[],False,dwide_k_shrude,,[],vegan newbie,text,t2_bfog48v,False,False,[],False,False,1617911229,self.vegan,https://www.reddit.com/r/vegan/comments/mmzuri/what_type_of_milk_do_you_use_the_most/,{},mmzuri,True,False,False,False,True,True,False,,[],dark,text,False,False,True,14,0,False,all_ads,/r/vegan/comments/mmzuri/what_type_of_milk_do_you_use_the_most/,False,6,1617911240,1,"

[View Poll](https://www.reddit.com/poll/mmzuri)",True,False,False,vegan,t5_2qhpm,587611,public,self,What type of milk do you use the most?,0,[],1.0,https://www.reddit.com/r/vegan/comments/mmzuri/what_type_of_milk_do_you_use_the_most/,all_ads,6,Question,3fa453f8-685e-11e9-862d-0ee93d557dce,Question,,,,,,,74f7ac8e-f01f-11e2-9c31-12313b0cdc23,dark,"{'is_prediction': False, 'options': [{'id': '7164370', 'text': 'Almond'}, {'id': '7164371', 'text': 'Soy'}, {'id': '7164372', 'text': 'Oat'}, {'id': '7164373', 'text': 'Coconut'}, {'id': '7164374', 'text': 'Cashew'}, {'id': '7164375', 'text': 'Other'}], 'resolved_option_id': None, 'total_stake_amount': None, 'total_vote_count': 1, 'tournament_id': None, 'user_selection': None, 'user_won_amount': None, 'voting_end_timestamp': 1618516028000}",,,,,,,,,
[],False,FormalBlock6489,,[],,text,t2_a5micupx,False,False,[],False,False,1617911213,self.vegan,https://www.reddit.com/r/vegan/comments/mmzujj/i_need_advice/,{},mmzujj,True,False,False,False,True,True,False,,[],dark,text,False,False,True,9,0,False,all_ads,/r/vegan/comments/mmzujj/i_need_advice/,False,6,1617911224,1,"My partner and I made the decision to go fully plant based a few months ago, it was an awesome decision that has been such a positive impact on us mentally and physically. I’m really interested in nutrition and have done a lot of research which lead myself and my partner to making the switch wanting the best for our health, our sons health, the planet and the animals. 
My only issue is confrontation, the negativity I’m receiving from a few family members and others is really impacting my mental health because I’m just awful at speaking my mind when I am confronted, it’s making social situations extremely difficult for me. 
Does anyone have any advice on how to confront or converse with people who are so ignorant to the subject?",True,False,False,vegan,t5_2qhpm,587610,public,self,I need advice,0,[],1.0,https://www.reddit.com/r/vegan/comments/mmzujj/i_need_advice/,all_ads,6,,,,,,,,,,,,,,,,,,,,,
[],False,swift_sparrow,,[],,text,t2_a4uwn3pb,False,False,[],False,False,1617907497,self.vegan,https://www.reddit.com/r/vegan/comments/mmyifi/friendly_vegan_seeks_housing_in_boulder/,{},mmyifi,True,False,False,False,True,True,False,,[],dark,text,False,False,True,1,0,False,all_ads,/r/vegan/comments/mmyifi/friendly_vegan_seeks_housing_in_boulder/,False,6,1617907507,1,"Hello there!  


Firstoff, reading the threads, I hope everyone stays safe today under this bomb threat news.

I'm looking for a single availability or apartment/house to share with \[an\]other vegan\[s\]. I can pitch in about $800/month, but am flexible.  


I'm friendly, productive, social, respectful, clean, COVID-conscious and responsible. I can be outgoing as well as leave others to their privacy or parties. I enjoy hiking, cooking, listening to many genres of music (not honkytonk...), and being a helpful community member. I typically vape Cannabis, but would love the freedom to smoke it indoors as well. Currently moving from Frederick to be closer to the mountains, and ideally would love to find my own place or one with some like-minded people!  


My requirements are a private or strictly vegan kitchen as well as a private bathroom or one shared with only one other individual. I'd prefer not to live with couples, dogs or other noisy animals (love 'em, but I want assured peace and no dog hair). Cats and reptiles, etc. probably fine.  


Looking to live in or close to Boulder. Ideally, a monthly lease. Let me know if you know of any opportunities for me/us!

Pics of me and/or more info available on request.",True,False,False,vegan,t5_2qhpm,587591,public,self,Friendly Vegan Seeks Housing in Boulder,0,[],1.0,https://www.reddit.com/r/vegan/comments/mmyifi/friendly_vegan_seeks_housing_in_boulder/,all_ads,6,,,,,,,,,,,,,,,,,,,,,
[],False,dogangels,,[],veganarchist,text,t2_1h86z2dy,False,False,[],False,False,1617906916,self.vegan,https://www.reddit.com/r/vegan/comments/mmyb05/effective_forms_of_activism_during_a_pandemic/,{},mmyb05,True,False,False,False,True,True,False,,[],dark,text,False,False,False,7,0,False,all_ads,/r/vegan/comments/mmyb05/effective_forms_of_activism_during_a_pandemic/,False,6,1617906928,1,"I feel like making good choices for myself isn’t cutting it, at all. I would like to do something more meaningful and get out there, but there aren’t really any in person events due to the pandemic, and I don’t know what else to do. I want to hand out leaflets when I go back to school in person but that’ll be in a few months. Any suggestions?",True,False,False,vegan,t5_2qhpm,587585,public,self,Effective forms of activism during a pandemic?,0,[],1.0,https://www.reddit.com/r/vegan/comments/mmyb05/effective_forms_of_activism_during_a_pandemic/,all_ads,6,Question,3fa453f8-685e-11e9-862d-0ee93d557dce,Question,,,,,,,a267b3ba-3ff9-11e3-a1fd-12313d21c4ee,dark,,,,,,,,,,
[],False,MettaSuttaVegan,,[],,text,t2_bc8dvfqb,False,False,[],False,False,1617906707,self.vegan,https://www.reddit.com/r/vegan/comments/mmy896/looking_for_some_inspiration_possibly_cooperation/,{},mmy896,True,False,False,False,True,True,False,,[],dark,text,False,False,False,2,0,False,all_ads,/r/vegan/comments/mmy896/looking_for_some_inspiration_possibly_cooperation/,False,6,1617906717,1,"If this isn't allowed in r/vegan I'm sorry. Take the post down.

\---

Hello to all you wonderful green people of [r/vegan](https://www.reddit.com/r/vegan)

First of all I want to say three crucial things:

\#1 From the bottom of my heart, thank you for choosing compassion over fear and suffering. This is the most important thing we as vegans need to remember and remind ourselves each and every day if we are to live at peace with the fact that we are vegan in a non-vegan. 

\#2 I hope to make it as straightforward as possible that my intention of writing this post is not about an egotistical gathering of attention to and around me and my work. Let me be the first to say that the most critical voice that I will ever hear about what I do is my own voice. This post is because I'd like to stretch a hand of compassion and offer an opportunity to those who resonate with me. This project of mine has been a considerable source of personal growth, and I'd like to try at least to inspire someone to join me. I'm doing this because this is what I would have liked to see more of in my own ideal world.

\#3 I hope to clarify that I don't sell anything, nor that I am going to. This post is not about trying to get people to WATCH my content. It's about asking WHAT the vegan community would like to see and hear more of. 

For the animals, together we stand strong!

\---Abstract/TLDR---

What kind of content would you, yourself, have wanted to see produced on YouTube? 

Is there anything I can help you with to make you start producing your own videos on YouTube? 

Are there any specific topics, questions, or things I can make to help people be inspired to become vegan or make vegans be inspired to become active for the animals? 

Is there any suffering (vystopia) which people struggle with, and I can help alleviate through inspiring videos and content on YouTube or otherwise? 

Any other questions, information, contact info about me, or anything else, please leave a comment. It would mean the whole world to me to get feedback from you.

\---lengthy post with lots of details about who I am, where I'm from, what drives me and why I do what I do follows--- 

So basically what drives, and makes me want to innovate is largely fuelled by the profound amount of energy, and gratitude I get from just the simple fact of being vegan, from just having the flame and feeling within me of the knowledge that every day that I live life, I'm sparing animals from being killed. That is what I fundamentally want to pass on to the other people of the vegan community. I really want to help alleviate the suffering people feel about how humanity is treating animals. I want to help people see and realize that we do the things we do to animals because we are unconscious. 

This is what the brand I have created since November 2020 has turned into today. 

Metta Sutta Vegan Activism:

The name ""Metta Sutta"" is inspired by a Buddhist text about the cultivation of goodwill, and it's something I really found inspiring because it's what we as vegans do towards animals.

This is what I've been doing in the vegan community the last few weeks (I've only recently started being active)

\*I've been active in Facebook comments on agricultural/vegan groups for the last month 

\*Me and my girlfriend started a podcast (Norwegian podcast) this easter - it's gotten great responses from our closest vegan friends and the community!

\*I have invested around 2000 dollars in hardware for creating high-quality videos: mirrorless camera, professional recording software, microphones, website, ads, etc...

\*Recently, I started producing videos on YouTube. This will be my primary focus from now on. I'm working intensely on upgrading the quality of those videos by working on myself, which is a major reason as to why I'm asking the community for feedback and constructive criticism.

\*Recently started a Metta Sutta Instagram where me and my girlfriend will be collecting and posting inspirational videos, quotes and all things that makes the hearts of vegans melt in joy from the love of animals.

\*Recently became active in reddit (this account is 3 days old :) )

I know me posting this may be something that I regret doing ""too soon."" Still, I would rather get some genuine feedback about my work thus far, and hopefully some guidance on where to go from now on and, hopefully, find someone that would like to connect more with me. 

From the understanding that the reason we as a human race do these things to animals stems from an unconscious state of mind, we as vegans can ourselves become liberated from the constant judging, and maybe more fully start to communicate to the meat-eaters in more effective ways? That's my highest hope, and I wish someone has some thoughts about how we can do this. I've read the book ""A Plea for the Animals"" by a Buddhist monk called Matthieu Ricard and recently listened to ""The Joyful Vegan"" by Colleen Patrick-Goudreau. I find these books highly inspiring, and I want to pass along that inspiration in video and podcast format. And what I'm hoping is that if anyone resonates with anything written here, I would like you to get to know me a little better and work together to find out how to speak our truth to the world more effectively.

I'm trying to offer to create a place, a circle of innovation and inspiration that will hopefully blossom into a beautiful space of support and clarity, and my highest wish is that you would be a part of it!

\---

A little bit more about me: I'm 22 years old, I've been vegan for 1,5 years now, and l live in Norway. When I first went vegan, I was met with so much resistance from family, friends, and the society around me, and the path from the transition to veganism to the present day, has been a really hard, but rich learning experience. What I really want to do with my work is to inspire vegans to live happily with the knowing that they are doing the right thing, as well as (hopefully) helping meat-eaters realize that choosing compassion is the right choice.

How our truth needs to be spoken is in a way that connects with those people's minds, at their stage of development, through the heart, in a way that's relatable, in my opinion. 

If anyone is interested in checking me out, I do have a website: [www.mettasutta.net](https://www.mettasutta.net/) \- although I'd like to mention that the website is not fully finished yet, it's under construction. Alternatively check out my youtube channel. I recently deleted all my videos from other channels, and reuploaded the best I've made thus far on my main channel ""Metta Sutta"". Some are English, some are Norwegian.  
[https://www.youtube.com/channel/UCAkJcRMcWoY2fsJBF5uXCTQ](https://www.youtube.com/channel/UCAkJcRMcWoY2fsJBF5uXCTQ)  
If there is anything particularly good or bad about my videos thus far, feedback is highly appreciated.   


I will be actively responding to whatever does (or doesn't) come out of this post. I'm a little bit giddy, and nervous, but at the same time inspired and grateful for doing this.

I'm hoping that I can use the responses I get from everyone in the r/vegan subreddit to better see myself clearly and how I need to align myself going forward, to better help the animals that are suffering every day! 

If there are any spelling errors, or there is some clarification that's needed, please let me know!",True,False,False,vegan,t5_2qhpm,587586,public,self,"Looking for some inspiration, possibly cooperation if anyone is interested?",0,[],1.0,https://www.reddit.com/r/vegan/comments/mmy896/looking_for_some_inspiration_possibly_cooperation/,all_ads,6,Activism,7371b396-1c1e-11e5-a3f0-0ef6ca535a4d,Activism,self,"{'enabled': False, 'images': [{'id': 'L2V-bJnQo2M1UfmeZY8DhWyMKPXl4-nqsqfNslnFj-E', 'resolutions': [{'height': 108, 'url': 'https://external-preview.redd.it/HGXSgycXl04N9toFUD_MOIoLP0TYB6apCd1ivT3f1GQ.jpg?width=108&amp;crop=smart&amp;auto=webp&amp;s=8258fcecf42ff46bfc171353c6db4a212b910738', 'width': 108}, {'height': 216, 'url': 'https://external-preview.redd.it/HGXSgycXl04N9toFUD_MOIoLP0TYB6apCd1ivT3f1GQ.jpg?width=216&amp;crop=smart&amp;auto=webp&amp;s=844e7a42fc2ca2fe56cfaed48d6e89b37c82fce3', 'width': 216}, {'height': 320, 'url': 'https://external-preview.redd.it/HGXSgycXl04N9toFUD_MOIoLP0TYB6apCd1ivT3f1GQ.jpg?width=320&amp;crop=smart&amp;auto=webp&amp;s=69140d2e06e42c100c38a4a39389f95601206cf4', 'width': 320}, {'height': 640, 'url': 'https://external-preview.redd.it/HGXSgycXl04N9toFUD_MOIoLP0TYB6apCd1ivT3f1GQ.jpg?width=640&amp;crop=smart&amp;auto=webp&amp;s=5848f69db0125d9527833e3b933eea184eff0d52', 'width': 640}], 'source': {'height': 732, 'url': 'https://external-preview.redd.it/HGXSgycXl04N9toFUD_MOIoLP0TYB6apCd1ivT3f1GQ.jpg?auto=webp&amp;s=d12740d5e8a184cf3ed6b3a02679718a149fd7dd', 'width': 732}, 'variants': {}}]}",,,,,,,,,,,,,,,,
[],False,bikaland,,[],,text,t2_117x57,False,False,[],False,False,1617906414,self.vegan,https://www.reddit.com/r/vegan/comments/mmy4kc/making_my_on_makeup/,{},mmy4kc,True,False,False,False,True,True,False,,[],dark,text,False,False,False,4,0,False,all_ads,/r/vegan/comments/mmy4kc/making_my_on_makeup/,False,6,1617906425,1,"Hi everyone! 
 I want to start by saying I already buy vegan make-up.

I am really thinking about making my own make-up with what I can harvest from nature up here in north, in Sweden. But I don't know *how*. Or, mpre precisely; what to use! 
 I want to make eyeshadows-which plants gives what color? Should I mix plants? Dry them to a powder and mix with (plantmade) fat?

This might be a somewhat difficult question perhaps, but if anyone has any tips or pointers I would surely appreciate it!
Thanks in advance  ! 

Ps: tried to post this in r/veganmakeupshare but since I am not a trusted member (yet) I wasn't allowed to post",True,False,False,vegan,t5_2qhpm,587589,public,self,Making my on make-up,0,[],1.0,https://www.reddit.com/r/vegan/comments/mmy4kc/making_my_on_makeup/,all_ads,6,,,,,,,,,,,,,,,,,,,,,
[],False,plastic-pulse,,[],,text,t2_6gvfqsf9,False,False,[],False,False,1617905380,self.vegan,https://www.reddit.com/r/vegan/comments/mmxr6v/any_postgraduate_researchers_students_here/,{},mmxr6v,True,False,False,False,True,True,False,,[],dark,text,False,False,False,0,0,False,all_ads,/r/vegan/comments/mmxr6v/any_postgraduate_researchers_students_here/,False,6,1617905391,1,"Hi all

Veggie 30 years / vegan 15. 

Can anyone recommend a university in the U.K. who could support a phd in animal rights related topics well?

I have two undergraduate qualifications and two postgraduate qualifications in music / sonic art and teaching related subjects and have had two phd proposals accepted but money prevented me from pursuing these. 

I was thinking of the OU as a possibility especially as I teach full time. But if there are any unis or professors in particular that anyone can recommend that would be very helpful. 

If I was in the US I would have considered Gary Francione. Are there any similar people pursuing these issues at that level in the U.K.?

Thanks",True,False,False,vegan,t5_2qhpm,587586,public,self,Any postgraduate researchers / students here?,0,[],1.0,https://www.reddit.com/r/vegan/comments/mmxr6v/any_postgraduate_researchers_students_here/,all_ads,6,Educational,700e5036-b9b6-11e8-bfb2-0ef7b7f43048,Educational,,,,,,,,,,,,,,,,,,
[],False,weetikniett,,[],,text,t2_b0yef81w,False,False,[],False,False,1617904290,self.vegan,https://www.reddit.com/r/vegan/comments/mmxcan/educating_nonvegans_on_social_media/,{},mmxcan,True,False,False,False,True,True,False,,[],dark,text,False,False,False,4,0,False,all_ads,/r/vegan/comments/mmxcan/educating_nonvegans_on_social_media/,False,6,1617904300,1,"Hello!

I wanted to ask if anybody knows where I can find infographics/illustrations/whatever that explains what happens in the dairy industry, egg industry and everything else that is important for people to know, in a short, easy to understand, non-graphic (in terms of images) way?

I ask this because I want to “teach” people around me, on social media, but they are turned off constantly because of the graphic images or the large amount of information, and therefor the message goes over their heads? I am trying to find things that I can share that is easier for them to digest and less graphic?

Can anyone point me into the right direction?",True,False,False,vegan,t5_2qhpm,587578,public,self,Educating non-vegans on social media,0,[],0.99,https://www.reddit.com/r/vegan/comments/mmxcan/educating_nonvegans_on_social_media/,all_ads,6,,,,,,,,,,,,,,,,,,,,,
[],False,brotorb,,[],,text,t2_2ihije3b,False,False,[],False,False,1617903568,self.vegan,https://www.reddit.com/r/vegan/comments/mmx2q9/hate_speech/,{},mmx2q9,True,False,False,False,True,True,False,,[],dark,text,False,False,True,4,0,False,all_ads,/r/vegan/comments/mmx2q9/hate_speech/,False,6,1617903578,1,"In my observations, when a vegan makes any kind of comment pointing out the flaws in the meat industry, they are often met with hostility. 

The last comment I saw was someone replying to a vegan post saying ""real men eat animal protein, otherwise they look like a pussy like you"". I reported that comment because to me that looks like hate speech. It's diminishing someone based on their beliefs. 

As it turns out, facebook does not consider this to be hate speech. Is it not hate speech to attack someone based on their beliefs? 

I can not recall the last time I saw a vegan personally attack someone. Usually we just offer some facts or defend our cause. Why does it seem so widely accepted to attack vegans?

I wonder how other people experience this. Am I just exaggerating things?",True,False,False,vegan,t5_2qhpm,587571,public,self,Hate speech,0,[],1.0,https://www.reddit.com/r/vegan/comments/mmx2q9/hate_speech/,all_ads,6,,,,,,,,,,,,,,,,,,,,,
[],False,LoL_is_pepega_BIA,,[],,text,t2_50hi5dwg,False,False,[],False,False,1617902620,self.vegan,https://www.reddit.com/r/vegan/comments/mmwq7j/serious_what_are_vegans_thoughts_on_the_fact_that/,{},mmwq7j,True,False,False,False,True,True,False,,[],dark,text,False,False,True,10,0,False,all_ads,/r/vegan/comments/mmwq7j/serious_what_are_vegans_thoughts_on_the_fact_that/,False,6,1617902631,1,"To some ppl like us, that may not be that big of a deal, I.e we aren't all that smart or brilliant as a species in a cosmic scale.. meeting an EBE, I know I won't think of it a big deal since my attitude towards other living beings is that of compassion and curiosity..

The rest of humanity is who I'm worried about (Simpsons it brings peace meme here). Considering our horrible attitude towards animals and each other with minor differences, is there any chance of there being peaceful contact and coexistence with these technologically &amp;or intellectually superior beings?

Do u think disclosure on the UFO subject would have the incredibly positive impact in terms of opening one's hearty with compassion for fellow life forms, leaving behind archaic religious traditions, etc that UFO proponents imagine? Or are we only destined for horrible conflicts with newly discovered tech from other civilizations?

Considering what little we know of UFOs and their pilots, they don't seem to be much of a threat, though we don't really know their overall agenda..",False,False,False,vegan,t5_2qhpm,587563,public,self,"[Serious] What are Vegan's thoughts on the fact that there are incredible unexplained UFOs, (possibly alien) visiting here for a long time? At some point, people are going to have to wake up to the fact that humans aren't the smartest or greatest around.",0,[],1.0,https://www.reddit.com/r/vegan/comments/mmwq7j/serious_what_are_vegans_thoughts_on_the_fact_that/,all_ads,6,Discussion,0d26d52c-2ef1-11e5-8c17-0ec131dbf691,Discussion,,,,,,,,,,,,,,,,,,
[],False,azerowastevegan,,[],,text,t2_56vkqucs,False,False,[],False,False,1617901896,self.vegan,https://www.reddit.com/r/vegan/comments/mmwgsb/which_documentary_is_better_to_show_the_cruelties/,{},mmwgsb,True,False,False,False,True,True,False,,[],dark,text,False,False,True,3,0,False,all_ads,/r/vegan/comments/mmwgsb/which_documentary_is_better_to_show_the_cruelties/,False,6,1617901907,1,"Ive only watched earthlings and cant bring myself to watch dominion to compare since Ive been vegan for years at this point. But want to know what others think I should be recommending or if one is clearly better.

[View Poll](https://www.reddit.com/poll/mmwgsb)",True,False,False,vegan,t5_2qhpm,587559,public,self,Which documentary is better to show the cruelties of animal ag to an omni?,0,[],1.0,https://www.reddit.com/r/vegan/comments/mmwgsb/which_documentary_is_better_to_show_the_cruelties/,all_ads,6,Question,3fa453f8-685e-11e9-862d-0ee93d557dce,Question,,,,,,,,,"{'is_prediction': False, 'options': [{'id': '7160799', 'text': 'Earthlings'}, {'id': '7160800', 'text': 'Dominion'}], 'resolved_option_id': None, 'total_stake_amount': None, 'total_vote_count': 0, 'tournament_id': None, 'user_selection': None, 'user_won_amount': None, 'voting_end_timestamp': 1618333896271}",,,,,,,,,
